broadcast,title,description,pub_date,title_sentiment_score,description_sentiment_score
Aljazeera,How can Syria be rebuilt and who will pay?,Years of war and sanctions have left much of the country in ruins.,"Tue, 10 Dec 2024 20:15:59 +0000",-0.1027,-0.7783
Aljazeera,Police fire tear gas at Kenya protesters rallying against femicide,Hundreds gather in Kenya&#039;s capital to rally against gender-based violence.,"Tue, 10 Dec 2024 20:12:24 +0000",-0.5106,-0.6249
Aljazeera,Kenyan police tear gas protesters marching against femicide,Police in Nairobi used tear gas to disperse protesters demanding an end to femicide. ,"Tue, 10 Dec 2024 19:54:42 +0000",-0.2263,-0.4215
Aljazeera,US sanctions China cyber firm for potentially deadly ransomware attack,"Some firewalls targeted in the US were protecting critical infrastructure companies, the US Treasury Department says.","Tue, 10 Dec 2024 19:28:22 +0000",-0.4767,-0.128
Aljazeera,"Republicans targeted Hunter Biden’s board role, but overlook Trump Jr’s",Hunter Biden was accused of influencing policy for personal gain. His critics aren&#039;t upset over Trump Jr&#039;s similar role.,"Tue, 10 Dec 2024 19:16:03 +0000",0.0,-0.3818
Aljazeera,Argentina’s Milei emerges as blueprint for global far right,"One year into his presidency, Milei has fast become a symbol of what the global far right hope to achieve. ","Tue, 10 Dec 2024 19:15:01 +0000",0.0,0.4404
Aljazeera,Israel’s Netanyahu decries ‘absurd’ charges at corruption trial appearance,Netanyahu took the stand for about four hours and will resume testifying on Wednesday.,"Tue, 10 Dec 2024 18:00:53 +0000",-0.2732,0.0
Aljazeera,‘Step towards justice’: US indicts ex-military officials for Syria abuses,"Officers Jamil Hassan and Abdul Salam Mahmoud behind torture of detainees, including US citizens, prosecutors say. ","Tue, 10 Dec 2024 17:11:31 +0000",-0.5574,-0.5994
Aljazeera,What is Iran signalling since the fall of Syria’s Bashar al-Assad?,"A stalwart Assad ally for decades, Iran has to decide how it will approach the new Syria.","Tue, 10 Dec 2024 16:54:19 +0000",0.0,0.0
Aljazeera,Syrian fighters name Mohammed al-Bashir as caretaker prime minister,Al-Bashir headed the HTS-led Syrian Salvation Government (SSG) in the northwest area of Idlib.,"Tue, 10 Dec 2024 16:19:33 +0000",-0.0516,0.0
Aljazeera,Why is Europe pausing Syrian asylum claims after al-Assad’s fall?,Some European countries are freezing asylum applications for people from Syria in the wake of the fall of its regime.,"Tue, 10 Dec 2024 16:07:10 +0000",0.0,-0.1027
Aljazeera,"‘From the heart of the north, we are happy for your freedom’","A young girl in northern Gaza sends a heartfelt message to the people of Syria, congratulating them on their freedom.","Tue, 10 Dec 2024 15:50:19 +0000",0.836,0.8271
Aljazeera,Pakistan’s military charges former spy chief over ‘political activities’,"Lieutenant-General Faiz Hamid, under arrest since August, is the first spy chief accused of helping a political party.","Tue, 10 Dec 2024 15:44:47 +0000",-0.2732,0.0772
Aljazeera,Brazil’s President Lula ‘stable’ after emergency surgery,Doctors say left-wing leader will remain under observation for a few days after surgery for intracranial haemorrhage.,"Tue, 10 Dec 2024 15:28:01 +0000",-0.3818,0.0
Aljazeera,"Firefighters in US battling a wildfire in Malibu, California","Malibu wildfire forces evacuation of residents near Pepperdine University, students seek shelter in campus library.","Tue, 10 Dec 2024 15:23:26 +0000",-0.2732,0.0
Aljazeera,"Argentina court dismisses rape charges against France rugby’s Jegou, Aurado",The dropping of charges against Hugo Aurad and Oscar Jego draws a line under a dark period for France&#039;s rugby community.,"Tue, 10 Dec 2024 15:05:21 +0000",-0.7783,-0.2732
Aljazeera,US and UK sanction gold smuggler Kamlesh Pattni,"Pattni featured heavily in Al Jazeera’s Gold Mafia investigation, which looked at gold smuggling in Southern Africa.","Tue, 10 Dec 2024 14:49:41 +0000",-0.4767,-0.4767
Aljazeera,It is time for justice and accountability in Syria,But that is no easy task.,"Tue, 10 Dec 2024 14:41:24 +0000",0.5267,-0.4782
Aljazeera,Voluntary carbon market has failed the human rights test,Our organisations’ research showed that carbon projects can badly harm the communities they claim to benefit.,"Tue, 10 Dec 2024 14:32:28 +0000",-0.5106,-0.5574
Aljazeera,Rethinking the UN: Reform or obsolescence?,We talk to the UN&#039;s special rapporteur on the occupied Palestinian territories about the genocide in Gaza. ,"Tue, 10 Dec 2024 14:30:00 +0000",0.0,0.4019
The Guardian,Syrian rebels name new PM as outside powers move to shore up interests,"Israel plans to create ‘sterile defensive zone’ inside southern border, and Turkey bombs Kurdish targets in north SyriaMiddle East crisis – live updatesSyria’s leading rebel group has named a new prime minister to head the country’s transitional government as outside powers move to shore up their interests in the wake of the Assad regime’s collapse.The new prime minister, Mohammad al-Bashir, previously ran an administration in Idlib under the control of Hayat Tahrir al-Sham (HTS), the strongest of the rebel groups which have moved into Damascus and other cities. Continue reading...","Wed, 11 Dec 2024 01:44:30 GMT",0.0516,-0.0516
The Guardian,"Crown prince lobbied Cameron over Saudi dissident, documents reveal","Exclusive: Records obtained via FoI request relate to critic of Saudi royal family living in UK under asylum protectionMohammed bin Salman personally lobbied David Cameron earlier this year to intervene in the legal case of a London-based dissident who is suing the Saudi government, amid threats by its officials that the issue “could have implications” for £100bn of investment in the UK.UK government documents obtained by the Guardian show that Cameron asked senior Foreign Office (FCDO) officials to propose options after the extraordinary intervention by the Saudi crown prince over the case brought by Ghanem Al-Masarir, a prominent critic of the Saudi royal family who is living under asylum protection in the UK. Continue reading...","Tue, 10 Dec 2024 19:53:27 GMT",0.0,-0.6486
The Guardian,"Suspect in CEO shooting to plead not guilty and fight extradition, lawyer says","Suspect shouted outside court before hearing where he was denied bail The suspect in the shooting death of the UnitedHealthcare CEO, Brian Thompson, shouted: “This is completely out of touch and an insult to the intelligence of the American people” on Tuesday before he fought being extradited from Pennsylvania to face murder charges in New York.During the hearing, Luigi Mangione was denied bail, meaning he will return to custody at Pennsylvania’s Huntingdon state correctional institution while navigating the process to contest extradition, which could take days – if not a month or more, as the New York Times noted. Continue reading...","Tue, 10 Dec 2024 23:54:04 GMT",0.3217,-0.9648
The Guardian,Māori tribes make rare plea to King Charles for intervention in New Zealand politics,"Exclusive: Open letter seen by the Guardian asks King to ‘ensure the government does not diminish the crown’s honour’ amid tensions over policy direction for MāoriWhat is NZ’s treaty principles bill and why is it controversial?Representatives of more than 80 Māori tribes have issued a rare plea to King Charles III requesting his intervention in New Zealand politics, amid growing tension over the government’s policies for Māori and a souring of the relationship between Indigenous people and ruling authorities.The National Iwi Chairs Forum – a collective of tribal leaders – has sent an open letter to the King asking him “to ensure that the [New Zealand] government does not diminish the crown’s honour” over what they believe to be ongoing breaches of the crown’s promises made to Māori in the Treaty of Waitangi, the founding document of New Zealand. Continue reading...","Wed, 11 Dec 2024 00:37:35 GMT",0.0,0.2263
The Guardian,Two people taken to hospital after explosion at east London house,Fire brigade sends eight fire engines and about 60 firefighters to deal with blaze in IlfordTwo people have been taken to hospital after an explosion in a terrace house in east London.London fire brigade sent eight fire engines and about 60 firefighters to deal with the blaze in Ilford just after 4pm on Tuesday. Continue reading...,"Tue, 10 Dec 2024 20:49:25 GMT",0.0,-0.7351
The Guardian,"‘Medical misogyny’ condemns women to years of gynaecological pain, MPs told","Damning parliamentary report blames lack of education by healthcare workers and ‘pervasive stigma’ for poor careWomen and girls are enduring years of pain because their reproductive conditions are being dismissed due to “medical misogyny”, according to a damning parliamentary report.The report, by the Women and Equalities committee, found that gynaecological conditions such as endometriosis and adenomyosis are treated with inadequate care due to a “pervasive stigma”, a lack of education by healthcare professionals and “medical misogyny”. Continue reading...","Wed, 11 Dec 2024 00:01:31 GMT",-0.765,-0.9274
The Guardian,"Hundreds of thousands hit by ruinous carer’s allowance penalties, audit shows","Campaigners say NAO report shows impact of DWP staffing decisions and failure to address flaws in benefit’s designHundreds of thousands of unpaid carers were hit with ruinous penalties for minor breaches of carer’s allowance rules in the five years after senior welfare officials promised to fix the scandal-hit benefit, an official audit has revealed.Campaigners said the National Audit Office (NAO) report highlighted the scale of the misery and hardship inflicted on carers over the period as well as the extent of the failure by the Department for Work and Pensions (DWP) to tackle overpayments. Continue reading...","Wed, 11 Dec 2024 00:01:31 GMT",-0.5719,-0.8658
The Guardian,Christmas disruption likely as Avanti West Coast train managers vote to strike,"RMT members plan to take industrial action on 22, 23 and 29 December in dispute over rest day working Train managers at Avanti West Coast are to strike in a dispute over rest day working.Members of the Rail, Maritime and Transport union plan to walk out on 22, 23 and 29 December. Continue reading...","Tue, 10 Dec 2024 23:54:41 GMT",-0.4588,-0.7096
The Guardian,Further South Korea martial law protests as ex-defence minister and senior police arrested,"Minister Kim Yong-hyun formally arrested amid concerns evidence might be destroyed amid protests against President Yoon and vandalism of ruling party lawmakersSouth Korea’s former defence minister has been formally arrested on insurrection charges related to President Yoon Suk Yeol’s brief declaration of martial law, a court spokesperson said early on Wednesday.Kim Yong-hyun, who had first been detained on Sunday, has now been arrested on charges including “engaging in critical duties during an insurrection” and “abuse of authority to obstruct the exercise of rights”. Continue reading...","Tue, 10 Dec 2024 23:39:58 GMT",-0.6124,-0.9531
The Guardian,Photos of Birmingham DHL fire suggest device could have downed plane,"Images consistent with fire from magnesium-based device, suspected to be part of Russian sabotage plotPhotographs of the fire caused by a suspected Russian incendiary device at a DHL facility in Birmingham in July have backed up intelligence assessments that the blast was strong enough to have brought down a cargo plane.One image appears to show when the booby-trapped item, hidden in a massage device, caught fire. A distinctive bright light emerges from the top of a crate of parcels being moved around the site on an electric vehicle. Continue reading...","Tue, 10 Dec 2024 18:50:51 GMT",-0.34,-0.296
The Guardian,Paul Mescal sells clothes on Vinted to raise money for Irish charity,"Fans of Gladiator II star can choose from knitwear items, vintage T-shirt and Jimmy Choo bootsFirst the chain he wore in Normal People gained a cult following, then he went viral for the tiny shorts he’d been papped wearing while running through London and Dublin.Paul Mescal’s latest fashion fixation is the cardigan, and fans will no longer have to admire them from afar or flock to buy the same pieces before they sell out, as he has started selling off clothes to raise money for charity. Continue reading...","Tue, 10 Dec 2024 20:23:19 GMT",0.4215,0.5423
The Guardian,Syrian activist whose suffering became symbol of Assad brutality found dead in Sednaya prison,"Mazen al-Hamada had escaped to tell the world about regime’s torture before returning to DamascusMiddle East crisis – live updatesWhen he spoke to lawmakers and in lecture theatres around the world, Mazen al-Hamada’s face told the story of brutal torture by Bashar al-Assad’s regime. The discovery of the Syrian activist’s body inside the notorious Sednaya prison on the outskirts of Damascus brought the news that he never lived to see its downfall.Hamada’s sunken eyes and haunted face, his tears as he described the depth of horrors he experienced, made him a symbol of the crimes the Assad regime committed against those who spoke out against it. Continue reading...","Tue, 10 Dec 2024 16:37:29 GMT",-0.9403,-0.9738
The Guardian,"Ukraine war briefing: Don’t let Patriot missile systems gather dust, says Zelenskyy, after deadly strike on clinic","President calls for more air defence systems from allies, and blames Russia for drone hitting nuclear inspectors’ car. What we know on day 1,022See all our Ukraine war coverageVolodymyr Zelenskyy has urged Ukraine’s allies to provide 10-12 more Patriot air defence systems that he said would fully protect its skies, after a Russian missile killed at least four people in the south-eastern city of Zaporizhzhia. The attack destroyed a private clinic and injuring 20 more people, including a child. “We repeat again and again that air defences should save lives, not gather dust at storage bases,” Ukraine’s president said.In Zaporizhzhia, rescuers worked in piles of rubble from the collapsed building where at least six people were trapped, the regional governor, Ivan Fedorov, said on the Telegram messaging app. Anna Zubchenko, a 26-year-old ophthalmologist, was working in her office when the attack happened. “The ceiling just collapsed onto my head. Another doctor was with me, she was hit harder. Once I dug myself out I started shouting ‘please help’,” Zubchenko said. She helped to partially dig out her colleague who was later evacuated by rescuers.The US has disbursed a $20bn loan for Ukraine backed by proceeds earned on frozen Russian assets, as part of a $50bn G7 support package. Zelenskyy said he was “deeply grateful” for the disbursement, calling it “a powerful act of justice”. The US treasury secretary, Janet Yellen, called it a “critical infusion of support as [Ukraine] defends its country against an unprovoked war of aggression”. Donald Trump, who will become US president in January, has said he will “probably” reduce aid to Kyiv.On Tuesday, the International Atomic Energy Agency said a drone attack had severely damaged its official vehicle heading to the Zaporizhzhia nuclear power plant in a Russian-occupied part of the region. No one was injured and workers were safe, said the agency’s chief, Rafael Grossi. Zelenskyy said the drone was Russian. There was no immediate comment from Moscow.The US state department has approved the potential sale to Ukraine of F-16 sustainment services and related equipment for $266m, the Pentagon said on Tuesday. The principal contractors will be Sabena, Lockheed Martin Aeronautics and Pratt and Whitney, the Pentagon said in a statement.Poland’s prime minister, Donald Tusk, said peace talks on ending Russia’s war in Ukraine could begin this winter. Poland is a staunch backer of neighbouring Ukraine and next month will take over the rotating EU presidency. Tusk also announced a series of upcoming talks with foreign officials. “Our [EU] presidency will notably be co-responsible for what the political landscape will look like, perhaps how the situation will look during [peace] negotiations, which could begin – though there are still question marks – in the winter of this year.” Continue reading...","Wed, 11 Dec 2024 00:27:40 GMT",-0.6597,-0.9321
The Guardian,Always prepared: why prepping for doomsday is a logical choice for many Americans,"Over 20 million Americans engage in prepping. Closing the hatch is a logical response to a hollowed-out stateA family of six pulls up to the Be Prepared Expo in Farmington, Utah. They are concerned about supply-chain failure, sure of the fact that the Covid-19 pandemic was only a taste of what’s to come.They want to buy seeds for their garden so they can grow food to preserve and stash in the basement. The kids pet the puppies at breeder booths selling guard dogs, the father exchanges opinions about the best weapons to cache, and the mother gathers pamphlets about hoarding gold and the crises of the international economy. Continue reading...","Tue, 10 Dec 2024 16:00:21 GMT",-0.4404,0.5994
The Guardian,Exceedingly good needle drops: why a 1915 Kipling poem is the cherry on top of the 28 Years Later trailer,"Zombie movie action soundtracked by the unhinged vinyl screeches of Boots, Rudyard Kipling’s evocation of soldiers in battle? It’s a match made in horror movie heavenIf you’re honest with yourself, you probably weren’t all that excited about 28 Years Later when you first heard about it. After all, as entertaining as 2002’s 28 Days Later was, 2007’s 28 Weeks Later demonstrated all the signs of diminishing returns. It wasn’t as scary. It wasn’t as memorable. And it turns out that things just weren’t as interesting six months after a zombie outbreak as they were four weeks after. By rights, 28 Years Later should continue this trend. And, when it comes out, that might still prove to be the case. As of now, though, it’s just about the most exciting film of 2025. And this is entirely down to its trailer.By now, you know the basic formula for most movie trailers. Pick any song from the last 50 years, doesn’t matter which, and record a new version of it. The first half of it should be dreamy and distant, the second punctuated with big echoey drums that cut well with the action. Just recently, the Minecraft Movie trailer did this with Magical Mystery Tour, Babygirl did it with Madison Beer’s Make You Mine and even A Complete Unknown managed to find a way to shoehorn giant drum noises into Like a Rolling Stone. Continue reading...","Tue, 10 Dec 2024 16:52:28 GMT",0.5719,0.7841
The Guardian,A Complete Unknown review – Timothée Chalamet’s Bob Dylan is an electric revelation,"James Mangold’s biopic follows the rise of the era-defining star with Chalamet brilliantly embodying his shapeshifting allureNot Judas – Jesus. Timothée Chalamet’s hilarious and seductive portrayal of Bob Dylan makes him the smirking, scowling and unwilling leader of his generation, whose refusal to submit to the crucifixion of folk-acoustic purity is his own crucifixion. Chalamet gives us a semi-serious ordeal of someone who is part Steinbeck hero, part boyband star, part sacrificial deity. On being derisively asked if he is God, Chalamet’s Dylan replies: “How many more times? Yes.” Chalamet shows us the mysterious burden of celebrity and zeitgeist-ownership endured by a singer-songwriter who transcends John the Baptist (in the form of fatherly and sad-eyed folk mentor Pete Seeger – wonderfully played by Edward Norton) and finally has to wake up his dozing Apostles in Garden of Gethsemane with electric guitars played, in his legendary words, “fuckin’ loud”.James Mangold’s biopic, co-scripted by him and Jay Cocks, is based on Elijah Wald’s 2015 book Dylan Goes Electric! Newport, Seeger, Dylan and the Night That Split the Sixties; it’s the story of Dylan’s musical and personal adventures in the first half of the decade as he electrified the world of folk in every sense. He was carried onwards and upwards by the folk movement appreciative of his poetic talent, but dissatisfied with what he saw as folk’s regressive, museum-oriented placidity (and Dylan is shown here not engaging explicitly with its socialist traditions); he is yearning for the new modern energy of rock’n’roll as the musical form which he has to master if it is not to surpass him. Continue reading...","Tue, 10 Dec 2024 17:00:22 GMT",0.0,0.8942
The Guardian,"The best scented candles: 16 affordable, genuinely great-smelling candles – tested","From sea salt to ginger, soy wax to sustainable refills, these are the best, most nausea-free scented candles aroundWhile scented candles are a failsafe gift, they can be seen as a bit unimaginative. But they’re perfect for winter days at home and thoroughly festive. Lighting a candle is a ceremony, and the flickering flame can trigger something comfortingly primal in us.Retailers, from supermarkets to artisan independents, are developing huge ranges of scented candles, and it’s hard to know where to start. Many of us have been disappointed by a candle that smelled divine when we had an in-store sniff, only to be distinctly underwhelming once it’s home. So we’ve sniffed, burned and rated dozens of candles for you. Continue reading...","Tue, 10 Dec 2024 18:00:23 GMT",0.6369,0.9625
The Guardian,"Nigel Farage, man of the people, welcomes his latest billionaire to Reform | John Crace","Like our Nige, Nick Candy doesn’t appear to have any solutions to anything … but he does have very deep pocketsSeveral Range Rovers with blacked out windows pulled up outside the TV studios in Westminster. Out stepped Theresa May. Awkward. If she’d known her arrival was going to coincide with a Reform party photo call, she’d have probably asked the driver to go round the block again. Just in case people jumped to conclusions. Not that there was much chance of anyone imagining that the Maybot was about to leave the Tory party and defect to Reform. But better safe than sorry.These are happy days for Nigel Farage. OK, so Donald Trump might have gone a little cold on him. The Donald’s apparatchiks have been letting it be known that the president-elect regards Nige as an eccentric fanboy, basking in the reflected glory. But back in the UK things are hunky dory. The Tories are barely alive and Labour hasn’t got off to the best of starts. To put it kindly.Taking the Lead by John Crace is published by Little, Brown (£18.99). To support the Guardian and Observer, order your copy at guardianbookshop.com. Delivery charges may apply. Continue reading...","Tue, 10 Dec 2024 17:48:22 GMT",0.4019,0.9848
The Guardian,Comfort and joy! Merry gentlemen Sheeps deliver the ultimate Christmas album,"With A Very Sheeps Christmas, featuring songs such as Hoo Hoo Daddy X, the comic trio and guests including Rose Matafeo pastiche all manner of festive tunesAre any two forms of artistic expression more widely maligned than musical comedy and the Christmas album? It would take a talent of Santa’s-sack proportions, surely, to redeem both at once. Step forward the gadfly sketch trio Sheeps, who have released their maiden (and I think we can assume, only) festive album, A Very Sheeps Christmas. The “musical passion project” of Sheeps’ Daran Johnson and Al Roberts, and supposedly 10 years in the making, it features 20 original tracks and guest vocal appearances by fellow Sheep Liam Williams alongside comedy megastars Rose (Starstruck) Matafeo, Lolly (Ghosts) Adefope, Jamie (Stath Lets Flats) Demetriou and more. Oh, and it’s very funny indeed.A good way to experience it would be at one of the trio’s three live gigs this month that launch the album: my enjoyment of it was greatly intensified by familiarity with Sheeps as live performers. On record as on stage, the joke when Liam Williams opens his lungs to sing is that such a gruff and deadpan man should be going all light entertainment in the first place. But Johnson and Roberts take more of the strain here, with a suite of songs of sometimes sublime silliness – lyrically, conceptually and vocally too, whether that’s Roberts’ high-pitched Prince stylings in the sexy-Santa number Hoo Hoo Daddy X or giving it sinister little yelps in the death-worshipping country-and-western carol (“that baby’s gonna die for me”) No Room at the Inn.Sheeps are at Moth Club, London, 16-18 December. A Very Sheeps Christmas is available now Continue reading...","Tue, 10 Dec 2024 20:40:47 GMT",0.8777,0.4557
The Guardian,‘Shōgun was so refreshing for the Japanese’: Takashi Murakami on his blockbusting return,"The superstar artist, famed for his Louis Vuitton bags and Kanye West album sleeves, is back with epic paintings riffing on the history of Japanese art. He talks cuteness, gold leaf and hara-kiri on TVIt’s Kyoto, but not as you know it. Forget cherry blossom and golden temples: study one of Takashi Murakami’s vast new paintings and you’ll notice shimmering clouds laid over the embossed outlines of cartoon skulls. It’s a reference, he says, to the city’s ancient Toribeno burial ground – and a key motif for the artist in his evocation of Japan’s postwar ghosts.“I really wanted to depict a version of Kyoto that is not beautiful or pleasing to tourists,” says Murakami via a translator from his vast studio-cum-factory complex outside Tokyo. “I wanted to show that Kyoto’s arts and culture were nurtured within the context of really gruesome historical and political conflicts.” Continue reading...","Tue, 10 Dec 2024 15:20:32 GMT",0.0,-0.6408
