broadcast,title,description,pub_date,title_sentiment_score,description_sentiment_score
The Guardian,Bouldering equipment for beginners: the gear you need to crush it at the climbing wall – and the stuff you don’t,"New to bouldering? Here’s what’s actually worth buying, from shoes and finger tape to training aids• From turbo trainers to running buggies: the fitness gear that made you fitterBouldering and climbing have become hugely popular. What was once a niche hobby is now an Olympic sport, and with bouldering gyms popping up across the UK, it’s an exciting time to join the climbing community.Various weird and wonderful products that promise to up your climbing game are now available, but which ones do you need? As an avid climber who’s tried countless training tools over the past eight years, I have a good idea of what works and what doesn’t – because I’ve spent a lot of money finding out the hard way. Continue reading...","Tue, 25 Feb 2025 15:00:14 GMT",-0.1531,0.9301
The Guardian,"‘It could get an orgasm out of a cabbage’: the best vibrators, tested","From bullets to rabbits to wand vibrators, our sexual wellbeing expert demystifies what’s available, and rates her top 16 models (she tested 53)I could write here about how almost a fifth of women surveyed by Durex said using a sex toy was the most dependable way for them to climax. Or I could point out how Kinsey Institute research suggests regular masturbation can help relieve and prevent symptoms of menopause, such as vaginal atrophy. I could even tell you that studies demonstrate a significant correlation between intimate toy ownership and greater satisfaction – not only with sex but also with life itself.But the potted version is that orgasms and erotic pleasure are glorious, and top-class toys can help you savour more of both. So here are the best vibrators available. Scroll to the bottom to find out how I selected these vibrators from the 53 I tested for this piece.Best bullet vibrator overall:We-Vibe Tango X£79.99 at SinfulBest rabbit vibrator overall:
 Je Joue Hera Flex£87.20 at Je JoueBest wand vibrator overall:
 Doxy Die Cast By You£174.99 at Doxy Continue reading...","Sun, 23 Feb 2025 12:00:37 GMT",0.6369,0.9719
The Guardian,‘More like vegetable cooking water’: the best (and worst) supermarket chicken soup,"Whose soup is a chunky triumph? And whose is a sludgy mess? Felicity Cloake tries out supermarket takes on chilled, ready-made chicken and vegetable soup• The best blenders to blitz like a pro, tried and testedAs a small child, my dream was to open an underwater restaurant (no, me neither), and the short menu I painstakingly wrote out for said venture started with chicken and vegetable soup. Which is to say, I have history with this dish. It feels familiar, comforting and overwhelmingly wholesome, yet I don’t often eat it these days, not least because I’ve never found one commercially that makes any welfare claims for the chicken concerned (and I’m generally too cheap to make it myself).So I was quite excited about this particular taste test – and perhaps inevitably disappointed that even the most expensive samples gave so little information about the provenance of their meat. That said, with a handful of exceptions, the standard was pretty high flavour-wise, and Aldi, Marks &amp; Spencer, Morrisons and Sainsbury’s all at least note that they use British chicken, which is a start. Continue reading...","Sat, 22 Feb 2025 10:00:03 GMT",0.3818,0.9281
The Guardian,My big red carpet makeover: what I learned from the stylists to the stars,"Stock up on wig tape, plunge your face in icy water, prepare your poses – and get ready for some really tricky interview questionsAwards season draws to a close this weekend, with the Brits on Saturday and the Oscars on Sunday. At both, stars will face the red carpet – a gauntlet of fans, photo ops and rapid-fire interviews, which involves being scrutinised from every angle.They make it look effortless, “but it’s an intimidating thing, especially if you’ve never done it before”, says Niamh Eastabrook, a publicist at Multitude Media, who helps actors prepare for red carpets. “People forget that this side of the job is not why anyone becomes an actor.” The makeup artist Lisa Eldridge agrees: “It’s such a nerve-racking experience for most actresses. A lot are quite introverted and they have to walk out and be analysed by the world.”Two of my red-carpet looks: gold gown by Edeline Lee; green dress by Self Portrait, rented from Rites. Photographs: Linda Nylind/The Guardian Continue reading...","Wed, 26 Feb 2025 05:00:03 GMT",0.0,0.0534
The Guardian,Naivety cost me my Transit van and motorbike insurance,"I have been driving for 38 years, I have never had an accident, but I can no longer get insuranceI am a volunteer driver for various NGOs in disaster- and war-torn environments. In March 2023, my Transit van was stolen along with a number of possessions while I was working in a refugee camp.This was extremely stressful to come home to and things got worse because my insurer rejected my claim because I had been using it as a camper van at weekends. In the letter cancelling the policy it said I’d failed to tell it about “modifications” I’d made. Continue reading...","Wed, 26 Feb 2025 07:00:07 GMT",0.0,-0.9869
The Guardian,Diesel connects with gen Z for denim brand’s revival,"Milan fashion week show featured spraypainting by 7,000 graffiti artists – and impossibly low bumster jeans Diesel is famous for denim, but not the run-of-the-mill jeans-and-a-jumper kind. Seven thousand graffiti artists spraypainted nearly 2 miles (3km) of fabric, which was draped and swagged over the catwalk and seats of a concrete show space in Milan, transforming it into a rainbow-coloured, ballroom-sized skate park.Models wore contact lenses that turned their eyeballs white, like horror-film dolls, or had clown smiles crayoned on to their faces. Hooded puffer jackets and corsets came with bumster jeans so impossibly low that they were fitted with adjustable internal underwear to hold them up, or tiny shorts that would make Daisy Duke blush. Continue reading...","Wed, 26 Feb 2025 16:43:55 GMT",0.0,0.8549
The Guardian,Are you a Type A traveller? Why the quest for perfection could be ruining your holiday – and your relationships,"Tomas Telegramma’s endless quest to optimise his holiday was doing the opposite. Here’s how he learned to put down the to-do list and love uncertaintyRome. Late summer. The crowds aren’t easing, nor is the sun, and it’s about to sear a hole in my relationship. Hot, hangry and hungover – a diabolical combination – we’re our own kind of ancient ruins, skulking aimlessly in what feels like a black hole: an area nowhere near any of the 50-odd places I’ve saved on Google Maps for our four-day stay.A bakery appears. Then a panini bar. Then a trattoria. Then another. We don’t stop. Instead I feverishly research them online for any signs of superiority. None were pre-approved on my months-long mission to compile the ultimate Rome hitlist, cross-referencing recommendations from friends with what I had found online. Continue reading...","Wed, 26 Feb 2025 14:00:40 GMT",0.6597,0.9477
The Guardian,"For too long, my wheelchair reminded me of what I’d lost. Then I saw it as liberating","When my rheumatoid arthritis became more aggressive, I clung to the idea of still being a ‘walking person’. Letting go of that gave me more freedom than I could have imaginedIt started like any normal day – or normal for us, at least. My partner, Stewart, helped me out of bed and on to the wheeled office chair I kept next to it. Then I&nbsp;propelled myself to the top of the stairs before leaning precariously on my crutches as I made my way down, slowly and dangerously, with lots of swearing at the pain (I&nbsp;find it helps). Then, on the way out to the car, I missed my footing&nbsp;and fell.Not for the first time, Stewart was caught between concern and frustration. Wasn’t it time, he asked, for me to consider using a wheelchair? Once again, I rejected the suggestion. Continue reading...","Wed, 26 Feb 2025 06:55:05 GMT",-0.3182,-0.7506
The Guardian,How to make cheese fondue – recipe | Felicity Cloake's Masterclass,"The ultimate cheesy indulgence in nine simple stepsFive years ago, I was worried that the pandemic had killed off fondue for ever. And, while it wasn’t my biggest concern back in February 2020, a world that couldn’t come together over molten cheese still seemed a bleak prospect. Clearly I wasn’t alone, because Swiss public health experts were later forced to issue reassurance – thankfully, the only risk here is overindulgence.Prep 10 min
 Cook 15 min
 Serves 4 Continue reading...","Wed, 26 Feb 2025 12:02:33 GMT",0.0,-0.7269
The Guardian,Tell us: have you been threatened with ‘eviction’ from a specialist care home?,"We’d like to hear from people or anyone in their family who has been ‘evicted’ from a care home providing specialist care for vulnerable adults due to funding cutsResidential homes providing specialist care to thousands of vulnerable adults with learning disabilities and severe autism have warned they are having to “evict” residents to avoid insolvency because of tax and wage rises and local authority funding cuts.The annual Sector Pulse Check survey of more than 200 social care providers, both private and charitable, says many are on the brink as they struggle to remain viable in the face of cash-strapped councils’ refusal or inability to meet the rising cost of services. Continue reading...","Mon, 27 Jan 2025 14:46:05 GMT",0.0516,0.6808
The Guardian,Parents in England: share your experiences of NHS dental services for your children,"We would like to hear from parents about their children’s experiences of getting NHS dental treatmentAccording to a government report, nearly 50,000 tooth extractions took place last year in NHS hospitals in England for 0 to 19-year-olds, with 62% of those having a primary diagnosis of tooth decay.We would like to hear from parents in England about their experiences of accessing NHS dental services for their children. Were you able to find somewhere locally or do you have to travel further afield? How easy have you found it to access care? We’re also interested in hearing from those whose children have had hospital tooth extractions recently. Continue reading...","Wed, 26 Feb 2025 13:01:34 GMT",0.296,0.9211
The Guardian,Post your questions for Edwyn Collins,"The singer-songwriter and former Orange Juice frontman is releasing new album Nation Shall Speak Unto Nation in March, and will take on your questionsFrom his days with Orange Juice to his solo gems, Edwyn Collins has long cut a distinctive dash in the worlds of British pop and indie – and he’s still at it, putting out his 10th solo album, Nation Shall Speak Unto Nation, on 14 March. As he prepares the release he’ll be joining us to answer your questions.Now 65, Collins was born in Edinburgh and raised in Dundee, before he headed to Glasgow where he worked as an illustrator for the city’s parks department, drawing “chaffinches and squirrels and moorhens for park leaflets” he later remembered. But he was also frontman of the burgeoning band Orange Juice, who came to define a moment in Scottish indie-pop with spirited tunes such as Rip It Up, Blue Boy and Falling and Laughing (the latter one of Keir Starmer’s Desert Island Discs), topped by Collins’s untutored yet romantic croon. Continue reading...","Fri, 21 Feb 2025 15:10:46 GMT",0.0,0.8537
The Guardian,Share your experience of using personified artificial intelligence chatbots,"We would like to hear how you have found them useful and if you have any concernsThe AI chatbot market has grown exponentially in recent years, with more than 1.4 billion people worldwide estimated to be using them.While tools such as ChatGPT and customer service assistants are most prevalent, millions of people are turning to personified AI chatbots, such as Replika and My AI (Snapchat), which look to imitate human interactions. Some are using these personified chatbots for platonic or romantic companionship, while others are using them for support with managing their wellbeing and mental health. Continue reading...","Fri, 21 Feb 2025 16:03:37 GMT",0.6486,0.8689
The Guardian,Satellite image captures three tropical cyclones spinning in the South Pacific at once,"Tropical cyclones Rae, Seru and Alfred are churning as the region’s season reaches its peak Three tropical cyclones are churning in the South Pacific, an occurrence that scientists say is unusual.Tropical cyclones Rae, Seru and Alfred are all spinning as the region’s cyclone season, which starts in November and ends in April, reaches its peak. Continue reading...","Thu, 27 Feb 2025 01:57:37 GMT",0.0,0.1027
The Guardian,"‘They forced me to stand for hours in the cold, arms raised and shackled’: eight Gaza doctors on their Israeli prison ordeal","Senior doctors and surgeons describe the torture, starvation, humiliation and denial of medical care they endured while being held without chargeMore than 160 Gazan medics held in Israeli prisons amid reports of tortureMany days I was tied to a chair in the interrogation room for maybe 15 hours. I was not allowed to sleep or eat or drink. They tied my arms to the chair very painfully and when they were beating me they would put their hands or legs on my chest to bend my back. Continue reading...","Wed, 26 Feb 2025 05:00:03 GMT",-0.743,-0.902
The Guardian,Doug Ford: rightwing populist becomes Canada’s anti-Trump figurehead,"The Ontario premier says he’s ready to stand up to Trump over tariffs – will that yield a third straight election win?The day Donald Trump won the United States presidential election was a happy one for Doug Ford.The conservative politician who oversees Canada’s most populous province – and its largest economy – made the admission to caucus and supporters, in off-the-cuff remarks accidentally caught by a nearby microphone. Continue reading...","Wed, 26 Feb 2025 11:55:02 GMT",0.0,0.9337
The Guardian,#AltGov: the secret network of federal workers resisting Doge from the inside,"Government employees fight the Trump administration’s chaos by organizing and publishing information on BlueskyAfter seeing Elon Musk’s X post on Saturday afternoon about an email that would soon land in the inboxes of 2.3 million federal employees asking them to list five things they did the week before, a clandestine network of employees and contractors at dozens of federal agencies began talking on an encrypted app about how to respond.Employees on a four-day, 10-hours-a-day schedule wouldn’t even see the email until Tuesday – past the deadline for responding – some noted. There was also a bit of snark: “bonus points to anyone who responds that they spent their government subsidy on hookers and blow,” one worker said. Continue reading...","Wed, 26 Feb 2025 12:00:33 GMT",0.0,-0.743
The Guardian,‘We try to put applicants off’: couple chosen as live-in caretakers on uninhabited Irish island,"Recently married couple selected to look after Great Blasket, the largest island on Europe’s most westerly archipelagoA young couple in search of a new chapter in their lives are swapping creature comforts for life on an otherwise uninhabited island off the coast of Ireland with no hot water, stable electricity or cars.Camille Rosenfeld, from Minnesota in the US, and James Hayes, from Tralee in County Kerry, have been chosen to be this year’s live-in caretakers of Great Blasket, the largest island of the most westerly archipelago in Europe. Continue reading...","Wed, 26 Feb 2025 05:00:05 GMT",0.0,0.9062
The Guardian,Trump administration briefing: Musk’s demands trigger mass Doge resignations and cabinet backlash,"Musk’s Doge demands wreak havoc in federal agencies and its cost-cutting impact may be having less impact than he claims – key US politics stories from Tuesday at a glanceMore than 20 staffers of Elon Musk’s so-called “department of government efficiency” (Doge) stepped down on Tuesday, saying in a joint letter they refused to use their expertise to “dismantle critical public services”.The mass resignations are the latest rebuke to the billionaire entrepreneur’s hard-handed approach to slashing jobs and resources from federal government agencies. Musk had demanded federal workers email his office with five things they did the week prior to justify their positions. Continue reading...","Wed, 26 Feb 2025 03:10:16 GMT",-0.296,-0.9118
The Guardian,‘Losing hope with every day that passes’: torment of the ships’ crews abandoned at sea,"Thousands of seafarers are left on board their vessels in foreign waters, unpaid, with scant supplies – and no way of getting home When Vihaan* set off from his home in Tamil Nadu, south India, to work on a vessel crossing the Bay of Bengal into neighbouring Bangladesh, he told his family he would be gone a few months. After delivering his cargo of stone to Bangladesh’s Kutubdia Island, the marine engineer was due to head home in March 2024 to disembark at Thoothukudi port, India.But that month, the rusting tug, the Navimar 3, which was being operated by Middle East Marine (MEM), was detained by the authorities in Bangladesh due to unpaid fees. For almost a year, Vihaan has become a virtual prisoner on board, he says, forced to work without pay to keep the vessel safe, amid strong currents where it is anchored off the island in the cyclone-prone bay. His passport and certification documents are being held by a local agent for the Dubai-based company. With no means of getting home, no visa to disembark and without supplies, he has to rely on food and water from charities and unions. Continue reading...","Wed, 26 Feb 2025 06:00:05 GMT",-0.0258,-0.6254
The Guardian,‘I felt nothing but disgust’: Tesla owners vent their anger at Elon Musk,"The tycoon’s links with Donald Trump and Germany’s far-right AfD have slammed the brakes on sales and put the car’s owners in a spinTesla sales almost halve in Europe over Musk’s ties to TrumpWhen Mike Schwede first sat in a Tesla Roadster 15 years ago, he felt like it was a glimpse into the future. By 2016, he was the proud owner of a Tesla, revelling in the thumbs up he would get from other drivers as he whizzed along Europe’s highways in the electric vehicle.But of late the sheen of owning a Tesla has begun to wear off. For years the brand has been synonymous with Elon Musk and his stance against the climate crisis. Recently, Schwede watched aghast as the Tesla CEO poured hundreds of millions into backing Donald Trump as he made promises to ramp up domestic oil and gas production. Continue reading...","Tue, 25 Feb 2025 17:09:18 GMT",-0.7227,0.0772
The Guardian,Too evil! Too smutty! Too Thatcher! When TV stars demand cuts to their scenes,"Not all actors are comfortable with baring their behinds … or their souls. From Bridgerton to The Sopranos, some have insisted on moments being axed – although they don’t always get their wayAs professional show-offs with A-list ambitions, you might assume that any TV star wants to maximise their screen time – the meatier the role and the more minutes in the limelight, the better. Yet that isn’t always the case. Sometimes, actors want their scenes to be cut, either from the script or from the edit. And they can have all sorts of reasons, from personal politics to second thoughts about stripping off.The recent Channel 4 docudrama Brian and Maggie, written by Sherwood’s James Graham, saw Dame Harriet Walter deliver a nuanced, non-cartoonish portrayal of the, let’s say, “divisive” figure of Margaret Thatcher. The lady wasn’t for turning. She was for being left on the cutting room floor, though. Continue reading...","Tue, 25 Feb 2025 15:20:43 GMT",-0.8392,0.3818
The Guardian,Welcome to Britain in 2025 – where there is a heist in my local shop and no one is surprised | Zoe Williams,"Three young men began stealing all the cigarettes and the staff responded with pure resignation. Society is unspooling before our eyesEverything was going so well in my local Co-op. I’d gone in for vape juice, which they often run out of. I could see my preferred brand and I was having a comradely moment with the assistant, who is only too used to my crestfallen face when I have to make do with blueberry flavour. Then, right next to me, a man started to slither through the adjacent service hatch. The first I made of it was that the friction of his body against the counter was pulling his trousers down. I was close enough to see the whites of his pants, which were not that white. I thought: “That young man should really wear a belt next time he tries to hijack the till-cockpit of a Co-op.” Then: “NO WAY! That young man is hijacking the Co-op!”He was wearing a face bandana, so he had at least got that far with his accessorising, and he yelled at the lady to get out from behind the tills, then let his two friends in. It was a classic in-through-the-trapdoor, open-the-drawbridge manoeuvre. The manager was on the phone to the police, saying in neutral tones: “Robbery in progress, robbers in the building,” as they piled cigarettes into three giant bags-for-life, which they had definitely stolen from their mums in advance. The planning was meticulous. We watched for a few seconds, fascinated. I asked the lady if she thought we should hide and she made a noncommittal noise that I have spent ages since deciphering. It was something in the realm of “they’re just kids, they’re probably not armed”; she is probably not paid enough to defend the cigarettes. Continue reading...","Tue, 25 Feb 2025 11:00:08 GMT",0.4019,0.1841
The Guardian,Chelsea back in the top four and Crystal Palace thrash Villa: Football Weekly - podcast,"Max Rushden is joined by Barry Glendenning, Nedum Onuoha and Barney Ronay to look back on Tuesday night’s Premier League action, which saw Chelsea halt their slide in the league with an emphatic 4-1 win over SouthamptonRate, review, and share on Apple Podcasts, Soundcloud, Audioboom, Mixcloud, Acast and Stitcher, and join the conversation on Facebook, Twitter and email.On the podcast today: Ismaïla Sarr strikes twice as everything goes the way of Crystal Palace in their dismantling of a sorry Aston Villa. The panel discuss just how high the Eagles should set their targets. Continue reading...","Wed, 26 Feb 2025 15:25:46 GMT",0.2023,0.6597
The Guardian,"From the archive: One drug dealer, two corrupt cops and a risky FBI sting – podcast","We are raiding the Guardian Long Read archives to bring you some classic pieces from years past, with new introductions from the authors.This week, from 2017: Davon Mayer was a smalltime dealer in west Baltimore who made an illicit deal with local police. When they turned on him, he decided to get out – but escaping that life would not prove as easy as falling into it. By Yudhijit Bhattacharjee. Read by Lola Ogunyemi Continue reading...","Wed, 26 Feb 2025 05:00:04 GMT",-0.2023,-0.5732
The Guardian,Undercover in the House of Lords – podcast,"A Labour member of the House of Lords offered access to ministers during discussions about a commercial deal worth tens of thousands of pounds, an undercover investigation can reveal. Henry Dyer reportsLord David Evans of Watford, 82, offered access to ministers during discussions about a commercial deal, an undercover investigation can reveal.Lord Evans was recorded explaining to Guardian undercover reporters – who were posing as property developers looking to lobby the government – on how to approach Angela Rayner, the deputy prime minister and housing secretary. Continue reading...","Wed, 26 Feb 2025 03:00:00 GMT",0.0,0.25
The Guardian,"Lionesses frustrated, plus the Rubiales trial fallout – Women’s Football Weekly podcast","Faye Carruthers is joined by Sophie Downey, Suzy Wrack and Jamie Spangher to talk through the Women’s Nations League openersOn Tuesday’s episode of Women’s Football Weekly the panel discuss the start to the Lionesses’ Nations League campaign: a 1-1 draw in Portugal.Also the panel talk about the defeats for Wales, Scotland and Northern Ireland, although the Republic of Ireland started their campaign off with a 1-0 win over Turkey. Continue reading...","Tue, 25 Feb 2025 16:15:14 GMT",-0.5267,0.3612
The Guardian,"S9, Ep2: Ellie Simmonds, Paralympian","This week on Comfort Eating, Grace is joined by five-time Paralympic gold medalist Ellie Simmonds. At 30, Ellie has hung up her goggles and retired from swimming, but instead of claiming an early pension, she has turned her hand to disability activism and documentary making – in 2024 she won a Bafta for her documentary Finding My Secret Family. She talks to Grace about the food that sustained her gruelling swim training schedule, her celebratory McDonald’s order during the Paralympics, and her secret recipe for orange scones. Ellie also opens up about accusations of bullying within British Para-Swimming in the buildup to Rio 2016New episodes of Comfort Eating with Grace Dent will be released every Tuesday Continue reading...","Tue, 25 Feb 2025 05:00:32 GMT",0.0,0.9366
