broadcast,title,description,pub_date,title_sentiment_score,description_sentiment_score
The Guardian,"Who wants to look a million dollars, these days? | Zoe Williams","There was a time when being a millionaire represented fantastical, unimaginable wealth – but our language needs an updateTwo friends and I were walking through our various rationales for some recent stupid act or thought. I didn’t pay my tax on time, because I didn’t want to cash in my premium bonds before the end of the month, because maybe I’d win a million pounds. H reckons if she applied herself seriously to writing erotic fanfic, she would definitely make a million pounds. D was wondering what the maximum amount of compensation would be for a range of workplace accidents, what limb you’d have to lose for a million pounds. She’s dreaming. She’s a graphic designer.One million pounds has been the objective unit of gigantic wealth for as long as I’ve been alive. There has never been any point in two million and it would sound unbelievably pedantic to wish for three. That’s 50 years, during which time the value of one million pounds has changed quite a lot. Half a century ago, you could have bought an island, and now you might get a house with a well-made kitchen island. Yet the word has meant “unimaginably massive” all that time. It never even respected currency variation – when a photo caption once ran “Elizabeth Taylor arrived looking like a million dollars” and the newspaper sub added, per house style, “(£565,000)”, people found that ridiculous; of course she didn’t look like £565,000. If she looked like a million dollars, she looked like a million pounds. Continue reading...","Tue, 11 Feb 2025 11:00:54 GMT",0.0,0.9773
The Guardian,"With a new hit film, Netflix has reduced disabled lives to feelgood fodder – and got the facts shockingly wrong | Archie Bland and Ruth Spencer","This story about a child with cerebral palsy is badly misleading – and a slap in the face for families like oursAmazing news from Netflix: there is an extraordinary treatment available for children with very severe neurological disabilities, one that, given the appropriate level of parental gumption, will grant kids written off as hopeless cases the ability to walk and talk. The medical establishment, populated as it is with hopeless dinosaurs, hasn’t yet absorbed its full significance, and you won’t find it on the NHS, or through mainstream providers in the United States or Europe. But quietly, almost magically, it is already changing lives.The device that provides this treatment, the Cytotron, is the subject of the Mexican movie Lucca’s World, the No 1 non-English-language film on the world’s biggest streaming platform last week. It follows one family – led by a remarkable mother, Bárbara Anderson, on whose memoir the movie is based – as they turn every stone in pursuit of a better life for their little boy. And as soon as Anderson learns about the Cytotron, there is very little room for doubt about its remarkable properties. By “stimulating the damaged brain cells in order for them to become more active and create new connections”, the device can apparently restore the functions that have been destroyed by Lucca’s severe cerebral palsy. “The Cytotron will mark a before and after in the history of medicine,” we learn. It’s “scientifically supported”. Yes, it’s eye-wateringly expensive – $50,000 for a single course of treatment in the movie – but that’s because it’s unprecedented. Continue reading...","Tue, 11 Feb 2025 08:00:11 GMT",-0.5859,0.7955
The Guardian,Martin Rowson on Starmer aligning with the US in refusing to sign the Paris declaration on AI – cartoon,Continue reading...,"Tue, 11 Feb 2025 17:26:52 GMT",-0.4019,0.0
The Guardian,Time for BP’s chair to head for the exit | Nils Pratley,"Helge Lund is too closely tied to share price failure and BP’s inability to carry its investors with itBP chief says it will ‘fundamentally reset’ amid threat of activist investorHere – maybe only for another two weeks – is how BP describes the progress of its current strategy: “Since we set out our strategy in 2020, our track record of delivery has given us increased confidence as we invest in BP’s transition and the energy transition,” boasts the website.That message will soon be deemed non-operative, one suspects. The shoddy share price says the stock market doesn’t have “increased confidence” in BP’s current approach, and it sounds as if the board doesn’t either. The strategy will be “fundamentally reset” on 26 February, chief executive Murray Auchincloss said on Tuesday, and there will be “a new direction for BP.” Continue reading...","Tue, 11 Feb 2025 18:28:36 GMT",0.0,0.2263
The Guardian,"Who thinks creators of deepfake porn can be excused? Labour ministers, it seems | Polly Toynbee","A bill that would ban the creation of these images without consent was watered down by the government. This is where timidity gets youAt an away day last week, Keir Starmer told his cabinet that they must become “disruptors if you don’t want to be disrupted”. Yet timidity, caution and hesitation have damaged too many of Labour’s bold policies. Will Starmer’s new message percolate through to the cabinet – and to their junior ministers, civil servants and official lawyers? This week, one policy decision that went largely unnoticed suggests his party is still far from embracing disruption.Tens of thousands of deepfake porn images are produced every week, many of celebrities, mostly of ordinary women. These obscene AI-generated images have the power to destroy lives, roaming the internet for ever. They can be sent to friends, family, children, school friends, present or future employers. Those who create these poisonous pictures often turn out to be close friends, or people seeking revenge. Nobody thinks this is OK. Indeed, sharing deepfake porn became a criminal offence in the 2023 Online Safety Act.Polly Toynbee is a Guardian columnistDo you have an opinion on the issues raised in this article? If you would like to submit a response of up to 300 words by email to be considered for publication in our letters section, please click here. Continue reading...","Tue, 11 Feb 2025 10:00:14 GMT",0.0,-0.8088
The Guardian,What Republicans really mean when they blame 'DEI' | Mehdi Hasan,"Referencing DEI is the new rightwing abstraction deployed by Republicans to conceal their anti-Black racismIn 1981, Lee Atwater, the most influential Republican party strategist of the late 20th century, sat down for an off-the-record interview with the political scientist Alexander P Lamis. At the time, Atwater was a junior member of the Reagan administration, but he would later go on to run George HW Bush’s presidential campaign in 1988 and then become chair of the Republican National Committee in 1989.In perhaps the most revealing, and most infamous, portion of the interview, the hard-charging Republican operative explained to Lamis how Republican politicians could mask their racism – and racist appeals to white voters – behind a series of euphemisms.You start out in 1954 by saying, ‘[N-word, N-word, N-word]’. By 1968 you can’t say ‘[N-word]’ – that hurts you, backfires. So you say stuff like, uh, forced busing, states’ rights, and all that stuff, and you’re getting so abstract. Now, you’re talking about cutting taxes, and all these things you’re talking about are totally economic things and a byproduct of them is, blacks get hurt worse than whites … ‘We want to cut this,’ is much more abstract than even the busing thing, uh, and a hell of a lot more abstract than ‘[N-word, N-word]’.Mehdi Hasan is the CEO and editor-in-chief of the new media company Zeteo Continue reading...","Tue, 11 Feb 2025 11:00:56 GMT",-0.34,-0.9883
The Guardian,Robert F Kennedy Jr has mass appeal despite his extreme ideas. This theory explains why | Darren Loucaides,"In just a few years, Kennedy and his dangerously popular ‘diagonalist’ politics have gone from the fringes of the web to, perhaps, the White House“Back at home in the United States, the newspapers are saying that I came here today to speak to about 5,000 Nazis,” Robert F Kennedy Jr told a large crowd in Berlin. Estimated at 38,000 people, the crowd was a mix of hippies, anti-war types, Green party voters and anti-vaxxers, rubbing shoulders with a smattering of skinheads. It was late August 2020 and a group called Querdenken had rallied this motley crew together in defiance of Covid-19 restrictions.“Governments love pandemics,” Kennedy said. “They love pandemics for the same reason they love war – it gives them the ability to impose controls that the population would otherwise never accept.”Darren Loucaides is a writer based in Barcelona and LondonDo you have an opinion on the issues raised in this article? If you would like to submit a response of up to 300 words by email to be considered for publication in our letters section, please click here. Continue reading...","Tue, 11 Feb 2025 16:00:01 GMT",0.0,0.9609
The Guardian,The Guardian view on campus cuts: academics pay a high price for Westminster’s mistakes | Editorial,"The government should not stand aloof as a crisis unfolds in our universities. A new settlement is neededIn one of David Lodge’s famous campus novels, a young English literature lecturer pictures her university as “the ideal human community, where … people were free to pursue excellence and self‑fulfilment, each according to their own rhythm and inclination”. A non-academic friend comments wryly: “Well, it’s nice work if you can get it.”Nice Work was written in 1988, in part as a fictional response to the Thatcher cuts to higher education at the time. It’s safe to say a contemporary equivalent would need a different title. Forty years on, universities&nbsp;like to sell themselves along the lines of Robyn Penrose’s romantic vision. But the marketised reality for modern university staff, particularly those at&nbsp;the sharp end of a deepening funding crisis, is another world altogether.Do you have an opinion on the issues raised in this article? If you would like to submit a response of up to 300 words by email to be considered for publication in our letters section, please click here. Continue reading...","Tue, 11 Feb 2025 18:30:04 GMT",-0.6249,0.8385
The Guardian,The Guardian view on the health service: the problems go deeper than the boss | Editorial,"MPs are right to push for improvements. But it is unclear what recent attacks on NHS England’s Amanda Pritchard will achieveIt was presumably a coincidence that last month’s highly critical report on NHS finances from the House of Commons public accounts committee (PAC) was published just hours before Amanda Pritchard, NHS England’s chief executive, appeared before the health and social care committee. The report accused leaders at the organisation and the Department of Health and Social Care of lacking “drive” and “ideas”. That same day, immediately after Ms Pritchard’s evidence, the health committee issued a statement. Echoing the PAC,&nbsp;it said Ms Pritchard and her team lacked “drive” and “dynamism”.NHS England hit back at the PAC, claiming that MPs did not fully understand the financial processes at issue. Wes Streeting was reported to have “full confidence” in Ms Pritchard, making it clear that her job is not on the line. But this two-pronged attack must have stung. While critical reports like the PAC’s are part and parcel of parliamentary scrutiny, it is highly unusual for public servants to be rebuked for their oral evidence.Do you have an opinion on the issues raised in this article? If you would like to submit a response of up to 300 words by email to be considered for publication in our letters section, please click here. Continue reading...","Tue, 11 Feb 2025 18:25:04 GMT",-0.4019,0.644
The Guardian,Mental health services utterly failed my child | Letters,"Parents write of the agonising attempts to access support for their children, in response to an article about a 17-year-old who killed herself while waiting for therapyThe story about 17-year-old Jen&nbsp;Bridges-Chalkley, who killed herself after enduring a long wait for mental health support, was very hard to read, and almost identical to my son’s experience (The life and death of Jen Bridges-Chalkley: why did a 17-year-old die waiting for NHS therapy?, 6 February). He is now nearly 30, and – by the skin of his teeth – alive. He has tried to kill himself five times. He has rarely wanted to die, but many times he has wanted to stop living.One of those times when he was distraught and suicidal, I rang the child and adolescent mental health services (Camhs) out-of-hours “emergency line” repeatedly and left desperate messages. I didn’t even receive a call back that week. The times someone did respond, it was to tell us to call the police to pick up my desperate, terrified child to take him to a hospital where no one cared and he was regarded as a bedblocker. We stopped doing that. Continue reading...","Tue, 11 Feb 2025 17:09:50 GMT",-0.5563,-0.9923
The Guardian,Britain needs to protect citizens’ rights in the race for AI | Letter,"The government must urgently develop a declaration of digital rights and principles involving the public and civil society, write Polly Curtis, Prof Robert Trager, Prof Gina Neff, Maeve Walsh, Jim Killock and Dr Jeni TennisonAs global leaders meet at the AI summit in Paris, we are calling on the UK government to urgently develop and adopt a citizen-led UK declaration of digital rights and principles (AI race must be led by ‘western, liberal, democratic’ countries, says UK minister, 10 February).We agree with the science, innovation and technology secretary, Peter Kyle, when he says: “Government does have agency in how technology is developed … We need to use that agency to reinforce our democratic principles, our liberal values and our democratic way of life.” Continue reading...","Tue, 11 Feb 2025 17:08:51 GMT",0.3818,0.8176
The Guardian,Real Madrid’s Bellingham settles thriller to leave Manchester City on ropes,"Pep Guardiola had made the point that it was “impossible” to control Real Madrid’s front four. You can only hold out for so long against them, the Manchester City manager suggested. They tend to find a way. This Madrid victory was built on their cut and thrust up front, the slickness of their bursts, the sheer speed of them.For a good while, it felt as though Erling Haaland would be the story; another striker who is not in the business of being shackled. The City No 9 had drawn blanks in all four of his previous Champions League ties against Madrid. He had a point to prove and he proved it, twice putting his team in front, the second for 2-1 coming from the penalty spot after Phil Foden, on as a substitute, had been fouled by Dani Ceballos. Continue reading...","Tue, 11 Feb 2025 22:07:17 GMT",0.0516,-0.0
The Guardian,Nottingham Forest beat 10-man Exeter on penalties as Devon double denied,"At 11.04pm, at last there was a result, Nottingham Forest avoiding an FA Cup upset against 10-man Exeter City after prevailing from the final fourth-round tie via a 4-2 penalty shootout victory. Neco Williams scored the decisive penalty before Matz Sels, who replaced the injured Carlos Miguel midway through the second half, saved low to his right to deny Reece Cole before Angus MacDonald blasted his spot-kick against the crossbar. It was an absorbing contest – locals craned their necks from the windows of the terraced houses on St James Road to catch a view – but a cruel crescendo for third-tier Exeter.Forest had a man advantage for 53 minutes after Ed Turns was given a straight red card for a high challenge on Morgan Gibbs-White, 23 of which were in second-half stoppage time after Taiwo Awoniyi suffered a concussion and broken nose. The striker received 12 minutes of medical treatment on the pitch but by the end he was well enough to salute the Forest fans, some of whom will do well to return home by 4am. “He is in a lot of pain but with a smile on his face because he did an amazing job, scoring for us,” said Nuno Espírito Santo, relieved about his side’s progress and the injury prognosis. Continue reading...","Wed, 12 Feb 2025 00:18:48 GMT",-0.4404,-0.7003
The Guardian,Sam Kerr eyes Chelsea return ‘within a month’ after being cleared in court,"Player to return to non-contact training soon‘I can finally put this challenging period behind me’Sam Kerr, who was found not guilty of racially aggravated harassment of a white police officer on Tuesday, is expected to be back on the pitch within the next month.The Guardian understands the 31-year-old Australia captain is close to making her return for Chelsea for the first time since rupturing her anterior cruciate ligament during Chelsea’s warm weather training camp in January 2024, though it is expected that will not come before the international break at the end of this month. Continue reading...","Tue, 11 Feb 2025 21:15:17 GMT",0.1027,-0.3438
The Guardian,Sherratt given Wales job for rest of Six Nations after Gatland’s abrupt exit,"Six Nations defeat by Italy was 14th consecutive reverseWales sit 12th in world rankings, lowest-ever positionCardiff’s Matt Sherratt has been handed the Wales coaching reins on an interim basis after Warren ­Gatland’s second spell as head coach ended abruptly on Tuesday. Welsh ­supporters have been warned, ­however, there is “no magic bullet” that will instantly revive the national team after their dismal 22-15 defeat by Italy on Saturday.Gatland has departed “by mutual agreement” after 14 successive Test defeats, the worst run in the country’s 144-year international rugby ­history. Gatland, 61, had been contracted until the 2027 World Cup but Abi Tierney, the Welsh Rugby Union chief exe­cutive, acknow­ledged “there was a mounting sense that it wasn’t working” and said the ­decision was “in the best interests of&nbsp;the Wales squad”. Continue reading...","Tue, 11 Feb 2025 18:16:06 GMT",0.0,0.5859
The Guardian,Moyes out to close gulf in class as Goodison Park hosts its final derby,"Manager admits Everton have fallen further behind Liverpool but hopes to make farewell memorable for fansDavid Moyes may well have watched Goodison Park’s final derby from the comfort of his home in Lytham but for Storm Darragh battering the original date in December into submission. A different storm awaits on Wednesday when Liverpool cross Stanley Park one last time intent on silencing taunts about blowing the league at the home of their oldest rivals and containing the fallout from a shock FA Cup exit at Plymouth. There is nowhere else Moyes would rather be than in its midst of it all.“Strange it was rearranged,” the 61-year-old said, reflecting on the opportunity that has blown his way since the Merseyside derby was postponed on 7 December, the inevitable consequence of 70mph winds. Everton have changed owners and manager since then. A new era in a new stadium begins at Bramley-Moore dock next season and, thanks to three successive league wins under Moyes, Everton have newfound belief in remaining a Premier League club when they get there. Continue reading...","Tue, 11 Feb 2025 22:30:09 GMT",0.0,0.9694
The Guardian,England turn to Banton with consolation the target after sorry series,"Somerset batter who last played 50-over cricket in 2020 is poised to feature in the final ODI, with a whitewash loomingAnother punishing England tour of India approaches the end, the scorelines ugly, the tight moments spurned by the visitors. With one match left to&nbsp;play on Wednesday, Jos ­Buttler’s team have six defeats and one ­victory. Should they endure a one‑day international series whitewash, it won’t be off‑Broadway: the Narendra Modi Stadium in Ahmedabad, with its six‑figure capacity, awaits.A year ago it was the Test side that tumbled to a 4-1 defeat. That tour began with a famous victory in Hyderabad and a tasty fifth-Test decider was in the offing when ­England took a first-innings lead in the fourth. Then came the contractually obligated ­collapse to spin before an innings defeat in the final Test. Continue reading...","Tue, 11 Feb 2025 17:40:28 GMT",-0.0772,-0.891
The Guardian,Super League 2025: team-by-team guide to the new season,"Wigan have no weakness, Hull face a rebuild and newcomers Wakefield will quietly fancy their chancesSuper League’s 30th season gets under way on Thursday evening, with the biggest opening-night crowd in the competition’s history anticipated to watch the reigning champions, Wigan Warriors, take on their local rivals, Leigh Leopards. Matt Peet’s side completed an historic quadruple last year and have all the hallmarks of a side that could sweep aside all comers again.Will Wigan dominate 2025 just like they did in 2024? Can the likes of Warrington, Hull KR and Leeds put up a credible challenge? And who is in a struggle to avoid finishing bottom? Here is the Guardian’s team-by-team guide to the new season. Continue reading...","Tue, 11 Feb 2025 19:00:05 GMT",0.5994,0.7828
The Guardian,Grand National 2025: I Am Maximus must emulate Red Rum to win Aintree double,"Last year’s winner handed 11st 12lb top weightMullins says ‘we had an idea it would be’ toughI Am Maximus, the easy winner of the Grand National last year, will need to emulate a feat last achieved by the mighty Red Rum if he is to double up at Aintree on 5 April after he was allotted top weight of 11st 12lb when the handicap for the world’s most famous steeplechase was published on Tuesday.Red Rum, who is buried next to the winning post at Aintree, is most familiar to the British sporting public as the only horse to win the Grand National three times, but he was also the last horse to carry top weight to victory, when he won for the second time – under what was then the maximum burden of 12st – in 1974. Continue reading...","Tue, 11 Feb 2025 19:15:34 GMT",0.7783,0.9387
The Guardian,"Conspiracy theory on methane-cutting cow feed a ‘wake-up call’, say scientists","Social media storm of misinformation about Bovaer has drawn in Reform UK, the dairy industry and even Bill GatesScientists say a recent methane-related conspiracy theory was “a wake-up call” for the industry, reminding them they need to communicate better and more directly with the public.Over the last few months, Bovaer, a cattle feed additive that is proven to reduce emissions of the greenhouse gas, has been at the centre of a swirl of misinformation, drawing in Reform UK, the dairy industry and even the billionaire Bill Gates. Continue reading...","Tue, 11 Feb 2025 08:00:13 GMT",-0.5267,-0.6249
The Guardian,Polar heritage sites are slipping into the sea – but can one island live forever online?,"On Qikiqtaruk, off Canada’s Yukon coast, scientists are wielding virtual-reality cameras, 3D models and digital archives to protect the island’s history and culture before it disappearsIt was early July when the waters of the Beaufort Sea crept, then rushed, over the gravel spit of a remote Arctic island. For hours, the narrow strip of land, extending like the tail of a comma into the waters, gradually disappeared into the ocean.When Canadian scientists on Qikiqtaruk (also known as Herschel Island), off the coast of Canada’s Yukon territory, surveyed the deluge, they saw a grimly comical scene unfold. Continue reading...","Mon, 10 Feb 2025 10:00:10 GMT",0.0,0.1027
The Guardian,UK halves subsidies for Drax and says it must use 100% sustainable wood,"North Yorkshire power plant has been criticised for burning wood pellets sourced from US and Canadian forestsNils Pratley: Drax is the subsidy show that goes on and onThe UK government has halved subsidies for the Drax power station and ordered it to use 100% sustainable wood after sustained criticism over its business model.The large power plant in North Yorkshire would play a “much more limited role” in future, operating less than half as often as it currently does, the government said. Continue reading...","Mon, 10 Feb 2025 14:50:16 GMT",0.0,-0.6697
The Guardian,Hottest January on record mystifies climate scientists,"EU monitor says global temperatures were 1.75C above preindustrial levels, extending run of unprecedented highsA run of record-breaking global temperatures has continued, even with a La Niña weather pattern cooling the tropical Pacific.The Copernicus Climate Change Service said last month was the warmest January on record, with surface – air temperatures 1.75C above preindustrial levels. Continue reading...","Thu, 06 Feb 2025 09:41:11 GMT",0.0,0.4019
The Guardian,UK to refuse citizenship to refugees who have ‘made a dangerous journey’,"Home Office accused of shutting out thousands, as new guidance says those applicants will ‘normally be refused’The Home Office has been accused of quietly blocking thousands of refugees from applying for citizenship if they arrived in the UK by small boats or hidden in vehicles.Guidance for staff assessing people who have applied for naturalisation says that, since Monday, applicants who have “made a dangerous journey will normally be refused citizenship”. Continue reading...","Tue, 11 Feb 2025 19:09:01 GMT",-0.6486,-0.8834
