broadcast,title,description,pub_date,title_sentiment_score,description_sentiment_score
Aljazeera,Trump receives no punishment for felony hush money conviction,"A judge did not impose fines, jail time, or probation on US President-elect Donald Trump for his hush money conviction.","Fri, 10 Jan 2025 19:07:55 +0000",-0.2197,0.2235
Aljazeera,"Australian Open 2025: Schedule, how to watch, top seeds, prize money",Who are the favourites and when are the finals? Al Jazeera gives a low-down on the year&#039;s first tennis Grand Slam.,"Fri, 10 Jan 2025 18:25:02 +0000",0.6249,0.1027
Aljazeera,Tennis number one Sinner has doping hearing at sport court fixed for April,The Court of Arbitration for Sport to rule on allegations of doping by tennis&#039;s world number one Jannik Sinner in April.,"Fri, 10 Jan 2025 18:06:57 +0000",0.0772,0.0772
Aljazeera,US targets Russia’s oil sector with ‘sweeping’ sanctions,Ukrainian President Zelenskyy says he is confident sanctions will &#039;significantly reduce Russia’s petrodollar income&#039;.,"Fri, 10 Jan 2025 18:00:32 +0000",0.0,0.4939
Aljazeera,"Israel launches air raids on power station, ports in Yemen","Benjamin Netnayahu says Houthis &#039;will continue to pay, a heavy price for their aggression against&#039; Israel.","Fri, 10 Jan 2025 17:56:10 +0000",0.0,-0.3818
Aljazeera,Venezuela’s President Maduro begins third term amid international protest,"A new wave of protest accompanied Maduro&#039;s inauguration, after a contested July election spurred fraud accusations.","Fri, 10 Jan 2025 17:42:00 +0000",-0.25,-0.7964
Aljazeera,"Amid genocide, the tide is turning on Palestine","Pro-Palestine activists could not end Israel&#039;s genocide, but managed to shift the public opinion on the conflict.","Fri, 10 Jan 2025 17:35:47 +0000",0.0,-0.4497
Aljazeera,Amorim says Man Utd keen to keep Mainoo and Garnacho,Manchester United coach Ruben Amorim says the club are keen to extend Kobbie Mainoo and Alejandro Garnacho&#039;s contracts.,"Fri, 10 Jan 2025 17:23:56 +0000",0.3612,0.7184
Aljazeera,Venezuela’s Nicolas Maduro sworn in for third term after disputed election,The Venezuelan president promises period of peace and prosperity as the opposition and US continue to reject his rule.,"Fri, 10 Jan 2025 16:29:39 +0000",-0.34,0.5267
Aljazeera,"Israeli settlers set fires, vandalise buildings in occupied West Bank",Israeli settlers have set fire to farmland and wrote racist slogans in Abu Falah village in the occupied West Bank.,"Fri, 10 Jan 2025 15:19:19 +0000",0.0,-0.7506
Aljazeera,"Italy foreign minister meets Syria’s new rulers, calls for sanctions talks",Antonio Tajani says Italy wants to serve as a bridge between Damascus and the European Union.,"Fri, 10 Jan 2025 15:17:53 +0000",0.0,0.0
Aljazeera,Trump sentenced in New York hush-money case days before taking office,"Donald Trump avoids jail time or a fine, but the US president-elect&#039;s criminal conviction will be on his record.","Fri, 10 Jan 2025 15:09:29 +0000",-0.0258,-0.6757
Aljazeera,Why does Trump want Greenland?,"Incoming President Donald Trump has repeated his desire to take control of Greenland, despite being condemned.","Fri, 10 Jan 2025 14:48:36 +0000",0.0772,0.6256
Aljazeera,"Lakurawa, the new armed group wreaking havoc on the Nigeria-Niger border",Strained relations between Abuja and Niamey have disrupted joint military patrols and allowed the armed group to expand.,"Fri, 10 Jan 2025 14:11:35 +0000",-0.5994,-0.1027
Aljazeera,Union Berlin appeals court ruling over Bochum goalkeeper hit by lighter,Union Berlin appeal decision to award match to Bochum after their keeper was struck by a lighter in December.,"Fri, 10 Jan 2025 13:13:02 +0000",0.0,0.3612
The Guardian,"Grooming gang rhetoric risks inciting mass violence, says Wes Streeting","Exclusive: Health secretary points to New Zealand mosque massacre and says entire communities must not be tarred with the same brushThe use of inflammatory language over grooming gangs risks vilifying entire communities and could lead to atrocities such as the mosque massacre in New Zealand that killed more than 50 people, the health secretary has warned.Wes Streeting said he had “no difficulty or qualms” calling out the “sickening” crimes of sexual abuse gangs, criticising “well meaning, but ultimately fundamentally misguided and warped views of political correctness” for letting down thousands of children. Continue reading...","Fri, 10 Jan 2025 20:00:43 GMT",-0.7351,-0.8151
The Guardian,Pressure on Nigel Farage as Reform UK councillors resign over his leadership,Exclusive: Departures will add to scrutiny of party leader after Elon Musk said he was ‘not up to the job’A group of 10 councillors representing Reform UK have given notice of their intention to resign en masse in protest at Nigel Farage’s leadership.The resignations will add to pressure on the Reform leader after Elon Musk said he was “not up to the job”. They are timed to overshadow the party’s south-east conference this weekend. Continue reading...,"Fri, 10 Jan 2025 22:44:32 GMT",-0.5574,-0.6249
The Guardian,Trump avoids punishment for hush-money conviction and calls case ‘terrible experience’,"President-elect, who was found guilty of committing 34 felonies, sentenced to unconditional discharge in New YorkTrump hush-money sentencing – latest updatesDonald Trump will avoid jail time for his felony conviction in the New York hush-money case, a judge determined on Friday, marking both a dramatic and anti-climactic development in the historic criminal proceedings weeks before he returns to the White House.The judge who presided over Trump’s criminal trial, Juan Merchan, issued a sentence of “unconditional discharge”, meaning the president-elect will be released without fine, imprisonment or probation supervision for his conviction on 34 felony counts of falsifying business records. While the sentence makes Trump a convicted felon, he will face no penalty other than this legal designation. Continue reading...","Fri, 10 Jan 2025 16:26:32 GMT",-0.5994,-0.953
The Guardian,Ukraine’s highest profile combat unit to recruit English-speaking soldiers,"Azov, a volunteer brigade, plans to form international battalion to boost  numbers as Ukraine heads into fourth year of warThe Britons killed fighting for Ukraine against RussiaUkraine’s highest profile combat unit is seeking English-speaking recruits at a time when the impending presidency of Donald Trump means that Kyiv is expected to come under intense pressure on the battlefield.Azov, a volunteer brigade whose decade-old nationalist origins have made it a target of Russian propaganda, plans to form an international battalion to boost its numbers as Ukraine heads into a fourth year of full-scale war. Continue reading...","Fri, 10 Jan 2025 20:00:44 GMT",-0.34,-0.7845
The Guardian,Labour MPs urge Rachel Reeves to demand Jimmy Lai’s release,"UK chancellor will be first to make an official visit to China in a decadeLabour MPs have urged Rachel Reeves to demand Jimmy Lai’s release when she becomes the first UK chancellor to make an official visit to China in nearly a decade.Nine Labour MPs have joined a cross-party call for Reeves to raise the detention of political prisoners in Hong Kong and ask for Lai’s “immediate and unconditional release”, during her visit to China this weekend. Continue reading...","Sat, 11 Jan 2025 00:01:48 GMT",-0.128,-0.743
The Guardian,UK records -17.3C in chilliest January night in 15 years,"Altnaharra, in Sutherland, the most northern region of the Highlands, had reached the low by 9pm on FridayThe UK has recorded its chilliest January night in 15 years, as forecasters predicted it could get even colder over the weekend with temperatures falling as low as -20C in some locations.Altnaharra, in Sutherland, the most northerly region of the Highlands, reached the low of -17.3C by 9pm on Friday. It is the coldest January overnight temperature since 2010, when it dropped below -15C several times at locations across the UK, including -22.3C on 8 January in Altnaharra. Continue reading...","Fri, 10 Jan 2025 23:55:03 GMT",0.0,-0.6249
The Guardian,"Louise Haigh pleaded guilty to lying that phone was stolen, paper shows","Exclusive: Document sheds new light on episode that led to minister’s exit and guilty plea that friends say she regretsLouise Haigh pleaded guilty to lying that her work mobile phone had been stolen in 2013, according to a court document seen by the Guardian which sheds new light on the controversy that triggered her departure from the cabinet.The former transport secretary accepted the charge in a London magistrates court that she had dishonestly reported to her employer that her BlackBerry had been stolen, prompting her conviction for fraud and a £100 fine. Continue reading...","Fri, 10 Jan 2025 16:46:34 GMT",-0.8555,-0.9325
The Guardian,Two more lynx captured in Scottish Highland woods,"Second pair of illegally released animals safely captured in Cairngorms after they were spotted on camera trapsTwo more lynx abandoned in the Cairngorms have been safely captured, the Royal Zoological Society of Scotland said on Friday.Two of the illegally released animals were captured on Thursday after being sighted in the Dell of Killiehuntly near Kingussie in the Scottish Highlands. Continue reading...","Fri, 10 Jan 2025 20:50:59 GMT",0.0,0.4804
The Guardian,Meta terminates its DEI programs days before Trump inauguration,"Meta, fresh off announcement to end factchecking, follows McDonald’s and Walmart in rolling back diversity initiativesFollowing a week in which Mark Zuckerberg announced that Meta was getting rid of factchecking, as of Friday the company is also terminating its diversity, equity and inclusion (DEI) programs, effective immediately.An internal memo from Meta acknowledged that “the legal and policy landscape surrounding diversity, equity and inclusion efforts in the United States is changing”, while pointing to recent supreme court decisions and the “charged” view some have of DEI as a concept. Axios and Business Insider first reported the memo. While Meta confirmed to the Guardian the company is ending its DEI practices, the company did not respond to a request for a comment about how the decision aligns with its overarching goals. Continue reading...","Fri, 10 Jan 2025 21:06:35 GMT",0.0,0.9062
The Guardian,"‘Hotel of mum and dad’ in UK at its fullest in two decades, study finds","Almost a fifth of adults aged 24-34 are living with parents, particularly in areas of high-cost housingThe “hotel of mum and dad” is the busiest it has been for two decades as an increasing number of young adults in the UK choose – or are forced by low wages and rising rents – to live with their parents, research has found.The prohibitive cost of renting, let alone buying, a home explains why more twenty- and thirtysomethings are “co-residing” with family at an age when their parents would have been living independently, the Institute for Fiscal Studies (IFS) said. Continue reading...","Sat, 11 Jan 2025 00:01:48 GMT",0.0,-0.7003
The Guardian,Mark Rylance joins criticism of police ban on pro-Palestine march in London,"Police opposed to protesters gathering outside BBC HQ, which is near a synagogue, on the Jewish holy dayMark Rylance, the star of the BBC’s Wolf Hall, has joined the singer Charlotte Church and actor Juliet Stevenson to condemn a decision by the police to ban a pro-Palestine protest outside the corporation’s Broadcasting House headquarters.Protesters were planning to gather in Portland Place in central London on Saturday 18 January before marching to Whitehall. A ban was imposed on Thursday by the Met, with officers citing the risk of “serious disruption” to a nearby synagogue on the Jewish holy day, as congregants attend Shabbat services. Continue reading...","Fri, 10 Jan 2025 18:48:34 GMT",-0.7579,-0.9337
The Guardian,Inside the ‘fortress’ where South Korea’s impeached president awaits his fate,"Yoon Suk Yeol is barricaded inside a compound protected by rolls of barbed wire, a blockade of buses and hundreds of security force membersRolls of barbed wire encircle the perimeter of South Korea’s presidential residence, where impeached leader Yoon Suk Yeol has transformed his hilltop home into an urban stronghold against arrest.The compound in the capital’s exclusive Hannam-dong district, previously home to diplomatic receptions and banquets, has become the frontline of an unprecedented political crisis. Continue reading...","Sat, 11 Jan 2025 00:00:49 GMT",0.0772,0.743
The Guardian,Rachel Reeves faces another anxious week of second-guessing the City,"Markets appear to be fretting over sustainability of tax and spending plans and whether UK is heading for ‘stagflation’Rachel Reeves intended to spend January burnishing her reputation on the global stage with trips to Beijing and Davos, and flipping the focus from her £40bn tax-raising budget to Labour’s plans to rekindle economic growth.Instead, the chancellor was reduced to watching anxiously, as a sell-off swept through government bond markets, and sterling came under intense pressure as a result. Continue reading...","Fri, 10 Jan 2025 17:00:52 GMT",-0.25,-0.4215
The Guardian,Legal fight over €2.5bn worth of aircraft stuck in Russia plays out in Dublin,"World’s largest aircraft lessors and insurance firms battle over compensation for jets stranded after Ukraine invasionSitting in a nondescript building near the high court in Dublin, about 40 cloaked barristers have gathered almost daily since June last year. At stake is €2.5bn (£2.1bn) worth of aircraft stranded in Russia after the invasion of Ukraine.Behind multiple screens and a mountain of warehouse boxes they are fighting to determine who should pay for the losses – the aircraft lessors or the several insurance companies, including Lloyd’s, AIG and Chubb. Continue reading...","Fri, 10 Jan 2025 15:59:19 GMT",-0.0516,-0.743
The Guardian,66 days to cut down sugar: ‘I find myself enjoying the sweetness of my lip balm’,"How long does it take to change a habit? It varies, but one paper suggests it takes an average of 66 days. We ask writers to change one thing in their lives within that timeframe … and tell us if it worksRead more in the 66 days to change seriesMore summer essentialsGet our breaking news email, free app or daily news podcastNot even a year ago, I would have called myself crazy for giving up sugar, even for 66 days. But the truth is I eat way too much of it and it can’t be good for me.I’ve eaten cake for breakfast on more than one occasion and can easily finish a packet of biscuits in a day. I have a soft spot for baked goods, kindled by the many bakeries and cafes in my neighbourhood. If I go to bed without eating something sweet I feel as though something’s missing. Continue reading...","Fri, 10 Jan 2025 14:00:39 GMT",0.6705,0.8031
The Guardian,Our appeal has raised £1.5m for those affected by war. You can still donate,"As we enter the last weekend, please support the work of Médecins Sans Frontières, War Child and Parallel Histories• A guide to the Guardian and Observer’s 2024 appeal partnersDonate to our charity appeal hereA few weeks ago we launched our appeal in aid of victims of war and conflict in a mood of both gloom and optimism: despair at the terrible scale of human suffering in the world this year, but hope generated by the inspiring work of our partner charities.As we enter the last weekend of the appeal, it is clear that while there is little relief from the violence and misery, whether in Gaza, Ukraine or Sudan or beyond, the appeal has offered extremely positive glimmers of hope. We have raised the enormous sum of £1.5m. Continue reading...","Fri, 10 Jan 2025 13:45:22 GMT",-0.6705,0.7615
The Guardian,How Los Angeles wildfire smoke affects mental health,"Wildfire smoke is linked to health issues like heart attacks and strokes. Research is helping us understand its impacts on our wellbeingWildfires burning across the Los Angeles area have left 11 dead, thousands displaced, and over 10,000 structures destroyed. As authorities struggle to contain the blazes, the Centers for Disease Control and Prevention (CDC) has urged those in the area to monitor the local air quality on their weather app, or on airnow.gov.Wildfire smoke, a major source of air pollution, is linked to severe health issues including heart attacks, strokes and lung diseases like asthma. Continue reading...","Sat, 11 Jan 2025 00:43:18 GMT",0.0,0.4019
The Guardian,Fears of ‘rogue rewilding’ in Scottish Highlands after further lynx sightings,"Environmentalists condemn unauthorised releases as ‘reckless’ and ‘highly irresponsible’For a brief moment this week, lynx have been roaming the Scottish Highlands once again. But this was not the way conservationists had hoped to end their 1,000-year absence.On Wednesday, Police Scotland received reports of two lynx in a forest in the Cairngorms national park, sparking a frantic search. That episode ended in less than a day. Both animals were quickly captured by experts from the Royal Zoological Society of Scotland (RZSS) and taken to quarantine facilities at Highland wildlife park. Continue reading...","Fri, 10 Jan 2025 20:53:49 GMT",-0.4215,-0.3071
The Guardian,‘The speakers are the crown jewels’: the rise of Britain’s listening bars,"Music on high-end sound systems takes centre stage in these Japanese-inspired spaces for audiophiles Paul Noble was working as a radio producer and sound engineer when his frequent travels to Tokyo sparked the idea for a change of career.“In Japan, there’s an amazing tradition of listening bars, where they have a deep, beautiful, reverential approach to listening to music,” he says. “It’s nothing to do with club culture. It could be a tiny bar, with six seats in it, and you’ll just sit and listen to music, usually in silence. Continue reading...","Fri, 10 Jan 2025 15:00:37 GMT",0.0,0.8934
The Guardian,"‘When a friend is struggling, they need an ally, not an opinion’: 11 surprising habits that can ruin friendships","Think you always know what your mate is thinking? Forever making elaborate plans together? You might be doing your friendships more harm than you realise, say these experts“It’s very British to joke and tease to show affection, but it can tip over into being unhealthy,” says the friendship coach Hannah Carmichael. Her online community, Friendshift, coaches adults to build authentic friendships and navigate social situations. “At the heart of every healthy relationship is the ability to show up fully as ourselves,” she says. Continue reading...","Fri, 10 Jan 2025 15:00:37 GMT",0.0772,0.9705
The Guardian,How we met: ‘We’re like two pieces of a puzzle clicking together’,"Brandon, 28, and Christine, 27, became close friends when they worked together at a Covid testing lab. Now they live in different countries, but make time to continue their friendshipWhen Brandon and his boyfriend moved to London from Wales in April 2021, there wasn’t much going on. With the city under lockdown, he took a job in a Covid lab at Gatwick Airport. “I was processing PCR tests for people who were travelling,” he says. “I didn’t know anyone in London except my boyfriend, but luckily the team I was working with were great.”In June, they were joined by Christine, a biology graduate who lived in London and had transferred from the PCR testing lab at Heathrow. “When I arrived, they seemed like a tightknit team, so I was a bit anxious about fitting in,” she says. “But Brandon was super friendly and that drew me to him straight away. I really wanted to be his friend.” Continue reading...","Fri, 10 Jan 2025 15:24:55 GMT",0.3612,0.965
The Guardian,My husband is unfaithful and wants an open relationship. Is it time for us to split? | Ask Annalisa Barbieri,"We’ve been together a long time but now he says I either accept an open marriage or we get a divorce. The only way I cope is by turning to alcoholWe are gay men in our mid 40s, who have been together 20 years. From the outside, we have a fantastic life: very well-paid, high-status jobs, and we divide our time between lovely homes in two cities. We have an active social life in both places.Around 10 years ago, I had a feeling of mild unease that he was cheating on me, but I told myself I was being silly. He soon asked for an open relationship and said that I wasn’t sexual enough for his needs. I said no. Looking back, I think that may have been the moment that killed my marriage. Continue reading...","Fri, 10 Jan 2025 14:30:36 GMT",0.0,-0.0772
The Guardian,Guardian and Observer readers give more than £1.5m for victims of war,"Charity appeal reaches milestone with a weekend left for supporters to continue giving A guide to our 2024 appeal partnersDonate to our charity appeal hereGenerous readers have given more than £1.5m to the Guardian and Observer charity appeal in aid of victims of conflict and war – and there are nearly three days still left to make a donation.The milestone was reached on Friday afternoon, suggesting the latest appeal will become one of our most successful in terms of cash raised. More than 13,000 people have so far donated. The appeal closes at midnight on Sunday 12 January. Continue reading...","Fri, 10 Jan 2025 16:33:38 GMT",-0.7351,0.796
The Guardian,‘Bullets can make a real mess of bones’: the hospital where the war wounded have their lives put together again,"At MSF’s pioneering centre in Amman, Jordan, the dedicated team deal with lives that have already been saved. Here they make those lives worth livingAs a sign of commitment to peace, help us support those affected by war | Kath VinerDonate to our charity appeal hereA girl slips through the corridors of the hospital’s fifth floor with her friend, the pair bright-eyed and shy. Today is her last chance to wear her sparkly new shoes, bought for a party last week. Tomorrow, the 12-year-old Iraqi will have a leg amputated.The operation was due two weeks ago but the surgeon, who had tried not to weep as he broke the news that amputation was necessary, agreed to delay surgery. She wanted the chance to wear her new shoes to the party first. Continue reading...","Sat, 28 Dec 2024 05:00:30 GMT",-0.7506,0.9209
The Guardian,‘They can’t sleep … can’t speak’: the lifeline offered to Gaza’s traumatised children,"War Child hopes to provide a million children in the strip with basic aid and educational and mental health support. It’s their biggest emergency appeal yetDonate to our charity appeal here“They have many symptoms,” says Ibrahim, describing how trauma is manifesting daily in children in Gaza. “Being attached to their parents to&nbsp;the point that they don’t want to leave the place they are in – such as a tent. Severe anxiety and fear. Going to the&nbsp;toilet a lot – involuntary urination, basically.“They don’t want to participate in activities. They can’t sleep, they’re having trouble eating. Sometimes it can escalate to the point where a child becomes catatonic. They can’t speak. They can’t connect to family members because of severe trauma. Some have become very angry, defensive, aggressive. Some also have speech impediments – they can’t talk; they stutter.” Continue reading...","Sun, 22 Dec 2024 08:00:44 GMT",-0.5267,-0.9369
The Guardian,"In the DRC, rape is rife. How can women recover in a war zone?","Near the eastern city of Goma, charities such as MSF are reporting rising numbers of refugees experiencing rape and tortureAs a sign of commitment to peace, help us support those affected by war | Kath VinerDonate to our charity appeal hereThey arrive every few minutes, survivors of the unrelenting sexual violence that defines one of the world’s most intractable conflicts. And among the first to assess the exhausted women after they reach the squalid camps on the outskirts of Goma, regional capital of the war-ravaged east of the Democratic Republic of the Congo (DRC), is Irengue Trezor.The 35-year-old works for Médecins Sans Frontières (MSF), overseeing the charity’s sexual violence clinics within the sprawling camps of grubby white tents that are home to 650,000 people who have fled the fighting. Continue reading...","Sat, 21 Dec 2024 10:05:42 GMT",-0.8625,-0.8008
The Guardian,Alexander-Arnold could douse the fire around him but Liverpool owners deserve heat too | Barney Ronay,"The full-back is clearly itching to move but an unrealistic Local Lad premium is demanded of him that reflects wider alienationStop talking about this thing I’m talking about. Enough already with the big media fuss I am making a big media fuss over. This kind of messaging is always hard to swallow. Why, the angry man demanded, is everyone so angry right now?For all that, the fuss over Trent Alexander-Arnold is definitely real, whatever its source or ultimate legitimacy. Why does everyone care so much about this? It seems weird, disproportionate and strangely fevered, not to mention hostage to some persuasive media voices that carry a bit too much unexamined fan-feeling and not enough of the old journalistic detachment. Continue reading...","Fri, 10 Jan 2025 20:00:43 GMT",-0.1779,-0.9026
