broadcast,title,description,pub_date,title_sentiment_score,description_sentiment_score
The Guardian,Coroner issues warning about antidepressants after suicide of royal’s husband,"Thomas Kingston, son-in-law of Prince and Princess Michael of Kent, had been prescribed SSRIsA coroner has issued a warning about the effects of antidepressants prescribed by a Buckingham Palace doctor to the son-in-law of Prince and Princess Michael of Kent before his suicide.Thomas Kingston, 45, whose marriage to Lady Gabriella at Windsor Castle in 2019 was attended by the late Queen, killed himself last February after “suffering adverse effects of medication he had recently been prescribed”, an inquest found last month. Continue reading...","Fri, 10 Jan 2025 18:30:21 GMT",-0.7845,-0.8555
The Guardian,Man with epilepsy in Leeds died in fall after pharmacy ran out of drug,"David Crompton, 44, was reportedly given ‘IOU’ for prescription medication before fatal incidentA man with epilepsy died in a fall after his pharmacy reportedly left him an “IOU” for his prescribed medication when it ran out of an anti-epileptic drug.David Crompton, a 44-year-old man in Leeds, died on 13 December after a fall downstairs resulted in a loss of oxygen to his brain and a cardiac arrest. Continue reading...","Fri, 10 Jan 2025 19:16:58 GMT",-0.5574,-0.9186
The Guardian,Head of Met black officers’ group guilty of gross misconduct in WhatsApp chats,"Insp Charles Ehikioya could lose job after ruling that he took part in sharing of  sexist comments and racist remarksThe head of the Metropolitan police’s Black Police Association (MBPA) committed gross misconduct over his participation in a WhatsApp group that shared sexist comments and racist remarks about Asian people, a police tribunal has found.Insp Charles Ehikioya faces potential dismissal after Friday’s tribunal ruling at Palestra House in London. It found he was in a chat group with a former officer, Carlo Francisco, where racist, misogynistic, homophobic and pornographic messages were sent. Continue reading...","Fri, 10 Jan 2025 15:44:54 GMT",-0.7096,-0.91
The Guardian,MPs write to Wes Streeting asking for action plan on 14 hospitals in crisis,"Committee says it wants urgent update on support for hospitals declaring critical incidents under winter pressureMPs have written to Wes Streeting, the health secretary, asking for his action plan to help the 14 hospitals declaring critical incidents under winter pressure.The health and social care committee wrote to Streeting on Friday asking him to spell out “what specific immediate additional support, including financial support” would be provided to trusts declaring critical incidents. Continue reading...","Fri, 10 Jan 2025 18:11:44 GMT",-0.6249,0.8519
The Guardian,Former Premier League footballer Dean Windass diagnosed with dementia,"Ex-Hull and Bradford forward has stage two dementia‘Just got to keep smiling and trying to help people,’ he saysThe former Premier League forward Dean Windass has been diagnosed with dementia at the age of 55, it has been revealed.The former Hull and Bradford City player, who scored the goal that took Hull to the Premier League in 2008, has stage two of the condition, but joked with social media followers that he was “glad they found a brain”. Continue reading...","Fri, 10 Jan 2025 15:21:04 GMT",0.0,0.7003
The Guardian,Tory party accused of ‘bottling’ May elections as county councils seek delay,"Applications to devolution programme by 13 Conservative-led councils in England will allow year’s delay if successfulThe Conservatives have been accused of “bottling” the local elections after 13 Tory-led county councils in England said they were asking for a delay to this May’s polls to allow them to take part in a structural shake-up.The Tory councils have agreed to ask to be part of the government’s priority programme for devolution, which would mean they could ask to put off county elections for a year. Another council, led by Liberal Democrats with support from the Greens, has asked to take part in the programme but also raised “significant concerns” about the implications of delaying elections. Continue reading...","Fri, 10 Jan 2025 17:15:41 GMT",-0.2023,0.1027
The Guardian,No 10 insists UK has sufficient energy supply despite ‘concerningly low’ gas storage levels,"Centrica says its inventories have fallen by half since early November amid winter cold snapWhy have Britain’s energy costs soared?Business live – latest updatesThe UK has enough gas and electricity to meet demand this winter, the government has insisted, after the owner of the country’s largest gas stores said levels had become “concerningly low” amid the current cold snap.Centrica, which also owns British Gas, said on Friday that its inventories had fallen by half since early November, to a quarter below where gas storage levels were at the same time last year when temperatures were milder than normal. Continue reading...","Fri, 10 Jan 2025 13:32:10 GMT",-0.0258,-0.5267
The Guardian,California wildfires live updates: Los Angeles death toll rises to 11 as governor orders water investigation,"Officials say five people killed in Palisades fire and six in Eaton fire, while LA fire chief criticizes city officials over hydrants than ran dryAfter the fire, the insurance battles: new ordeals to comeFleeing the LA fires alone on a wheelchair: ‘I had to take my chances’Californians: have you been affected by the wildfires?An update on the Hurst fire from the US forest service has increased the acreage burned to 771 and is 37% contained.477 personnel were assigned to the fire. Continue reading...","Sat, 11 Jan 2025 02:31:26 GMT",-0.5994,-0.9638
The Guardian,IDF soldiers on leave among New Orleans truck attack victims,"Adi Levin and a fellow reservist in the Israel Defense Forces came to New Orleans as part of a six-week trip to the USTwo Israeli military members on leave were critically wounded in the New Year’s Day truck attack on New Orleans’ famed Bourbon Street and remain hospitalized, according to a diplomatic official from Israel.Adi Levin and a fellow reservist in the Israel Defense Forces came to New Orleans as part of a six-week trip to the US meant to finish in Florida, said Elad Shoshan, the Israeli consul in Houston.The Associated Press contributed reporting Continue reading...","Sat, 11 Jan 2025 00:01:47 GMT",-0.6808,-0.3182
The Guardian,"Panama Canal will remain Panamanian and open to all nations, says official","Administrator rejects Donald Trump’s claims that China controls canal or suggestion US could take it backWho owns the Panama Canal and what does Trump want with it?The Panama Canal will remain in Panamanian hands, and open to commerce from all countries, according to the administrator of the waterway, who rejected claims by president-elect Donald Trump that the US should take it over.Ricaurte Vásquez denied Trump’s claims that China was controlling the canal’s operations, and said making exceptions to current rules concerning its operation would lead to “chaos”. Continue reading...","Fri, 10 Jan 2025 23:00:08 GMT",0.0,-0.8442
The Guardian,DoJ releases its Tulsa race massacre report over 100 years after initial review,"DoJ report acknowledges attack ‘was so systematic and coordinated that it transcended mere mob violence’On Friday, the Department of Justice (DoJ) released its report on the Tulsa race massacre after announcing the review last September.The report came more than 100 years after a June 1921 report by the justice department’s Bureau of Investigation, a precursor to the FBI, blamed the massacre on Black men and alleged that perpetrators did not violate any federal laws. Continue reading...","Fri, 10 Jan 2025 22:41:12 GMT",0.0,0.3022
The Guardian,Venezuela’s Maduro sworn in amid outrage over alleged fraudulent election,"US announces $65m bounty for arrest of president, who has led country since 2013 and failed to prove he won recent voteVenezuela’s authoritarian president, Nicolás Maduro, has been​ accused of a shameless and fraudulent power-grab after swearing himself in for a third term, despite domestic outrage and a chorus of international condemnation at his alleged theft of last year’s election.“This is a great victory for Venezuelan democracy,” the 62-year-old autocrat boasted during a sparsely attended oath-taking ceremony in Caracas that was boycotted by the leaders of democratic nations. Continue reading...","Fri, 10 Jan 2025 20:44:24 GMT",-0.7579,-0.859
The Guardian,"Gaza death toll 40% higher than official number, Lancet study finds","Analysis estimates death toll by end of June was 64,260, with 59% being women, children and people over 65Research published in the Lancet medical journal estimates that the death toll in Gaza during the first nine months of the Israel-Hamas war was about 40% higher than numbers recorded by the Palestinian territory’s health ministry.The peer-reviewed statistical analysis was conducted by academics at the London School of Hygiene &amp; Tropical Medicine, Yale University and other institutions, using a statistical method called capture-recapture analysis. Continue reading...","Fri, 10 Jan 2025 18:47:03 GMT",-0.5574,-0.9136
The Guardian,Amazon dials back DEI programs ahead of Trump inauguration,"Online giant is among several companies ending diversity, equity and inclusion programs before Trump takes officeAmazon.com is winding down diversity programs ahead of Republican Donald Trump’s return to the US presidency, amid growing conservative opposition to such initiatives.Some of biggest businesses in the US have been scaling back their diversity initiatives, years after pushing for more inclusive policies in the wake of protests that followed the police killings of George Floyd and other Black Americans in 2020. Continue reading...","Fri, 10 Jan 2025 22:56:54 GMT",0.1779,-0.6908
The Guardian,"One dead, two in hospital after knife-fight in Melbourne park","Police called after reports of a group of young people fighting in Wyndham Vale on FridayA male has died after an apparent late-night knife fight in Melbourne’s west.Police were called to reports of a group of young people fighting in a park on Haines Drive, Wyndham Vale, about 11.30pm on Friday.Sign up for Guardian Australia’s breaking news email Continue reading...","Fri, 10 Jan 2025 21:54:00 GMT",-0.6486,-0.8807
The Guardian,Rudy Giuliani found to be in contempt of court again for 2020 election lies,It’s the second time this week that the former NY mayor has been found to be contempt for defaming election workersRudy Giuliani was found in contempt of court on Friday for continuing to spread lies about two former Georgia election workers after a jury awarded the women a $148m defamation judgment.Federal judge Beryl Howell in Washington DC is the second federal judge in a matter of days to find the former New York City mayor in contempt of court. Continue reading...,"Fri, 10 Jan 2025 22:51:40 GMT",-0.765,-0.9081
The Guardian,"Biden extends temporary protections for more than 800,000 immigrants","US president moves to shield roughly 230,000 Salvadorans and 600,000 Venezuelans against Trump administrationThe Biden administration on Friday extended temporary humanitarian protections for about 230,000 Salvadorans and 600,000 Venezuelans living in the US, in an effort to shield those groups from an incoming Trump administration that has promised to deport them.The decision in the dying days of Joe Biden’s presidency came after immigrant advocates and lawmakers urged the Department of Homeland Security to extend temporary protected status (TPS), designed to protect immigrants from being deported to countries that are engulfed in disaster or conflict. Continue reading...","Fri, 10 Jan 2025 20:03:52 GMT",0.128,0.7184
The Guardian,"The best slow cookers for effortless homemade meals, tried and tested","Whether you’re making comforting curries, casseroles or chilli con carne, we’ve tested the top slow cookers for serving up winter warmers• The best blenders to blitz like a pro, tried and tested, from Ninja to NutribulletAs January beds in and our craving for cosiness increases, you may be minded to dig out the slow cooker. Coming home to a warm, bubbling meal – with very little effort – is a real treat in the cold and dark. Plus, slow cooking can be an economical method of cooking.If you have yet to experience the comfort and joy of a slow cooker, or if your ancient model has finally died a death, it could be time to treat yourself to a season of stews, casseroles, curries and more. I’ve spent weeks testing slow cookers to compile a shortlist of the most functional, useful and well-designed recommendations to transform your dinner time.Best overall slow cooker:GreenPan slow cooker£200 at GreenPanBest basic slow cooker:ProCook digital slow cooker£49 at ProCookBest multi-cooker:Ninja Foodi 8-in-1 PossibleCooker£120 at ArgosBest pressure-cooking slow cooker:Sage Fast Slow Pro£179.95 at Sage Appliances Continue reading...","Fri, 10 Jan 2025 09:00:34 GMT",0.6369,0.9551
The Guardian,"The best heated clothes airers to save time and money when drying your laundry, tested","Heated airers claim to dry your clothes whatever the weather, without costing the earth in energy. From covered options to mini drying racks, we put 13 to the test to reveal the bestAn energy crisis and perma-drizzle have conspired to keep the nation’s laundry damp, not least by making it such a turn-off to turn on the heating. No wonder heated clothes airers are having a moment. These modish appliances sell out within hours of reaching shops and inspire evangelistic fervour among owners, who call them “life-savers” and “gamechangers”.Can a hot clothes horse really change your life, let alone dry your washing as fast as a tumble dryer for a fraction of the cost and with none of the noise? I needed to be convinced, so I put 13 bestsellers through their paces with my soggy washing to find out whether they’re the best thing in laundry since the clothes peg – or destined for the loft. Continue reading...","Fri, 10 Jan 2025 12:00:50 GMT",0.8126,0.8074
The Guardian,From turbo trainers to running buggies: the fitness gear that made you fitter,"‘The best £12 I ever spent’: real fitness starts with the right kit. Here’s the gear that helped these ordinary people get fit and stay motivatedIf you’re anything like me, your social media feed will be awash with targeted ads for spurious fitness gizmos, questionable “supplements” and get-ripped-quick gadgets in January. “Get a rippling six-pack while you continue to rot on the sofa eating melted camembert,” they may as well say. Unfortunately, this is seldom the case.The harsh reality is that there’s no shortcut to getting fit. But certain tools can help you get there … or at least make the process slightly less harrowing. With that in mind, we asked ordinary people who got themselves in shape about the kit they couldn’t have done without. Continue reading...","Thu, 09 Jan 2025 15:00:31 GMT",0.2732,0.8946
The Guardian,"14 of the best men’s boots for winter, from Chelsea to brogues to western","A good pair of boots is essential in the colder months, and our expert has picked out the best ones for every occasion• The best men’s coats for winterMuch like our bodies, our wardrobes need to acclimatise to winter. It’s time to unpack your chunky knitwear and arm yourself with a waterproof coat or an umbrella at all times. And you can shelve your shoes and switch to boots instead.As with all types of footwear, it’s good to have a few pairs at your disposal so you’re covered no matter what you’ve got planned. Sophisticated brogues for a formal event. Hiking boots for outdoorsy activities. Boots with a fluffy lining for sub-zero temperatures. Or chelsea boots if you’re after versatility. Continue reading...","Wed, 08 Jan 2025 15:00:35 GMT",0.6369,0.9661
The Guardian,The Guide #173: Why Netflix and Spotify don’t seem to care if we are paying attention,"In this week’s newsletter: From Spotify’s bland ghost artists to Netflix’s ‘will this do?’ roster of movies, have audiences succumbed to the age of distraction?Over Christmas, two articles were released that felt like harbingers – if not full-on sirens – for the direction of travel of popular culture. There was Will Tavlin’s piece for n+1 about Netflix’s less-than-stellar film output, which was briefly touched on in last week’s newsletter. And in Harpers magazine, there was an extract from music journalist Liz Pelly’s new book on Spotify. It focuses on the streamer’s Perfect Fit Content (PFC) programme, which pays production companies to create cheap, generic music by “ghost artists” in order, Pelly alleges, to populate Spotify’s playlists and reduce royalty payouts to real artists. (In Pelly’s book Spotify acknowledges the existence of the Perfect Fit Content programme but denies that it is trying to increase the share of streams of Perfect Fit Content.) Both are eye-opening reads, depicting the two companies as industry disruptors with little or no care for the thing they’re disrupting, and making their respective industries worse in the process.But if Netflix and Spotify are cast as the villains of these stories, it is clear that we, the consumers, have a degree of complicity. Both streamers are, after all, simply adapting to, and profiting from, our viewing and listening habits. Two striking details from those articles underline this. Tavlin, in his piece, claims that screenwriters for Netflix movies are being asked by execs to include scenes where characters “announce what they’re doing so that viewers who have this program on in the background can follow along”. Meanwhile, Pelly notes in her piece that Spotify’s “internal research showed that many users were not coming to the platform to listen to specific artists or albums; they just needed something to serve as a soundtrack for their days, like a study playlist or maybe a dinner soundtrack … listeners often weren’t even aware of what song or artist they were hearing.” Continue reading...","Fri, 10 Jan 2025 17:00:39 GMT",0.4939,0.9564
The Guardian,Megan Thee Stallion granted restraining order against rapper Tory Lanez,Grammy-winning musician alleged the imprisoned rapper is harassing her through surrogates after he shot her in 2020Megan Thee Stallion has been granted a restraining order from the imprisoned rapper Tory Lanez until early 2030.The Los Angeles superior court judge Richard Bloom has granted Megan’s request for a protective order after the hip-hop star alleged that Lanez was harassing her from prison through surrogates as he serves a 10-year sentence for shooting her in the feet. Continue reading...,"Fri, 10 Jan 2025 18:09:02 GMT",0.25,-0.7579
The Guardian,Ignore all the fresh horrors of reality … two School of Rock co-stars just got married! | Stuart Heritage,"Child actors Caitlin Hale and Angelo Massagli met on the set of the 2003 film, fell in love and have now become husband and wife. This year only goes downhill from hereThe world is a dark and dismal place at the moment. Every day we’re greeted by fresh horrors from every quarter. Political cravenness. Environmental collapse. Sign after sign that we as a species have permanently blown the only chance we were ever given, and now we’re on a downward spiral to the end. Never before have we so needed something – anything – to lift our spirits and remind us that, despite it all, there might still be some good in the world.So thank God for the two kids from School of Rock who just got married. Continue reading...","Fri, 10 Jan 2025 11:38:20 GMT",-0.636,0.6369
The Guardian,"‘If you hear the siren, go to the shelter’: the wrenching play about the bombing of a theatre in Ukraine","In March 2022, the largest theatre in Mariupol – while in use as a bomb shelter for 1,000 people – was hit by a Russian air strike. A re-enactment based on survivors’ testimonies has been moving audiences to tearsThe play opens with the usual pre-show request for audiences to switch off their mobile phones before the curtain rises, but along with this come warnings – and instructions for how the audience should evacuate the auditorium in the event of an air raid.That is because Mariupol Drama, a play based on the real experiences of a Ukrainian theatre company during the Russian invasion of the titular city, was written and staged in the midst of war. It re-enacts the horrifying moment on 16 March 2022 when their theatre was bombed by Russian forces, even though it had by then been turned into an evacuation shelter for almost 1,000 people. Continue reading...","Fri, 10 Jan 2025 15:16:12 GMT",0.34,-0.9144
The Guardian,Resident Evil 4 at 20: the horror game that revitalised a genre,"With brutishly fast zombies, raw action and most importantly an over-the-shoulder viewpoint, the influence of Capcom’s horror game can still be feltIt is an interesting quirk of video game history that one of the greatest ever horror titles debuted on the Nintendo GameCube, a toylike console better known for the cutest titles in the Zelda series and Animal Crossing. But in 2002, Capcom revealed five exclusives to boost the beleaguered platform – and among them was Resident Evil 4, technically the 13th title in the franchise, which on its release three years later would be considered its zenith. It was an exciting new lease of life for the survival horror genre.Not that you’d guess all this from the game’s extraordinarily pedestrian setup. Six years after the fall of the Umbrella Corporation smouldering cop Leon Kennedy has been dispatched on a mission to retrieve the US president’s kidnapped daughter, who has been spotted in a tiny village in rural Spain. For some reason best known to the Secret Service, he’s going in alone. Continue reading...","Fri, 10 Jan 2025 15:40:10 GMT",-0.8442,0.7504
The Guardian,Mel Gibson to cast de-aged Jim Caviezel in ‘acid trip’ sequel to Passion of the Christ,"The director said the long-planned follow-up to the 2004 hit, which is due to start filming next year, will contain ‘some crazy stuff’Mel Gibson says that he is going to cast a de-aged Jim Caviezel in his long-planned sequel to The Passion of the Christ, and that the film will be an “acid trip”.Gibson was speaking on the Joe Rogan Experience podcast, and when asked who “the next Jesus” was going be, Gibson replied that he was aiming to use Caviezel, who had played the lead role in the first film in 2004, in a story about Jesus’ resurrection. Asked how he would handle the 20-year time gap for a story that is supposed to take place three days after the events depicted in Passion of the Christ, Gibson said he would use de-ageing techniques that are “so good now”. Continue reading...","Fri, 10 Jan 2025 15:46:26 GMT",0.4588,0.836
The Guardian,Cocktail of the week: Three Sheets’ cherry americano – recipe | The good mixer,"A negroni-style premix that you can prep ahead so it’s ready to rustle up on a Friday nightThis premix is brilliant for a crowd, and it’s also a celebration of every right-thinking bartender’s favourite garnish: the glorious maraschino cherry. Fabbri makes the best, but if you can’t find those, Luxardo is a good alternative.Max and Noel Venning, Three Sheets, London W1 Continue reading...","Fri, 10 Jan 2025 16:00:38 GMT",0.4404,0.907
The Guardian,"AngloThai, London W1: ‘There is an understated elegance to just about everything’ – restaurant review | Grace Dent on restaurants","The interior is beautiful and the cooking ingenious but don’t be daunted – it’s fun tooAngloThai, as the name suggests, has neatly entwined Thai and British roots. There are proudly British ingredients – Hebridean hogget, Cornish monkfish and crown prince pumpkin. And they’re cooked with Thai expertise in a kitchen led by John Chantarasak, who was brought up in Wales and trained at Le Cordon Bleu in Bangkok, where his father was born, and who, alongside his wife, sommelier and co-owner Desiree, has been beloved by the London food scene for several years now. Many new restaurants are said to be “much anticipated”, but in AngloThai’s case it has been anticipated for so many years now that many had given up hope of it ever becoming a reality.But you realise almost the moment you walk through the door where all that time went, because creating something as beautiful as this takes money and a great deal of planning. You need an interior created by Thai-American designer May Redding, complete with strategically placed Lampang Province ceramics to help attract a clientele who’ll be happy to stump up the £30 supplement to add Brixham crab, caviar and coconut crackers to their tasting menu. This isn’t Soho or Shoreditch; this is a smart restaurant close to Edgware Road where Anglo and Thai influences collide with the requisite levels of pomp and fire. Continue reading...","Fri, 10 Jan 2025 12:00:33 GMT",0.7096,0.9954
The Guardian,You be the judge: should my girlfriend agree to exile her unruly dog from my house?,"Fernanda’s pooch, Roo, has been banned from the home after an altercation with Vivienne’s cat. You decide if Roo should be let out of the doghouseIf Fernanda’s dog moves in, my cat will get stressed and not come home. That would break my heartI’ve put in more effort to adjust to Vivienne’s life than she has to mine. Roo&nbsp;just needs training Continue reading...","Fri, 10 Jan 2025 10:30:31 GMT",0.3612,-0.6597
