broadcast,title,description,pub_date,title_sentiment_score,description_sentiment_score
The Guardian,Elon Musk praises Doge efforts to cut federal workforce after judge ruling – live,"Musk claims Trump administration is ‘finding savings’ amid mass terminations; federal judge won’t block administration from laying off federal workersJudge rules Trump administration can continue mass firings of federal workersDonald Trump signed another round of executive orders onboard Air Force One last night, among them one aimed at ending federal benefits for people in the country illegally.The order seeks to end “all taxpayer-funded benefits for illegal aliens”, according to the White House, although it was not clear which benefits will be targeted. Continue reading...","Fri, 21 Feb 2025 02:32:58 GMT",0.3182,-0.6876
The Guardian,‘What a lie’: Danish astronaut responds to Musk claim that Biden abandoned ISS pair on purpose,"Musk claimed without evidence that Nasa’s Butch Wilmore and Suni Williams were left stranded on the orbital outpost for ‘political reasons’Elon Musk has got into a heated row with a Danish astronaut who criticised the tech billionaire’s claim that former president Joe Biden intentionally abandoned two American astronauts aboard the International Space Station.Andreas “Andy” Mogensen had on Thursday shared on X a Fox News clip featuring Musk and his boss, US President Donald Trump, in which Musk claimed Nasa’s Butch Wilmore and Suni Williams were left stranded on the orbital outpost for “political reasons” by Biden, and that the new administration was now coming to the rescue. Continue reading...","Fri, 21 Feb 2025 01:49:33 GMT",-0.4588,-0.5106
The Guardian,US Senate narrowly confirms Kash Patel as next FBI director,"Key Trump ally, who aligns with US president on range of issues, wins confirmation in 51-49 Senate voteThe US Senate has confirmed Kash Patel as the next FBI director, handing oversight of the nation’s premier law enforcement agency to an official who has declined to explicitly say whether he would use his position to pursue Donald Trump’s political opponents.Patel was narrowly confirmed on Thursday in a 51-49 vote, a reflection of the polarizing nature of his nomination and what Democrats see as his unwillingness to keep the bureau independent from partisan politics or resist politically charged requests from the president. Continue reading...","Thu, 20 Feb 2025 19:41:13 GMT",0.0,0.4404
The Guardian,Worm-like creature with ‘dark secret’ wins New Zealand bug of the year award,"Velvet worms have rows of pudgy legs, skin speckled like a galaxy and dissolve their prey with sticky goo An ancient gummy-looking worm-like creature with a vicious hunting method that involves projecting sticky goo from its head has been crowned New Zealand’s bug of the year.The Peripatoides novaezealandiae is from the family of velvet worms, or Ngāokeoke in the Māori language. The invertebrates have rows of pudgy legs and skin speckled like a galaxy, and are considered “living fossils”, having remained virtually unchanged for 500m years. Continue reading...","Thu, 20 Feb 2025 19:01:15 GMT",0.802,0.6124
The Guardian,US flies 177 deportees from Guantánamo to Honduras en route to Venezuela,"Move apparently empties military facility on Cuban base of migrant detainees and comes in wake of ACLU lawsuitThe US government has flown 177 deportees from Guantánamo Bay to Honduras, from where they are set to be transferred on to Venezuela, apparently emptying the military facility of migrant detainees.The move on Thursday came days after human rights lawyers filed a lawsuit seeking access to dozens of people who had been held at the US naval base. Continue reading...","Thu, 20 Feb 2025 23:25:52 GMT",0.0,-0.4939
The Guardian,James Bond producers give Amazon full creative control of 007,"Deal is struck with heirs to film producer Albert ‘Cubby’ Broccoli, long-serving stewards of franchiseJames Bond has fallen into the hands of a billionaire’s business empire after Amazon revealed that it has acquired “creative control” of the spy franchise from the Broccoli dynasty.Amazon MGM Studios said on Thursday it had struck a deal with Barbara Broccoli and Michael G Wilson, the British-American heirs to the film producer Albert “Cubby” Broccoli and longtime stewards of the Bond films. Continue reading...","Thu, 20 Feb 2025 17:37:33 GMT",0.5574,-0.5859
The Guardian,Six New York prison workers indicted for murder in beating death of inmate,"Assault on Robert Brooks in December caught on body cameras, triggering widespread outrage and calls for justiceSix New York prison workers have been indicted for second-degree murder in the beating death of an incarcerated man who had been handcuffed, while four others were charged with lesser crimes.The beating of Robert Brooks by multiple officers at Marcy Correctional Facility in December was caught on body cameras, triggering widespread outrage and calls for justice. Continue reading...","Thu, 20 Feb 2025 21:59:44 GMT",-0.9423,-0.9783
The Guardian,"Birkenstocks are not works of art, top German court rules in copyright case","Sandal maker, founded in Germany in 1774, wanted to stop ‘copycats’ selling similar productsThey may be the footwear of choice for Hollywood A-listers and pop stars, but Birkenstock sandals are not works of art, Germany’s top court ruled on Thursday.The German sandal maker had sought a ruling that its footwear, known for its cork and latex soles, could be classified as art and thus afforded strong copyright protections. Continue reading...","Thu, 20 Feb 2025 11:57:55 GMT",0.2023,0.7227
The Guardian,Liz Truss tells CPAC UK is ‘failing’ and needs Maga-style movement to save it,"Former prime minister says Britain is run by ‘deep state’ at rightwing conference in MarylandLiz Truss, the former British prime minister, told a rightwing conference in the US that her country was “failing” and needed a Donald Trump-style “Maga” movement to save it.Truss was speaking on Wednesday at the Conservative Political Action Conference (CPAC) at the National Harbor in Maryland, alongside rightwing populists from around the world planning deeper ties and cooperation. Continue reading...","Thu, 20 Feb 2025 12:24:13 GMT",0.4939,0.4939
The Guardian,Luis Rubiales found guilty of sexually assaulting Spanish footballer Jenni Hermoso,Former president of Spanish football federation kissed player after team won women’s World Cup in 2023The former president of the Spanish Football Federation Luis Rubiales has been found guilty of sexually assaulting the footballer Jenni Hermoso by kissing her on the lips against her will after Spain’s women’s team won the 2023 World Cup.A judge at Spain’s national court convicted Rubiales of sexual assault but acquitted him of attempting to coerce Hermoso into playing down the unsolicited and unwanted kiss. Continue reading...,"Thu, 20 Feb 2025 12:44:06 GMT",-0.7269,0.5927
The Guardian,"Indie legend Miki Berenyi: ‘There was a falling out in Lush. And, if I’m honest, it still hurts’","Ahead of her trio’s new album, the indie star answers your questions on the harsh 90s music press, her harrowing memoir, and the joy of Spurs walloping ArsenalYou’ve talked about how trying to break America led to Lush almost breaking up by the time of Chris Acland’s death. Did you actually want that level of success? tomfowler500If we had, then we wouldn’t have been on 4AD – because Pixies and Cocteau Twins were on 4AD and neither of them had a Top 10 single. They were popular and respected, but 4AD was not the label to push you up the Billboard charts. I don’t think any of us were built for that treadmill, or those long distances, and it’s hard not to lose your mind. I used to prepare for tours by taking Linguaphone tapes and thinking, “I’m going to learn Italian”. But within two weeks I was pissed out of my mind and shagging around and acting like an animal.Do you have a favourite memory of Chris you’d like to share? Mr_202I was at college with Chris. I went out with him. I knew him closely for a decade, so there’s not a single anecdote that sums him up. He was genuine, honest, likeable, good humoured. Not a shred of arrogance. What you got was really him. He wasn’t putting it on. He was just a joy to be around. I think he obviously went through something very difficult which must have overwhelmed him and ended with him taking his own life, but that wasn’t who he was. When I got the news, my overwhelming feeling was that I just wanted to run out of the room, up the street and away from it. I like to think that now he’d have been very happy, with a big family up in the Lakes. Continue reading...","Thu, 20 Feb 2025 15:00:11 GMT",0.4019,0.9857
The Guardian,Writer quits Society of Authors over union’s ‘betrayal’ of Jerusalem bookshop raided by Israeli police,"Matthew Teller, whose books include Nine Quarters of Jerusalem, said the society’s response to the event which saw two leading booksellers detained was ‘an abject failure’A writer has left the Society of Authors (SoA) in protest after the UK’s largest writers’ body made a statement on a recent Israeli police raid on a Palestinian-owned bookstore without mentioning Israel, Palestine or the names of the booksellers who were arrested.Matthew Teller, the author of books including Nine Quarters of Jerusalem, said the SoA’s statement “added insult to the injury” and was a “betrayal”, leading to him cancelling his membership on Tuesday. Continue reading...","Thu, 20 Feb 2025 17:34:09 GMT",0.0,-0.8316
The Guardian,Why Conclave should win the best picture Oscar,"Sturdy, classic storytelling and a peerless cast led by Ralph Fiennes’s anxious cardinal make this drama of Vatican intrigue a solid betCould it? Would it? Until it picked up best film at the Bafta awards, no one had really been taking this papal intrigue drama all that seriously – all the smart money was on one of two very American films: Anora and The Brutalist. (Even more so after Emilia Pérez’s spectacular Karla Sofía Gascón-related blow-out.) But could Conclave pull off a Green Book-style surge to the line, getting past more fashionable and/or artsy efforts through the virtues of sturdy, muscular storytelling?For this is surely the basis of Conclave’s appeal to Oscar voters. Although blessed by brilliant, subtle performances (courtesy of Ralph Fiennes, Stanley Tucci, Isabella Rossellini and John Lithgow among others), and handsomely mounted design and camerawork, Conclave’s great strength is its narrative furniture, a build-out of the microcosm that is the papal court. It has a head start, of course, in its source material: Robert Harris has to be the king of the issue-based suspense novel, and the practised ease of the storytelling is the ballast that keeps the film afloat. (Harris’s screen-adaptation ratio is remarkable, from Fatherland and Enigma back in the day, to the Polanski-directed projects The Ghost and An Officer and a Spy.) Continue reading...","Thu, 20 Feb 2025 10:00:34 GMT",0.8402,0.9947
The Guardian,"Nihilistic, anarchic, repugnant: Sam Peckinpah’s 10 best films – ranked!","The revered but divisive American director, who died in 1984, would have turned 100 this week. We rate his greatest movies, from Straw Dogs to The Wild BunchAfter making his name as a director of westerns, Sam Peckinpah was given his first shot at making a major studio film – an epic about a tyrannical cavalry officer (Charlton Heston) leading an expedition into Mexico. The production set a template for later Peckinpah films – heavy drinking, personality clashes, battles with the suits, and a final cut not matching the director’s vision. Major Dundee was a victim of its chaotic ambition and it’s easy to see why it flopped on release: even in the 2005 restored version, it is hopelessly unfocused, taking in Dundee’s Moby-Dick-like mission to track down an Apache chief, the dynamics of the US civil war, encounters with the French army and an unconvincing romantic interlude. But it’s interestingly flawed, a sort of dry run for The Wild Bunch, and Richard Harris is entertaining as Benjamin Tyreen, the Irishman who leads the Confederate prisoners in Dundee’s ragtag army. Continue reading...","Thu, 20 Feb 2025 13:00:08 GMT",0.6696,-0.8934
The Guardian,Where to start with: Jane Austen,"From sparkling dialogue to surprise character traits, wit, humour and tragedy, this is the year to appreciate AustenThis year marks what would have been Jane Austen’s 250th birthday, and getting stuck into the great Regency writer’s brilliant work is the best way to celebrate. Perhaps you’ve seen the film adaptations, or dipped into Pride and Prejudice, but what about the more obscure Lady Susan? Writer and professor John Mullan has come up with a handy guide to Austen’s writing.*** Continue reading...","Thu, 20 Feb 2025 17:25:28 GMT",0.0,0.8519
The Guardian,Sam Fender: People Watching review | Alexis Petridis's album of the week,"(Polydor)On his third album, produced by the War on Drugs, the North Shields singer-songwriter shows just how gifted he is at pairing stadium choruses with sharp, bleak vignettesSam Fender’s third album ends with a track called Remember My Name. It’s clearly a very personal song, about its author’s late grandfather – even revealing the address of his council house, 11 Wark Avenue. The northern British references – “Chasing a cross in from the wing / Our boy’s a whippet, he’s faster than anything” – are amplified both by Fender’s Geordie vowels and the backing, provided by the Easington Colliery brass band. It’s all very specific and individual – you really don’t hear brass bands, or indeed the mention of whippets in pop very often – and yet Remember My Name seems to have something of the self-fulfilling prophecy about it. You can immediately imagine its soaring melody being sung en masse by a huge festival audience, which is, one suspects, precisely the destiny that awaits it.It’s a reminder of the singularity of Fender’s rise. Both his 2019 debut Hypersonic Missiles and 2021’s Seventeen Going Under went platinum; the latter’s title track sold nearly 2m copies in the UK. He’s just announced a run of vast summer gigs, taking in the London Stadium and three consecutive nights at Newcastle’s St James’ Park: four shows that will see him play to the best part of quarter of a million people. This has happened despite the fact that his music is expressly political, and not in the usual platitudinous box-ticking way. It relentlessly picks away at the bleakest realities of northern working-class life, seldom a fashionable cause: you’d probably have to look back to Design for Life-era Manic Street Preachers – or even further, to the heyday of the Jam – to find rock musicians who made a similar agenda so commercially successful. He is probably the only pop star to have attracted both the praise of august socialist magazine the Tribune for his critiques of “the callousness of British neoliberalism” and the TikTok hashtag #toptierindiebois. Continue reading...","Thu, 20 Feb 2025 12:00:52 GMT",0.0,0.9606
The Guardian,"‘I love bass, bass, bass and bass’: DJ Paulette, Carl Craig and more on the best DJ headphones","We asked top DJs to share their favourite headphones for seamless setsAsk any DJ what their most important bit of kit is and they’ll tell you it’s what goes around their head. Whether playing off a laptop, CDJs or decks, a pair of decent headphones is your portal to the mix and an essential element to get right.Luckily, we’ve assembled some of the world’s best selectors to evangelise about the pairs they’re faithful to: from reliable specialist brands to old-school one-ear models, these are the best DJ headphones for crystal-clear sound and to hear that all-important bass. Continue reading...","Thu, 20 Feb 2025 15:00:10 GMT",0.8646,0.9531
The Guardian,‘The classiest gift I’ve heard of’: what to bring to a dinner party (that isn’t wine or chocolates),"From fancy olive oil to jazzy tea towels, skip the obvious and surprise your host with one of these creative dinner party giftsI’m convinced that the same bottle of Whispering Angel and box of Lindor chocolates have been doing the rounds among my friends for two or three years now. It’s not that we don’t like them (what’s not to like?); it’s that they are such easy gifts. Every host saves them for when they’re next a guest, in an unspoken game of Pass the Provençal Rose.Yet the reason wine and chocolates are such popular dinner party gifts is the same reason they get passed around: they’re often generic. They’re not thoughtless per se, but they rarely suggest a huge amount of thought for the personality or taste of the host. Continue reading...","Wed, 19 Feb 2025 15:00:11 GMT",0.6808,0.857
The Guardian,"15 of the best men’s jumpers, from cashmere and cable knit to merino wool","Whether you’re searching for a lamb’s wool layer or a stylish sweater vest, upgrade your knitwear with these instant classics• The best boots for men: 14 favourites, from Chelsea to brogues to westernKnitwear, like most menswear, is best done classic. As with other staples – denim, T-shirts, tailoring et al – it’s an investment that will go beyond any trend or season. So, if you buy the right pieces, you’ll likely wear them for years to come.With that in mind, there are a few things to consider when hitting the shops. Above all, it’s best to choose jumpers you know are made well, using good fabrics. That means you should go for brands you can trust in terms of craftsmanship and stick to natural fibres, such as cotton, wool and cashmere. Unlike human-made textiles, these are naturally breathable and temperature-regulating so they’re more comfortable and better for your skin. This sometimes means the price is a little higher than a fast-fashion buy, but they tend to last longer – just be sure to keep them protected when moth season hits. Continue reading...","Tue, 18 Feb 2025 16:00:09 GMT",0.6369,0.9732
The Guardian,‘Slightly plasticky … would avoid’: the best (and worst) supermarket spinach and ricotta tortelloni,"Whose tortelloni are pillows of pasta perfection, and whose taste like postage stamps? Our quick-cook columnist has the answers …• The best food processors and mixers – chosen by chefsShop-bought ravioli and tortelloni are staples in my kitchen – I’ve even been known (with some chutzpah) to serve bowls of the stuff to friends, including well-known food writers, albeit improved with brown butter, crisp sage and hazelnuts, or in my signature ravioli lasagne.In an ideal packet, I’m looking for a well-seasoned filling, nice and light from the ricotta, and not too processed or stodgy in texture. Similarly, the pasta shouldn’t taste plasticky; the closer it is to homemade, the better. Continue reading...","Sat, 15 Feb 2025 10:00:33 GMT",0.0258,0.9712
The Guardian,Bored kids and empty cupboards? Try these child-friendly recipes this half-term,"In this week’s newsletter: From pizza traybakes to rainbow dips, these fun, easy-to-prepare meals will keep little ones fed and occupied over the holidaysThis is an extract from our weekly Feast newsletter, written by Felicity Cloake, Meera Sodha, Rachel Roddy and others. Sign up here to get it free to your inbox every Thursday.Happy half-term everyone! If you are a parent reading this, the chances are you are in desperate need of a snack/strong coffee/stiff drink. I start these school breaks with great intentions – lots of wholesomeness, baking, arts and crafts, and so forth. But the snack cupboard is now bare, the kids have had a side of cucumber sticks with every meal as a token bit of “green” and there are only so many episodes of Bluey I can take (actually, that’s a lie, but you know, we can’t have it playing all day). To go out with a bang, I’ve got a few last-minute treats up my sleeve. Continue reading...","Thu, 20 Feb 2025 13:08:34 GMT",-0.4404,0.7959
The Guardian,What is nerve flossing and does it help with nerve pain?,"It can help relieve pain and tension, especially for patients recovering from injury or nerve compression conditionsAs a fairly diligent stretcher who tries to get at least five minutes of stretching in a day, I’d like to say that I’m fairly in tune with my body, and all its aches and pains. But recently I’ve been experiencing a bit of numbness and stiffness in my glutes that none of my usual stretches could address. Could the numbness indicate a possible issue with my nerves?It’s possible it could indicate a tight sciatic nerve, said Morgan Sileo, an orthopedic clinical specialist at the Hospital for Special Surgery, the treatment for which could include sciatic nerve flossing. Continue reading...","Thu, 20 Feb 2025 17:00:14 GMT",-0.1531,-0.5423
The Guardian,"Council brawls, suspicious blood and rampant capybaras – take the Thursday quiz","Questions on general knowledge and topical trivia, plus a few jokes, every Thursday. How will you fare?The Thursday quiz likes to think of itself as an oasis of calm in a turbulent world. A place where whatever global events have unfolded, you will find yourself being asked instead about silly animal stories that have been in the news, and have the chance to laugh along with the repetitive in-jokes and catchphrases. There are 15 questions on topical news, popular culture and general knowledge. There are no prizes, but you can let us know how you got on in the comments.The Thursday quiz, No 198 Continue reading...","Thu, 20 Feb 2025 11:00:38 GMT",-0.3612,0.4137
The Guardian,"Giants, saints and dragons on the Llŷn peninsula in north Wales","Three walks along the Wales Coast Path offer a fascinating insight into the legends, culture and industry that shaped this stunning outpostThe Llŷn peninsula projects a Tolkienesque mystique as you view it from Cardigan Bay. On a clear day, its jagged, alluring and yet foreboding topography – stretching outward into the Irish Sea – is easily visible from as far south as Aberystwyth. No wonder it was chosen as the location for the recent House of the Dragon Game of Thrones spin-off series. It’s also been my constant backdrop for the past few days as I walk the Wales Coast Path exploring the relationship of the people of this land to the sea – how it has shaped society, how humanity has tried to tame it and how the sea will inevitably prevail.Now, having reached Porthmadog (a town built on reclaimed sand from the Glaslyn estuary), I’m ready to experience the entrancing, wild-looking beauty of the Llŷn up close. I have three walks planned over the coming days. The first is a gentle six-mile stroll from Borth-y-Gest (one bay over from Porthmadog) to Criccieth Castle. As I set out, the tide is retreating at a rate that makes me think someone has pulled the plug on the entire estuary. The small boats bobbing in the bay become statues as they are stranded in the sand. Continue reading...","Thu, 20 Feb 2025 07:00:32 GMT",0.0,0.9578
The Guardian,Career catfishing: why gen Z accept job offers – then ghost their new employers,"Why would anyone apply for a role, go to an interview, sign a contract, but never turn up to work? The answer probably lies in the punishing jobs market ...Name: Career catfishing.Age: It’s very 2025. Continue reading...","Wed, 19 Feb 2025 17:16:25 GMT",0.0772,-0.8625
The Guardian,I muffle my cries of passion – but the noise is upsetting my partner’s teenager,"Slammed doors and avoidant behaviour have alerted me to the 18-year-old’s discomfort. How can I persuade my lover that this is a problem?I’ve been dating a man whose 18-year-old kid lives with him full-time. My partner and I are very intimate and I always thought that I kept my cries of passion down by screaming into a pillow. Recently, his kid began slamming doors and cupboards very loudly to let us know that they had heard us. I told my partner that I felt bad, but he said he didn’t think I was being loud and that he had already explained to his kid when they chose to live with him full-time that this would happen. I don’t have the best relationship with his kid because I very rarely spend any time with them, and they are quite introverted. What’s more, recently they were avoiding eye contact with me and seemed uncomfortable. Now, I’m afraid that I’ve made them unhappy by simply being there. I don’t spend very much time with the man I’m dating, which I think sends a signal to his kid that I’m mostly a sexual partner (I would like more but am afraid of asking for it for fear of being turned down). I want to respect his kid, but I also sense that they don’t respect me because my relationship with their father is not one of a bona fide girlfriend. What’s the best way to talk to the man I’m dating about my concerns?Pamela Stephenson Connolly is a US-based psychotherapist who specialises in treating sexual disorders.If you would like advice from Pamela on sexual matters, send us a brief description of your concerns to private.lives@theguardian.com (please don’t send attachments). Each week, Pamela chooses one problem to answer, which will be published online. She regrets that she cannot enter into personal correspondence. Submissions are subject to our terms and conditions. Continue reading...","Wed, 19 Feb 2025 11:48:40 GMT",-0.6124,0.97
