broadcast,title,description,pub_date,title_sentiment_score,description_sentiment_score
The Guardian,Tornado review – windswept samurai western set in apocalyptic Scotland,"The second feature from John Maclean is an almost surreal tale of itinerant martial arts performers and a band of thieves in 18th-century Scotland John Maclean’s new movie is a dour, pessimistic, almost surrealistically downbeat revenge western set in Scotland in the late 18th century – but it could as well be happening in some post-apocalyptic landscape of the distant future or on another planet. This is the follow-up to his debut Slow West, and as with that film it is shot by Robbie Ryan with music by Jed Kurzel (director Justin’s brother and collaborator). I have to admit, though, that this does not quite have the energy or the fluency of that previous film, perhaps not the same production resources either – and by comparison it is more strenuously contrived. Yet the pure strangeness of the movie commands attention and there is a charismatic lead performance by Japanese actor-musician Mitsuki Kimura, or Kôki.She plays a dancer called Tornado, who travels around what looks like utterly empty terrain with her impresario father Fujin (Takehiro Hira) in a covered wagon, putting on a samurai show. They perform with puppets, whose little lopped-off heads and limbs squirt out fake blood with tiny ingenious pumps; they also demonstrate samurai sword-twirling combat themselves. They appear to have once been part of a travelling circus encamped elsewhere. And who do they perform to? A crowd of people show up out of nowhere, having presumably walked many miles from the (unseen) villages where they live. Continue reading...","Wed, 26 Feb 2025 19:30:15 GMT",-0.6597,-0.2987
The Guardian,"The playbook for bombing hospitals in war: deny, deflect, justify. The law must close these loopholes |  Maarten van der Heijden","Cynical actors exploit the legal ambiguities around targeting healthcare facilities, as seen in Gaza. Unequivocal protections are neededHospitals in Gaza have “turned into battlegrounds”, the World Health Organization’s representative for the West Bank and Gaza stated at the UN security council in January. He warned that the healthcare system was being “systematically dismantled and driven to the brink of collapse”.Israel’s attacks on medical centres in Gaza have prompted widespread condemnation from civil society, academics and news agencies, many labelling these strikes as breaches of international law or war crimes. WHO director-general Tedros Adhanom Ghebreyesus posted that: “Any attack of healthcare facilities is a violation of international humanitarian law.” Continue reading...","Wed, 26 Feb 2025 12:00:34 GMT",-0.743,-0.9584
The Guardian,Dirtier BP is still miles away from resetting its share price,"Fossil fuel giant’s strategic U-turn may be far-reaching but even after ditching climate goals the shares fellBP to ramp up oil and gas output in major shift away from green goalsExplainer: why has BP pulled the plug on its green ambitions?BP’s new strategy is “exciting”, said chief executive Murray Auchincloss at one point during Wednesday’s long City presentation. Did the stock market agree? Hardly. Even after he ditched the climate goals, and vowed to pray solely at the altar of shareholder value, the shares fell by 1.4% on a day when the FTSE 100 index was up. The rotten share price, down by almost a quarter in the past two years, is a very long way from being “fundamentally reset”.The strategic U-turn itself, one can agree, is far-reaching. A company that until recently was still mouthing (just softly) former boss Bernard Looney’s old 2020 refrain about “reimagining energy for people and our planet” has relegated investment in low-carbon energy to 5% or less of the overall budget. Even that portion will need to be “underpinned by government support”, the finance director emphasised. And, having bought full control of solar developer Lightsource only last year, BP now wants to find a partner to share the capital load. Continue reading...","Wed, 26 Feb 2025 18:12:34 GMT",-0.0516,0.9718
The Guardian,Ella Baron on Keir Starmer’s meeting with Donald Trump – cartoon,Continue reading...,"Wed, 26 Feb 2025 18:46:59 GMT",0.0,0.0
The Guardian,"As the far right surges around the globe, what can a new TV series about Mussolini teach us? | Caroline Moorehead","Joe Wright’s new drama gives a theatrical take on the dictator’s flaws but there is so much more history viewers need to knowOn 3 January 1925, Benito Mussolini delivered the most important speech of his life to the Italian parliament. His career was about to be over. The body of the socialist deputy and his bitter foe, Giacomo Matteotti, had been discovered in a shallow grave near Rome and mounting evidence pointed to Mussolini’s responsibility for his murder. With the king, the old liberal democratic elite, the left and many of his own party pressing for his dismissal, Mussolini declared that everything – the fascist violence, the immorality, the turmoil into which Italy had sunk – was his fault, “because I, I alone, created it”. By the same token, he alone was the man “capable of dominating the crisis”. Parliament, stunned, sat silent. There was no voice of protest. The dictatorship was saved.Based on the first volume in a trilogy of the same name by Antonio Scurati and garlanded with praise by Italian critics, the television drama Mussolini: Son of the Century covers just six years in Mussolini’s life, from his days as a brawling but highly effective journalist in Milan to his assumption of total power. Joe Wright, better known for his gentle approach and light touch in Pride and Prejudice and Atonement, has produced a series that is loud, provocative and violent. The music that accompanies it is throbbing, incessant and often intrusive, with occasional snatches of Verdi and Puccini. All is dark, deeply gloomy and sepia-coloured. Continue reading...","Wed, 26 Feb 2025 15:45:35 GMT",0.0,-0.9894
The Guardian,Do Trump and co want a world reclaimed by straight white men? It’s not certain they’ll get it | Andy Beckett,"Trump calls diversity policies ‘immoral’ and Badenoch says they’re ‘poison’. But businesses know multiculturalism is good for the economyFor people who believe that the world should be run by straight white men, these are heady times. Probably the most powerful social conservative on the planet occupies the White House again, and seems determined to drive “immoral” and “discriminatory” diversity policies out of American life.Two years ago, the US supreme court banned the use of affirmative action in university admissions. A growing list of American and British companies, from Ford to BT to Goldman Sachs, appear to be reducing their commitment to the once fashionable corporate principles of diversity, equity and inclusion (DEI). Meanwhile, Reform UK promises to “scrap DEI rules that have lowered standards and reduced economic productivity”. In politics, commerce and education, a huge, potentially lasting counterrevolution seems to be under way.Andy Beckett is a Guardian columnistDo you have an opinion on the issues raised in this article? If you would like to submit a response of up to 300 words by email to be considered for publication in our letters section, please click here. Continue reading...","Wed, 26 Feb 2025 08:00:06 GMT",0.0992,0.9809
The Guardian,"Starmer doesn’t do performative politics. When he faces Trump, that will be an advantage | Tom Baldwin","The PM knows there is no use picking a fight. He will try to persuade the US president that what is in Europe’s and Ukraine’s interest is also his best betTom Baldwin is the author of Keir Starmer, The BiographyKeir Starmer is neither the kind of leader to light up Britain with a shining vision of the future, nor one of those populists who reheat supposedly glorious myths from a largely imaginary national past. On Tuesday, however, the prime minister proved there are few better than him at communicating the heavy weight of decisions that bear down on him – here and now – in the present world upheaval.Indeed, from the funereal manner of his announcement, you might have been forgiven for thinking that he was saying something deeply unpopular. Yet polls have suggested for some time that about two-thirds of the public – especially those parts of it Labour fears losing to Reform – want less taxpayers’ money spent helping the poorest in the world. More funding of Britain’s defence is usually backed by voters who also strongly support Ukraine in its fight for freedom. And, most importantly of all, it has been the key demand of a president threatening to withdraw US security from Europe and whom Starmer meets at the White House on Thursday.Tom Baldwin is the author of Keir Starmer, The Biography Continue reading...","Wed, 26 Feb 2025 14:22:38 GMT",0.25,0.9392
The Guardian,"Everyone has gone nuts for pistachios. But they’re just an upmarket green peanut, aren’t they? | Emma Brockes","Encased in chocolate, blended into martinis, baked in a croissant – tasty, maybe, but let’s not kid ourselves about the health benefitsOn my desk as I write this I have a packet of shelled, unsalted pistachios, a snack about which I have no particular feelings beyond the fact they’re better for me than Hula Hoops and, like so many things I’ve been persuaded to buy by my doctor, can be integrated into a “heart healthy diet”. Pistachios are also, it turns out, having a moment. We’ve been here before, with pomegranates and acai and, a few years ago, bone broth and anchovies. Now it’s the turn of the upmarket green peanut (oh look, I do have an opinion), which, once you start noticing it, you’ll find appears to be everywhere.It started last year with the rise of what is informally known as Dubai chocolate, the so-called confectionery invented by the British-Egyptian entrepreneur Sarah Hamouda, that took over the world – and that became, according to Deliveroo, one of last year’s top items ordered worldwide. If you haven’t encountered it, the Can’t Get Knafeh Of It chocolate bar is a fancy slab of milk chocolate stuffed with a mixture of shredded filo, date syrup and pistachio cream, which tastes like a blocked artery and looks like wet tobacco. The original bar – the market is teeming with knock-offs – costs about £15.99, and if you can finish it in one sitting I raise my cholesterol to you.Emma Brockes is a Guardian columnist Continue reading...","Wed, 26 Feb 2025 16:59:18 GMT",-0.1655,0.9505
The Guardian,"Starmer’s cuts are a huge mistake – foreign aid is an investment, not an expense | Halima Begum","At the height of the cold war, the west advanced its soft power through aid and development spending. If we cut that now, who will fill the vacuum?Halima Begum is the chief executive of Oxfam GBThe savagely deep cuts that Keir Starmer has announced to the international aid budget make a mockery of the pledge his party made to the British people in its manifesto. Then, it promised to restore development spending at the level of 0.7% of gross national income “as soon as fiscal circumstances allow”. On Tuesday the prime minister stood in front of parliament and announced that he will cut it from 0.5% to 0.3% of GDP. In the same manifesto, Labour made a commitment to “rebuild Britain’s reputation on international development with a new approach based on genuine respect and partnership with the global south”. This week, the government turned its back on it.Of course, I understand the argument that defence spending has to be increased, but cutting our aid budget still further when governments around the world are cutting theirs too will only increase division in our already deeply divided world. More than that, cutting aid amounts to a collective betrayal of the most vulnerable and dispossessed by western leaders.Dr Halima Begum is the chief executive of Oxfam GB Continue reading...","Wed, 26 Feb 2025 11:00:33 GMT",-0.3182,-0.8894
The Guardian,The Guardian view on Starmer in Washington: don’t compromise on the truth | Editorial,"The prime minister must handle Donald Trump with tact, but without flinching from a duty to confront falsehoods in the president’s worldviewIt is hard to set expectations ahead of a summit with no useful precedent. British prime ministers have visited the White House before and in a wide variety of geopolitical contexts, but never has the hosting president been hostile to the transatlantic alliance. Never before could it be said that Washington’s foreign policy regarding European security was closer to a Moscow line than a London one.Conventional platitudes about a “special relationship” and common values are of little use to Sir Keir Starmer in handling Donald Trump. History is not&nbsp;irrelevant, but on matters of substance – most urgently, a settlement to end the war in Ukraine – Mr Trump is behaving more like a mafia boss than a statesman. His method is to demand tribute in exchange for protection.Do you have an opinion on the issues raised in this article? If you would like to submit a response of up to 300 words by email to be considered for publication in our letters section, please click here. Continue reading...","Wed, 26 Feb 2025 18:30:13 GMT",0.3182,0.3696
The Guardian,The Guardian view on Spain: a progressive beacon in dark times | Editorial,"Pedro Sánchez’s Socialist-led government has welcomed immigration and boosted public spending, with stellar resultsCoverage of this week’s seismic election result in Germany focused on the disturbing rise of the far right, and chancellor-in-waiting Friedrich Merz’s warning that Europe can no longer rely on the United States for its security. But for European progressives, there was also a third depressing takeaway: the comprehensive rejection of Olaf Scholz’s Social Democratic party, which&nbsp;recorded&nbsp;its worst postwar result.Across the continent, centre-left parties have been exiled from the corridors of power, while the radical right has fuelled anxieties over immigration and economic stagnation to extend its influence. There is, however, one startling outlier to this dismal trend. Last year, Spain recorded the highest growth of any major country, at 3.2%. This was achieved under a Socialist-led coalition government that has welcomed high levels of immigration as a driver of economic prosperity, and which from this year plans to offer residency and work permits to up to 900,000 undocumented migrants. In 2024, over 400,000 vacancies were filled by migrants and dual nationals, as overall unemployment figures fell to their lowest level since the 2008 crash.Do you have an opinion on the issues raised in this article? If you would like to submit a response of up to 300 words by email to be considered for publication in our letters section, please click here. Continue reading...","Wed, 26 Feb 2025 18:25:13 GMT",0.0,-0.4088
The Guardian,Cutting aid to buy arms won’t make the UK safer | Letters,"Readers express dismay at the government’s decision to cut the foreign aid budget to pay for increased spending on defenceWhen Rishi Sunak cut the aid budget during the Covid pandemic from 0.7% to 0.5% of GDP, it was described by Larry Elliott in the Guardian as an act of “wilful political vandalism” (29 November 2020). This was partly because the amount saved, £3bn-£4bn, was “chickenfeed” in the context of a budget deficit running at 20% of GDP, but mostly because it completely undermined “the idea of aid as global public investment for the common good”.Keir Starmer’s aid cut is even more cynical, as your editorial (25 February) correctly identifies, because it is self-imposed without any economic logic to gain political traction in the Trumpian unilateralist world order. The moral bankruptcy of this approach was particularly evident in Elon Musk gleefully posting on X that “We spent the weekend feeding USAID into the wood chipper”. Starmer’s “aid for arms” announcement may find favour in the White House, but it will destroy the Labour government’s reputation and undermine multilateral approaches&nbsp;to poverty eradication when they are needed most.Stephen McCloskeyDirector, Centre for Global Education, Belfast Continue reading...","Wed, 26 Feb 2025 17:56:59 GMT",0.3182,-0.9462
The Guardian,Inside the mind of Trump – a president who talks tough but surrenders to Putin | Letters,"Trump has the classic authoritarian personality – not the same as being authoritarian, writes Mary Wilkinson, plus, letters by Tom Brown, Jim Hatley, Sally Burch and Alison RouthJonathan Freedland’s comments about Donald Trump highlighted two Trumps: the shoot-from-the-hip tough guy and the supplicant at the court of Vladimir Putin (Trump is the world’s greatest showman – and the weakest strongman it has ever seen, 21 February). Isn’t he an example of the authoritarian personality (not to be confused with being authoritarian)?Rupert Wilkinson’s 1972 book The Broken Rebel explored the subject. Some of the characteristics of the authoritarian personality that he listed are submission to a strong, admired authority; aggressive hostility to people in authority whose traits he resents, often as a result of being dominated himself in childhood or to compensate for a sense of weakness; open hostility to outsiders and admiration for his own side; a desire to be strong, to hold power and assert it aggressively; detests ambiguity and uncertainty; craves simple solutions and obvious results.Mary WilkinsonLondon Continue reading...","Wed, 26 Feb 2025 17:56:43 GMT",-0.0644,0.1184
The Guardian,Park grabs winner as England hold on for Nations League victory over Spain,"England’s gutsy, industrious and confident performance against Spain perhaps mattered more than the result but boy did they need a big win, too.It’s fair to say the past few months have not been easy for Sarina Wiegman’s side, the context around two wins from five games since their European Championship qualifying campaign a little lost. But a win for the European champions against the World Cup holders Spain to put them level on points with Portugal in their Nations League group lifts a pressure that perhaps shouldn’t be there. Continue reading...","Wed, 26 Feb 2025 22:02:05 GMT",0.5859,0.9736
The Guardian,Liverpool go 13 points clear after Mac Allister completes stroll past Newcastle,"That red spec disappearing over the horizon is Liverpool. Arne Slot’s relentless side stretched their Premier League lead to 13 points with 10 games to play courtesy of an assured victory over Newcastle. The strongest team in the league is improving while so-called title rivals falter, and Anfield knows what is coming.At 9.22pm news filtered through of Arsenal’s draw at Nottingham Forest in the earlier kick-off. The first chant of “Liverpool, top of the league” emerged from the Kop. Alexis Mac Allister soon added to Dominik Szoboszlai’s first-half goal with an emphatic finish of his own and the title-winning atmosphere cranked up. Anfield was denied the chance to roar home league championship No 19 due to the pandemic. The procession towards No 20 affords Liverpool supporters plenty of time to make amends. The run-in is turning into a lap of honour. Continue reading...","Wed, 26 Feb 2025 22:11:41 GMT",0.3818,0.9274
The Guardian,Blunted Arsenal grind to a halt in grating stalemate at Nottingham Forest,"These teams may only be separated by one place in the Premier League table but the emotions released by players, coaches and fans at the end of this rabidly entertaining draw showed just how far apart their ambitions lie. Arsenal, in second place but trailing Liverpool by 13 points, are resigned to Champions League qualification; Nottingham Forest, in contrast, are intoxicated by the prospect.Arsenal’s title challenge was limping anyway as their striking department fell into the treatment room in mid-winter but gaining one point from two games against West Ham and Forest over the past five days seems to have killed it off. Continue reading...","Wed, 26 Feb 2025 21:56:06 GMT",-0.1027,0.5927
The Guardian,Jos Buttler considering future after England’s sorry Champions Trophy exit,"Captain on brink after third group exit in a rowAfghanistan outplay England to win thrillerJos Buttler will consider his future as England’s white-ball captain after the agonising eight-run defeat by Afghanistan in Lahore that terminated his side’s Champions Trophy hopes, and left him wondering whether he is part of the problem.England fly to Karachi on Thursday for their final group game – against South Africa on Saturday – already out of the running for the semi-finals. Their defeat by Afghanistan, following the loss against Australia last Saturday, made it a third consecutive tournament failure under Buttler’s leadership. Continue reading...","Wed, 26 Feb 2025 18:53:16 GMT",0.4767,-0.4767
The Guardian,Manchester City back into top four as Haaland goal enough to beat Spurs,"For 45 minutes, it was tempting to wonder where this version of Manchester City had been hiding. They were energetic and incisive, threatening to tear Tottenham apart. Erling Haaland was back after injury and his 20th goal of the Premier League season – and 28th overall – was scant reward for their dominance.City’s previous visit to this stadium in late October had brought their first defeat of the season – in the Carabao Cup – and it is remarkable to consider how they have fared since then. Before kick-off here and taking in that result, their record showed 14 losses in 27 games in all competitions. They looked set to make a more coherent statement. Continue reading...","Wed, 26 Feb 2025 21:40:22 GMT",0.2023,-0.4404
The Guardian,Maguire heads Manchester United past Ipswich despite Dorgu’s red card,"This riveting affair took in the pantomime of Ipswich Town’s goals, Patrick Dorgu’s early bath for an industrial challenge, Alejandro Garnacho stomping off for the tunnel when sacrificed following the red card, and a trio of Manchester United set‑piece finishes to deliver three points that lifts Ruben Amorim’s charges to 14th.Ipswich departed as they arrived – third-bottom – and the United soap opera moves on to Fulham’s FA Cup fifth‑round visit on Sunday. In a tumultuous time of further redundancies and free lunches ended for many remaining staff, the head coach’s declaration that United’s players are in the “bubble” of trying to turn fortunes around was borne out on a night that began in incessant rain and ended with a precious win. Continue reading...","Wed, 26 Feb 2025 21:47:56 GMT",0.4215,0.8957
The Guardian,O’Brien dives to Everton’s rescue and extends Moyes bounce at Brentford,"Everton’s run of form survived Beto’s loss of his. David Moyes’s resurgent side secured a third draw in four games and extended their unbeaten run in the league to seven, despite their recently red-hot Portuguese striker’s failure to find a way past Mark Flekken with any of three superb chances.Instead it was Jake O’Brien – the 23-year-old whose promotion by Moyes to the first-team coincided with the start of their current run – who rescued a point with his first goal for the club after Yoane Wissa had put Brentford ahead in the first half. With Ipswich losing at Old Trafford, Everton, who were a single point above the relegation places when Moyes was appointed last month, now stand 15 clear with relegation worries a distant memory. Continue reading...","Wed, 26 Feb 2025 22:01:28 GMT",0.5859,0.6705
The Guardian,Rejuvenated Lewis Hamilton enjoys red-letter day in his new Ferrari,"On first serious drive in new car, former champion shows how he’s bringing an aura of optimism to the ScuderiaThe air of determination around Lewis Hamilton is certainly ­familiar but there is now also a sense of expectation, an aura radiating through the murky gloom of an empty enormo‑drome in the desert. Hamilton has always been a star but, entering his 19th Formula One season with a new start at Ferrari, he is now burning even brighter.In the chill wind of an ­unseasonably cold Bahrain for pre-season testing, Hamilton is a man anew as he takes on a challenge with the Scuderia, reinvigorated as perhaps he has not been since last he struck out on his own course when leaving McLaren for Mercedes in 2013. Continue reading...","Wed, 26 Feb 2025 18:35:10 GMT",0.5106,0.2023
The Guardian,"Total collapse of vital Atlantic currents unlikely this century, study finds","Climate scientists caution, however, that even weakened currents would cause profound harm to humanityVital Atlantic Ocean currents are unlikely to completely collapse this century, according to a study, but scientists say a severe weakening remains probable and would still have disastrous impacts on billions of people.The Atlantic meridional overturning circulation (Amoc) is a system of currents that plays a crucial role in the global climate. The climate crisis is weakening the complex system, but determining if and when it will collapse is difficult. Continue reading...","Wed, 26 Feb 2025 16:00:11 GMT",-0.2568,-0.9822
