broadcast,title,description,pub_date,title_sentiment_score,description_sentiment_score
The Guardian,Tom Willis double puts Saracens back on track against Bristol after humbling,"Saracens 35-26 BristolBack-rower’s starring role against injury-hit BristolIn the unpredictable world of top-flight rugby, here was a result we could all understand. Bristol arrived on a record-­breaking run of 10 away wins, but seriously hindered by injuries. They fought with spirit and snatched a late try bonus point, but rarely looked likely to seriously ­trouble Saracens, who were hungry to atone for last Saturday’s record thrashing by Bath.The Bears have never won at this venue and victory would have been a perfect way to start what is already a momentous weekend with Ilona Maher’s bow for their women’s side at Ashton Gate on Sunday. But two first-half tries by the outstanding Sarries’ No 8 Tom Willis – including one of the most fleet-footed finishes you will see from a forward – helped Mark McCall’s men take a grip on the contest they never relinquished. Continue reading...","Sat, 04 Jan 2025 19:51:22 GMT",0.0,0.834
The Guardian,Tomos Williams puts paid to Sale comeback as Gloucester hold on,"Gloucester 36-20 SaleThree tries in 25 first-half minutes is too much visitorsThese days, almost the worst thing a team can do in the Premiership is rack up an early lead, such is the likelihood of a stirring comeback. Sure enough, Gloucester ran rings around a leaden-footed Sale for half an hour; sure enough, Sale spent most of the rest of the match bulldozing away at Gloucester’s line.At times in the second half, it felt inevitable Sale would overturn the 22-3 deficit that faced them midway through the first, such was the inability of their hosts to gain a hold on the game that had been so firmly theirs. The referee, Jack Makepeace, was not a popular man, but Gloucester’s ­indiscipline yielded nearly 20 penalties for the visitors. Continue reading...","Sat, 04 Jan 2025 17:29:21 GMT",0.0,-0.3131
The Guardian,Swiatek and Boulter showcase new lease of life for mixed doubles format,"United Cup attracted a healthy field of top players and this dynamic and intense event appears to be thrivingTowards the end of the frantic, tension-filled mixed doubles tussle between Poland and Norway at the United Cup in Sydney last Monday, Casper Ruud took a deep breath as he stood on top of the baseline alongside his partner, Ulrikke Eikeri, and prepared to serve. With a 4-3 lead in the third set tiebreak, the following minutes would determine Norway’s fate in the competition.Ruud fired down a heavy topspin serve and then he traded forceful crosscourt groundstrokes with Poland’s Jan Zielinski from the left side of the court. But then, all of a sudden, his focus shifted. Ruud sharply changed directions, instead opting to hammer forehands down the line towards Iga Swiatek on the baseline in an attempt to overpower her. Continue reading...","Sat, 04 Jan 2025 13:47:03 GMT",0.0,0.5859
The Guardian,Lionesses approach Euro 2025 defence with more questions than answers,"Wiegman’s England tread a very different road this year, with squad berths and even the side’s system up for debateHow do you prepare to scale Everest three years after reaching the summit? You are a different person, your guide may have changed, your equipment may be different, and the route may be weathered, more hazardous and overcrowded. This time, luck may not be on your side.There is no single answer as to&nbsp;why Sarina Wiegman’s England triumphed at Wembley in 2022. No easily replicable blueprint for ­success. There were so many variables that could have changed the course of the Euros victory, but everything came together, a perfectly balanced melting pot. Now, all those variables have changed: ­personnel, opposition, preparation. Continue reading...","Sat, 04 Jan 2025 11:00:48 GMT",0.1027,0.7954
The Guardian,"Learning to swim as an adult is terrifying, embarrassing and wonderful | Alexandra Hansen","Swimming has become addictive – the euphoria of being in the water, of overcoming a fear I never expected to overcomeMore summer essentialsI don’t know if I’ve always been afraid of water, but I don’t remember a time when I wasn’t. I remember as a child sitting next to the bath to watch it fill lest it flood the house if we stepped away while the tap was still running. I’d had no bad experiences (that I could remember); my fear seemed innate.Like most Australians, I had swimming lessons in primary school. One of the first tasks was to submerge your face and head in the water, and I flat-out refused. The instructor told me that if I didn’t I would have to stay in the first lane with the little kids doing water play. I said that was fine, and she left me alone after that. So I never learned to swim. Continue reading...","Sat, 04 Jan 2025 19:00:03 GMT",-0.3818,0.0065
The Guardian,The Observer view on calls for a national inquiry into child sexual abuse,"The government’s most urgent priority is not to launch another review but  to develop a societal strategy to tackle the crimeJust over a decade ago, with the publication of an independent inquiry, Britain confronted the horror of the sexual abuse of children that had taken place in Rotherham over 16 years by organised gangs of men, mostly of Pakistani origin. The 2014 report conservatively estimated that 1,400 children – some as young as 11, many in the care of the state – were raped, abducted and sexually abused in Rotherham by groups of men. Since then, there have been many other reviews and inquiries in other towns and cities where children have been subjected to similar abuse by organised groups of men, including in Rochdale, Oxford, Telford and Bristol.Together, these reviews paint a dreadful picture of how child victims of sexual abuse were not only routinely ignored by those whose job it was to protect them – including social workers and the police – but how young girls were viewed by child protection authorities as complicit in their own rape and abuse, as if it were something they could consent to. A further 2015 review into Rotherham led by Louise Casey was also clear that these abusers could hide behind their race to perpetrate their abuse: she uncovered what she called an “archaic culture of sexism, bullying and discomfort around race”, with councillors and staff fearing being labelled racist if they mentioned the ethnicity of perpetrators. In suppressing an issue that should have been dealt with openly and properly, this was a factor in enabling the abuse to go on. Continue reading...","Sat, 04 Jan 2025 18:00:55 GMT",-0.6369,-0.9981
The Guardian,"The Observer view on the New Orleans attack: lone terrorist threat calls for wisdom, not divisive rhetoric | Observer editorial","Donald Trump blaming immigration will do nothing to counter the pernicious and lethal online influence posed by ISThe FBI says the man who drove a speeding truck into a crowd on Bourbon Street, New Orleans, early on New Year’s Day, killing 14 people, acted alone. Bureau officials also believe they know the man’s motive. Shamsud-Din Jabbar, 42, an American citizen from Texas who served eight years in the US army, some of it in Afghanistan, was “100% inspired” by Islamic State, said Christopher Raia of the FBI’s counter-terrorism division. An IS flag was affixed to his rented Ford pickup, Raia said.What is less clear is why Jabbar came to so closely identify with the extremist Sunni Muslim terrorist organisation that seized Mosul in 2014. Under Abu Bakr al-Baghdadi’s leadership, IS created a so-called caliphate in parts of Iraq and war-torn Syria. It became notorious for public executions, kidnappings and sexual enslavement. Baghdadi was killed in 2019. His followers were jailed and the caliphate smashed. But the IS brand was not.Do you have an opinion on the issues raised in this article? If you would like to submit a letter of up to 250 words to be considered for publication, email it to us at observer.letters@observer.co.uk Continue reading...","Sat, 04 Jan 2025 19:00:02 GMT",-0.872,-0.7933
The Guardian,Chris Riddell on Wes Streeting grasping the nettle of social care reform – cartoon,"The health secretary is geared up to tackle the thorny issue, but the sting lies in the question of cost Continue reading...","Sat, 04 Jan 2025 18:00:55 GMT",0.4939,-0.6428
The Guardian,"Crime is falling, but heists that make headlines imply otherwise","A burglary in London has triggered a press frenzy but the real story is that today such incidents are rareCrime stories serve up a reliable set of emotions – shock, sympathy, horror, outrage, morbid curiosity and fear. But there is something different, I think, about news of a heist. Against your will, in the crime pages of all places, you suddenly find yourself rooting for the villain. The ingenuity! The skill! The sheer improbability that one semi-retired cat burglar could shimmy up a drainpipe in full view of five sleeping XL bullies and still escape with the loot. Will he get away with it? Should he? You’re no longer reading an airport thriller, but a novel of deep moral complexity.Let us turn, for example, to the recent heist in Primrose Hill, north London, over which the media has been in a frenzy. More than £10m worth of jewellery and £150,000 of designer handbags were nicked in one swoop from the house of a Hong Kong socialite, in shenanigans involving the roof, a blowtorch, a crawl along a concrete gutter, near misses with a live-in governess, and the ability to climb on to a sink without disturbing a single cosmetic product scattered about the rim. In a BBC article displaying footage of the burglar at work, a family spokesperson actually described him as moving “like a cat”. In any case, the “hunt” for the suspect (how exciting) is on. Continue reading...","Sat, 04 Jan 2025 19:30:01 GMT",-0.3716,-0.9654
The Guardian,"In life, David Lodge was surprisingly mirthless. Luckily, his wife was a hoot | Rachel Cooke","A delightful but decidedly unfunny encounter with the author led to a train of thought about his comic booksWhen I was a teenager, David Lodge, who died last week at the age of 89, meant more to me than any other writer. It wasn’t only that his novels were so wildly entertaining and funny. My parents had been born into the optimistic but class-ridden postwar world he caught with such precision, and for this reason I saw his tales of campus life as helpful guides to the more baffling aspects of adult behaviour.There was no getting away from the fact that my father, a university lecturer, had an amazing amount in common with both conformist Philip Swallow and randy Morris Zapp, the two professors who enjoy a transatlantic exchange in Changing Places (the first of a trilogy set in Rummidge, a city modelled on Birmingham, where Lodge both lived and taught). Continue reading...","Sat, 04 Jan 2025 16:00:52 GMT",0.6705,0.9636
The Guardian,The Baldoni-Lively legal battle seems a depressing re-run of Depp v Heard | Arwa Mahdawi,"The It Ends With US wrangling is becoming increasingly nasty – we live in a world where the powerful can ‘bury’ their enemiesFirst, a mea culpa. Last year I wrote a critical piece about the promotional campaign for the adaptation of Colleen Hoover’s controversial novel It Ends With Us. The fact that Blake Lively appeared to be using a movie about domestic violence to promote her husband’s gin brand as well as her own haircare line, I noted, was pretty grim. Continue reading...","Sat, 04 Jan 2025 14:00:50 GMT",-0.5719,0.4767
The Guardian,Memo to Trump: US telecoms is vulnerable to hackers. Please hang up and try again | John Naughton,"State-backed cyberspies are exploiting ageing infrastructure to penetrate every corner of the US government, it seems – even its phone-tapping systemsYou know the drill. You’re logging into your bank or another service (Gmail, to name just one) that you use regularly. You enter your username and password and then the service says that it will send you an SMS message with a code in it which you can use to confirm that it is indeed you who’s logged in. It’s called “two factor authentication” (2FA) and it passes for best practice in our networked world, given that passwords and login details can easily be cracked.Sadly, our world is wicked as well as networked, and that SMS message can be redirected to someone else’s phone – that of the criminal who has logged in using your phished personal details – and who is now busily emptying your current account. Continue reading...","Sat, 04 Jan 2025 16:00:53 GMT",0.1027,-0.3818
The Guardian,The Guardian view on a carbon-free economy: no just transition in sight – yet,"Factory closures highlight the turbulent shift to a green economy, exposing political challenges and the urgent need for a equitable move to net zeroOne of the biggest political battles of the future began to take shape in 2024, yet it did not centre on Westminster. Instead, try Grangemouth in central Scotland, Port Talbot in south Wales and Luton in the south of England. Their stories were not front-page staples, but each was of huge significance – locally, nationally and&nbsp;economically.Grangemouth is Scotland’s sole oil refinery, whose owners confirmed in September that it would shut, to be replaced by a terminal taking in imported fuel – with&nbsp;nearly 400 workers losing their jobs. In the last&nbsp;days of September, the only remaining blast&nbsp;furnace&nbsp;at Port Talbot was shut down, as part of a restructuring that will cost 2,800 employees their jobs. At the end of November, staff at Vauxhall in Luton were told the plant would shut, ending 120 years of the carmaker’s association with the town and putting between 1,100 and 2,000 jobs at risk. One&nbsp;result was two&nbsp;days of protests in the town a week&nbsp;before&nbsp;Christmas.Do you have an opinion on the issues raised in this article? If you would like to submit a response of up to 300 words by email to be considered for publication in our letters section, please click here. Continue reading...","Fri, 03 Jan 2025 18:30:27 GMT",-0.296,0.7193
The Guardian,The Guardian view on the Shipping Forecast at 100: the radio’s prayer | Editorial,"‘Around the Bay of Biscay and back for tea’. The weather bulletin has inspired poets and popstars and become our national lullabyIt is no surprise that the Shipping Forecast, which turned 100 on New Year’s Day, is one of the cultural touchstones of our times. The weather is our national obsession, after all. Alan Bennett and John Prescott have read it, while poets Seamus Heaney, Sylvia Plath and Carol Ann Duffy have been inspired by it, along with musicians Tears for Fears, Radiohead and Blur. To mark its centenary, BBC Radio 4 devoted a day to celebrate this twice-daily bulletin and its place in the British psyche.In her diary, in January 1925, Virginia Woolf reported that it was “all gale &amp; flood; these words are exact” over New Year in East Sussex. And so it was a century later. Listening to the familiar refrains – Dogger, Fisher, German Bight – while wind and rain lashed outside, was a warm bath for the soul. Gavin and Stacey’s Ruth Jones read that day’s report as Nessa. But with parts of the country experiencing terrible flooding, it was a reminder of the dangers that led to its creation. This mixture of consolation and distant drama goes to the heart of what has come to be known as “the nation’s&nbsp;lullaby”.Do you have an opinion on the issues raised in this article? If you would like to submit a response of up to 300 words by email to be considered for publication in our letters section, please click here. Continue reading...","Fri, 03 Jan 2025 18:25:26 GMT",0.0,0.9428
The Guardian,Nostalgic memories of home and a carefree childhood | Letters,"Readers respond to Michael Rosen’s reminisces on where he was brought upThe home I grew up in had, like Michael Rosen’s, a geyser over the bath (My shirts reeked of onions; my father hated the ‘phoney Tudor windows’. That flat will always mean home, 24 December). Only my mother was brave enough to light it, as it made explosive noises when exposed to flame. That was in the bathroom, the only room in the flat without a coal fire. Our flat was on the top floor of a corner house in Kingly Street, behind Liberty in Regent Street, London, and once had clearly been the servants’ quarters of a great house.It had high windows and many rooms, and the kitchen had a huge built-in dresser, an enormous sink and a dumb waiter. In front of the kitchen range was a large sofa, and there was a big table at which my mother and aunt sat and sewed jackets for Savile Row firms, and I later did my homework. Continue reading...","Fri, 03 Jan 2025 17:33:13 GMT",0.4019,0.8568
The Guardian,Working on a world free of nuclear arms | Letters,"Readers Aaron Tovish, Diana Francis and Caroline Westgate respond to our editorial about arms control to prevent nuclear warThank you for addressing this existential threat to our world (The Guardian view on arms control: essential to prevent the total devastation of nuclear war, 27 December). It would seem a no-brainer that the logical corollary to “a nuclear war cannot be won and must never be fought” would be to unconditionally renounce all options to initiate nuclear warfare. To date, only two nuclear-armed states have taken this stance: China and India. It seems to have served them well – at least as well as those that retain the option of escalating a conventional war into a nuclear war.In an armed conflict between nuclear powers, it is courting disaster to make your adversary worry about being “beaten to the nuclear punch”, but Nato continues to consider the threat of escalating to nuclear warfare essential to the cohesion of the alliance. This policy urgently needs to be jettisoned. Continue reading...","Fri, 03 Jan 2025 17:29:45 GMT",0.5106,-0.9672
The Guardian,"‘Ironic’: climate-driven sea level rise will overwhelm major oil ports, study shows","Ports including in Saudi Arabia and the US projected to be seriously damaged by a metre of sea level riseRising sea levels driven by the climate crisis will overwhelm many of the world’s biggest oil ports, analysis indicates.Scientists said the threat was ironic as fossil fuel burning causes global heating. They said reducing emissions by moving to renewable energy would halt global heating and deliver more reliable energy. Continue reading...","Sat, 04 Jan 2025 06:00:44 GMT",-0.1779,-0.9042
The Guardian,Record number of electric cars were sold in UK during 2024,"Environmental groups urge government to keep tougher green targets despite industry claim they are unsustainableCarmakers sold a record number of electric cars in the UK last year, prompting environmental groups to urge the government to stick to tougher green targets even as the industry argues they are unsustainable.The number of new cars sold in the UK rose by 2.6% in 2024 to 1.95m, according to the Society of Motor Manufacturers and Traders (SMMT) lobby group. Of those, 19.6% were electric, up from 16.5% a year earlier. Continue reading...","Sat, 04 Jan 2025 06:00:41 GMT",0.0772,0.128
The Guardian,Back from the dead: the ‘zombie’ ponds repumping nature into Essex farmland,"A conservation project is helping identify and restore wildlife-rich sites previously degraded and dried upWhen Joe Gray coppiced a patch of woodland on his Essex farm, he noticed that an abandoned pond sprang back into life after it was exposed to sunlight.“It was a hole in the woods with some leaves in it – we didn’t think of it as a pond,” he says. Since then, he and his wife, Emma, have restored 11 “zombie” ponds on their 450-hectare (1,100-acre) regenerative farm. They’ve also persuaded a group of neighbouring farmers to bring back to life 80 ponds within a 3-mile (5km) radius near Braintree. Continue reading...","Fri, 03 Jan 2025 14:00:21 GMT",-0.6486,-0.0772
The Guardian,‘A place for kids to play and a place to store water’: the stormwater capture zone that is also a playground,"Flood-prone Hoboken, New Jersey, has opened a play area for its youngest residents that doubles as storage for stormwater runoffFor a city that is almost small enough to fit inside Manhattan’s Central Park just a few miles away, a lot of history has played out within the narrow borders of Hoboken, New Jersey.It was the site of the first organised baseball game in 1846, home of one of the US’s first breweries in the 17th century and the place where Oreo cookies were first sold in 1912. And, as any Hobokenite will tell you, the Mile Square City, as it is called, is also known for something else. Continue reading...","Fri, 03 Jan 2025 11:00:02 GMT",0.34,0.743
The Guardian,UK rollout of eVisas could leave non-EU migrants ‘vulnerable’,"Home Office is issuing digital visas without completing necessary checks, Freedom of Information quest revealsThe government is pressing ahead with a digital visa scheme to prove the residency rights of millions of people from outside the EU without having completed the necessary checks, campaigners are warning.The Home Office said in response to a freedom of information request from the Observer that it had not yet completed an equality impact assessment into the rollout of eVisas, despite launching the changeover last April. Continue reading...","Sat, 04 Jan 2025 13:55:36 GMT",-0.0516,0.8555
The Guardian,Detours and day trips: ‘Sunshine Saturday’ sees holiday bookings soar - with new trends for 2025,"More than 12 million have already booked trips abroad, with off-the-beaten track locations a popular pick More than 12 million Britons have already booked flights, transport or accommodation for international trips in 2025, with plans to spend £1,753 on the average holiday abroad, according to research by American Express.This weekend UK travel companies were expecting a surge in bookings, with “Sunshine Saturday” one of the most popular days of the year to book a holiday. Continue reading...","Sat, 04 Jan 2025 12:43:15 GMT",0.4019,0.8221
The Guardian,‘Clear creative abuse’: UK gravestone carvers condemn blatant reproduction of their designs,"Master carvers say mass production of their bespoke work is a growing concern and upsetting for bereaved familiesA walk down a churchyard path, passing other memorials and plaques, can be an important, meditative time for bereaved relatives. But some have had an unpleasant surprise when they find that the carefully chosen design and inscription on the headstone they have come to visit has been copied elsewhere.“When a design is copied, it is not just your design but your time and your creativity that is stolen,” said Teucer Wilson, a master stone carver. “You can try to see it as a compliment to your work in a way, of course, but it can be very upsetting for the family that you originally worked with.” Continue reading...","Sat, 04 Jan 2025 12:46:45 GMT",-0.1027,-0.1254
The Guardian,Man arrested over fatal alleged hit-and-run in Paisley,"Police say 18-year-old released pending further inquiries over death of Elizabeth Kennedy, 70, on New Year’s EveAn 18-year-old man has been arrested after a woman died during an alleged hit-and-run incident in Renfrewshire on New Year’s Eve.Elizabeth Kennedy, 70, was pronounced dead at the scene after being struck by a car on Barrhead Road in Paisley at 7pm on Tuesday. Continue reading...","Sat, 04 Jan 2025 15:06:47 GMT",-0.765,-0.9509
The Guardian,Labour goes slow on rape courts pledge amid fears over shortage of lawyers,"Election manifesto promise to set up specialist tribunals to deal with huge backlog of cases has been put on holdThe government appears to have stalled on plans to set up dozens of specialist rape courts to deal with a huge backlog of cases, amid warnings there are not enough lawyers to make the proposals work.Labour pledged during the election campaign to use vacant rooms and buildings on crown court sites to fast-track rape cases and reduce the numbers awaiting trial. Continue reading...","Sat, 04 Jan 2025 15:00:52 GMT",-0.8591,-0.8176
The Guardian,About 280 contractor jobs cut after Labour ends Rwanda asylum scheme,"Redundancies follow abandonment of previous government’s plans to send asylum seekers to east AfricaHundreds of guards employed to deport asylum seekers to Rwanda have been told their jobs are being cut, the Guardian has learned.About 280 Home Office contractors were informed on Friday that their roles were being made redundant because Labour has ditched the previous government’s controversial scheme to send asylum seekers to Rwanda. Continue reading...","Sat, 04 Jan 2025 12:37:02 GMT",-0.2732,-0.743
The Guardian,Keir Starmer to announce radical NHS changes to cut waiting times,"Exclusive: Patients in England to get direct referrals for tests without seeing consultant, but critics say plan is ‘deluded’Starmer’s team hope policy blitz will prove that Labour can deliver changeKeir Starmer will attempt to reset his premiership next week by setting out a series of radical NHS changes aimed at reducing waiting times for millions of patients in England.The shake-up comes after a torrid first six months in government and amid mounting frustration among patients. More than 6 million are waiting for care. Continue reading...","Fri, 03 Jan 2025 18:00:26 GMT",-0.2732,-0.4767
