broadcast,title,description,pub_date,title_sentiment_score,description_sentiment_score
The Guardian,Potter’s spell starts with FA Cup exit as Aston Villa battle back to beat West Ham,"Graham Potter’s first game back in the dugout for 20 months ended not only in an FA Cup exit, after the brightest of starts, but with the loss of two more strikers as West Ham’s hopes of resuscitating their season received further damage.After his appointment the day before this FA Cup third-round tie, the new West Ham manager saw his team carry out his brief but clear pre-match requests stylishly, as they led through Lucas Paquetá’s early goal. But after injuries to Niclas Füllkrug, with what appears a serious hamstring problem, and Crysencio Summerville, Potter will not be contemplating any honeymoon period. Continue reading...","Fri, 10 Jan 2025 22:05:38 GMT",-0.3818,0.0799
The Guardian,Women’s Ashes excitement tempered by concerns over congested schedule,"Australia and England will have to cram the eagerly anticipated series of three ODIs, three T20s and a four-day Test into three weeks and five citiesEngland’s last Women’s Ashes win was so long ago – 11 years, in fact – that, when asked about it last week, Danni Wyatt-Hodge struggled to ­remember many details. Her main ­recollection was of the raucous night out in Hobart afterwards – a ­celebration that the then-captain, Charlotte Edwards, said resulted in her “worst ever ­hangover”. ­Somewhere out there is a photograph of Edwards and her ­successor, Heather Knight, ­staggering back to the team hotel, looking ­distinctly worse for wear. Unsurprisingly, it has never found its way into the public domain.Of course, that was all in the pre-professional era (January 2014). All the same, should England pull off a similar triumph over the next three weeks (the series gets under way in Sydney on Sunday), Knight may be forgiven for leading some rambunctious celebrations of her own. This will be her fifth Ashes as captain: her side have fallen short on all four previous attempts. As for the possibility of beating Australia in their own backyard? England have managed it only three times, and one of those was the first ever ­international women’s series back in&nbsp;1934-35. Tasks don’t get much more uphill. Continue reading...","Fri, 10 Jan 2025 20:00:43 GMT",0.4939,0.2732
The Guardian,‘Imagine if Messi coached Ronaldo’: how Murray 2.0 will need to adapt to flourish with Djokovic,"Five months after retiring, the Scot is throwing himself into his work with the most successful men’s player of all timeAt the height of the Covid-19 lockdowns almost five years ago, Novak Djokovic and Andy Murray logged on to Instagram Live for a casual conversation from their homes. As some of their viewers began to send through questions, they were asked to list the first three things they do when they wake up. Djokovic went first: “Gratitude and prayer,” he said. “A couple of long, deep breaths. Hugging my wife if she’s still in bed and running to my children.”Murray, who seemed to be fighting hard to maintain a straight face throughout Djokovic’s response, offered his own contributions: “For me, too much information, but I go for a pee.” Continue reading...","Fri, 10 Jan 2025 19:00:42 GMT",0.0,0.5182
The Guardian,Plymouth appoint Austrian coach Miron Muslic to succeed Wayne Rooney,"Muslic managed Cercle Brugge until December sacking‘Miron comes with glowing reviews’ says Argyle chairmanPlymouth have appointed Miron Muslic as the club’s new head coach to replace Wayne Rooney.The 42-year-old former Cercle Brugge manager has signed a three-and-a-half year deal to succeed Rooney, who left the club on New Year’s Eve. Continue reading...","Fri, 10 Jan 2025 21:57:49 GMT",0.4939,0.4939
The Guardian,David Moyes agrees to rejoin Everton after productive talks with TFG,"Former manager to return on two-and-a-half year dealOwners hope Moyes can steer team away from relegationDavid Moyes has agreed in principle to become Everton’s new manager and is set to sign a two-and-a-half-year contract.Moyes met representatives from the Friedkin Group (TFG), ­Everton’s new owner, on Friday to discuss a return to the club he managed from 2002 to 2013. Negotiations advanced well and a deal is set to be announced on Saturday morning. Continue reading...","Fri, 10 Jan 2025 21:02:41 GMT",0.2023,0.7964
The Guardian,Bill Sweeney’s RFU fate to be decided after Six Nations following U-turn,"RFU agrees to special general meeting after rebellionSir Bill Beaumont: ‘This is a serious moment’Bill Sweeney’s fate as the Rugby Football Union’s chief executive will be decided shortly after the Six Nations following an embarrassing U-turn from the governing body which has now relented to a grassroots ­rebellion and agreed to a special general meeting.Sweeney has two weeks to set a date for the SGM, which is expected to be held in either late March or early April, after the RFU confirmed that it is “validating the additional information” sent in a letter by the 152 members – a combination of clubs and constituent bodies – calling for the chief executive’s removal. Continue reading...","Fri, 10 Jan 2025 19:05:32 GMT",0.0,0.6597
The Guardian,All-weather meeting at Lingfield called off due to bad weather as frost bites hard,"Ffos Las is Saturday’s only surviving turf fixture in BritainChelmsford, Newcastle to be staged on synthetic tracksThe “all-weather” fixture on the Flat at Lingfield on Friday succumbed to the Arctic blast that has played havoc with the racing programme over the past week while the feature meeting at Kempton on Saturday was also abandoned after an inspection of the track on Friday morning, but ITV Racing has spared no effort to avoid a second blank weekend in a row and plans to show 11 races from four tracks, including the €100,000 Dan &amp; Joan Moore Memorial Handicap Chase at Fairyhouse.The bumper schedule could yet be winnowed down, however, as the meeting at Ffos Las, the only surviving turf fixture in Britain on Saturday, is subject to an inspection at 7.30am GMT, with temperatures at the track forecast to be close to freezing overnight. Continue reading...","Fri, 10 Jan 2025 16:19:49 GMT",-0.5994,-0.6757
The Guardian,"There are no adults in the room: there’s barely a room. This is politics at warp speed, and we know who’s benefiting | Marina Hyde","Fiscal crisis, corruption claims, shenanigans and legal threats. This feels like the week old-style politics sat on a grenade The worst-timed foreign visit by a politician this week was LA mayor Karen Bass deciding to attend the inauguration of the president of Ghana. The second worst might be Rachel Reeves’s decision to push ahead with her China bridge-building trip against a backdrop of market turmoil, soaring UK borrowing costs and the inevitability of rising food prices. But look, maybe have no fear. The chancellor has apparently told all her cabinet colleagues to “cease anti-growth measures” – amazing – and also to come up with specific plans to boost economic activity. I am already picturing her opening the bits of paper from the hat. “Right, I’ve got 20 for ‘build an effing time machine’ and one that just says ‘Pass’. Sorry, Lammy – this isn’t Celebrity Mastermind.”As for auto-satirical lowlights further down the ministerial ladder, do keep your eye on anti-corruption minister Tulip Siddiq. The very regrettable lesson of the past few years in UK politics is that no matter how bad things seem, they can always take on a rosy glow in light of what comes after. The premiership of David Cameron seemed less foolhardy once we were living through the premiership of Theresa May. The premiership of Theresa May seemed less chaotic once we were living through the premiership of Boris Johnson. The premiership of Boris Johnson – well, lettuce not be too hasty. But contemplating the Siddiq situation, was it really so bad that Chris Grayling once gave a ferry contract to a firm with no ferries, considering that these days the anti-corruption minister could have three London properties she’s tied to investigated by the National Crime Agency’s international corruption unit? Siddiq has distanced herself from her deposed aunt’s authoritarian regime in Bangladesh – but not, it seems, from the properties given or made available to her by people with close links to that regime. Either way, we are asked to have full confidence in Keir Starmer’s assertion that he has full confidence in her.Marina Hyde is a Guardian columnist Continue reading...","Fri, 10 Jan 2025 15:16:08 GMT",-0.296,-0.9418
The Guardian,Trump and his henchman Musk treat America’s oldest allies as enemies. Britain can’t face that threat alone | Jonathan Freedland,"The president-elect’s hostility towards other democracies is already clear. There will be no special relationship with him: we should look to Europe Flood the zone with shit. So advised Steve Bannon, onetime chief strategist for Donald Trump, who understood long ago that if you want to get away with an outrageous act, follow it with another and then another. That way, the media will be sure to move on to the newest horror, so forgetting the one before.Trump continues to live by that rule, making it hard to keep up with everything he and his circle do and say – and he’s not even back in office yet. It therefore requires a conscious effort to take a step back and see what’s happening. That might be easier this week than others because the most egregious outrages form a pattern, one that poses a severe and direct challenge to Britain and its neighbours.Jonathan Freedland is a Guardian columnist Continue reading...","Fri, 10 Jan 2025 14:01:35 GMT",-0.7096,-0.9364
The Guardian,"Mick Lynch, you’re a legend – and the unapologetic working-class leader the left is missing | Polly Smythe","The outgoing RMT head dismantled pundits one by one on live TV, and showed a new generation why we need trade unionsMick Lynch is the trade union icon who nearly wasn’t. Leaving school at 16 to train as an apprentice electrician, he worked in construction until being blacklisted for his union activities. Unable to find work in the building trade, in 1993 he took a job at Eurostar and became involved with the RMT. Construction’s loss was to be the labour movement’s gain.Lynch was elected general secretary of RMT in 2021, and a year later, the UK’s first national railway strike since 1989 catapulted him into the public eye. He quickly became the face of a revitalised trade union movement. More than that, to his supporters – like those who bought T-shirts with his face on them – he became the combative, unapologetic working-class leader the left has been missing. Continue reading...","Fri, 10 Jan 2025 15:03:37 GMT",-0.296,0.5859
The Guardian,Martin Rowson on Keir Starmer’s tempestuous week – cartoon,Continue reading...,"Fri, 10 Jan 2025 16:59:51 GMT",0.0,0.0
The Guardian,Trump’s conviction is the latest twist in the Maga story | Lloyd Green,"The supreme court order may also be a harbinger of what awaits the US over the next four years: litigation that again divides the judiciary and the nationDonald Trump will take the office on 20 January 2025 as a convicted felon. On Thursday night, a sharply divided US supreme court declined to ride to his last-minute rescue. In a one-paragraph order, the majority refused to stay his state court sentencing whose genesis lay with payments that Trump allegedly arranged to cover up his purported affair with the adult film actor Stormy Daniels. Last May, a Manhattan jury unanimously found the 45th president guilty of 34 counts of conspiracy and fraud.The supreme court order may also be a harbinger of what awaits the US over the next four years: litigation that again divides the judiciary and the nation. Five of the nine supreme court justices, including Chief Justice John Roberts and Amy Coney Barrett, a Trump appointee, refused to buy what the monarch of Mar-a-Lago was selling. The rest may be more inclined to do his bidding.Lloyd Green is an attorney in New York and served in the US Department of Justice from 1990 to 1992 Continue reading...","Fri, 10 Jan 2025 19:00:41 GMT",0.0,0.875
The Guardian,"The AfD leader’s fawning over Elon Musk should sink her party. Instead, it will boost it | Thomas Verreyer","Alice Weidel’s livestreamed chat with the X owner made for excruciating listening – but even talk of Hitler won’t deter her supportersImagine a politician fighting a general election being granted the opportunity of a publicly livestreamed chat with one of the most powerful figures in the world, only to be heard wriggling out of it after 70 minutes. “I don’t know what to continue (with),” Alice Weidel said to Elon Musk, in effect shutting down the unique audience the owner of X had gifted the AfD leader on Thursday evening.Admittedly, the rambling conversation felt longer than 70 minutes. It missed moderation and while Musk and Weidel giggled a lot and agreed on almost every issue, the sense that they were boring each other became increasingly acute as they droned on about space travel and religious belief rather than the alleged decline of western civilisation. Had Adolf Hitler not been mentioned, the highly anticipated live talk would have been shocking only for being so unnewsworthy.Thomas Vorreyer is a Berlin-based journalist with a focus on East German politicsDo you have an opinion on the issues raised in this article? If you would like to submit a response of up to 300 words by email to be considered for publication in our letters section, please click here. Continue reading...","Fri, 10 Jan 2025 16:50:31 GMT",0.6597,0.8224
The Guardian,Digested week: Put away the hot wax and don’t eat your Christmas tree | Lucy Mangan,"Never trust a hippy selling pine-flavoured butter. Plus, a watch that finally explains it allThe AFSCA (Belgium’s federal agency for ensuring food supply chain safety – but of course you knew that) has been forced to issue a warning to the good people of Poirot’s homeland not to eat their Christmas trees. This is after the city of Ghent – an environmentalism hotspot in northern Flanders – posted tips on how to recycle their obsolete festive conifers into food, including using them to make pine-flavoured butter. Continue reading...","Fri, 10 Jan 2025 11:55:49 GMT",0.0,0.3716
The Guardian,Melania’s $40m Amazon deal: another sign Bezos is capitulating to Donald Trump | Margaret Sullivan,"Sadly, the Amazon-Melania deal has much the same flavor as the rest of Trump appeasement moves – not just by Bezos but by others of his ilkThe language in a New York Times article was extremely restrained as it described Jeff Bezos’s evolving stance regarding Donald Trump.The Amazon founder and the president-elect had had a rocky relationship in the past, “but in recent months, Amazon and Mr. Bezos have taken steps to repair it”.Margaret Sullivan is a Guardian US columnist Continue reading...","Fri, 10 Jan 2025 11:06:32 GMT",0.1779,0.4767
The Guardian,The Guardian view on the LA fires: Donald Trump’s denial and division fuel climate inaction | Editorial,"Events in California reveal how political obstruction is deepening a climate crisis that needs urgent action to prevent it becoming an irreversible disasterThe wildfires ravaging Los Angeles have killed at least 10 people, displaced 180,000 and scorched about 40 square miles – an inferno driven by fierce winds and severe drought in what should be California’s wet season. It is a sobering reminder that the climate crisis is driving wildfires to become more frequent, intense and destructive – leaving ruined lives, homes and livelihoods in their wake. The US president Joe Biden responded by mobilising federal aid. By contrast the president-elect, Donald Trump, a convicted felon who was criminally sentenced on Friday, used the disaster to spread disinformation and stoke political division.The climate crisis knows no national borders. Deadly floods in Spain, Hawaii’s fires and east Africa’s devastating drought show nowhere is safe from its effects. Countries must work toward the global common interest and beyond their narrow national interests. The scale of the climate emergency is such that there is a case to view all crises through a green lens. Instead Mr Trump’s denialism works to foment distrust about the science. He’s not just aiming to delay the onset of truth. He wants to demolish it. It’s a familiar playbook: the fossil fuel industry knows the reality of the climate emergency but chooses profit over responsibility, effectively deceiving the public while the planet burns.Do you have an opinion on the issues raised in this article? If you would like to submit a response of up to 300 words by email to be considered for publication in our letters section, please click here. Continue reading...","Fri, 10 Jan 2025 18:06:34 GMT",-0.25,-0.9131
The Guardian,The Guardian view on Magnus Carlsen’s power play: checking chess’s ruling body in style | Editorial,"The latest controversy reveals deeper tensions about who will shape the sport’s future: its greatest players or the governing authoritiesA persuasive case can be made that Magnus Carlsen is the greatest chess player of all time. The 34-year‑old Norwegian is no longer world champion – bored with classic (long-form) chess, he chose not to defend his title in 2023 – but his name resonates with the public more than ever. This is not due to his expertise in the Sicilian Defence but because chess’s world governing body, Fide, recently barred him from playing in a tournament for wearing jeans. “Jeansgate” illustrates that while the public may care little for the niceties of chess openings, they are captivated by the eccentricities of the chess world.The fabulous (often chess-inspired) costumes in Netflix’s drama hit The Queen’s Gambit made style magazines swoon. But in real life, chess and fashion rarely intersect, though the great Cuban world champion of the 1920s, José Raúl Capablanca, was a splendidly natty dresser who would never have been seen dead in a pair of jeans, and American world champion, Bobby Fischer, in his 1960s and early 70s pomp, sported bespoke suits, shirts and shoes. Fischer’s later decline – wandering Budapest in a dishevelled state – unfortunately mirrors the stereotype of chess players as a marginalised, shabbily attired community.Do you have an opinion on the issues raised in this article? If you would like to submit a response of up to 300 words by email to be considered for publication in our letters section, please click here. Continue reading...","Fri, 10 Jan 2025 18:06:09 GMT",0.34,0.9896
The Guardian,"From racism to ableism, Of Mice and Men still sparks a debate | Letters","Readers respond to a piece by Nels Abbey on the book’s place in schools and share their perspectives as students and teachersHaving taught Of Mice and Men for 30 years in multicultural schools in London, I wholeheartedly agree that it is a difficult, problematic novel to teach in secondary school classrooms, particularly because of some of the characters using racist slurs (Would you drop Of Mice and Men from the exam syllabus? The answer isn’t black and white, 6 January). However, to imply that it is educationally redundant does not acknowledge other important positive messages it contains, still relevant today, that do not appear in less problematic alternatives.During the 1930s, John Steinbeck was inspired by marine biologist and ecologist Ed Ricketts to describe how survival ultimately depends on diverse individuals or groups collaborating and working towards collective benefits. In his novels, Steinbeck champions the inclusive diverse group over the individuals holding power. He provides a counter argument to the sweeping enthusiasm for eugenics in California at that time. Continue reading...","Fri, 10 Jan 2025 17:55:13 GMT",-0.6249,0.6706
The Guardian,Make Olympics more frequent and you risk jumping the shark | Letter,"Responding to letters calling for the Games to run every two years, Charles Harris says that, like sightings of the great white in the film Jaws, less is moreIn calling for the Olympics to run every two years, I suspect people are falling into what I’ve called the Jaws delusion, as discovered by Steven Spielberg (Letters, 2 January).While showing an early cut of Jaws, Spielberg found a particular shock effect with the shark worked so well with preview audiences that he inserted a similar effect earlier in the movie. As he expected, audiences were nicely shocked by the new effect. However, to his dismay, when the original scene came along later in the film it had lost its power to surprise. He removed the new one. Continue reading...","Fri, 10 Jan 2025 17:49:36 GMT",-0.2732,0.4101
The Guardian,"2024 was hottest year on record for world’s land and oceans, US scientists confirm","Noaa says last year was the warmest since records began in 1850 and Nasa concurs: ‘The long-term trends are very clear’It was the hottest year ever recorded for the world’s lands and oceans in 2024, US government scientists have confirmed, providing yet another measure of how the climate crisis is pushing humanity into temperatures we have previously never experienced.Last year was the hottest in global temperature records stretching back to 1850, the National Oceanic and Atmospheric Administration (Noaa announced, with the worldwide average 1.46C (2.6F) warmer than the era prior to humans burning huge volumes of planet-heating fossil fuels. Continue reading...","Fri, 10 Jan 2025 18:21:20 GMT",0.0,0.7351
The Guardian,What are the unprecedented conditions facing firefighters in LA?,"Fire crews are facing dire challenges, hurdles that have intensified the fires and are complicating the responseLA fires live updates: California wildfires latest newsAs multiple fires rage around the Los Angeles basin, the 7,500 fire and emergency personnel on the ground are facing unprecedented conditions.At least five LA residents have been killed, and the death count is expected to rise as responders search burned areas. At least 10,000 structures have been destroyed, and several of the five blazes are still burning out of control. Continue reading...","Fri, 10 Jan 2025 00:20:10 GMT",0.0,-0.9716
The Guardian,Hottest year on record sent planet past 1.5C of heating for first time in 2024,"Highest recorded temperatures supercharged extreme weather – with worse to come, EU data shows  Climate breakdown drove the annual global temperature above the internationally agreed 1.5C target for the first time last year, supercharging extreme weather and causing “misery to millions of people”.The average temperature in 2024 was 1.6C above preindustrial levels, data from the EU’s Copernicus Climate Change Service (C3S) shows. That is a jump of 0.1C from 2023, which was also a record hot year and represents levels of heat never experienced by modern humans. Continue reading...","Fri, 10 Jan 2025 03:00:27 GMT",0.0,-0.25
The Guardian,World’s richest use up their fair share of 2025 carbon budget in 10 days,"Emissions caused by wealthiest 1% so far this year would take someone from poorest 50% three years to createThe world’s richest 1% have already used up their fair share of the global carbon budget for 2025, just 10 days into the year.In less than a week and a half, the consumption habits of an individual from this monied elite had already caused, on average, 2.1 tonnes of carbon dioxide emissions, according to analysis by Oxfam GB. It would take someone from the poorest 50% of humanity three years to create the same amount of pollution. Continue reading...","Fri, 10 Jan 2025 00:01:23 GMT",0.7845,0.6369
The Guardian,Fears over UK borrowing costs as US jobs figures prompt bond market volatility,"Pound falls against the dollar and bond yields rise amid concerns over high UK inflation and interest ratesReeves faces another week of second-guessing the CityConcerns over the UK government’s borrowing costs were revived on Friday after stronger than expected US jobs figures triggered volatile conditions in global financial markets.In an accelerating global bond market sell-off, investors warned that the UK was particularly exposed amid growing fears over stubbornly high inflation and higher for longer interest rates. Continue reading...","Fri, 10 Jan 2025 17:39:13 GMT",-0.4215,0.3961
The Guardian,"Relocation support could have saved Kelyan Bokassa’s life, charity says","Project Lifeline says it previously helped three friends of 14-year-old who was stabbed to death in south-east LondonThe life of the 14-year-old stabbing victim Kelyan Bokassa could have been saved if he had been helped to move out of south-east London, according to an anti-knife crime charity that knew him.Kelyan, who was an aspiring drill rapper, was stabbed to death in Woolwich on a 472 bus on Tuesday afternoon. Continue reading...","Fri, 10 Jan 2025 17:01:23 GMT",0.8074,-0.8885
The Guardian,Family of former Leicester City owner killed in helicopter crash sue makers for £2.15bn,"Vichai Srivaddhanaprabha’s relatives demand compensation from Italian firm Leonardo six years after his deathThe family of Leicester City’s former owner, who was killed in a helicopter crash outside the club’s stadium in 2018, have launched a lawsuit against the company which made the aircraft.Vichai Srivaddhanaprabha’s family are suing the Italian aerospace and defence company Leonardo SpA for £2.15bn – the largest fatal accident claim in English history, according to the family’s lawyers. Continue reading...","Fri, 10 Jan 2025 18:06:59 GMT",-0.802,-0.9468
