broadcast,title,description,pub_date,title_sentiment_score,description_sentiment_score
The Guardian,Wake up and smell the coffee: rising food prices show destabilising impact of climate crisis | Heather Stewart,"Policymakers must act as extreme weather events put more pressure on food inflation and production worldwideYour morning – and afternoon – coffee is the latest staple threatened by climate chaos: the price of quality arabica beans shot to its highest level in almost 50 years last week amid fears of a poor harvest in Brazil.It follows warnings that orange crops have been wiped out by the catastrophic floods in Valencia, Spain; and the soaring cost of olive oil in recent years, as the southern Mediterranean has sweltered. Continue reading...","Sun, 01 Dec 2024 12:31:31 GMT",-0.6249,-0.9612
The Guardian,Ideas and originality are overrated – just ask Titian or Michelangelo | Nell Frizzell,"Stop telling yourself you have to create something unique, and perhaps you will free yourself to make something goodLast week, I interviewed the journalist, podcaster and author Hattie Crisell about her new book, In Writing. It’s a collection of writing advice and insight from the many people she has interviewed over the years for her podcast, from the sublime (Jon Ronson constantly running out mid-sentence to save baby snapping turtles trying to cross the road to his garden), to the more worrying (Will Storr’s “dark hole” of a study in which he has a blackout curtain closed and even a sticker over his desk lamp so it only glows as faintly as possible for the entirety of the writing day). But the words that struck me most came from the comic book writer and illustrator Tor Freeman, who said: “I’m not going to write an original story, ever.” This was coupled with the journalist and novelist John Lanchester’s comment: “I find it hard to explain the extent to which the idea is not the main thing.”So there you have it. Ideas and originality are overrated. Hooray! As overrated as brunch, speaking Latin, pore strips, pugs, Formula One, mineral water, striped wallpaper, live music and expensive moisturisers. (That list is mine by the way – maybe even a wholly original thought.) As someone who has written four books and about 174 fortnightly columns, all tangentially connected to questions of pregnancy and parenting, I am of course relieved and delighted at the news that sometimes the idea that doesn’t leave you is better than the idea nobody else has ever had. In the words of Succession creator Jesse Armstrong: “I just keep on being interested in that world.” Continue reading...","Sun, 01 Dec 2024 14:00:11 GMT",0.0,0.9851
The Guardian,"No more marches, but I have faith in women to stand up to Trump | Natasha Walter","Feminist solidarity has weakened, but women around the world tell me their fight continuesWhat happens in America does not stay in America. The prospect of Trump’s second administration is devastating for many American women, but its reverberations are also echoing for women across the globe, and bringing much more fear and uncertainty than last time around.Eight years ago, while Trump’s success shocked women in Britain, it also brought rays of hope – in the shape of a resurgence of solidarity. On the day after the election in 2016, I remember going into my workplace, a charity for refugee women, feeling pretty bleak, and looking at other women’s downcast faces. Then, at the end of the day, one of our colleagues had the most unexpected news. The charity’s online donations had rocketed.Do you have an opinion on the issues raised in this article? If you would like to submit a letter of up to 250 words to be considered for publication, email it to us at observer.letters@observer.co.uk Continue reading...","Sun, 01 Dec 2024 13:00:09 GMT",0.4767,-0.358
The Guardian,Who should have the last word on assisted dying in a secular Britain? | Kenan Malik,"People of all faiths and none should be free to express their concerns in the public sphereFor many years, I used to give an annual lecture to theology students training to be Anglican priests at Trinity College, Bristol, on “Why I am an atheist”. One perennial response from the students was that “without belief in God, atheists can simply pick and choose which values to accept and which to reject”.To which I would reply: “Yes, that’s true, though we don’t pick and choose values simply as individuals, or as we might pick and choose a shirt or a car, but rather as part of communities, societies, cultures, histories and traditions, and in accordance with our foundational beliefs.” But, I would add, “you as believers have to pick and choose your values, too”.Do you have an opinion on the issues raised in this article? If you would like to submit a letter of up to 250 words to be considered for publication, email it to us at observer.letters@observer.co.uk Continue reading...","Sun, 01 Dec 2024 08:30:01 GMT",0.0,0.9153
The Guardian,"Who has priority in public spaces – dogs or children? Where I live, we’re about to find out  | Oliver Keens","My kids are afraid of dogs, but planned restrictions in east London have sparked anger among owners. I know where I standMy children have always been brave and fearless. They wouldn’t think twice about climbing the tallest tree in any park. The only problem is they would stay up there indefinitely if so much as a shih-tzu started snuffling at the base. The fact that my kids are scared of the many dogs we encounter when we play outdoors is a small pain. But it raises interesting questions about who has priority in a public space – a dog or a child?This debate has suddenly gone into overdrive in Tower Hamlets, east London, where we live. A consultation by the local council about imposing stricter controls on dog owners has sparked a visible rise in pro-dog activism over the past few weeks.Oliver Keens is a writer, author and columnist, as well as a DJDo you have an opinion on the issues raised in this article? If you would like to submit a response of up to 300 words by email to be considered for publication in our letters section, please click here. Continue reading...","Sun, 01 Dec 2024 12:00:08 GMT",0.0258,0.7303
The Guardian,Another election? Mr Caine is taking the Michael | David Mitchell,"Yes Labour have been taxier and spendier than their manifesto implied, but actors signing an Elon Musk-supported petition is a sinister stepThis week I was all geared up to slag off Rachel Reeves and now, thanks to Michael Caine, I can’t. I hope you’re happy, Michael. Is that what you wanted? To close down any centrist criticism of the government? Because that’s what you’ve done.Let me explain. Michael Caine, a great film star and an astute, relatable and popular public figure, has expressed his support for that petition for another general election. You know, the one that was set up a week or so ago by a pub owner from the Midlands and then got bigged up by Elon Musk. It accuses the government of having gone back on promises it made during the election campaign and, at the time of writing, it’s got 2.8m signatures, one of them, presumably, Michael Caine’s. Continue reading...","Sun, 01 Dec 2024 10:00:03 GMT",0.0,0.959
The Guardian,The Guardian view on a race for missile supremacy: competition fuels a dangerous escalation | Editorial,"The INF treaty kept nuclear missiles off European soil and was a brake on a perilous arms buildup. Now it is goneFive years ago, the collapse of a landmark cold war arms treaty opened a Pandora’s box, unleashing missile-shaped furies that have struck Ukraine. The 1987 Intermediate-Range Nuclear Forces (INF) Treaty ended when the US withdrew, citing Russian violations&nbsp;dating back to 2014 under Vladimir Putin. While abandoning the treaty aligned with the first Trump administration’s broader opposition to arms control, continuing to pressure Mr Putin into compliance would have been the wiser course.Targeting Kyiv’s forces are the hypersonic Oreshnik missile and the ballistic Iskander missile. Both can carry a nuclear warhead and would have been barred under the INF treaty. These weapons signal an alarming return to cold war-style tit-for‑tat posturing, with great powers ramping up their military&nbsp;capabilities. Their use highlights Moscow’s accelerated missile development. But it also raises questions about the implications of a nuclear-tipped Oreshnik missile – capable of striking European capitals within 12 to 16 minutes – for Nato security. Continue reading...","Sun, 01 Dec 2024 17:30:01 GMT",-0.4404,-0.2382
The Guardian,The Guardian view on Italy’s divided opposition: a Five Star revolution can help unite the left | Editorial,"Turmoil in the populist party founded by comedian Beppe Grillo could herald a crucial progressive realignmentPolitical scientists have long argued that a defining characteristic of populism is the distinction between a “pure people” and a “corrupt elite”. In the turbulent politics of the early 21st century, few public figures have promoted that worldview with as much vigour and impact as the Italian comedian Beppe Grillo.During the 2010s, Mr Grillo’s Five Star Movement (M5S) became at one point the most successful and quixotic populist party in Europe, coming first in the Italian election of 2018 by a comfortable margin. Its signature principles were a belief in the power of direct&nbsp;democracy, and a conviction that traditional left‑right politics should be superseded by a popular revolt against la casta – the privileged elite whose power persisted whichever government was in charge. People power was mobilised through the party’s Rousseau platform, designed as a forum for online democracy by M5S’s co-founder and internet evangelist Gianroberto Casaleggio. Continue reading...","Sun, 01 Dec 2024 17:25:01 GMT",0.4019,0.9785
The Guardian,Only proper funding can rescue social care | Letters,"Inadequate funding of adult social care in England has a harmful knock-on effect on the NHS, writes Laura DaviesThe Nuffield Trust’s warning that parts of the adult social care market in England could collapse is a stark reminder of the challenges facing the sector (Large parts of adult social care market in England face collapse, thinktank warns, 22 November).Recent national insurance and minimum wage increases, which the thinktank said could drive costs up by £2.8bn for private and non-profit social care providers, could be the tipping point for organisations already under pressure following a decade of cuts and ongoing inflationary pressures. Continue reading...","Sun, 01 Dec 2024 16:49:52 GMT",0.7579,0.128
The Guardian,Let’s summon the courage for UN reform | Letters,"The west cannot in good conscience continue to press for democracy when it denies it at the core of the global system, writes Simon PrentisOmar Barghouti quite is right to highlight the dysfunctional nature of the UN (The UN has failed us on Gaza. We need to decolonize and radically reform it, 25 November). Indeed, as currently constituted it cannot be otherwise, given the glaring conceptual contradiction at its very heart: the democratic nature of the general assembly is fatally vitiated by the veto system at the security council. For a veto (Latin for “I forbid”) is the classic tool of tyrants, and at the UN it allows any of its five permanent members – the heirs of the victorious allies of the second world war – to unilaterally suppress any democratic decision that goes against what they consider to be their interests.And, for the most part, these interests remain those of a world that is the product of another age – the age of empire. That was the price of the UN’s formation – a US delegate at the 1945 San Francisco conference dramatically tore up a copy of the draft charter to emphasise that without agreement on the veto, there would be no UN. But we no longer live in that world – or at least, not in a world where such interests are still seen as the natural spoils of victory. Continue reading...","Sun, 01 Dec 2024 16:50:54 GMT",0.4939,-0.4568
The Guardian,Salah seals dominant Liverpool win over Manchester City in major title race blow,"When times have been tough in the past for Manchester City under Pep Guardiola, there has always been the sense they will pull through; it will be OK. Almost to the extent there has been little dramatic tension around them, only inevitability. Not now.The City machine looks broken, the certainties that have driven them for so long absent, the control gone. They got exactly what they deserved on a highly charged Anfield occasion – another defeat, a sixth in seven matches in all competitions, a fourth in succession in the Premier League and it is almost impossible to see them defending their title from here. Continue reading...","Sun, 01 Dec 2024 18:14:33 GMT",0.5859,-0.6013
The Guardian,Max Verstappen accuses George Russell of ‘trying to screw me over’ at Qatar GP,"Verstappen: ‘For me, I lost all respect … I can’t stand that’Red Bull driver wins race after incident in qualifyingMax Verstappen issued a blunt condemna­tion of his fellow driver George Russell stating he had “lost all respect” for him after the pair were involved in an incident during qualifying for the Qatar Grand Prix. Verstappen con­sidered that Russell had tried to “screw me over” with the stewards and the pair exchanged words about it before the race at the Lusail circuit on Sunday.Verstappen won the race in Qatar but afterwards his anger with ­Russell was direct. After qualifying ­Verstappen had been penalised for driving unnecessarily slowly and impeding Russell. Both drivers had been summoned to the stewards to give their sides of the incident and Russell’s behaviour had left ­Verstappen incensed. Continue reading...","Sun, 01 Dec 2024 20:33:52 GMT",-0.4215,0.0129
The Guardian,Amorim says he will be ‘judged on the place we finish’ at Manchester United,"Manager wants to focus on performance not resultsAmorim says Rashford ‘can play so much better’Ruben Amorim has said he will be judged on Manchester United’s finishing position after Sunday’s 4-0 defeat of Everton lifted them to 19 points, four behind Brighton in the final Champions League berth.Two goals each from Marcus Rashford and Joshua Zirkzee gave the Portuguese victory in his first home league match and afterwards he was asked if Champions League qualification is realistic. Continue reading...","Sun, 01 Dec 2024 17:23:06 GMT",0.4215,0.7351
The Guardian,England’s Ben Stokes ‘raring to go’ for second Test after injury concerns,"All-rounder scored 80 and bowled 19.3 overs in first TestEngland captain confident of being fit for WellingtonBen Stokes moved to play down concerns over his fitness and declared himself “raring to go” for the second Test at Wellington after the England captain ended his efforts with the ball mid-over during the eight-wicket win at Hagley Oval.At the end of a year in which Stokes has missed four Tests with a hamstring injury, there were fears the all-rounder had done himself another mischief when pulling up lame three balls into the fifth over of his spell on the fourth morning. Continue reading...","Sun, 01 Dec 2024 16:22:16 GMT",-0.4215,0.2263
The Guardian,Fiorentina player Edoardo Bove in intensive care after collapsing on pitch,"Club statement says Bove ‘stable’ but ‘under sedation’Midfielder collapsed during Serie A match against InterThe Fiorentina midfielder Edoardo Bove is being treated in intensive care after collapsing on the pitch during the team’s Serie A match against Internazionale on Sunday.In an official statement, the club said: “ACF Fiorentina and the Careggi university hospital have announced that footballer Edoardo Bove, who was treated on the pitch following a loss of consciousness during the Fiorentina v Inter match, is currently under sedation and is hospitalised in intensive care.” Continue reading...","Sun, 01 Dec 2024 20:46:45 GMT",0.25,-0.4767
The Guardian,Judd Trump sinks battling Barry Hawkins to pick up UK Championship,World No 1 wins final 10-8 to seal second UK crownHawkins beaten for fourth time in a major finalJudd Trump was forced to work overtime to end his 13-year wait for a second UK Championship title after squeezing past the dogged challenge of Barry Hawkins in York.Trump was stuck in his seat as Hawkins won two in a row to reduce the deficit to a single frame before the world No 1 pounced on a missed red from his opponent with a 67 break that proved just enough to seal a 10-8 win. Continue reading...,"Sun, 01 Dec 2024 22:35:47 GMT",0.2023,-0.8806
The Guardian,Mikaela Shiffrin has deep puncture wound to abdomen after scary crash,"World Cup champion crashed during giant slalom29-year-old also suffered ‘severe muscle trauma’Mikaela Shiffrin suffered a deep puncture wound to her abdomen and “severe muscle trauma” during her crash in a race on Saturday but she escaped serious bone, ligament or organ damage.The five-time overall World Cup champion is sidelined for the Killington Cup slalom race on Sunday. There is no timetable for her return to competition, the US Ski Team said in a statement released before the start of the slalom, which was won by Switzerland’s Camille Rast for her first career World Cup victory. Continue reading...","Sun, 01 Dec 2024 15:33:35 GMT",-0.7096,0.7615
The Guardian,Luke Cowan-Dickie helps Sale hand Leicester first Premiership away loss,"Sale 39-25 LeicesterAsher Opoku-Fordjour scores first senior tryIn the opening stages of this year’s Premiership it has not exactly been the vintage Sale Sharks we have grown accustomed to seeing in recent seasons. However, one thing that has been a hallmark of Alex Sanderson’s tenure remains the same as we approach the halfway point in the campaign: if they are to make the playoffs, it will be their home form that is likely decisive.The Sharks have lost just five Premiership games on home soil since Sanderson was appointed in January 2021. It is a remarkable record, and one which could be more important than ever this season given their polarising form on their travels. Eight games in, Sale have lost all four of their away matches – two of them bruising, heavy losses against Northampton and Bath before the international break. Continue reading...","Sun, 01 Dec 2024 18:49:39 GMT",0.5423,-0.1548
The Guardian,Could Tenbury Wells be the first UK town centre abandoned over climate change?,"Worcestershire town has been flooded seven times in past four years and shop owners can no longer afford insuranceIn the aftermath of its latest flood, the town centre of Tenbury Wells was a scene of chaos. The main street was caked with a layer of mud, shop windows were smashed and piles of sodden furniture and wares, all ruined, were heaped in the street.“On Monday when we came in we wanted to leave, lock the doors and just disappear,” said Richard Sharman, the owner of Garlands Flowers. “We’ve lost about £6,000 and we won’t get a penny back. Six weeks ago we lost about £4,000 in a flood.” Continue reading...","Sun, 01 Dec 2024 15:24:10 GMT",-0.25,-0.8957
The Guardian,International talks on curbing plastic pollution fail to reach agreement,"Chair of talks in Busan says progress has been made but ‘a few critical issues’ are unresolvedNegotiators have failed to reach agreement on a landmark treaty to curb plastic pollution, the diplomat chairing the talks has said.Nearly 200 nations are taking part in a meeting in Busan, South Korea, which is intended to result in a landmark agreement after two years of discussions. A week of talks has failed to resolve deep divisions between “high-ambition” countries seeking a globally binding agreement to limit production and phase out harmful chemicals, and “like-minded” nations who want to focus on waste. Continue reading...","Sun, 01 Dec 2024 14:11:39 GMT",-0.0516,0.8338
The Guardian,Environmental groups demand EPA to start monitoring microplastics in water,"Legal petition filed by 170 groups pushes environmental agency to tackle pressing health threat of pollutionA new legal petition filed by more than 170 top environmental groups demands that the Environmental Protection Agency (EPA) begin monitoring for microplastics in drinking water, an essential first step to reining in pollution viewed as one of the nation’s most pressing public health threats.The scale of microplastic water pollution, the extent to which the substance is lodged throughout human bodies, and the many health implications have come into sharp focus in recent years, but the EPA still has not taken meaningful action, public health advocates say. Continue reading...","Sun, 01 Dec 2024 13:00:07 GMT",-0.128,-0.4331
The Guardian,People are angry about the floods – but turning to Reform endangers us all,"The climate crisis can’t be ignored, yet UK voters are being pushed by inaction towards a party that denies its existence There is an irony to the fact that many Welsh communities are now threatened by the coal that has been dug up around them for ­centuries. This is the fuel that helped launch the Industrial Revolution and changed the world. At the same time, its combustion has played a key role in boosting amounts of carbon in the atmosphere to levels that have triggered global temperature rises to near 1.5C, propelling the UK – and the rest of the world – into a climate crisis.Sea levels are rising, meaning our shores are being battered by higher, more destructive waves, while rainfall in Britain is intensifying, putting communities at real risk of devastation, as seen in Wales last week. Continue reading...","Sun, 01 Dec 2024 06:00:48 GMT",-0.2846,-0.923
The Guardian,"Weather blamed for small boat arrivals under Labour passing 20,000","Home secretary to highlight data showing record number of calm autumnal days that made Channel crossings likelyThe number of small boat arrivals since Keir Starmer took power has passed 20,000, with the Home Office claiming a record number of calm autumnal days in the Channel was responsible.A 31-day period in October and November had the highest ratio of so-called “red days” – when weather conditions make crossings likely or very likely – since records began in 2018, according to a leaked analysis. Continue reading...","Sun, 01 Dec 2024 18:00:01 GMT",-0.4767,0.6808
The Guardian,"Putin may have wanted Skripal dead over what he knew, UK officials believe","Ex-spy had information about Putin’s ‘embezzlement’ of profits from metals production, intelligence official saysVladimir Putin may have ordered the assassination attempt on Sergei Skripal because the former Russian spy harboured secret information about the Russian president’s “criminal embezzlement” of profits from metals production, the UK government believes.A leading intelligence official on Russia has said he took “at face value” Skripal’s assertions that secrets he knew about how Putin may have made money led to the nerve agent attack on him in Salisbury. Continue reading...","Sun, 01 Dec 2024 17:11:30 GMT",-0.6486,0.6124
The Guardian,"Man charged with murder of woman, 57, in south-east London","Andrew Cunningham, 61, held after death of Margaret Cunningham, who was found at address in Surrey QuaysA 61-year-old man has been charged with the murder of a 57-year-old woman in south-east London.Officers were called to an address in Greenland Quay, Surrey Quays, at about 3pm on Friday after reports that a woman had been stabbed, the Metropolitan police said. Continue reading...","Sun, 01 Dec 2024 17:37:46 GMT",-0.7579,-0.9231
The Guardian,UK weather: Arctic blast will end unseasonably mild weekend,"Widespread sub-zero conditions in rural areas forecast from Monday, with high ground in Scotland as low as -12CAn Arctic blast will send temperatures as low as -12C in parts of the UK this week after an unseasonably mild weekend.The hillier parts of Scotland are braced for the coldest weather, although forecasters expect widespread sub-zero conditions in rural areas on Monday and Tuesday. Continue reading...","Sun, 01 Dec 2024 13:12:39 GMT",0.0,-0.4939
The Guardian,Four people accuse undercover officer of arson attack on Debenhams store,"Witnesses allege Bob Lambert was involved in fire at store in London in 1987, a claim he has repeatedly deniedFour witnesses have testified at a public inquiry that an undercover police officer carried out an arson attack on a well-known high street department store while pretending to be an ardent animal rights campaigner.Their testimony directly contradicts consistent denials by the undercover officer Bob Lambert, who says he did not set fire to a London branch of Debenhams, causing damage totalling £340,000. Continue reading...","Sun, 01 Dec 2024 12:00:08 GMT",-0.5994,-0.6771
The Guardian,Community turns ancient oak into single-tree table in Devon woodland,"Table to seat 60 being built by local artists and craftspeople in woodland on edge of DartmoorA community in Devon has raised £22,555 to turn a 500-year-old oak tree into what they believe will be the longest table ever crafted from a single English oak tree.The 18 metre-long (59ft) Great Oak Table, capable of seating 60 people, was being built in a small patch of private woodland near Chagford, on the edge of Dartmoor. Continue reading...","Sun, 01 Dec 2024 13:00:08 GMT",0.0,0.7717
