broadcast,title,description,pub_date,title_sentiment_score,description_sentiment_score
Aljazeera,Senegal seeks answers 80 years after French colonial massacre of soldiers,Commemoration prompts renewed calls for investigation into the killing of African soldiers by the French army in 1944.,"Sun, 01 Dec 2024 18:20:18 +0000",0.0,-0.6597
Aljazeera,Syrian rebels push towards Hama as government forces launch counterattacks,Russian and Syrian jets reportedly attack Idlib city on fifth day of opposition&#039;s surprise advance in northwest Syria. ,"Sun, 01 Dec 2024 16:01:19 +0000",-0.2023,-0.25
Aljazeera,Death toll from sectarian violence in northwest Pakistan rises to 130,Violence has escalated in the region after gunmen opened fire on convoys carrying Shia pilgrims on November 21.,"Sun, 01 Dec 2024 15:43:55 +0000",-0.8402,-0.7579
Aljazeera,"Ding, Dommaraju tied after six games at World Chess Championship",Teen challenger Gukesh Dommaraju of India holds reigning champ Ding Liren after first week of competition.,"Sun, 01 Dec 2024 15:32:49 +0000",0.4404,0.5574
Aljazeera,Mapping who controls what in Syria,Rebels led by Hayat Tahrir al-Sham seize control of large parts of Aleppo as they push south.,"Sun, 01 Dec 2024 15:09:59 +0000",0.0,-0.2023
Aljazeera,It’s time to tax fossil fuels and shipped goods to fund climate resilience,Climate-stricken regions are sinking into debt. We can stop that by financing the loss and damage fund through levies. ,"Sun, 01 Dec 2024 14:27:25 +0000",0.0,-0.8481
Aljazeera,Patricia Scotland on the Commonwealth’s future and its colonial past,The Commonwealth faces questions about its relevance amid climate change and inequality. Can it adapt to changes?,"Sun, 01 Dec 2024 13:55:00 +0000",0.0,0.0
Aljazeera,Syrian rebel advance brings exiled Aleppo residents back to city,"Syrian opposition fighters have pushed Assad’s forces out of Aleppo, allowing exiled residents to return.","Sun, 01 Dec 2024 13:50:50 +0000",-0.1531,-0.0516
Aljazeera,Israel to be “more forceful” with any Hezbollah “skirmishes”,Drew Mikhael on why Israel may consider ratcheting up its military response to any ceasefire violations by Hezbollah.,"Sun, 01 Dec 2024 13:23:13 +0000",0.0,-0.5267
Aljazeera,Loving it: Populist on populist violence,Trump’s fans in Canada are outraged now that he has threatened tariffs.,"Sun, 01 Dec 2024 13:13:07 +0000",-0.0516,-0.7579
Aljazeera,US surgeon breaks down reading stories from Gaza doctors,US paediatric surgeon Dr Tanya Haj-Hassan broke down in tears at a UN hearing as she recounted stories from Gaza.,"Sun, 01 Dec 2024 13:04:16 +0000",0.0,-0.5719
Aljazeera,‘Maya blue’: The mystery dye recreated two centuries after it was lost,A ceramicist retraces his Maya roots to recreate a long-lost pre-Hispanic pigment that survived for over a millennium.,"Sun, 01 Dec 2024 12:51:14 +0000",-0.3182,0.5106
Aljazeera,UNRWA pauses aid through key Gaza crossing as hunger stalks Palestinians,Suspension of humanitarian aid into Gaza comes as Israeli attacks kill almost 100 Palestinians in the last 24 hours.,"Sun, 01 Dec 2024 12:42:21 +0000",-0.25,-0.8225
Aljazeera,Video: Norwegian minister pushes for European action to recognise Palestine,Norway’s foreign minister says his country is taking the lead in pushing to establish a Palestinian state. ,"Sun, 01 Dec 2024 12:39:24 +0000",0.0,0.0
Aljazeera,"Who is Kash Patel, the Trump loyalist tapped to run the FBI?",Appointment of a loyal aide to the FBI post could end long-running tradition of keeping presidents at arm’s length.,"Sun, 01 Dec 2024 12:28:52 +0000",0.3612,0.4767
Aljazeera,"Israel kills Gaza aid workers from World Central Kitchen, Save The Children",World Central Kitchen was forced to pause operations after three more of its employees were killed in Israeli attacks.,"Sun, 01 Dec 2024 11:45:03 +0000",-0.0772,-0.886
Aljazeera,"China blasts US arms sale to Taiwan, President Lai’s visit to Hawaii","Beijing lodges &#039;serious protests&#039; with the US saying it &#039;strongly condemns&#039; Taiwanese leader&#039;s stopover in Hawaii, Guam.","Sun, 01 Dec 2024 10:24:48 +0000",0.0,0.0
The Guardian,Joe Biden issues ‘full and unconditional’ pardon to son Hunter,"Decision marks reversal for US president, who had said he would not use executive authority to pardon son’s chargesBiden’s statement in full Joe Biden has issued “a full and unconditional” pardon to his son Hunter Biden, covering his son’s convictions on federal gun and tax charges, the US president said in a statement released by the White House on Sunday.The decision marks a reversal for the president, who has repeatedly said he would not use his executive authority to pardon his son or commute his sentence. Continue reading...","Mon, 02 Dec 2024 02:15:53 GMT",0.3182,0.3565
The Guardian,Syrian and Russian airstrikes hit Aleppo and Idlib after insurgents advance,"Assad regime seeks to repel Islamist rebels in north as Iran’s top diplomat visits Damascus in show of supportSyrian and Russian airstrikes have pummelled areas of northern Syria as Iran’s top diplomat arrived in Damascus in a show of support for Bashar al-Assad’s regime after Islamist insurgents made a sudden advance and seized control of Aleppo.As the regime attempted to repel the strongest challenge to its authority in years, state media in Damascus shared images of airstrikes across opposition-controlled areas, claiming they were targeting enemy command centres and positions. Syria’s military said they struck close to a stadium in Aleppo in a joint operation with Russia. Continue reading...","Sun, 01 Dec 2024 20:07:16 GMT",0.0,0.5994
The Guardian,"New plan would ‘transform’ end of life care for 100,000 in England and Wales","Palliative care commission set up to provide high-quality, holistic support following assisted dying voteAssisted dying bill brings critical state of palliative care into government’s focusMPs, doctors and charities have drawn up a blueprint to deliver an “unprecedented transformation” of care for 100,000 people a year in the final stages of their lives.After parliament’s historic vote last week to legalise assisted dying in England and Wales, a commission on palliative care has been set up to help improve end-of-life care. Continue reading...","Sun, 01 Dec 2024 20:45:03 GMT",0.4939,0.959
The Guardian,Outrage as Gregg Wallace calls accusers ‘middle-class women of a certain age’,"BBC faces questions after revelations that it received complaints about MasterChef star over period of 12 yearsOutrage over Gregg Wallace’s alleged conduct has intensified after he dismissed his accusers as “middle-class women of a certain age”, following revelations that the BBC received multiple complaints about him over a period of 12 years.The corporation and other broadcasters are facing growing questions about how the MasterChef presenter was allowed to remain on screen despite a series of allegations of inappropriate behaviour dating back to at least 2012. Continue reading...","Sun, 01 Dec 2024 19:55:28 GMT",-0.296,-0.3818
The Guardian,"Terry Griffiths, former world snooker champion, dies at age of 77","Welshman won world title in 1979 as a qualifierJudd Trump leads tributes to ‘legend of the game’The former world snooker champion Terry Griffiths has died at the age of 77 after a “lengthy battle with dementia”, his family have confirmed.Griffiths famously came through the qualifying rounds to win the 1979 Crucible world title, beating Dennis Taylor 24-16 in the final. The Welshman also won the Masters title in 1981 and the UK Championship in 1982 to complete the sport’s illustrious “triple crown”, and reached a career-high world ranking of No 3. Continue reading...","Sun, 01 Dec 2024 23:52:43 GMT",0.5994,0.8402
The Guardian,"Reforms of NHS don’t stand a chance unless recruitment is fixed, say top nurses",Number of registered nurses at record high in UK but workforce is ‘increasingly inexperienced’Top nurses have said that planned government reforms for the health service “stand no chance” if issues with recruitment and retention in the profession are not addressed.They made the warning as new figures show the number of nurses and midwives registered in the UK has grown to a record high. Continue reading...,"Mon, 02 Dec 2024 00:01:08 GMT",0.4215,-0.6652
The Guardian,"Growth expectations among UK firms take ‘decisive turn for worse’, says CBI","Expectations negative for first time in 2024 as business confidence plummets since Rachel Reeves’s budgetGrowth expectations among UK companies have taken “a decisive turn for the worse”, in a fresh blow to Rachel Reeves amid warnings that business confidence has plummeted since the budget.For the first time this year, expectations for growth have turned negative, according to the Confederation of British Industry’s latest growth indicator, which shows that a majority of companies expect activity to decline in the three months to February. Continue reading...","Mon, 02 Dec 2024 00:01:09 GMT",0.3818,0.6597
The Guardian,"Cladding will be fixed on high-rise buildings in England by 2029, says Angela Rayner","Deputy prime minister announced acceleration plan and criticised pace of works seven years after Grenfell fireDangerous cladding on all high-rise buildings in government-funded schemes in England will be fixed by the end of 2029, Angela Rayner has pledged.Criticising the pace of remediation, more than seven years after the Grenfell Tower fire killed 72 people, the deputy prime minister announced an acceleration plan on Monday for buildings of 18 metres and over, which will include severe penalties for freeholders who fail to act. Continue reading...","Mon, 02 Dec 2024 00:01:09 GMT",0.0,-0.9231
The Guardian,Manchester City’s Stefan Ortega claims Liverpool ‘not best part of UK’ after loss,"Home fans chanted ‘sacked in the morning’ at GuardiolaCity manager says: ‘I didn’t expect that from Anfield’Pep Guardiola said he expected more respect at Anfield after being taunted about the sack during Manchester City’s defeat at Liverpool, with the chants prompting the goalkeeper Stefan Ortega to criticise the city as “not the best part in the UK”.Guardiola held six fingers up to the Anfield crowd – one for each Premier League title he has won at City – in response to chants of “You’re getting sacked in the morning”, as Liverpool moved 11 points clear of the faltering champions with a 2-0 win. Continue reading...","Sun, 01 Dec 2024 20:30:56 GMT",0.4404,0.908
The Guardian,Stellantis chief executive Carlos Tavares resigns as carmaker struggles,"Company, which makes Jeep, Fiat and Peugeot vehicles, says it aims to find new leader in first half of 2025Carlos Tavares has resigned as the chief executive of Stellantis, the maker of Jeep, Fiat and Peugeot cars announced on Sunday, and said it aimed to find a new leader in the first half of next year.Previously regarded as one of the most respected executives in the auto industry, Tavares came under strong criticism earlier this year after Stellantis issued a profit warning on its 2024 results, including a forecast for a cash burn of up to €10bn, mostly blaming slow sales and bloating inventories in its key North American market. Continue reading...","Sun, 01 Dec 2024 21:10:13 GMT",-0.5859,0.024
The Guardian,‘Brain rot’: Oxford word of the year 2024 reflects ‘trivial’ use of social media,"Expression chosen after public vote describes impact of endless scrolling of mind-numbing content“Brain rot” has been announced as the Oxford word of the year for 2024, amid concerns over endless social media scrolling and mind-numbing content.More than 37,000 people voted to help choose the winner from a shortlist of six words drawn up by Oxford University Press, the publisher of the Oxford English Dictionary. Continue reading...","Mon, 02 Dec 2024 00:00:09 GMT",0.0,0.7579
The Guardian,Rebels behind Aleppo’s surprise fall took advantage of Russian and Iranian distraction,"Forces only took three days to take the city from Bashar al-Assad’s regime, but the Middle East’s newest conflict looks set to lastMiddle East crisis – live updatesIt was not Kyiv that fell in three days, but Aleppo. A surprise offensive launched by Syrian rebels from the north west of the country last week has reignited a dormant conflict – and revealed a change in the balance of power caused not by one but two nearby wars, in Ukraine and Lebanon and the Middle East.Aleppo was the scene of fierce and destructive fighting between 2012 and 2016 when the Syrian civil war was at its height. Rebel groups were forced out as Syrian government forces supporting the president, Bashar al-Assad, were able to capture the country’s second city, with the help of Russia and its air force. Continue reading...","Sun, 01 Dec 2024 19:10:19 GMT",-0.0772,-0.9855
The Guardian,"Ukraine war briefing: Sceptics can be converted to my Nato plan, says Zelenskyy","Ukrainian president presses idea of ‘Nato umbrella’ for areas under Kyiv’s control while Kaja Kallas says it should not be ruled out. What we know on day  1,013 Continue reading...","Mon, 02 Dec 2024 00:39:25 GMT",-0.6808,0.0
The Guardian,Former Tesco boss wants to send power from Morocco to Great Britain using subsea cable,"Dave Lewis says the near-constant stream of clean electricity could supply the grid as early as 2030In the south-west of Morocco, a sprawl of wind and solar farms stretching across an area the size of Greater London could soon generate the green electricity powering more than 9m British homes.This is the unflinching vision of Sir Dave Lewis, the former Tesco boss who is hoping to build the world’s longest subsea power cable in order to harness north Africa’s renewable energy sources and power Britain’s clean energy agenda. Continue reading...","Sun, 01 Dec 2024 17:00:01 GMT",0.6249,0.9313
The Guardian,Who is Bushra Bibi? Imran Khan’s wife stands at the forefront of the Pakistan protests,"Elusive spouse of the former prime minister led march of tens of thousands on IslamabadAs vast crowds converged on Pakistan’s capital demanding the release of the former prime minister Imran Khan, one unlikely figure was at the forefront of the protest.Bushra Bibi, Khan’s third wife, had always been deemed an apolitical and somewhat mysterious spiritual figure. Her marriage to Khan had generated wild gossip for years, but she kept herself largely shielded from the public gaze – even as she found herself jailed alongside her husband in January. Continue reading...","Mon, 02 Dec 2024 02:06:39 GMT",-0.2263,-0.7269
The Guardian,Emma review – a Regency comedy as light as a pillow fight,"Abbey theatre, DublinSet in a nonspecific Austenland inspired more by Hollywood than history, this is an energetic, puppyish production that is easy to likeHandsome, clever and rich Emma Woodhouse finds new ways to exercise her charm in Kate Hamill’s adaptation of Jane Austen’s novel from 1816. Claire O’Reilly’s pop-powered production ramps up the arch comedy and artifice in a fluorescent, Regency-lite setting, which exists somewhere in an Austenland informed by screen adaptations from Clueless to Netflix’s Persuasion, with a hint of classical Hollywood romcoms in set designer Molly O’Cathain’s sweeping stairs. What is retained from Austen’s social satire is the wealthy, leisured milieu of the characters.Indulged by her widowed father, the hyperactive Emma (Toni O’Rourke) fills her days by manipulating the relationships of people around her. Fancying herself a matchmaker, she takes gawky teenager Harriet (Hannah Mamalis) under her wing, persuading her that the unctuous vicar Mr Elton (Domhnall Herdman) would be a brilliant catch. Mamalis brings puppyish energy to her absurdly gauche character, gulping down the biscuits that Emma throws at her in reward for her devotion. Continue reading...","Sun, 01 Dec 2024 20:00:04 GMT",-0.0258,0.9812
The Guardian,‘It’s about balancing out December’: why nutritionists overindulge at Christmas too,"Experts say they also enjoy ultra-processed treats at this time of year – the problem is when they become an everyday stapleFrom mince pies to pigs in blankets, Christmas is a time for indulgence – often on ultra-processed foods.And as we eat our own body weight in chocolate while watching It’s a Wonderful Life for the 14th time, we often expect somebody who knows better to be tutting at us as they prepare healthier options. Continue reading...","Sun, 01 Dec 2024 14:00:09 GMT",0.0,0.7964
The Guardian,The brain microbiome: could understanding it help prevent dementia?,"Long thought to be sterile, our brains are now believed to harbour all sorts of micro-organisms, from bacteria to fungi. How big a part do they play in Alzheimer’s and similar diseases?Nine years ago, Nikki Schultek, an active and healthy woman in her early 30s, experienced a sudden cascade of debilitating and agonising symptoms – including cognitive and breathing problems and heart arrhythmia – and was investigated for multiple sclerosis. But three brain scans and numerous X-rays later, there was still no diagnosis or treatment plan. “It was like living in a nightmare, imagining not watching my children – three and five years old – grow up,” says Schultek.Now, speaking on a video call from North Carolina, she is as bright as a button and shows no signs of degenerative brain disease. It turned out she had multiple chronic infections, including Borrelia burgdorferi bacteria, which causes Lyme disease and which had stealthily reached her brain. Antibiotics restored her health, but B burgdorferi is hard to eradicate once in the brain. She may need maintenance treatment to keep the disease at bay. Continue reading...","Sun, 01 Dec 2024 14:00:10 GMT",0.4215,0.8462
The Guardian,Every Valley: The Story of Handel’s Messiah review – hallelujah! A fresh take on the composer’s much-loved work,"By revealing the murky circumstances in which it was created, Charles King’s fascinating history of the oratorio shows it in a new lightI love the amorous mayhem of Handel’s operas, but have always had my doubts about his oratorios, especially the Messiah. First there’s the bossy compulsion to stand during the “Hallelujah” chorus, just because a spurious tradition says that King George II did so in 1743; once hoisted upright, you have to fidget through endless awkwardly mis-accentuated iterations of “for ever and ever”. I’m also puzzled by the quirks of the biblical text, which are underlined by musical repetition. The soprano rhapsodises like a fetishist about the “beautiful feet” of those who preach the gospel, and the tenor prophesies that “every valley shall be exalted” by the saviour: will salvation really reflate those sagging hollows in the landscape?But after reading Charles King’s Every Valley: The Story of Handel’s Messiah, I have been converted. King doesn’t exactly explicate the phrase he takes for his title, but he points out that Martin Luther King often quoted it in his orations about civil rights, so I probably shouldn’t quibble. More importantly, his book humanises the work’s exalted creators and demonstrates that the Messiah is not a pompous manifesto of faith but a troubled, often desperate quest for consolation. Despite those hectoring hallelujahs, what moves King is the oratorio’s prescription for overcoming personal misery. Continue reading...","Sun, 01 Dec 2024 17:00:00 GMT",0.7644,0.429
The Guardian,"‘With brain preservation, nobody has to die’: meet the neuroscientist who believes life could be eternal","A brilliant young scientist believes that if we preserve our brains, they could  be revived in the future, helping us live for centuriesElizabeth Hughes Gossett shouldn’t have survived beyond 11, the age at which she developed type 1 diabetes. Born in Albany, New York, Gossett received her diagnosis in 1918 when diabetes had no known treatment. Tragically, her life expectancy was just a matter of months. Her parents desperately searched for any way to keep their daughter alive. A New Jersey physician had developed a radical course of action: keeping the blood sugar levels of diabetic children low by feeding them the bare minimum needed to survive. This could see a prognosis of months extended to years. These young patients weren’t exactly living, but they were alive.In the spring of 1919, Gossett went into this starvation clinic. She’d have been constantly cold and hungry. Emaciated, unable to move or grow. At its lowest, her weight dropped to 20kg. Three years later, Gossett was lingering on death’s threshold but, crucially, hadn’t crossed to the other side. Continue reading...","Sun, 01 Dec 2024 14:00:13 GMT",0.0,-0.0258
The Guardian,‘You feel sorry for the person as well’: why are so many pet cats being abandoned?,"Many of us saw lockdown as the ideal chance to get a cat. But now, a huge number of pets are being abandoned, and rescue charities are overwhelmedHelen Lecointe answers the phone sounding frazzled. As the senior manager of the Woodside Animal Welfare Trust in Plymouth, she is tasked with not only herding cats, but accommodating them, too, and this autumn, she says, the shelter is rapidly approaching breaking point. “It just feels as if it’s been nonstop,” she says. Long after the supposed end of kitten season, the shelter is still receiving a steady stream of newborns, along with pregnant cats.Out in the community, at the Plymouth dockyards and elsewhere, large colonies of feral cats have sprung up, and are multiplying exponentially. And then there is the increasing number of often beloved pets being relinquished by their owners, who can no longer look after them or afford their care. Continue reading...","Sun, 01 Dec 2024 11:00:05 GMT",-0.5106,0.9319
The Guardian,‘I’m a mixed Black female historical re-enactor in a sea of men with beards’,"Not everyone would want to spend their weekends dressed in a tunic fighting medieval battles, but my love of re-enacting is rooted in keeping history aliveIt is the summer of 1265. I am bottling leeches in an open-air apothecary as a medical apprentice of the church. Minstrels tune their musical instruments and soldiers sharpen their swords. Gloucester has just been captured by Prince Edward, and royal forces are growing in the west of England. The men come to me for yarrow to staunch their bleeding, comfrey to heal their injuries, and sulphur to soothe their sores. I smile at their faith in vinegar, a woman’s touch and prayer. But secretly I long to be a lowly foot soldier, fighting with the men in the mud.Eventually, I summon the courage to pick up an axe and infiltrate their ranks. My presence on the battlefield is not as unlikely as it might sound. Some of us, such as Margaret of Beverley, fought. Only a little cross-dressing is required. I swap my ankle-length kirtle for a tunic, the wimple on my hair for a coif and helmet, and wrap my legs in woollen hose over large linen trousers. A knife hangs at my side. My femininity is hidden beneath a heavy protective gambeson or tunic. Its stitches are grubby and grey, as if the garment itself is sewn together with gristle. The thick padding absorbs the shock of a weapon, though sometimes a blade still slips through. At this point I drop my axe, clutch my chest and groan. The crowds, delighted by the spectacle of death, begin to cheer. Continue reading...","Sun, 01 Dec 2024 10:00:03 GMT",0.0,-0.2732
The Guardian,Labour’s big relaunch won’t solve its biggest problem: this government doesn’t speak human | John Harris,"Farage and Trump are winning because they understand the politics of emotion, while Labour is lost in numbers and statisticsKeir Starmer’s people don’t like the word “relaunch”, but that’s what it is. On Thursday, the prime minister will give a set-piece speech about a “Plan for Change” that really should have materialised back in July. It will seemingly be based on “tangible outcomes” and the insistence that the government machine is newly focused on issues such as early years education and NHS waiting lists, briefed to the media in a blizzard of official statistics. What has triggered all this is not exactly mysterious: amid dire approval ratings and a general sense of malaise and mishap – the latest hiccup is the somewhat farcical departure of the transport secretary, Louise Haigh – his administration is palpably unpopular.The truth, of course, is that the prime minister and his colleagues hardly attracted much acclaim and affection in the first place. In July, only one in five of the electorate voted Labour. Our electoral system might maintain the appearance of politics-as-usual, but a lot of us know what is really afoot: the UK’s increasing resemblance to any number of European countries, with two supposedly main parties competing for a declining share of the vote, while everything fragments and hard-right populists seize on people’s continuing resentments. As evidenced by Starmer’s recent acknowledgment that “very many people didn’t vote Labour at the last election”, the tension between his government’s parliamentary majority and its dearth of support in the real world remains its defining feature. Continue reading...","Sun, 01 Dec 2024 15:11:00 GMT",-0.2263,0.9268
The Guardian,Ella Baron on the 600 Brazilians deported from the UK on secret flights – cartoon,Continue reading...,"Sun, 01 Dec 2024 17:15:18 GMT",0.0,0.0
