broadcast,title,description,pub_date,title_sentiment_score,description_sentiment_score
BBC,'I have nothing to go back to' - reporter tells of LA fires heartbreak,Lucy Sherriff had covered fires before for the BBC - this time one reduced her own home to ash.,"Fri, 10 Jan 2025 16:30:15 GMT",-0.5719,0.0
BBC,Reeves pledges to 'make UK better off' on China visit,It follows criticism of the chancellor's trip which comes at a time of economic unease as UK borrowing costs rise.,"Sat, 11 Jan 2025 00:16:59 GMT",0.4404,-0.6808
BBC,More people in late 20s still living with parents,"The rising cost of buying or renting home has led more to remain in the family home, a think-tank says.","Sat, 11 Jan 2025 00:40:19 GMT",0.0,0.0
BBC,Temperature drops to -17.3C in Scottish hamlet,Altnaharra in the Highlands recorded the lowest overnight temperature of the winter in Scotland.,"Fri, 10 Jan 2025 23:10:52 GMT",0.0,-0.3818
BBC,Warwick Davis to receive prestigious Bafta Fellowship,The actor is known for appearing in the Star Wars and Harry Potter films and presents game show Tenable.,"Fri, 10 Jan 2025 19:30:32 GMT",0.0,-0.5574
BBC,"10,000 brave -3C at Bradford's magical City of Culture launch","Steven Frayne, aka magician Dynamo, stars at an opening ceremony in sub-zero temperatures for Bradford 2025.","Fri, 10 Jan 2025 21:50:31 GMT",0.5267,0.0
BBC,US and UK toughens sanctions on Russian oil industry,The actions are aimed at cutting off revenue Moscow is using to fund its war in Ukraine.,"Sat, 11 Jan 2025 01:48:00 GMT",-0.0516,-0.6597
BBC,Second pair of lynx captured in Cairngorms,Two other lynx were captured in the same area on Thursday.,"Fri, 10 Jan 2025 20:13:45 GMT",0.0,0.0
BBC,Meta and Amazon axe diversity initiatives joining US corporate rollback,The companies are among the latest major corporations to alter their diversity programmes since Trump's re-election.,"Sat, 11 Jan 2025 01:06:29 GMT",0.0772,0.0
BBC,Reform UK councillors resign in protest over Farage,"A group of councillors in Derbyshire say the party ""has lost its sense of direction"" under Farage's leadership.","Sat, 11 Jan 2025 00:12:54 GMT",-0.5267,0.1027
BBC,Watch: How three days of devastation unfolded,Multiple fires are still burning in LA as authorities warn fierce winds threaten more destruction.,"Fri, 10 Jan 2025 15:41:30 GMT",-0.4215,-0.7902
BBC,Maps and pictures chart how fires have spread,Maps and images showing how the fires currently affecting the Los Angeles area are developing.,"Fri, 10 Jan 2025 17:27:02 GMT",0.0,0.0
BBC,'It's like a ton of bricks fell on me' - Victims' loved ones share stories ,"An amputee and his bedbound son, a man trying to defend his home of 55 years are among the 11 victims of the Los Angeles fires.","Sat, 11 Jan 2025 01:22:10 GMT",0.743,-0.3182
BBC,"LA celebrities lose homes, share reactions to wildfires","Jeff Bridges, Mel Gibson, Paris Hilton and Adam Brody are among the celebrities who have lost their homes.","Sat, 11 Jan 2025 01:39:07 GMT",-0.128,-0.3182
BBC,What's the latest on the wildfires and what caused them?,Everything you need to know about the blazes that have forced thousands to leave their homes.,"Fri, 10 Jan 2025 22:58:14 GMT",0.0,-0.4939
BBC,Before and after: How wildfires tore through LA,"Homes, businesses and schools were damaged or destroyed in wildfires that struck Los Angeles county.","Thu, 09 Jan 2025 12:20:10 GMT",0.0,-0.7964
BBC,Fact-checking criticism of California officials over fires,The US president-elect has criticised a top California Democrat for challenges fighting the blazes in Los Angeles. ,"Fri, 10 Jan 2025 22:41:44 GMT",-0.4404,-0.4939
BBC,"In court with the '9/11 mastermind', two decades after his arrest",Legal disputes leave Khalid Sheikh Mohammed in limbo as the population dwindles at Guantanamo Bay,"Fri, 10 Jan 2025 22:23:11 GMT",-0.34,-0.2023
BBC,'Cold bites' gas supply and 'Dementia shock',"Saturday's headlines include the nation's winter gas supply and Dean Windass's ""shock"" dementia diagnosis.","Fri, 10 Jan 2025 23:58:42 GMT",-0.3818,-0.3818
BBC,"Probation: 'Too few staff, with too little experience, managing too many offenders'",Probation officers say they were overworked even before thousands of prisoners were released early.,"Sat, 11 Jan 2025 01:07:31 GMT",-0.3612,-0.5106
BBC,Oldham abuse survivors criticise government over inquiry decision,Three women whose lives were ruined by historical child abuse want the PM to come and meet survivors. ,"Fri, 10 Jan 2025 18:07:19 GMT",-0.7964,-0.7906
BBC,Faisal Islam: Mortgage rates are not rising yet but Reeves has to act,Why Rachel Reeves needs a more detailed growth strategy - and soon.,"Fri, 10 Jan 2025 17:14:28 GMT",0.0,0.4364
BBC,The quest to catch the Cairngorms' mysterious lynx,Two cats have been captured and a search goes on for two more in the UK's largest national park.,"Fri, 10 Jan 2025 23:06:41 GMT",0.0,0.0
BBC,"Teen whose art sells for £23,000 gets first painting lesson","Makenzy Beard, 17, made waves during lockdown after painting a portrait of her neighbour. ","Fri, 10 Jan 2025 22:53:50 GMT",0.0,0.0
BBC,Could a mango-flavoured pill end  intestinal worms?,"The pill is a combination of two existing anti-parasitic drugs that, used together, appear more effective. ","Sat, 11 Jan 2025 00:58:28 GMT",0.0,0.5256
BBC,"Ruins, racers and rockers: Photos of the week",A selection of news photographs from around the world.,"Sat, 11 Jan 2025 00:41:12 GMT",-0.4404,0.0
BBC,MPs urge checks as Shein refuses to answer questions,The chair of a committee of MPs has written to the London Stock Exchange with concerns over the fashion retailer.,"Fri, 10 Jan 2025 20:59:13 GMT",0.0,0.0
BBC,TikTok's future in the US rests with the Supreme Court,The platform with nearly 170 million American users is challenging a law that would see it banned in the US in a matter of days.,"Fri, 10 Jan 2025 23:32:32 GMT",0.5574,-0.3182
BBC,Bride's fury after Instagram stunt wedding turns out to be real,The woman got married to her partner as she believed it would boost his social media following.,"Fri, 10 Jan 2025 12:33:11 GMT",-0.5719,0.4019
BBC,Another icy night for UK - but end of cold snap on horizon,Freezing conditions are set to continue into Saturday - but things will start to warm up by the end of the weekend.,"Fri, 10 Jan 2025 18:11:19 GMT",0.0,0.2846
BBC,BBC News app,"Top stories, breaking news, live reporting, and follow news topics that match your interests","Tue, 20 Aug 2024 11:35:33 GMT",0.0,0.4215
BBC,Trump in Court (Again),The president-elect avoids jail for hush money fraud,"Fri, 10 Jan 2025 18:40:00 GMT",0.0,-0.6705
BBC,Mark Zuckerberg sends Trump a friend request,And the L.A. wildfires have already become political,"Fri, 10 Jan 2025 15:30:00 GMT",0.4939,0.0
BBC,Potter 'excitement' short lived - but West Ham find 'positives',"Graham Potter says West Ham's display at Aston Villa gave him ""encouragement"" - even if his pre-match ""excitement"" was short lived.","Fri, 10 Jan 2025 23:55:53 GMT",0.7717,0.7184
BBC,Moyes in talks with Everton over return to club,David Moyes is in talks with Everton over a possible return to the Toffees as manager following Sean Dyche's sacking.,"Fri, 10 Jan 2025 17:17:03 GMT",0.0,0.0
BBC,Glasgow beat Racing to seal Champions Cup knockout spot,Glasgow Warriors book their spot in the knockout stages of the Champions Cup with a clinical destruction of Racing 92 at Scotstoun.,"Fri, 10 Jan 2025 21:55:15 GMT",0.5267,-0.0772
BBC,England's decade-long quest to bring Women's Ashes home,"Players to watch, how to follow and England's chances - here's all you need to know as Heather Knight's side look to win the Ashes for the first time since 2014.","Fri, 10 Jan 2025 16:18:54 GMT",0.0,0.6808
BBC,Man City agree £33.6m deal for Lens defender Khusanov,Manchester City agree £33.6m deal with Lens for Uzbekistan central defender Abdukodir Khusanov.,"Fri, 10 Jan 2025 23:09:08 GMT",0.4404,0.4404
BBC,Defending champion O'Sullivan withdraws from Masters ,"Ronnie O'Sullivan, the defending champion, will miss the Masters in London on medical grounds. ","Fri, 10 Jan 2025 11:47:32 GMT",0.5994,0.5106
BBC,Should this have stood? - Villa score controversial equaliser,"Watch Amadou Onana score a controversial goal for Aston Villa in their FA Cup win, with West Ham protesting the award of the corner which lead to the goal as well as a possible foul on Lucas Paqueta.","Fri, 10 Jan 2025 22:58:06 GMT",-0.2023,0.7003
NYC Times,"An Altadena Family Escaped the L.A. Wildfires, but They Lost Almost Everything",Aurielle Hall knew she had little time to get herself and her daughter out of Altadena. Convincing Aunt Cheri would be a different challenge.,"Sat, 11 Jan 2025 02:18:35 +0000",-0.4497,0.4588
NYC Times,Who Are the Victims of the Los Angeles Fires?,At least 11 people were reported dead in fires raging across Los Angeles. Five lived near each other in a ravaged Altadena neighborhood.,"Fri, 10 Jan 2025 23:23:54 +0000",-0.3182,-0.8271
NYC Times,"The Memories That Burn, Too","Shawn Hubler, who covers California from Sacramento, details the personal, psychological toll of the wildfires.","Fri, 10 Jan 2025 23:31:09 +0000",0.0,0.0
NYC Times,Supreme Court Seems Poised to Uphold Law That Could Ban TikTok,"The justices are expected to rule quickly in the case, which pits national security concerns about China against the First Amendment’s protection of free speech.","Fri, 10 Jan 2025 21:30:04 +0000",0.25,0.6908
NYC Times,Can You Still Use TikTok if It’s Banned? What Users Should Know About the App.,The social media app is likely to disappear from the app stores of Google and Apple right away. But it’s unclear if users will completely lose access.,"Fri, 10 Jan 2025 18:37:51 +0000",-0.4588,-0.7869
NYC Times,"As a Felon, Trump Upends How Americans View the Presidency",President-elect Donald J. Trump has worked for years to discredit any and all criminal and civil cases against him as nothing more than politically motivated witch hunts.,"Sat, 11 Jan 2025 02:06:04 +0000",0.0,-0.3892
NYC Times,Trump Is First President to Be Sentenced as a Felon,"President-elect Donald J. Trump’s New York criminal case culminated with him avoiding jail, but he is set to become the first felon to occupy the Oval Office.","Fri, 10 Jan 2025 23:26:44 +0000",-0.0258,-0.4404
NYC Times,"Trump’s Sentence Comes With No Penalty, but He Will Take Office as a Felon","Justice Juan M. Merchan gave Donald J. Trump a symbolic punishment. The judge said that leniency was due the office of the president, not the man who will soon hold the title.","Fri, 10 Jan 2025 23:14:14 +0000",0.224,0.0516
NYC Times,Trump Received an Unconditional Discharge. What Does That Mean?,"The rare and lenient sentence, which will spare President-elect Donald J. Trump jail time, was used to address his unusual status.","Fri, 10 Jan 2025 15:09:46 +0000",0.0,0.34
NYC Times,Giuliani Found in Contempt of Court Over Continued Defamation of Election Workers,"In November, Rudy Giuliani repeated accusations against the women at least four times, after Donald J. Trump won the 2024 presidential election.","Sat, 11 Jan 2025 00:30:16 +0000",-0.5859,0.34
NYC Times,Inside Mark Zuckerberg’s Sprint to Remake Meta for the Trump Era,"After visiting President-elect Donald J. Trump in November, Mr. Zuckerberg decided to relax Meta’s speech policies. He asked a small team to carry out his goals within weeks. The repercussions are just beginning.","Sat, 11 Jan 2025 00:50:34 +0000",0.0,0.4404
NYC Times,Biden Calls Meta’s Ending of Fact-Checking Program ‘Shameful’,"Responding to a question from a reporter, the president said he believed Americans “want to tell the truth.”","Sat, 11 Jan 2025 01:56:18 +0000",0.0,0.0
NYC Times,Bob Dylan Is Having a Hollywood Moment. His No. 1 Hater Is Ready.,A.J. Weberman sifted through the prophetic singer’s trash in search of meaning. He turned on him as a sellout and has spent decades trying to reclaim him for the counterculture.,"Fri, 10 Jan 2025 16:02:46 +0000",-0.0772,0.0
NYC Times,Regulators Tell Baltimore Drug Program to ‘Cease and Desist’,Maryland issued the order after an investigation by The New York Times and The Baltimore Banner traced overdoses and deaths to an addiction program offering free housing.,"Sat, 11 Jan 2025 02:19:59 +0000",0.0,0.5106
NYC Times,Biden Issues Sweeping Deportation Protections Before Trump Takes Office,"The move allows hundreds of thousands of people from Sudan, Ukraine, El Salvador and Venezuela to stay in the country temporarily.","Sat, 11 Jan 2025 01:43:02 +0000",0.0,0.0
NYC Times,Investing in Stocks and Bonds Will Be Trickier Under Trump,"Sizzling returns may well continue, but our columnist suggests that it would be wise to prepare for the next storm.","Fri, 10 Jan 2025 23:32:57 +0000",-0.1779,0.6908
NYC Times,"James Arthur Ray, Self-Help Guide Whose Retreat Became Deadly, Dies at 67","A rising star among New Age motivational speakers, he was brought down by a disaster during one of his retreats in Arizona, where three people died in a sweat lodge.","Sat, 11 Jan 2025 00:53:38 +0000",0.2023,-0.8271
NYC Times,Israeli Hostage Hamza Ziyadne Is Declared Killed in Gaza,"Hamza Ziyadne, 23, was abducted in the 2023 Hamas-led attack on Israel alongside his siblings and father, whose body was also recovered this week.","Fri, 10 Jan 2025 18:59:07 +0000",-0.6705,-0.7506
NYC Times,Israel Strikes Ports and a Power Plant in Houthi-Controlled Parts of Yemen,"Israel and its allies have escalated strikes against the Houthis, trying to force the Iran-backed group to stop firing on Israel and Red Sea shipping.","Fri, 10 Jan 2025 18:00:34 +0000",-0.3612,-0.7269
NYC Times,"As a Climate Scientist, I Knew It Was Time to Leave Los Angeles","After the Bobcat fire, the area no longer felt safe.","Fri, 10 Jan 2025 20:30:31 +0000",-0.0516,-0.1779
NYC Times,Trump 2.0 and the Return of ‘Court Politics’,The political scientist Erica Frantz describes the regime change the second Trump administration represents.,"Fri, 10 Jan 2025 13:37:01 +0000",0.0,0.0
NYC Times,Supreme Court to Hear New Affordable Care Act Case on Preventative Care,Lower courts ruled that a task force that determines which treatments must be covered at no cost had not been validly appointed.,"Sat, 11 Jan 2025 01:35:12 +0000",0.875,-0.5267
NYC Times,Columbia Professor Katherine Franke Says She Was Forced to Retire Because of Activism,"Katherine Franke, a law professor and vocal advocate of pro-Palestinian students, had been under investigation over remarks she made about Israeli students.","Sat, 11 Jan 2025 02:27:07 +0000",-0.4588,0.0
NYC Times,"In San Francisco, Controversial Flags Have Had Their Ups and Downs","A collection of historic flags, some with provocative associations, was removed from the plaza outside City Hall for Mayor Daniel Lurie’s inauguration. By Friday, they were flying again.","Sat, 11 Jan 2025 02:39:25 +0000",-0.2023,0.0
NYC Times,"Vatican Allows Italian Gay Men to Enter Seminaries, if They Remain Celibate","Candidates for the seminary should not be disqualified based on sexual orientation, according to new church guidelines in Italy.","Fri, 10 Jan 2025 21:06:08 +0000",0.0,0.3252
CBS News,Greenland head says his people don't want to be Americans amid Trump interest,"Greenland's prime minister said he hasn't spoken to President-elect Donald Trump, but that he's open to discussions about what ""unites us.""","Fri, 10 Jan 2025 17:54:43 -0500",0.4172,0.0
CBS News,Maduro sworn in for 3rd term despite outcry over Venezuela's election,President-elect Donald Trump says Venezuela's embattled opposition leader must be protected as President Nicolas Maduro takes the oath of office for a third six-year term.,"Fri, 10 Jan 2025 15:42:10 -0500",0.4023,0.4404
CBS News,"As Gaza deaths climb over 46,000, some pin hope for a truce on Trump","Palestinian officials say the war in Gaza has killed more than 46,000 people, as some on both sides of the conflict hope for ""help from Donald Trump.""","Fri, 10 Jan 2025 13:03:12 -0500",0.4404,-0.7269
CBS News,"Nigerian authorities round up street children seen as ""security threat""","Sharia police in Nigeria's Kano state say they've ""mopped up 300 of these boys from the streets"" and put them in a camp for ""rehabilitation.""","Fri, 10 Jan 2025 10:12:56 -0500",-0.25,0.0
CBS News,Mercury's north pole seen in stunning new photos after spacecraft flyby,The BepiColombo spacecraft swooped as close as 183 miles above Mercury's night side before passing directly over the planet's north pole.,"Fri, 10 Jan 2025 07:41:42 -0500",0.3818,0.0
CBS News,Founder of adult website linked to mass rape trial faces charges,"The website enabled Dominique Pelicot to recruit dozens of strangers to rape his heavily sedated wife for years,  authorities say.","Fri, 10 Jan 2025 06:28:44 -0500",-0.7783,-0.6908
CBS News,Woman reportedly wounds 8 in hammer attack at university in Tokyo,Japanese media say a sociology student attacked her classmates with a hammer during class after voicing frustration at being ignored.,"Fri, 10 Jan 2025 06:20:30 -0500",-0.4767,-0.8126
CBS News,1/9: CBS Evening News,"Los Angeles officials face questions, criticism as out-of-control wildfires continue to rage; How to help Southern California wildfire victims","Fri, 10 Jan 2025 06:11:50 -0500",0.0,-0.7269
CBS News,Poland says Netanyahu could attend Auschwitz memorial despite ICC warrant,"Poland has ensured that Israel's leader could attend events marking 80 years since the liberation of Auschwitz despite an ICC arrest warrant, thought he's not expected.","Fri, 10 Jan 2025 05:21:00 -0500",0.0,0.2584
CBS News,"Most of the world's 35,000 online pharmacies are run illegally, U.S. warns","Ninety-six percent of online pharmacies were found to violate the law, meaning they were operating without a license and selling medications without prescriptions.","Thu, 09 Jan 2025 14:31:14 -0500",-0.1027,-0.4939
CBS News,Climber's remains identified 6 decades after he fell from glacier,"The German man has been identified after his bones, including part of a leg, were discovered in western Austria.","Thu, 09 Jan 2025 11:02:35 -0500",0.0,0.0
CBS News,"As U.S. announces new Ukraine aid package, Zelenskyy says send troops","Ukraine's leader says partners sending ground troops would help ""force Russia into peace,"" as America's European allies ponder Trump's next move.","Thu, 09 Jan 2025 10:00:04 -0500",0.0,0.7351
CBS News,Photo shows rescue of baby girl born at sea on migrant ship,"""Christmas ended in the Canaries with the rescue of a baby born while crossing the sea,"" the coastguard said.","Thu, 09 Jan 2025 09:34:59 -0500",0.5106,0.5106
CBS News,How one U.K. man helps people cope with homelessness,"Verral Paul-Walcott isn't part of any charity, but during the COVID lockdown in the U.K., he saw a problem and mobilized a group of people to help. He told CBS News' Leah Mishkin how he built a network via social media that's helping to get people struggling with homelessness things they desperately need, when they need them.","Thu, 09 Jan 2025 07:38:00 -0500",0.3818,-0.5267
CBS News,"Inside a U.K. couple's ""secondhand wedding""","Tying the knot can be pricey, with the average cost of a wedding estimated at about $35,000.   But CBS News' Leah Mishkin met a British couple who've proven you don't have to break the bank to have the wedding of your dreams.","Thu, 09 Jan 2025 07:38:00 -0500",0.0,0.5499
CBS News,"Mexico president trolls Trump with ""Mexican America"" map","Mexico's president sarcastically said that the U.S. should be called ""Mexican America"" after Trump's vow to rename the Gulf of Mexico the ""Gulf of America.""","Thu, 09 Jan 2025 07:20:09 -0500",0.0,-0.2732
CBS News,Japan mafia leader pleads guilty in U.S. to nuclear material trafficking,Takeshi Ebisawa allegedly conspired to traffic uranium and plutonium from Myanmar in the belief that Iran would use it for nuclear weapons.,"Thu, 09 Jan 2025 06:44:00 -0500",-0.4215,-0.4404
CBS News,Iran puts on show of force with war games ahead of Trump's second term,"Weeks before Trump's inauguration, Iran is preparing for potential threats to its nuclear facilities – and for the possible domestic reaction.","Thu, 09 Jan 2025 05:16:58 -0500",-0.5994,-0.4215
CBS News,1/8: CBS Evening News,"Firestorm brings death, destruction to Los Angeles County; Los Angeles fire official on the challenges crews are facing","Thu, 09 Jan 2025 02:30:45 -0500",0.0,-0.8658
CBS News,Why would Trump want Greenland and the Panama Canal?,"Donald Trump says the U.S. needs control of Greenland and the Panama Canal ""for national security."" Here's why both places are so important.","Wed, 08 Jan 2025 13:31:00 -0500",0.0772,0.5812
CBS News,Mexico president addresses fentanyl production after Trump's tariff threat,President Claudia Sheinbaum's statement on Mexico's anti-drug campaign follows President-elect Donald Trump's threats to impose tariffs over drug trafficking.,"Wed, 08 Jan 2025 12:19:14 -0500",-0.5267,-0.6124
CBS News,Iran frees Italian journalist held for 3 weeks with no explanation,It's believed that Iran detained Italian journalist Cecilia Sala to use as a bargaining chip for the release of two Iranians held by Italy and the U.S.,"Wed, 08 Jan 2025 07:09:00 -0500",0.0,-0.4019
CBS News,"Scientists: ""Toxic"" semen could kill female mosquitoes, curb disease spread","Female mosquitoes are targeted because only they bite and drink blood, thereby spreading diseases such as malaria and dengue fever.","Wed, 08 Jan 2025 07:01:31 -0500",-0.6908,0.0
CBS News,"Police say hiker lost 2 weeks in mountains found in ""great condition""",A hiker who got lost in Australia's Snowy Mountains has shocked police by surviving on a couple muesli bars and foraged berries.,"Wed, 08 Jan 2025 06:15:19 -0500",0.4215,-0.34
CBS News,1/7: CBS Evening News,"Strong winds fuel rapidly expanding wildfires in Southern California; Peter Yarrow, of Peter, Paul, and Mary, dies at age 86","Wed, 08 Jan 2025 06:11:42 -0500",0.0,0.1779
CBS News,"Cartel threatens to kill famed singer: ""Last time you will receive a warning""",Photos of a banner threatening the lives of Natanael Cano and several other artists circulated on social media over the weekend.,"Wed, 08 Jan 2025 06:09:00 -0500",-0.8658,-0.5267
CBS News,Trump says he won't rule out military force to take Greenland,"President-elect Donald Trump held a wide-ranging news conference Monday in which he reiterated his insistence that the U.S. should take control of the Panama Canal and Greenland, adding that he wouldn't rule out the use of military force to do it. Trump also said he plans on pardoning people convicted in cases stemming from the Jan. 6 attack on the U.S. Capitol. Caitlin Huey-Burns reports.","Tue, 07 Jan 2025 19:49:00 -0500",0.0,-0.1027
CBS News,Second man charged in Liam Payne's death surrenders to Argentine police,"David Ezequiel Pereyra, 21, surrendered Monday to police in Barracas, south of Buenos Aires.","Tue, 07 Jan 2025 17:04:12 -0500",-0.6908,0.0
CBS News,Tennis star accidentally hits woman in stands with thrown racquet,Video of the incident showed a woman in a hat being struck by the racquet as the crowd gasped.,"Tue, 07 Jan 2025 14:14:41 -0500",-0.34,-0.25
CBS News,U.S. accuses one side in Sudan's vicious civil war of genocide,The U.S. government has determined that Sudan's RSF paramilitary force and its allies have committed genocide in the country's raging civil war.,"Tue, 07 Jan 2025 13:18:48 -0500",-0.8316,-0.5859
Aljazeera,Myanmar’s rebels liberate territory – administrating it is the next battle,Al Jazeera visits liberated area in Karen State where establishing a civil administration is the next task for fighters.,"Sat, 11 Jan 2025 01:44:02 +0000",-0.5267,-0.0516
Aljazeera,Guantanamo at 23: What’s next for the ‘lawless’ detention facility?,"With 15 inmates remaining, advocates urge Biden to release more Gitmo detainees before he leaves office on January 20.","Fri, 10 Jan 2025 22:49:10 +0000",-0.3612,0.0
Aljazeera,"Meta, Amazon nix diversity, inclusion programmes ahead of Trump term",Conservative groups have denounced the programmes and threatened to sue companies over them.,"Fri, 10 Jan 2025 22:28:15 +0000",0.1779,-0.4588
Aljazeera,US Supreme Court critical of TikTok arguments against looming ban,A law would require parent company ByteDance to sell off US operations of TikTok by January 19 or face a ban.,"Fri, 10 Jan 2025 21:07:05 +0000",-0.6705,-0.5574
Aljazeera,Can a new president change Lebanon’s fortunes?,Appointment of Joseph Aoun ends two years of political paralysis.,"Fri, 10 Jan 2025 20:40:44 +0000",0.0,0.0
Aljazeera,"Biden extends temporary status for immigrants from Ukraine, Venezuela",The US&#039;s decision to renew the &#039;temporary protected status&#039; comes as President-elect Trump prepares to take office.,"Fri, 10 Jan 2025 20:34:13 +0000",0.128,0.4404
Aljazeera,Venezuela’s Maduro sworn in for third consecutive term as president,Venezuela’s Nicolas Maduro was sworn in for a third six-year term as president.,"Fri, 10 Jan 2025 20:23:18 +0000",0.0,0.0
Aljazeera,The UN can end the Middle East conflict by welcoming Palestine as a member,The June 2025 UN Conference on Palestine can be the long-awaited turning point for the region.,"Fri, 10 Jan 2025 20:02:33 +0000",0.1531,0.0
Aljazeera,‘I lost everything:’ Fire crews battle ‘unprecedented’ Los Angeles blazes,Officials hope improved wind conditions will allow firefighters to contain wildfires that have devastated the US city.,"Fri, 10 Jan 2025 19:33:32 +0000",-0.743,0.4404
Aljazeera,"Greenland does not want to be American or Danish, PM says","Mute Egede, who previously said territory ‘not for sale’, underlined people’s desire to be ‘master of own house’.","Fri, 10 Jan 2025 19:15:25 +0000",-0.0572,0.4019
