broadcast,title,description,pub_date,title_sentiment_score,description_sentiment_score
The Guardian,Tell us: do you prefer to send Christmas cards or digital versions?,"We’d like to hear from gen Z and other generations about which type of Christmas cards they prefer to sendWe’d like to find out if you’re sending Christmas cards this year.There’s been a suggestion that gen Z who have grown up with all things digital still like to send physical Christmas cards. 59% of gen Z and 62% of millennials prefer physical cards over digital ones, according to a survey of 2000 adults by OnePoll and Shutterfly. Continue reading...","Wed, 11 Dec 2024 15:22:07 GMT",0.0,0.7579
The Guardian,People in the UK: tell us what your hopes and concerns are for your finances in 2025,We would like to hear from people in the UK and what they predict will happen to their finances next yearWe want to find out more about how people in the UK feel about the state of their finances and what the new year might bring for them.What are your hopes and concerns for your finances in 2025? Are you hoping to get promoted or change jobs? Are you starting a family and worried about how you will manage? Perhaps you have been unemployed and will be returning to work next year. What will this mean for you? Continue reading...,"Mon, 09 Dec 2024 09:19:47 GMT",0.4215,0.8738
The Guardian,Share your reaction to the fall of Assad in Syria,"We would like to hear from Syrian refugees, the diaspora and anyone affected by the regime changeCrowds in Syria have been celebrating the end of five decades of dynastic rule following the fall of the dictator Bashar al-Assad who has fled to Moscow.People waved the Syrian revolutionary flag and pulled down statues and portraits of the president and his father, Hafez. Families have been reunited with loved ones long lost to the dark of the regime’s notorious prison system. Continue reading...","Mon, 09 Dec 2024 12:33:03 GMT",0.296,0.5994
The Guardian,No comfort and little shelter in Gaza as nightmare of winter sets in,"Displaced residents face acute hardship, fleeing airstrikes and suffering from disease and hunger as temperatures plummetTens of thousands of people sheltering on Gaza’s exposed Mediterranean coastline face harsh winter conditions with inadequate shelter, food and fuel, as temperatures plunge in the devastated territory and a series of storms destroy their makeshift tents.In recent weeks, bad weather has forced hundreds living in the coastal strip of Gaza around al-Mawasi to evacuate their shelters, ruining cooking utensils, clothes, stocks of food and precious firewood. Al-Mawasi was designated a “humanitarian zone” by Israeli military offensives and is packed with people displaced during 13 months of fighting, airstrikes and artillery bombardment. Continue reading...","Thu, 12 Dec 2024 12:00:17 GMT",-0.2755,-0.9796
The Guardian,German election opinion polls – who’s leading for 2025,"The German chancellor, Olaf Scholz, has announced fresh elections to the Bundestag for February 2025, after the collapse of his SPD-led coalition. Find out which parties are polling best todayGermany is preparing for a general election to the Bundestag, the lower house of its parliament, on 23 February, after its “traffic-light” coalition of social democrats, liberals and greens collapsed. The country’s electoral system is highly proportional, so polls give a good indication of what shape of government might be possible after the election. Continue reading...","Thu, 12 Dec 2024 09:25:58 GMT",0.0,0.6808
The Guardian,Trawl the sea or mine for metals? Pacific nations wrestle with how to protect oceans - and livelihoods,"Palau plans to allow more fishing in its marine sanctuary, as countries across the region seek to balance conservation with economic needsDotted across the north-west of the Pacific Ocean, the limestone islands of Palau rise like forested domes. Beneath the waves, reefs pulse with activity – fish dart through coral gardens, turtles drift nearby, while sharks with black-tipped fins shadow a passing tourist boat.Nearly a decade ago, the country took a bold step to safeguard this vibrant seascape, declaring 80% of its waters a no-fishing sanctuary.Ngerukewid, also known as the ‘Seventy Islands’, is a group of dozens of small, raised coral islands nestled within Palau’s lagoon. Continue reading...","Wed, 11 Dec 2024 12:00:48 GMT",0.5423,0.9118
The Guardian,‘Mother of all battles’: terror for Mexicans as war rages inside Sinaloa cartel,"Violence shows few signs of ending after three months of war between rival factions that have left more than a thousand dead or disappearedOne bright recent morning, Culiacán threw a party like old times, with chefs serving up aguachile, a Sinaloan-style ceviche, and musicians blasting a riot on their trumpets and drums.“It used to be like this every weekend,” said Alexis, one of the apprentice chefs, taking a moment in the cool quiet of the cathedral. Continue reading...","Thu, 12 Dec 2024 10:00:14 GMT",-0.886,-0.2263
The Guardian,‘Many migrant workers will die’: the likely human cost of awarding the 2034 World Cup to Saudi Arabia,"Millions of migrants will build stadiums, transport networks and hotels. But testimonies from Bangladeshis who have worked there suggest abuse is deeply entrenched in the Gulf kingdomWhen Shahadat set out for Saudi Arabia from his village in Bangladesh, he was driven by a single purpose: to earn money for his impoverished family. “If he sent money home, his family would eat. If he didn’t, they wouldn’t,” says a relative.For years he just about scraped by, sending a little money home each month and trying to pay down the huge debt he took on to afford the illegal fees a recruitment agent had charged him to get to Saudi Arabia. Continue reading...","Wed, 11 Dec 2024 14:49:29 GMT",0.4404,-0.9413
The Guardian,A Route 66 town was dead. This man resurrected it into ‘a classic desert destination’,"Purchased in 2005 by Albert Okura, Amboy now honors the Japanese American man who spent his life preserving symbols of AmericanaThis small town, like so many along Route 66, should be dead. Doomed by the rise of modern highways and the harsh Mojave Desert environment, Amboy should look like its abandoned neighboring towns. Yet, on a crisp November day, Amboy thrummed with friends and travelers swapping stories about the area’s history, the family that saved it, and the road that led them there.“It’s the mother road,” said Digger Simpson, 61, gesturing towards the legendary Route 66 that once was the nation’s main artery for travel from Chicago to Santa Monica, California. “It’s Americana – it’s mom-and-pop restaurants and gas stations,” he added, reflecting on the nostalgia that drew him from Twentynine Palms to Amboy to celebrate Albert Okura, the man credited with injecting life back into the town. Continue reading...","Wed, 11 Dec 2024 16:00:02 GMT",-0.6486,0.6124
The Guardian,"The cochlear question: as the parent of a deaf baby, should I give her an implant to help her hear?","Cochlear implantation is controversial in ways that parallel medical situations – such as artificial limbs and cornea transplants – are not. Why does this issue provoke such fierce debate?This essay first appeared under the title The Cochlear Question on Aeon.coI knew my daughter could hear: not just because she loved music, but because she had perfect rhythm. She punched her fists in the air like a human metronome, and brought a doughy heel to the ground precisely on each downbeat. I had thrown off the yoke of milestone-tracking months earlier, having become fixated on her inability to roll during the precise developmental week for rolling. So when she didn’t form consonants at the prescribed time, I made a deliberate choice to ignore it. It didn’t occur to me that deafness might not be a binary, and that certain vibrations and pitches – the downbeat of a song by toddler-music group the Wiggles, say – could be apprehended, while other subtle speech sounds might be snatched out of a sentence. So it was a couple of months after her first birthday when we discovered that our Botticellian baby had mild hearing loss, and two years after that when she lost almost all of her remaining hearing entirely.Like most hearing parents of deaf children, my first close relationship with a deaf person was with my child. Despite a relatively broad cultural education, I knew next to nothing about hearing loss or deaf culture. What little I had absorbed was an incomplete and almost entirely inaccurate patchwork of pop culture snippets – the mother’s horror when her baby doesn’t react to the fire engine’s siren in the film Mr Holland’s Opus (1995); Beethoven’s struggle to hear the first performance of his Ninth Symphony; the lift scene in Jerry Maguire (1996) where the loving boyfriend signs “you complete me” to his partner; Quasimodo’s apparent industrial deafness from the bells of Notre-Dame; and, worst of all, the appalling memory of my university housemate imitating a deaf accent for laughs. This bleak landscape of ignorance and misinformation is often the lookout from which parents begin making decisions, as deaf critics have rightly pointed out. But although I began educating myself belatedly, it didn’t take long for the calcified layers of assumptions and approximations to disintegrate. Chief among them was the unquestioned belief that hearing loss, for an early deafened person, is even a loss at all. Continue reading...","Wed, 11 Dec 2024 23:59:02 GMT",0.4019,-0.9734
The Guardian,‘It’s a pure form of gambling’: memecoins boom after Trump election,"‘Hawk tuah girl’ Haliey Welch’s coin fails amid new wave of hype around crypto-related assetsIt is a parable for the attention economy. A celebrity created entirely by social media, “hawk tuah girl” Haliey Welch, helps launch a crypto asset that stokes a viral frenzy and then flames out.The Hawk memecoin was worth $490m (£385m) hours after it launched on 4 December but now has a market capitalisation – the value of all Hawk coins in circulation – of $17m. Continue reading...","Thu, 12 Dec 2024 07:00:11 GMT",0.0,0.6486
The Guardian,‘Someone has to stay’: how Ukrainian power plant workers keep the country running,"The Guardian visits a Soviet-era coal-fired thermal installation to explore how it has held up to Russian attacksIn the cavernous turbine hall of a coal-fired thermal power plant, deputy chief engineer Oleksandr runs through the extensive damage, pointing out various consequences of numerous Russian strikes over the past two years.Machinery is covered in thick dark streaks of grime, the residue of heating insulation that burned and rained down on the equipment. A roof girder, 10 metres long, is impaled in the floor. Oil tanks and machines are strafed with shrapnel marks. Continue reading...","Wed, 11 Dec 2024 17:35:57 GMT",0.0,-0.802
The Guardian,I was forced to give my baby away – and it was 40 years before I saw him again,"Abused as a child, barely able to support herself as an adult, Maria Arbuckle was one of thousands of unmarried women who suffered in Ireland’s mother and baby homes. She talks about her long battle to be reunited with her son – and the tragedy that struck soon afterWhen Maria Arbuckle thinks of her time in Ireland’s largest mother and baby home, she thinks of the nursery and its snug rows of cots, each one filled with a tiny, bleating bundle. She thinks of her boy, Paul, among them, and the 8lb 10oz weight of him in her arms. She thinks of how she fed and washed him under the careful watch of the Daughters of Charity of Saint Vincent de Paul. And she thinks of the refrain that ended each visit, when she had to&nbsp;hand him back to them: “He’s not yours any more. He doesn’t belong to you.”Arbuckle, 62, was six months pregnant when she was sent by social services in Northern Ireland to Saint Patrick’s mother and baby home over the border in Dublin. She was 18 and emerging from a childhood spent shunted between a children’s home, an abusive foster home and a church-run industrial school for children considered to be in “moral danger”. It was 1981, Northern Ireland was in the thick of the Troubles and she was living in the border county of Monaghan, far from her native Derry. Her first serious relationship had collapsed, she had no contact with the foster family who had raised her for 11 years and she was barely making ends meet with her traineeship with a bookmaker. “At the mother and baby home, they told me that I had nowhere to go,” she recalls, more than four decades later. “I&nbsp;was on my own. I had no man, no&nbsp;family. And they were right.” Continue reading...","Wed, 11 Dec 2024 10:00:44 GMT",-0.4588,-0.9605
The Guardian,Does Google’s ‘mindboggling’ new chip bring quantum computers any closer? – podcast,"On Monday Google unveiled its Willow quantum computing chip. The new chip takes just five minutes to complete tasks that would take 10 septillion years for some of the world’s fastest conventional computers to complete. But despite its impressive power, it’s not clear the chip has any practical applications. So does it bring quantum computing any closer? To find out Ian Sample speaks to Winfried Hensinger, professor of quantum technologies at the University of Sussex.Because of industrial action taking place by members of the National Union of Journalists at the Guardian and Observer this week, you may notice some disruption to the availability of new episodes in your Guardian podcast feeds in the coming days. All the work on this episode was done before the strike action began. For more information please head to theguardian.comGoogle unveils ‘mindboggling’ quantum computing chipSupport the Guardian: theguardian.com/sciencepod Continue reading...","Thu, 12 Dec 2024 05:00:09 GMT",0.0,-0.7883
The Guardian,What next for Britain’s Syrian refugees? – Politics Weekly UK,"The UK government has announced it is suspending Syrian asylum claims, after the fall of the decades-long Assad regime. So, what will happen to the Syrians who have made the UK their home? The Guardian’s John Harris hears from one woman settled in Yorkshire. And political correspondent Kiran Stacey joins us to talk through what Rachel Reeves’s spending review reveals about Labour’s priorities.This year the Guardian and Observer’s annual charity appeal is asking for your support to help individuals whose lives have been turned upside as a result of conflict. We’re partnering with War Child and MSF to help support individuals affected by the horrors of war, providing assistance from emergency aid to psychological support. Plus, we’ve also teamed up with Parallel Histories who help schools teach children about contested conflicts. If you can, please donate now at theguardian.com/donate24 Continue reading...","Thu, 12 Dec 2024 05:00:08 GMT",0.0,-0.0772
The Guardian,Revisited: The Unabomber and his ongoing influence,"Ted Kaczynski, the Harvard-educated mathematician who ran a 17-year bombing campaign that killed three people, died in prison last year. But his manifesto promoting violent rebellion against the modern world continues to inspire copycat attacksBecause of industrial action taking place by members of the National Union of Journalists at the Guardian and Observer this week, we are re-running an episode from earlier in the year.This episode originally ran on Monday 19 June 2023.Theodore “Ted” Kaczynski died at the federal prison in Butner, North Carolina, last year at the age of 81. Known as the “Unabomber”, Kaczynski waged a 17-year bombing campaign from an isolated shack in the Montana wilderness before finally being caught in 1996. One of those who helped apprehend Kaczynski was former FBI agent Jim Fitzgerald. He tells Michael Safi that the arrest was only possible following the publication of the bomber’s manifesto in the Washington Post. It was those words that were recognised by Kaczynski’s brother, who took his concerns to the authorities. Continue reading...","Thu, 12 Dec 2024 03:00:06 GMT",0.0,-0.959
The Guardian,Liverpool clear in Champions League and a Bergamo belter: Football Weekly - podcast,"Max Rushden, Barry Glendenning, Nicky Bandini and Philippe Auclair discuss big wins for Liverpool and Villa, while Brest’s dream continues. Plus, David Squires joins to chat about his new bookRate, review, share on Apple Podcasts, Soundcloud, Audioboom, Mixcloud, Acast and Stitcher, and join the conversation on Facebook, Twitter and email.On the podcast today: wins for Liverpool and Aston Villa in the Champions League. Ross Barkley grabs a late winner in Leipzig and Liverpool keep up their 100% start with a somewhat unconvincing performance in Girona. Continue reading...","Wed, 11 Dec 2024 12:42:33 GMT",0.7184,0.9638
The Guardian,10 years of the long read: Ukraine’s death-defying art rescuers (2024) – podcast,"As the Long Read turns 10 we are raiding the archives to bring you a favourite piece from each year since 2014, with new introductions from the authors.This week from 2024: When Putin invaded, a historian in Kyiv saw that Ukraine’s cultural heritage was in danger. So he set out to save as much of it as he could. By Charlotte Higgins Continue reading...","Wed, 11 Dec 2024 05:00:37 GMT",0.0,-0.0516
The Guardian,Sara Sharif murder: what we know now the verdict is in - video report,"Sara Sharif’s father and stepmother have been found guilty of her murder at the Old Bailey on Wednesday after an eight-week trial. Urfan Sharif, 43, and Beinash Batool, 30, were convicted along with Urfan's brother, Faisal Malik, 29, who was found guilty of causing or allowing her deathFather and stepmother of 10-year-old Sara Sharif found guilty of her murderSara Sharif murder: who are the 10-year-old girl’s killers?Sara Sharif ‘was doing her best to be a child’ – while suffering years of abuse Continue reading...","Wed, 11 Dec 2024 20:47:15 GMT",-0.6249,-0.9493
The Guardian,The 'war' on disabled people and my fight for an independent life – video,"Disability services in the UK have been consistently cut after 14 years of Tory rule and austerity, but with the promise of change from a new Labour government, musician and activist John Kelly is concerned that politicians are still not listening to disabled voices and what they want. Kelly chained himself to London buses in the 1990s to protest over a lack of access to transport, but has watched the right to an independent life be steadily eroded. He worries that yet more cuts to services are on their way Continue reading...","Tue, 10 Dec 2024 10:31:41 GMT",-0.7579,-0.8604
The Guardian,Reunited families celebrate as Syrian rebels return home to Damascus – video,"For years, fighters and displaced people in the north-west of Syria were unable to return home to government-held territories. Thousands were greeted with teary embraces and celebratory gunfire as they reunited with their families in Damascus in its surrounding countryside. ‘This is a happy day’: Syrian rebels return home to reunite with family and rebuildWho are the main actors in the fall of the regime in Syria?Inside the hunt for hidden cells in Sednaya prison, Syria’s ‘human slaughterhouse’ Continue reading...","Tue, 10 Dec 2024 06:03:16 GMT",0.4404,0.128
The Guardian,"Cars, art and Louis Vuitton: what people found at Assad's presidential palace – video","Syrians entered the presidential palace in Damascus to loot Bashar al-Assad's belongings, and were seen taking items such as Louis Vuitton boxes, art and furniture. Footage showed people discovering a fleet of luxury cars belonging to the former president. What was thought to be a secret bunker was also found beneath the palace, with empty boxes indicating it contained valuable items before its discoveryMiddle East crisis live - latest news updates Continue reading...","Mon, 09 Dec 2024 12:47:32 GMT",0.0,-0.4215
The Guardian,The Guardian's top 10 female footballers in the world 2024 – video,"A panel of 99 judges have submitted their verdicts on the best female players in the world in 2024. Together their votes determined a list of the top 100 players in the world. Here, Guardian football writer Suzanne Wrack talks through the top 10 players and why they made it to the top of the list this year.The 100 best female footballers in the world 2024 Continue reading...","Sat, 07 Dec 2024 18:51:56 GMT",0.2023,0.9382
The Guardian,How we created ultra-processed food from industrial waste – video,"In the UK and US, more than half the average diet consists of ultra-processed foods. For some people, especially those who are younger, poorer or from disadvantaged areas, a diet comprising as much as 80% UPFs is typical, and this has been linked to a myriad of harmful effects to health.Neelam Tailor traces the surprising journey of ultra-processed foods from their origins in industrial waste to today's complex ingredient lists and the regulatory loopholes that paved the way Continue reading...","Mon, 09 Dec 2024 14:21:36 GMT",-0.2023,-0.7096
The Guardian,How the Brian Thompson shooting unfolded – video timeline,"On 4 December, Brian Thompson, the 50-year-old chief executive of UnitedHealthcare, was shot and killed in New York near the midtown Manhattan branch of the Hilton hotel. The search for his killer has entered its third day, with police revealing clues about the suspect's identity. However, many details surrounding the shocking shooting remain unclear. Here is a timeline compiled by The Guardian covering the incident and the suspect's escape routeBrian Thompson: search for shooter continues for third day as police reveal clues Continue reading...","Fri, 06 Dec 2024 21:29:36 GMT",0.0,-0.9153
The Guardian,Syrians around the world celebrate fall of Bashar al-Assad regime – video,"Syrians in cities across the world celebrated the fall of the Bashar al-Assad regime. People cheered, danced with flags and beeped car horns after the Syrian government was ousted in an end to the Assad family's 50-year ruleSyria live – latest updates Continue reading...","Sun, 08 Dec 2024 18:13:56 GMT",0.5719,0.7906
The Guardian,Syrian rebels seize the capital: How the night unfolded – video,"The Syrian president, Bashar al-Assad, is believed to have fled the country his family has ruled over for 50 years, after rebels said they had captured the capital after a lightning advance completed in just under two weeks. Footage from the capital, Damascus, showed rebels storming the presidential palace and destroying the Iranian embassy. State television soon declared the end of Assad's rule and celebrations erupted on the streets across Syria. In a matter of hours, queues formed at the Lebanese border with Syria as displaced families began to return to their homes Middle East crisis - live updatesBashar al-Assad reported to have fled Syria as rebels say they have captured Damascus Continue reading...","Sun, 08 Dec 2024 14:51:24 GMT",-0.2023,-0.9001
The Guardian,Sign up for the Fashion Statement newsletter: our free fashion email,"Style, with substance: what’s really trending this week, a roundup of the best fashion journalism and your wardrobe dilemmas solved, direct to your inbox every ThursdayStyle, with substance: what’s really trending this week, a roundup of the best fashion journalism and your wardrobe dilemmas solved, delivered straight to your inbox every ThursdayExplore all our newsletters: whether you love film, football, fashion or food, we’ve got something for you Continue reading...","Tue, 20 Sep 2022 11:06:20 GMT",0.5106,0.9565
The Guardian,Sign up for the Guardian Documentaries newsletter: our free short film email,"Be the first to see our latest thought-provoking films, bringing you bold and original storytelling from around the worldDiscover the stories behind our latest short films, learn more about our international film-makers, and join us for exclusive documentary events. We’ll also share a selection of our favourite films, from our archives and from further afield, for you to enjoy. Sign up below.Can’t wait for the next newsletter? Start exploring our archive now. Continue reading...","Fri, 02 Sep 2016 09:27:20 GMT",0.5106,0.9001
The Guardian,Guardian Traveller newsletter: Sign up for our free holidays email,"From biking adventures to city breaks, get inspiration for your next break – whether in the UK or further afield – with twice-weekly emails from the Guardian’s travel editors. You’ll also receive handpicked offers from Guardian Holidays. From biking adventures to city breaks, get inspiration for your next break – whether in the UK or further afield – with twice-weekly emails from the Guardian’s travel editors.You’ll also receive handpicked offers from Guardian Holidays. Continue reading...","Wed, 12 Oct 2022 14:21:58 GMT",0.7096,0.9217
The Guardian,Sign up for the Feast newsletter: our free Guardian food email,"A weekly email from Yotam Ottolenghi, Meera Sodha, Felicity Cloake and Rachel Roddy, featuring the latest recipes and seasonal eating ideasEach week we’ll send you an exclusive newsletter from our star food writers. We’ll also send you the latest recipes from Yotam Ottolenghi, Nigel Slater, Meera Sodha and all our star cooks, stand-out food features and seasonal eating inspiration, plus restaurant reviews from Grace Dent and Jay Rayner.Sign up below to start receiving the best of our culinary journalism in one mouth-watering weekly email. Continue reading...","Tue, 09 Jul 2019 08:19:21 GMT",0.5106,0.8979
The Guardian,"Swimmers, the Sphinx and an effigy on wheels: photos of the day – Thursday",The Guardian’s staff select photographs from around the world Continue reading...,"Thu, 12 Dec 2024 11:52:21 GMT",0.0,0.0
