broadcast,title,description,pub_date,title_sentiment_score,description_sentiment_score
Aljazeera,Chemical weapons watchdog urges probe in Syria after al-Assad toppled,Call by OPCW comes as Israel continues to strike Syria days after ouster of president by opposition forces.,"Thu, 12 Dec 2024 20:57:10 +0000",-0.4404,-0.128
Aljazeera,France’s Macron set to name new prime minister on Friday,French president&#039;s office says a new PM will be named Friday morning following Michel Barnier&#039;s resignation last week.,"Thu, 12 Dec 2024 20:56:06 +0000",0.0,-0.296
Aljazeera,Will Biden administration’s final push for a ceasefire in Gaza succeed?,Two top US diplomats travel to the Middle East to push negotiations to end Israel&#039;s war on Gaza.,"Thu, 12 Dec 2024 20:43:22 +0000",0.4939,-0.4767
Aljazeera,Hundreds march at Mazen al-Hamada’s funeral in Damascus," Hundreds of mourners marched at the funeral of Syrian activist Mazen al-Hamada, who was found dead this week.","Thu, 12 Dec 2024 20:41:44 +0000",-0.3612,-0.8625
Aljazeera,The Trump administration could reverse progress on AI regulation,"Trump&#039;s pick for the US FTC chair is expected to push back against regulating AI, undermining efforts so far.","Thu, 12 Dec 2024 20:37:47 +0000",0.4215,-0.3612
Aljazeera,‘Climate of terror’: New York’s migrants and asylum seekers brace for Trump,"More than 200,000 asylum seekers and migrants have arrived in the US city in the past two years. Many fear deportation.","Thu, 12 Dec 2024 20:16:28 +0000",0.0,-0.4939
Aljazeera,"Blinken meets with Jordanian leaders, focuses on Syria’s future",US Secretary of State Antony Blinken stressed the importance of a “unified approach” to Syria during meetings in Jordan.,"Thu, 12 Dec 2024 19:51:31 +0000",0.0,0.0258
Aljazeera,"Israeli attacks kill dozens across Gaza, including 15 guarding aid trucks",Attacks come after the UN General Assembly approves a resolution calling for a ceasefire in the besieged Gaza Strip. ,"Thu, 12 Dec 2024 19:06:42 +0000",-0.8225,-0.0516
Aljazeera,"Police, protesters scuffle near South Korean president’s home",Police and pro-impeachment protesters scuffled near the home of South Korean President Yoon Suk-yeol.,"Thu, 12 Dec 2024 18:43:02 +0000",-0.2263,-0.2263
Aljazeera,Brazil’s Lula recovering after ‘successful’ second surgery: Doctors,"Brazilian president is doing well and should be discharged early next week, his medical team says.","Thu, 12 Dec 2024 18:34:52 +0000",0.0,0.2732
Aljazeera,Israeli attack kills guards protecting Gaza aid convoy,At least 12 people were killed in two Israeli strikes that targeted guards protecting an aid convoy in southern Gaza.,"Thu, 12 Dec 2024 17:00:35 +0000",-0.765,-0.7906
Aljazeera,American man found near Damascus after seven months in Syrian prison,"Travis Timmerman, an American from Missouri, says he was held for seven months in Syria’s infamous Sednaya prison ","Thu, 12 Dec 2024 16:37:59 +0000",-0.5106,-0.5106
Aljazeera,Blinken says Washington working to bring home US citizen found in Syria,Travis Timmerman says he was detained after crossing into Syria on a Christian pilgrimage earlier this year.,"Thu, 12 Dec 2024 16:27:26 +0000",0.0,-0.4019
Aljazeera,"At least nine people die, six missing as boat sinks off Tunisia",Coastguard rescues 27 people on the boat when it broke down and took on water due to bad weather.,"Thu, 12 Dec 2024 16:03:35 +0000",-0.7269,-0.6124
Aljazeera,After Syria: Is there a chance for Iran-US rapprochement?,Political scientist Vali Nasr argues Iran-US relations can improve as Iran’s footprint across the Middle East shrinks.,"Thu, 12 Dec 2024 15:42:25 +0000",0.25,0.0772
Aljazeera,TIME Magazine names Donald Trump ‘Person of the Year’,"Magazine says we are &#039;living in the Age of Trump&#039; as US president-elect makes mass deportation, foreign policy plans. ","Thu, 12 Dec 2024 15:04:55 +0000",0.0,0.0
Aljazeera,France and Germany in turmoil; how would that affect EU economy?,Paris and Berlin that make up almost half of the eurozone economy face political and economic woes.,"Thu, 12 Dec 2024 15:00:28 +0000",-0.3612,-0.4404
Aljazeera,Syria after Assad | Start Here,What’s next for Syria after the fall of President Bashar al-Assad? ,"Thu, 12 Dec 2024 14:31:20 +0000",0.0,0.0
Aljazeera,India’s Gukesh beats China’s Ding to become youngest chess world champion,Indian teen prodigy Gukesh Dommaraju prevailed in a thrilling endgame that had been expected to end in a draw.,"Thu, 12 Dec 2024 14:15:52 +0000",0.5994,0.4767
The Guardian,Sara Sharif’s father given custody despite years of reported abuse of mother and siblings,"Trial of Urfan Sharif revealed children’s services, Surrey police and primary school were aware of concerns about the family for 16 yearsThe father of Sara Sharif was awarded custody of the schoolgirl despite being accused of abusing her siblings and mother for years, it has emerged.
 The trial of Urfan Sharif, 43, revealed how Surrey county council children’s services, Surrey police and Sara’s primary school were aware of concerns about the family for 16 years.During the period of abuse and torture leading up to her death, Sharif twice said he would homeschool his daughter, and on Thursday ministers pledged stronger safeguards for children being taken into home education. Continue reading...","Thu, 12 Dec 2024 13:17:48 GMT",-0.6369,-0.8132
The Guardian,'I will not touch bread if it is moist': Kemi Badenoch sparks Westminster food fight,"Starmer says he prefers a toastie over steak after Badenoch claims ‘lunch is for wimps’ and sandwiches are not ‘a real food’In a row likely to generate more debate than many of their exchanges over the dispatch box, the prime minister has hailed the humble sandwich as “a great British institution” after Kemi Badenoch denounced the lunchtime staple as “not real food”.In an interview with the Spectator, the leader of the opposition channelled her inner Gordon Gekko to declare: “Lunch is for wimps. I have food brought in and I work and eat at the same time. There’s no time…Sometimes I will get a steak,” she said. Continue reading...","Thu, 12 Dec 2024 14:54:20 GMT",-0.3818,0.4215
The Guardian,Pete Hegseth decried out gay troops in US military as part of Marxist agenda,"Trump’s embattled secretary of defence nominee expresses contentious views on gay service members in latest bookPolicies allowing out gay people to serve in the US military have been denounced as part of a “Marxist” agenda aimed at prioritising social justice above combat-readiness by Pete Hegseth, Donald Trump’s embattled defence secretary pick.The assertion was among many contentious “anti-woke” views expressed in Hegseth’s latest book, The War on Warriors, published this year, in which he lambasted a previous policy – known as don’t ask, don’t tell (DADT) – that tolerated gay service members as long as they did not disclose their sexual orientation, while also excoriating its repeal. Continue reading...","Thu, 12 Dec 2024 19:48:07 GMT",0.0,-0.4767
The Guardian,"Suspect in UnitedHealthcare CEO killing may not have been a client, say police","Shooter, who mentioned company in note found during arrest, may have targeted it because of its size and influenceThere is no indication the man charged with killing the UnitedHealthcare CEO, Brian Thompson, was ever a client of the medical insurer and may have targeted it because of its size and influence, a senior police official said on Thursday.Joseph Kenny, chief of detectives for the New York police department, told NBC New York in an interview on Thursday that investigators had uncovered evidence that Luigi Mangione had prior knowledge UnitedHealthcare was holding its annual investor conference in New York City. Continue reading...","Fri, 13 Dec 2024 01:43:16 GMT",-0.765,-0.8689
The Guardian,Ukraine war briefing: Nato warns that Putin wants to ‘wipe Ukraine off the map’,"Nato secretary general Mark Rutte says people should gird themselves for the prospect that Russia might try to use ‘swarms of drones’ in Europe. What we know on day 1,024Nato secretary general Mark Rutte has warned that Russian President Vladimir Putin wants to “wipe Ukraine off the map” and could come after other parts of Europe next. Rutte told the Carnegie Europe thinktank in Brussels it is “time to shift to a wartime mindset” and that people should gird themselves for the prospect that Russia might try to use “swarms of drones” in Europe as it has to deadly effect in Ukraine. The former Dutch prime minister was making his inaugural speech just over two months after he took office as Nato’s top civilian official.US President Joe Biden announced another package of weapons aid for Ukraine on Thursday, valued at $500m, secretary of state Antony Blinken said in a statement. White House spokesperson John Kirby said earlier the US would continue to provide additional packages for Ukraine “right up to the end of this administration.” Washington said 10 days ago it would send Ukraine $725m worth of missiles, ammunition, anti-personnel mines and other weapons. Biden’s outgoing administration is seeking to bolster Ukraine in tackling Russia’s invasion, before Biden’s term ends in January when president-elect Donald Trump takes office.In a wide-ranging interview with Time magazine, US president election Donald Trump offered his thoughts on global affairs, including the war in Ukraine. The president-elect has previously derided US aid to Kyiv. Pressed on whether he would abandon Ukraine in its efforts to stave off Russia’s invasion, Trump said he would use US support for Kyiv as leverage against Moscow in negotiating an end to the war. “I want to reach an agreement,” he said, “and the only way you’re going to reach an agreement is not to abandon.”Ukraine’s top military commander says fighting around a key eastern Ukraine city is “extremely intense” after a months-long Russian push. Analysts estimate Russian forces are now within just a few kilometres, or miles, of Pokrovsk. Ukraine’s general staff said on Thursday that Ukrainian troops had repelled nearly 40 Russian attempts to storm defences around Pokrovsk over the previous 24 hours. Ukraine’s stretched defences in Donetsk have been creaking since early this year under a fierce Russian drive. Pokrovsk is one of Ukraine’s main defensive strongholds and a key logistics hub in the Donetsk region.Ukrainian President Volodymyr Zelenskyy’s chief of staff said in an interview broadcast late on Thursday that Kyiv was not yet ready to start talks with Russia as it lacked the weapons, security guarantees and international status that it sought. Andriy Yermak’s comments to public broadcaster Suspilne come as Zelenskyy publicly considers the possibility of a negotiated settlement to the war with Russia, launched by Moscow’s full-scale invasion of its neighbour in February 2022. “Not just yet today,” Yermak told Suspilne, when asked whether Ukraine was ready to embark on talks. “We don’t have the weapons, we don’t have the status that we are talking about.”French President Emmanuel Macron and Poland’s prime minister, Donald Tusk, said Ukraine must have a pivotal role in any potential negotiations over Russia’s war in the country, after a meeting Thursday in Warsaw. Macron also insisted Europeans must be involved in security talks in “very close” coordination with the United States to ensure Europe’s interests are taken into account. The meeting comes after Macron held key talks with Trump and Zelenskyy on Saturday in Paris.Billions of Russian state funds frozen in the European Union should be used to aid Ukraine, the EU’s top diplomat has said. Kaja Kallas, the EU’s high representative for foreign affairs and security, told the Guardian and four other European newspapers that Ukraine had a legitimate claim to compensation and that Russian assets held in the EU were “a tool to pressure Russia”. “Better to have a small bird in your hand than a big bird on the roof,” she said. “So we have the small bird in our hand [the frozen assets] and this is the tool to also pressure Russia.” Her proposal comes amid growing questions over how to fund Ukraine in the medium term and pay its colossal reconstruction bill. Continue reading...","Fri, 13 Dec 2024 02:21:14 GMT",-0.6486,-0.1536
The Guardian,Tory peer faces suspension over ‘Lord Poppadom’ remark,"Lady Meyer found to have breached harassment rules with behaviour towards Lord Dholakia that had ‘racial element’A Conservative peer is facing suspension from the House of Lords for calling a British-Asian peer “Lord Poppadom” and touching an MP’s braids without permission.Catherine Meyer was accused of referring to Navnit Dholakia, a Liberal Democrat peer, as “Lord Poppadom” twice while in a taxi during a visit to Rwanda with a parliamentary committee this year. Continue reading...","Thu, 12 Dec 2024 17:05:21 GMT",0.0,-0.6908
The Guardian,"Guardian and Observer charity appeal raises more than £250,000","Readers reach donation milestone before Saturday telethon, securing money to help families in Gaza and Ukraine• Donate to our charity appeal hereMore than £250,000 for charities supporting families hit by war and violence in Gaza, Ukraine and elsewhere has been raised by Guardian and Observer readers less than a week after the appeal launched.The milestone was achieved before the annual fundraising telethon on Saturday 14 December. Journalists who will be on hand to take donations over the phone include Polly Toynbee, John Crace, Marina Hyde and Zoe Williams. Continue reading...","Fri, 13 Dec 2024 00:01:31 GMT",0.4215,0.802
The Guardian,"Birmingham fairground ride crashes to the ground, injuring several people","Two people have been taken to hospital after a fairground ride ‘failed and crashed’Two people have been taken to hospital after a fairground ride “failed and crashed” in Birmingham, the West Midlands fire service said.Officers and paramedics attended the scene at Centenary Square, Birmingham, at 7.30pm on Thursday after the ride dropped to ground level “whilst in operation”, according to the fire service. Continue reading...","Thu, 12 Dec 2024 22:21:02 GMT",0.0,-0.5859
The Guardian,"Comedian Duncan Norvelle, famed for ‘chase me’ catchphrase, dies aged 66","The comic, who was a staple of 80s British TV, was described by his partner as ‘the last of the legends of true variety comedy’The comedian Duncan Norvelle, whose catchphrase “chase me” made him a staple of British Saturday night TV in the 1980s, has died aged 66. He had suffered from a chest infection and sepsis.His partner Lynn Trevallion said: “His type of comedy doesn’t happen anymore, he’s probably last of the legends of true variety comedy, so many have passed now. Continue reading...","Thu, 12 Dec 2024 21:48:24 GMT",0.3818,0.6597
The Guardian,Gukesh Dommaraju becomes youngest world chess champion after horrific Ding Liren blunder,"Indian teenager becomes 18th world chess championModi hails ‘historic and exemplary’ achievementMove-by-move report of Game 14 – as it happenedPlay through 22 famous world championship gamesIndian teenager Gukesh Dommaraju capped a stunning ascent to the pinnacle of chess by dethroning China’s Ding Liren to become the youngest ever world champion on Thursday in Singapore.The 18-year-old from Chennai dramatically snatched the decisive victory from a dead-drawn position in the final contest of their best-of-14-games showdown when Ding made one of the worst blunders in the 138-year history of world championship matchplay. The 32-year-old defending champion resigned moments later after a game that lasted 58 moves and just over four hours, sealing Gukesh’s 7½-6½ win in the three-week match and rendering moot the widely expected prospect of tiebreaker matches on Friday afternoon. Continue reading...","Thu, 12 Dec 2024 13:56:59 GMT",-0.128,0.9517
The Guardian,‘Unprecedented risk’ to life on Earth: Scientists call for halt on ‘mirror life’ microbe research,"Experts warn that mirror bacteria, constructed from mirror images of molecules found in nature, could put humans, animals and plants at risk of lethal infectionsWorld-leading scientists have called for a halt on research to create “mirror life” microbes amid concerns that the synthetic organisms would present an “unprecedented risk” to life on Earth.The international group of Nobel laureates and other experts warn that mirror bacteria, constructed from mirror images of molecules found in nature, could become established in the environment and slip past the immune defences of natural organisms, putting humans, animals and plants at risk of lethal infections. Continue reading...","Thu, 12 Dec 2024 19:00:25 GMT",0.0,0.1531
The Guardian,‘We won’t stop until we find them all’: joy gives way to grief as Syria buries its dead,"As thousands took to the streets of Damascus for the funeral of Mazen al-Hamadah, a victim of Assad’s brutal regime, the search for Syria’s disappeared continuesThe streets of Damascus have been filled with celebrations since Bashar al-Assad fled to Russia last Sunday in the face of an unexpected rebel offensive, ending more than 50 years of his family’s brutal rule over Syria. But at a public funeral for Mazen al-Hamadah – before his disappearance in 2020 one of the most vocal survivors of torture in the regime’s prisons system – the joy gave way to sorrow, as the country begins to grapple with the fact that many of the estimated 130,000 people missing may be lost forever.Thousands of people flooded the streets on Thursday, following Hamadah’s body, wrapped in a traditional white shroud, as it was driven slowly from a hospital to the Abdulrahman Abu al Ouf mosque for funeral prayers. At a vigil afterwards in nearby al-Hijaz square, thousands of men, women and children cried and hugged each other, many carrying pictures of their own disappeared loved ones. Continue reading...","Thu, 12 Dec 2024 18:16:22 GMT",-0.7096,-0.9682
The Guardian,From red meat to alcohol: the factors that affect bowel cancer risk,"As a study reveals that England has fourth-fastest growth rate globally, we outline some of the issues that increase riskRates of bowel cancer in young people are rising more sharply in England than in many other countries around the world, a study has found. Experts are still in the early stages of understanding the reasons behind the rise but here we look at some of the factors that could be contributing. Continue reading...","Thu, 12 Dec 2024 12:37:05 GMT",-0.7579,-0.0644
The Guardian,Penny Lancaster: I was a victim of Gregg Wallace’s bullying and harassment,"Loose Women actor says MasterChef host used position of power to intimidate and cause distress to people on setPenny Lancaster has alleged that she witnessed and was a victim of bullying and harassment by the MasterChef presenter Gregg Wallace.The model and Loose Women actor said she did not know that her husband, Sir Rod Stewart, was going to make accusations about Wallace’s behaviour until she saw a post on Instagram. Continue reading...","Thu, 12 Dec 2024 15:08:07 GMT",-0.8591,-0.9538
The Guardian,"My long-distance partner is moving in with me, but I have trepidation. How can I be at peace with it? | Leading questions","‘Going off’ someone isn’t the same as realising they’re taking more than you want to give, writes advice columnist Eleanor Gordon-SmithRead more Leading questionsMy long-distance partner of nearly 10 years is moving in with me in the next few months. For most of this time it is what I thought I wanted, but the closer it gets, the more trepidation I have. I used to put up with behaviours from people that I didn’t really like, but kept relationships going for fear of what would happen if I ended them. I’m not that person any more.I left my husband of 25 years a decade ago and have dropped many friends who I feel no longer give me what I need, who I was “people pleasing” – doing what they wanted to my detriment. I love my partner very much. He is a good, kind, caring man who adores me. But I’m so scared that suddenly I’ll “go off” him like I have other people and that I’ll be stuck living with someone I don’t want to be around. I know I sound dismissive of people. But I have cultivated my own space, my own understanding of my needs and wants. I eventually went off my husband. I don’t want to go off my partner too. How can I be at peace and not be scared of him moving in? It would be positive in so many ways. Continue reading...","Thu, 12 Dec 2024 23:00:29 GMT",0.6956,0.9885
The Guardian,"Fainting, fighting and folk-horror: Florence Pugh’s best films – ranked!","Ahead of the release of We Live in Time next month, we celebrate the filmography of a breakout British star, from Little Women to Lady MacbethThe only reason this fabulous DreamWorks animation is not nearer the top of this list is that Pugh is not the star - that’s Antonio Banderas as Puss. But her Goldilocks, head of the Three Bears crime family, is surely channelling none other than the great Billie Whitelaw in The Krays. Continue reading...","Thu, 12 Dec 2024 13:00:18 GMT",0.4574,0.852
The Guardian,Knitting with dog hair was a craze in the 90s – let’s make it happen again,"Clothes made from a canine you know are much more special than clothes from an anonymous sheepSeveral decades ago, the idea arose of writing a book to examine the ways in which dog hair could be used by knitters. Most people thought the concept was a few puppies short of a litter, if not downright crazy. The exceptions were experienced spinners (for whom dog hair was merely another nifty fiber to experiment with) and people of exceptional vision and imagination (nearly all of whom owned beloved dogs who shed exasperating quantities of fuzz).The project began when I was spinning fluff from Ollie, a Great Pyrenees belonging to my friends Barbara Binswanger and Jim Charlton. Like many spinners, I already knew that dog fuzz could be spun – many books devoted to the craft of spinning carried a paltry brief paragraph on it, but the information was often sketchy and seemed like an afterthought, a footnote to more substantial sections on alpaca, vicuña and other exotic fibers. After collecting Ollie fuzz over time at each dinner date with Barb and Jim, I spent a weekend spinning, which yielded enough yarn to make nothing less than a sweater for Barb and a vest for Jim. Continue reading...","Thu, 12 Dec 2024 17:00:23 GMT",-0.1531,0.9535
The Guardian,Cottage cheese mixed with ice cream or with pancakes: In reluctant praise of a viral food trend,"In this week’s Feast newsletter: The next big recipe on Instagram and FoodTok can be a great way for the uninitiated to find new favourite flavoursSign up here for our weekly food newsletter, FeastI was asked recently which food trends I think will take over in 2025. Personally, I don’t get caught up in trends. Or maybe it’s that I’m a bit sceptical of them: if something is good – really good – then it’s timeless. Sure, we all get excited about the next big thing, but I don’t believe something’s value should be determined by how much attention it gets on Instagram or TikTok.But food trends can bring certain ingredients into the spotlight. I can’t help but find it intriguing when something suddenly has its moment, much as harissa did 10 or so years ago. Harissa has been a kitchen staple for a very long time for me, a familiar ingredient with depth and history, but I can see why it would be an exciting discovery for others. Continue reading...","Thu, 12 Dec 2024 13:00:17 GMT",0.3818,0.9721
The Guardian,‘A rapist can be in the family’: how Dominique Pelicot became one of the worst sexual predators in history,"Gisèle Pelicot had no idea her husband of 50 years had been drugging her and inviting dozens of men to rape her. As one of the most horrific trials France has ever seen comes to a close, the world is left asking: how could this happen?Warning: this article contains descriptions of alleged rape and sexual assaultDominique Pelicot called himself a family man. He liked cycling in the French countryside on a Sunday, he took his son and grandson to football matches, and he was good at celebrating birthdays. Continue reading...","Wed, 11 Dec 2024 23:59:03 GMT",-0.875,-0.7645
The Guardian,Gorge-ous: the world’s grandest canyons – in pictures,"As the governor of Oregon, Tina Kotek, petitions to have the state’s Owyhee Canyonlands made a protected natural monument, we take a look at canyons from across the globe Continue reading...","Thu, 12 Dec 2024 10:00:14 GMT",0.5267,0.6597
The Guardian,‘Can we show someone being shot?’: the tense true story behind September 5,"The Oscar-tipped drama follows the ABC crew of journalists who had to cover the unfolding violence as terrorism overtook the the Munich Olympics in 1972Geoffrey Mason had begun the day expecting to oversee TV coverage of sports such as boxing, swimming and volleyball. Hours later, he found himself staring at German machine guns and being ordered to turn the cameras off.The story of how Mason’s control room responded to the hostage siege at the 1972 Olympic games in Munich is told in September 5, a thriller starring John Magaro and Peter Sarsgaard and directed by Tim Fehlbaum. The film follows the ABC Sports team as they turn their cameras on the news – the first time a terrorist attack would be broadcast live to a global audience. Continue reading...","Thu, 12 Dec 2024 09:21:13 GMT",0.1027,-0.9524
