broadcast,title,description,pub_date,title_sentiment_score,description_sentiment_score
Aljazeera,Alcaraz beats Cilic in straight sets to advance at Qatar Open,Spain&#039;s Carlo Alcaraz beats Croatia&#039;s Marin Cilic to progress to the last 16 of the Qatar Open.,"Mon, 17 Feb 2025 21:28:12 +0000",0.2263,0.4215
Aljazeera,DRC rebels promise security after seizing Bukavu in country’s east,M23 rebels pledge to restore security in Bukavu as an escalation in fighting fans fears of an all-out regional war.,"Mon, 17 Feb 2025 20:42:35 +0000",0.4404,-0.7506
Aljazeera,Inside the El Salvador prison where the US could send its own citizens,El Salvador’s president offered to hold US citizen convicts in his “Terrorism Confinement Center.&quot;,"Mon, 17 Feb 2025 20:39:49 +0000",-0.5106,0.0
Aljazeera,Video: Tight security ahead of Pakistan’s first ICC tournament in decades,Pakistan has put security measures in place as it prepares to host the International Cricket Council’s Champions Trophy.,"Mon, 17 Feb 2025 20:13:21 +0000",0.34,0.7003
Aljazeera,Trump fires hundreds of federal aviation workers weeks after deadly crash,Personnel from DOGE are set to visit FAA headquarters on Monday as union says US workforce is &#039;already stretched thin&#039;. ,"Mon, 17 Feb 2025 18:46:12 +0000",-0.4019,0.0
Aljazeera,M23 rebels tighten their grip on major city in eastern DRC,"Rwandan-backed M23 rebels patrol major intersections in Bukavu, the capital of South Kivu province.","Mon, 17 Feb 2025 18:31:09 +0000",-0.2023,-0.2023
Aljazeera,What is holding up the implementation of the Teesta River Project?,Protests are taking place in Bangladesh over a water-sharing dispute with India.,"Mon, 17 Feb 2025 18:14:23 +0000",0.0,-0.5574
Aljazeera,Netanyahu says Israel committed to Trump’s ‘take over’ Gaza plan,Israeli PM hails US push to build ‘different Gaza’ as defence minister unveils plan for &#039;departure&#039; of Palestinians.,"Mon, 17 Feb 2025 17:31:07 +0000",0.2732,0.1027
Aljazeera,‘We will last six months’ if Trump pulls US military aid from Ukraine,Trump’s recent statements and planned meeting with Putin raise fresh uncertainty about Washington&#039;s support.,"Mon, 17 Feb 2025 17:02:55 +0000",0.0,0.3818
Aljazeera,Video: Senior Hamas official killed in Israeli strike in Lebanon’s Sidon,An Israeli strike targeted and killed a person in a vehicle in Lebanon&#039;s Sidon. ,"Mon, 17 Feb 2025 16:53:15 +0000",-0.7184,-0.7184
Aljazeera,Which countries are the top military spenders and where does Europe rank?,"The US, the world&#039;s largest military spender, allocates $880bn to defence – more than the next eight countries combined.","Mon, 17 Feb 2025 16:03:24 +0000",0.2023,0.1027
Aljazeera,"US, Russia confirm high-level Ukraine talks without Kyiv",Ukraine’s president says he “knew nothing about” high-level talks between the US and Russia to end Moscow’s war.,"Mon, 17 Feb 2025 15:40:01 +0000",0.0,-0.5994
Aljazeera,"Pope’s hospitalisation extended to treat ‘complex’ condition, Vatican says",It remains unclear how long Pope Francis will remain in hospital as he seeks treatment for respiratory tract infection.,"Mon, 17 Feb 2025 15:22:15 +0000",0.4019,-0.25
Aljazeera,ICC Champions Trophy 2025: Pakistan’s ‘punishment’ ends as cricket is back,"Inzamam-ul-Haq, Misbah-ul-Haq and Aamer Sohail say Pakistan is abuzz with the return of an international cricket event.","Mon, 17 Feb 2025 15:16:46 +0000",0.5267,0.0
Aljazeera,Unchilding Palestine’s children,"Israeli and Western portrayal of Palestinian children as adults aims to cover up their murder, maiming and imprisonment.","Mon, 17 Feb 2025 15:12:55 +0000",0.0,-0.6908
Aljazeera,Israel says troops will stay in five locations across southern Lebanon,Israeli army&#039;s announcement comes after Lebanese leader raises concern Tuesday&#039;s withdrawal deadline will not be met.,"Mon, 17 Feb 2025 13:29:46 +0000",0.0,0.0258
Aljazeera,Prominent gay imam shot dead in South Africa,"The killing of Muhsin Hendricks, a prominent openly-gay imam, in South Africa has shocked the LGBTQ community. ","Mon, 17 Feb 2025 13:09:51 +0000",-0.4588,-0.6597
Aljazeera,ICC Champions Trophy 2025: Afghanistan lose warm-up match to New Zealand,New Zealand defeat Afghanistan by two wickets in Karachi ahead of their Champions Trophy opener against hosts Pakistan.,"Mon, 17 Feb 2025 13:07:58 +0000",0.1779,0.1027
The Guardian,"US ‘backstop’ vital to deter future Russian attacks on Ukraine, says Starmer","British prime minister says force would need protections such as air cover that only US can provide Keir Starmer has urged Donald Trump to provide a US “backstop” to a European peacekeeping force in Ukraine, saying it is the only way to deter Russia from attacking the country again.The UK prime minister’s appeal to Trump came after an emergency summit in Paris that heard widespread calls by European leaders for a large boost in defence spending. Continue reading...","Mon, 17 Feb 2025 22:09:11 GMT",-0.1779,0.128
The Guardian,At least 18 injured after plane crashes and flips on landing in Toronto,"Two people in critical condition airlifted to nearby trauma centre and one child taken by ambulance to hospitalA plane carrying 80 people crash landed at Toronto Pearson airport yesterday, flipping upside down and leaving at least 18 people injured.Video from the scene showed a Delta Air Lines plane belly-up on snow-covered tarmac and people walking away. Continue reading...","Mon, 17 Feb 2025 22:33:34 GMT",-0.4019,-0.7783
The Guardian,Woman shot dead at Kent pub on Valentine’s Day named,"Police continue to search River Thames for suspect over Friday’s fatal shooting of Lisa Smith, 43, from SloughA woman shot dead at a Kent pub on Valentine’s Day has been named as Lisa Smith.The 43-year-old from Slough was killed in Knockholt near The Three Horseshoes pub shortly after 7pm on Friday, Kent police said. She died at the scene after being shot. Continue reading...","Mon, 17 Feb 2025 13:29:12 GMT",-0.6486,-0.959
The Guardian,"Prison system crisis due to overreliance on long sentences, says Gauke review","Successive governments’ ‘penal populism’ has driven England and Wales justice system to brink of collapse, report findsSuccessive governments’ overreliance on prison sentences and desire to seem “tough on crime” have driven the justice system in England and Wales to the brink of collapse, an official review has found.A form of “penal populism” where longer incarceration is seen as the only effective means of punishment has contributed to the crisis in the prison system, according to the interim findings of a review led by former justice secretary David Gauke. Continue reading...","Tue, 18 Feb 2025 00:01:50 GMT",-0.802,-0.6249
The Guardian,E-scooters blamed for big jump in children caught in UK driving without insurance,"Hundreds of teenagers have been given an IN10 police endorsement since 2020, says road safety charityElectric scooters have been blamed for a surge in the number of children being penalised for driving without insurance.Since the start of 2020 almost 800 children aged between 13 and 16 have been given an IN10 endorsement – the code used by the police for “using a vehicle uninsured against third party risks” – according to data obtained by a road safety charity. Continue reading...","Tue, 18 Feb 2025 00:01:51 GMT",-0.4767,0.8442
The Guardian,"Support for ESG proposals at record low driven by US investors, report shows","Report highlights ‘worrying retreat’ in support for shareholder resolutions on environmental and social risksSupport for shareholder proposals aimed at tackling environmental and social risks hit a record low last year, figures show, amid a “worrying retreat” by investors, particularly in the US.A report compiled by the responsible investment campaign group ShareAction found that, out of 279 environmental, social and governance (ESG) shareholder resolutions put forward at annual general meetings last year in the UK, Europe and the US, only four – or 1.4% – secured majority support. Continue reading...","Tue, 18 Feb 2025 00:01:51 GMT",0.1531,0.5423
The Guardian,Chiltern Firehouse luxury hotel blaze caused by falling wood from pizza oven,"Fire broke out on Valentine’s Day, partially destroying London venue that had been due to host Bafta party A fire that tore through a luxury London hotel popular with celebrities was caused by wood falling from a pizza oven.The Chiltern Firehouse, which had been due to host a post-Bafta film awards party on Sunday evening, was partially destroyed by the fire on Friday  Continue reading...","Mon, 17 Feb 2025 22:20:04 GMT",-0.1531,-0.5859
The Guardian,Netanyahu seeks to draw Trump into future attack on Iranian nuclear sites,"Israeli PM urges US to help ‘finish the job’ as Washington makes early maximalist demand over Tehran’s programmeBenjamin Netanyahu has vowed that, with Donald Trump’s support, his government will “finish the job” of neutralising the threat from Iran, amid US reports that Israel is considering airstrikes against Iranian nuclear sites in the coming few months.Trump has said he would prefer to make a deal with Tehran, but also made clear that he was considering US military action if talks failed, and his administration has laid down an early maximalist demand: Iranian abandonment of its entire nuclear programme. Continue reading...","Mon, 17 Feb 2025 19:34:57 GMT",-0.4767,-0.7992
The Guardian,UCL student accused of rape tells court he liked pornography featuring sleeping women,"Jury hears Zhenhao Zou took drugs and watched ‘time stop’ pornographic scenes  An engineering student accused of drugging and raping women has said he took drugs and viewed pornography, with his favourite scenes involving sleeping women.Zhenhao Zou, 27, is accused of raping 10 women and filming his attacks. He denies all the charges. Continue reading...","Mon, 17 Feb 2025 18:58:40 GMT",-0.6249,-0.9623
The Guardian,A ‘great shock’: Julianne Moore’s children’s book under review by Trump administration,The actor’s book Freckleface Strawberry is on a list of library books suspended for a ‘compliance review’ after a presidential executive orderJulianne Moore has said it is a “great shock” to learn that one of her books had been “banned by the Trump Administration” from schools serving the children of US military personnel and civilian defence employees.The Boogie Nights and Mary &amp; George star wrote that she was “truly saddened” by the news in an Instagram post on Sunday. Continue reading...,"Mon, 17 Feb 2025 14:15:45 GMT",0.0,-0.4019
The Guardian,Europe tries to shore up fragile unity as it realises it cannot rely on US,"Leaders attend Paris summit for urgent talks on Ukraine after week that showed how far values have divergedEurope live – latest updatesThey came smiling, but the task was immense. After dozens of summits at which a hesitant and discordant EU had failed to agree on anything like a cohesive plan for the end of the war in Ukraine, this one had, suddenly and vitally, to be different.The leaders of France, Germany, Poland, Italy, Spain and – speaking for the Nordic and Baltic states – Denmark, plus Britain’s prime minister and the heads of Nato and the European Commission and Council, arrived in Paris reeling from a historic week. Continue reading...","Mon, 17 Feb 2025 18:13:15 GMT",0.0,-0.2263
The Guardian,What might a European military force in Ukraine look like?,"How could European countries provide security guarantees in the event that a peace deal with Russia is reachedEurope live – latest updatesEuropean leaders have been asked by the US to provide security guarantees, including a military force, for Ukraine in the event that Donald Trump is able to strike a peace or ceasefire agreement with his Russian counterpart, Vladimir Putin.Though an end to the near three-year war in Ukraine had been considered some way off, Trump’s announcement last Wednesday that he was willing to talk to Russia – has led to a scramble across Europe to work out how to respond. Continue reading...","Mon, 17 Feb 2025 16:11:20 GMT",0.3612,0.8625
The Guardian,Ukraine war briefing: Zelenskyy rejects ‘quick win’ ceasefire sought by US,"‘We will not sign just anything in order to be applauded,’ Ukrainian president insists; European leaders pressed on sending troops to enforce peace. What we know on day 1,091  The US is trying to “please” Vladimir Putin as it aims for a “quick win” by rushing towards a ceasefire in the Russia-Ukraine war, Volodymyr Zelenskyy said in an interview broadcast on Monday. “The US is now saying things that are very favourable to Putin … because they want to please him. They want to meet quickly and have a quick win. But what they want – just a ceasefire – is not a win,” said Ukraine’s president, according to a translation provided by broadcaster ARD. “We [Ukraine] will not sign just anything in order to be applauded … the fate of our state for generations to come [is at stake].”Zelenskyy warned that Europe was in a weak position if it could not rely on US security assistance. While “readiness has increased” in recent years, “in terms of troop strength, the number of combat troops, the fleet, the air force, the drones … I honestly think that Europe is weak today”, he said. Zelenskyy said Ukraine had grown more resilient over the past three years and that “Putin wouldn’t be able to occupy us the way he wanted to”. Even so, he warned that “there will definitely not be a Ukrainian victory without US support”.Zelenskyy said he and Trump had spoken about deploying foreign troops to police a future ceasefire. “I told him the Americans should be a part of this, because otherwise we might lose our unity.” At a meeting of Kyiv’s backers in Brussels last week, Pete Hegseth, the US defence secretary, flatly rejected the possibility of a US troop deployment to Ukraine.Zelenskyy has hardened his language since the US announced one-on-one talks with Russia, excluding Ukraine and Europe. On Monday he said that Kyiv “did not know anything about” the talks in Saudi Arabia this week and “cannot recognise any things or any agreements about us without us. And we will not recognise such agreements”.Speaking after emergency talks between European leaders in Paris, the Danish prime minister, Mette Frederiksen, also warned the US against attempts to agree a “fast” ceasefire, which would give Russia the chance “to mobilise again, attack Ukraine or another country in Europe”. Russia was “threatening all Europe now”, she said. The war was about Russia’s “imperial dreams, about building a stronger and a bigger Russia, and I don’t think they’re going to stop in Ukraine”.After Keir Starmer, Britain’s prime minister, said he would consider putting troops in Ukraine to enforce a peace deal, the prime ministers of Sweden and the Netherlands indicated they would consider it if the peacekeeping force had a strong and clear mandate. The Polish prime minister, Donald Tusk, said Poland did not plan to do so. The German chancellor, Olaf Scholz, said: “We in Germany are prepared to contribute soldiers to a security guarantee for Ukraine if necessary.” However, he was “irritated”, adding: “It is completely premature and completely the wrong time to have this discussion now ... I want to say that quite frankly, people are talking over Ukraine’s head, about the outcome of peace talks that have not taken place and to which Ukraine has not said yes.”Keith Kellogg, officially Donald Trump’s Ukraine envoy, on Monday denied that Washington would impose a peace deal “on an elected leader of a sovereign nation”, meaning Zelenskyy. Kellogg, however, does not appear to be involved in the Russia-US talks taking place in Saudi Arabia this week. Asked if the US would put a security guarantee behind other countries sending troops to enforce a ceasefire, Kellogg said: “I’ve been with President Trump, and the policy has always been: you take no options off the table. Before any type of discussion and security guarantees is finalised, of course those discussions are going to take place. Answers to those questions will be determined as you come up with the final process.” Continue reading...","Tue, 18 Feb 2025 01:44:09 GMT",-0.7964,0.9823
The Guardian,Gaza: How to Survive a Warzone review – these incredible children offer a sliver of hope,"This often-distressing BBC documentary follows astonishing kids working as TikTok chefs and hospital porters – and shows their determination to smile in the face of unimaginable horrorThe children of Gaza will be its future, if they are able to remain there. Starting several months into Israel’s bombardment and continuing right up until the recent ceasefire, London-based directors Jamie Roberts and Yousef Hammash made their documentary Gaza: How to Survive a Warzone by remotely instructing two local cameramen, Amjad Al Fayoumi and Ibrahim Abu Ishaiba, as they captured life inside the “safe zone” – an ever-changing, ever-dwindling area in the south-west of Gaza, designated by Israel as the place where displaced Palestinians should reside. That the cameras predominantly follow children has an unexpected double effect: it makes the film’s many deeply distressing moments all the more unbearable, yet it tinges them with some sort of hope.The kids are led by 13-year-old Abdullah, who acts as narrator as well as appearing on camera. “This area used to be colourful,” he says, briskly touring a scene of apocalyptic destruction in Khan Younis, where he lived in a house that sheltered 40 people before Israeli bombs turned it to dusty rubble. “Now, it’s grey.” Continue reading...","Mon, 17 Feb 2025 22:00:48 GMT",0.4404,-0.6997
The Guardian,‘Allo ‘Allo! Europe’s leaders get together dans Paris for emergency sommet | John Crace,"Emmanuel Macron, Kier Starmer and others discuss Trump, Russia and Ukraine at hastily arranged conferenceEmmanuel Macron: Bienvenu á Paris.Keir Starmer: Bonjour, Monsieur le President. Thank you for organising this “once-in-a-generation” summit at such short notice. Continue reading...","Mon, 17 Feb 2025 19:00:26 GMT",-0.4389,0.3612
The Guardian,What Marielle Knows review – teenager’s telepathic powers reveal parents’ secrets and lies,"In this fantasy-satire of bourgeois family life, a girl is suddenly able to see everything her messed-up parents are up toHere is a high-concept satire of bourgeois family life with all its secrets and lies from German film-maker Frédéric Hambalek; it is something to remind you of the notorious Babel fish in Douglas Adams’s The Hitchhiker’s Guide to the Galaxy, which you can put in your ear and then comprehend what any creature in the universe is saying — a miraculous promotion of pure understanding which has been the cause of more and bloodier wars than anything else.Marielle (Laeni Geiseler) is a moody and withdrawn teenager with messed-up parents. Her mum is Julia (Julia Jentsch, who 20 years ago memorably played anti-Nazi martyr Sophie Scholl) and dad is Tobias (Felix Kramer). Julia is on the verge of a furtive affair with work colleague Max (Mehmet Ateşçi) while Tobias is being turned into a beta-male joke at his publishing company – his cover design choice for a new novel is scorned by his underlings, and he’s particularly undermined by a supercilious smoothie called Sören (Moritz Treuenfels). Continue reading...","Mon, 17 Feb 2025 18:00:43 GMT",-0.4215,-0.8384
The Guardian,UK savers urged to ‘act now’ and shake off their Isa apathy,"With the savings ‘season’ starting early, there are many advantageous deals out there. But for how long?The annual push to get savers to use up their tax-free allowance has begun early – but there is speculation that the cash Isa could be under threat.The chancellor, Rachel Reeves, has reportedly been lobbied to ditch the tax breaks on the popular accounts, just as people are piling in their money to take advantage of them. Continue reading...","Mon, 17 Feb 2025 10:30:33 GMT",-0.4404,0.7876
The Guardian,Life classes: is it time to draw a line under nude modelling?,A row over an art class raises potentially difficult questions about the traditional method of learning to drawName: Life drawing.Age: Ancient. Continue reading...,"Mon, 17 Feb 2025 16:40:30 GMT",0.0,-0.3612
The Guardian,‘Clambering about in Victorian boots was brutal’: how we made Picnic at Hanging Rock,"‘A potential US distributor,’ recalls director Peter Weir, ‘supposedly threw his coffee cup at the screen at the end of the film, saying, “So whodunnit?” He felt he’d wasted a couple of hours’One morning in early 1973, the TV personality Patricia Lovell knocked on my door. She was thinking of buying the rights for a novel by Joan Lindsay, Picnic at Hanging Rock, a story about the mysterious disappearance of three schoolgirls at an ancient rock formation and she was looking for an up-and-coming director. I had been gripped by the book and was very keen to make it. Continue reading...","Mon, 17 Feb 2025 15:01:52 GMT",0.0,0.2247
The Guardian,‘Serge Gainsbourg pretended to be an alcoholic’: Jean-Claude Vannier on making a masterpiece with the louche legend,"He has influenced everyone from Beck to De La Soul to Arctic Monkeys. As the great musical ‘disruptor’ unveils his new murder-and-mandolins epic, he looks back on his most famous collaborationAsk a set designer to create a bohemian Paris apartment and they’ll probably come up with something that looks a lot like Jean-Claude Vannier’s: books everywhere, vintage Bauhaus armchairs, art on every bit of wall space. You would say the living room was dominated by his grand piano, but your eye keeps getting drawn to a plethora of toy pianos that sit on and around it. On closer inspection, there are toy pianos on the shelves too, crammed among the books. “I’ve got more in the other rooms,” shrugs Vannier, speaking through an interpreter, “and I have a house in the country that’s full of them too. I take them to concerts and play a note or two. I find it adds something to a live performance that is filled with virtuosos. I have an open-tuned guitar that I kick, too – it makes a big boom.”Disrupting an orchestral performance by playing a toy piano or kicking a guitar seems characteristic: Vannier, now in his early 80s, has been a disruptive presence in French pop for 60 years. His latest project is pretty odd: a song cycle performed by a vast mandolin orchestra, accompanied by a story written by Vannier that involves a broken romance, alcoholism, homelessness and murder. Continue reading...","Mon, 17 Feb 2025 17:17:00 GMT",0.6249,0.9325
The Guardian,Intercepted review – phone taps are a chilling glimpse into Russian soldiers’ minds in Ukraine,"Recordings of fighters’ wiretapped phone calls are juxtaposed with images of wartime destruction in Oksana Karpovych’s compelling war documentaryVietnam saw the advent of the visible war, documented by TV cameras; but the Russia-Ukraine war perhaps represents the moment we also get a fully audible one. With two relatively affluent belligerents involved, mobile phone coverage is ubiquitous on both the civilian and soldier sides. Juxtaposing intercepted calls back home from frontline Russian troops with shots of the devastation they have wreaked in Ukraine, this film is a bleak and searing wiretap into Putin’s warping effect on his people and the psychology of power.“A Russian is not a Russian if they don’t steal something,” jokes one woman when she hears her brave boy has looted some makeup for her. Set against the shots of ransacked living rooms, wrecked petrol stations and dimly lit bomb shelters, such casual banter hammers home a chilling normalisation of imperialism and aggression – which comes with varying justifications. There is the standard dehumanisation: that the “khokhols” (a derogatory Russian term for Ukrainians) deserve it. Many parrot Putin’s line that the special military operation is fighting fascists. Or, in some troops’ amazement at Ukrainian ice-cream and abundant livestock, we glimpse an economic envy that lets such lies slip down more easily. Continue reading...","Mon, 17 Feb 2025 13:00:36 GMT",-0.0258,-0.9666
