broadcast,title,description,pub_date,title_sentiment_score,description_sentiment_score
The Guardian,The new world order is exactly what it looks like. Are we too frozen with fear to name it? | Zoe Williams,"The truth is paralysing. But after JD Vance met the far-right leader Alice Weidel in Germany, it is time to be clear about what we are seeingJD Vance’s decision, while in Germany, to meet the far-right AfD leader, Alice Weidel, yet decline a meeting with the chancellor, Olaf Scholz, would have caused more alarm, I feel, if it hadn’t come accompanied by so much other signalling. The vice-president of a nation engaged in tearing down its own institutions lectured the whole of Europe on its project to “destroy democracy”, which is absolutely textbook: he’s describing black as white, openly turning observable reality on its head. It’s unsettling, for sure, but that’s because it’s audacious, not because it’s complicated. It’s the simplest move of statecraft ever – show the world who you are, dare them to call you on it.Meeting Weidel was the second simplest move – show the world who your allies are, dare them to mention it, or see if instead they turn themselves in knots trying to bring the AfD back into the fold, rather than accept that the postwar consensus has folded.Do you have an opinion on the issues raised in this article? If you would like to submit a response of up to 300 words by email to be considered for publication in our letters section, please click here. Continue reading...","Mon, 17 Feb 2025 18:07:01 GMT",-0.1779,0.9602
The Guardian,Ben Jennings on the victors and victims of Donald Trump’s early second term, Continue reading...,"Mon, 17 Feb 2025 19:20:06 GMT",-0.3182,0.0
The Guardian,Human rights are not a ‘loophole’ – why can’t families from Gaza like mine seek safety in the UK? | Ghassan Ghaben,"When another Palestinian family was allowed to stay here, I saw a glimmer of hope. Now the prime minister wants to put it outAs the devastation in Gaza continues, Palestinian families in Britain are racing against the clock to try to bring our loved ones to safety. News finally came of a successful family reunification – but instead of being able to feel a moment of relief for this one family, we’ve had to face a vicious political and media backlash.The UK media, government and even the prime minister have fixated on a “loophole” that allowed a mother, father and four children from Gaza to be granted the right to live in the UK via the Ukraine family scheme. It obscures the reality that there is no Gaza family reunification scheme, forcing Palestinians to navigate an immigration system that offers no clear pathway to safety.Ghassan Ghaben is a member of the Gaza Families Reunited campaignDo you have an opinion on the issues raised in this article? If you would like to submit a response of up to 300 words by email to be considered for publication in our letters section, please click here. Continue reading...","Mon, 17 Feb 2025 08:51:24 GMT",0.6486,0.8802
The Guardian,Better mental health care around pregnancy exists – I’ve seen it. Why aren’t all women getting it? | Rhiannon Lucy Cosslett,"The tragic loss of a mother of three highlights how widespread perinatal mental illness is – and that care is patchy and underfundedTwo sobering facts for you: 1) Suicide is the leading cause of maternal death in the period from six weeks to a year after birth, and 2) There are only 22 mother and baby units in the whole of the UK, with not a single one in Northern Ireland.Perinatal mental illness – a leading complication of pregnancy – is in the news again. Services are crumbling and overstretched, and a postcode lottery means women are often struggling to access treatment, with devastating consequences. The new Labour MP Laura Kyrke-Smith has been speaking movingly about the death by suicide of her friend Sophie, who ended her life 10 weeks after the birth of her third child. Sophie had been suffering from anxiety, especially around her baby’s feeding, and they had spent a night in A&amp;E, but it is unclear whether signs that she was at risk were picked up by professionals. Her friend has been left wondering if, amid all the worry about the baby, anyone asked her mother if she was OK, and what a difference that might have made not only to Sophie, but to the three young daughters she left behind.Rhiannon Lucy Cosslett is a Guardian columnist and author. She is the author of a novel, The Tyranny of Lost Things, and a memoir, The Year of the CatIn the UK and Ireland, Samaritans can be contacted on freephone 116 123, or email jo@samaritans.org or jo@samaritans.ie. In the US, you can call or text the National Suicide Prevention Lifeline on 988, chat on 988lifeline.org, or text HOME to 741741 to connect with a crisis counselor. In Australia, the crisis support service Lifeline is 13 11 14. Other international helplines can be found at befrienders.org Continue reading...","Mon, 17 Feb 2025 13:00:37 GMT",0.7269,-0.9887
The Guardian,Trump’s plan for Gaza leaves Arab nations facing an impossible choice | Nesrine Malik,"This mortifying dilemma goes to the very soul of the region - and its leaders have brought it on themselvesArab states are in a bind. King Abdullah of Jordan squirmed in the Oval Office last week, as the press asked him and Donald Trump about the latter’s Gaza plan. He is in a tight spot, wanting to keep Trump onside while at the same time not agreeing to the ethnic cleansing of Gaza. Immediately after, anonymous Egyptian “security sources” – not parties prone to leaking without strategic direction from President Abdel Fatah al-Sisi – said that Sisi would not accept an invitation to visit Washington as long as the Gaza displacement plan was on the agenda. Now, this was probably more for the Egyptian public’s consumption than for Trump’s benefit – Egypt is in no position to make an enemy of the new administration – but it nonetheless shows how hard it is for Trump to secure the acquiescence of even the US’s closest allies.Saudi Arabia also postponed a visit to the US once Trump announced his intentions for Gaza. And in a remarkable change of tune, Saudi, which before 7 October 2023 was en route to normalisation with Israel and is not usually a country to make heated statements, lost its patience. When Benjamin Netanyahu quipped that maybe it would like to take Palestinians from Gaza (“they have a lot of territory”, he said), Saudi state media unleashed a storm of invective against him. When Trump announced his plan, Saudi Arabian authorities immediately put out a statement rejecting it. So keen was the government to signal that rejection that it released the statement at 4am local time. Continue reading...","Mon, 17 Feb 2025 06:00:29 GMT",0.0,-0.3181
The Guardian,It’s never been more important to stay tuned in | Margaret Sullivan,"I’m far from certain that staying engaged will make a difference. What I do know is that if we all tune out, there’s no hope at allIt’s tempting in this dire moment to try and shut out the nightmare of what’s happening in Washington DC.“I’m waking up every day to a genuinely sick feeling in my stomach and a heavy feeling in my chest,” my friend Laura, who follows the news closely, texted me recently. Continue reading...","Mon, 17 Feb 2025 11:00:36 GMT",-0.2044,-0.0531
The Guardian,"As the US retreats, Europe must look out for itself – so is Macron’s nuclear offer the answer? | Simon Tisdall","Development of a joint defence shield would be politically explosive for Keir Starmer. But it’s an idea whose time has comeThe startling contempt for Europe’s intensifying security concerns displayed by Donald Trump and his henchmen has brought an old, controversial question back to the fore: should Britain and France pool their nuclear weapons capabilities and create a Europe-wide defensive nuclear shield to deter Vladimir Putin’s Russia, if the US reduces or withdraws its support?Trump has not so far explicitly threatened to cut US nuclear forces based in Europe. But speaking last week, the president said he wanted to halve the US’s defence spending, especially on nuclear weapons. Trump often denigrates Nato, keystone of European security. Last year, he encouraged Russia “to do whatever the hell they want” to member states that, in his view, spend too little on defence. Continue reading...","Mon, 17 Feb 2025 07:00:30 GMT",0.0,-0.9548
The Guardian,Thrill-seeking made me feel alive – until the day I hurtled down a volcano on a mountain bike | Gary Nunn,"My bungee-jumping and skydiving days are over because I can’t shake the visceral memory of learning that I’m not invincibleI’d just completed the spectacular four-day Inca Trail hike to Machu Picchu and, drunk on nature, was feeling dangerously invincible. Fresh Peruvian air still rejuvenated my lungs and the brain fog induced by my daily smartphone addiction hadn’t yet crept back in.The disastrous events that followed began once I turned my phone back on. Responding to a Twitter solicitation for Peru recommendations, a man I’d never met posted: “Go mountain biking down a volcano in Arequipa!”Gary Nunn is a freelance journalist and author Continue reading...","Mon, 17 Feb 2025 08:00:29 GMT",0.25,-0.4753
The Guardian,"The Guardian view on the US, China and the rest: Trump is opening doors for Xi | Editorial","The US president’s bullying of allies and partners is short-termist and will boost Beijing’s power, not Washington’sDonald Trump’s return to the White House is so far proving more nightmarish for US allies and friends than adversaries. China certainly doesn’t relish a trade war with the US, but it was better prepared than others for Mr Trump’s tariffs, and both sides appear to be leaving room for a potential deal. And, though China’s leader, Xi Jinping, is poised for worse to come, the second Trump term is bringing Beijing opportunities as&nbsp;well as problems.International respect for the US plummeted under his last administration. As the US president turns the screws on long-term partners, China is looking to take advantage. Colombia quickly caved to Mr&nbsp;Trump on the matter of migrant returns, but China’s ambassador&nbsp;has been celebrating the “best moment” in&nbsp;relations between Bogotá and Beijing. Under pressure from the Trump administration, Panama announced that it would allow its participation in China’s global infrastructure plan, the belt and road initiative (BRI), to expire. Yet behind-the-scenes arm-twisting had already begun tilting Panama back towards the US. Mr&nbsp;Trump’s attempts to humiliate and bully may backfire there and across the region.Do you have an opinion on the issues raised in this article? If you would like to submit a response of up to 300 words by email to be considered for publication in our letters section, please click here. Continue reading...","Mon, 17 Feb 2025 18:30:44 GMT",0.0,0.7587
The Guardian,The Guardian view on the care experience: looked-after children and care leavers must be heard | Editorial,"The increased visibility of people whose lives have been shaped by social services is a change for the betterSelect committee hearings typically involve experts answering questions from MPs. Last week there was a&nbsp;strikingly different session, as four care-experienced young people offered their perspectives to the education committee. The point was to increase MPs’ insight by confronting them with children for whom social care is a hugely important fact of life.Some of the material shared was personal. But these witnesses also had opinions about how services could be changed to better meet the needs of young people in similar positions. As well as describing losses and disappointments, they spoke warmly about adults who&nbsp;had supported them. This included teachers, personal advisers (support workers for care leavers up&nbsp;to age 25) and foster carers. One young woman said&nbsp;her independent visitor (a voluntary role) was a&nbsp;key person&nbsp;in her life.Do you have an opinion on the issues raised in this article? If you would like to submit a response of up to 300 words by email to be considered for publication in our letters section, please click here. Continue reading...","Mon, 17 Feb 2025 18:25:43 GMT",0.7506,0.972
The Guardian,Why changes to assisted dying bill are cause for concern | Letters,"Readers respond to Kim Leadbeater’s proposed amendment to replace a high court judge with an expert panel to make final decisions on applications Polly Toynbee’s article on Kim&nbsp;Leadbeater’s assisted suicide bill has a familiar feel (The concerted attack on assisted dying won’t stop the public supporting this bill, 14 February), with its ad hominem attack on opponents and dismissive approach to their concerns. I am not religious, I don’t read the Tory press, I am not part of some opaque conspiracy and my opinions are not&nbsp;“sham indignation”. I feel genuine dismay at the manipulation and incompetence on show in parliamentary consideration of the bill.My perspective comes from my background as a psychiatrist with expertise in the interaction between severe physical illness and mental health. Leadbeater’s committee initially refused to hear from the Royal College of Psychiatrists and backtracked in response to the resultant outcry, eventually inviting&nbsp;a representative of the college and two other psychiatrists (one of them me) who appeared as individual experts. Continue reading...","Mon, 17 Feb 2025 17:05:00 GMT",0.0,-0.9842
The Guardian,"Reducing plastic use is possible, but it’s not easy | Letters","Sue Kellaway says the switch takes time and effort and Cathy Swann says the path to a sustainable life is not straightforwardIt’s difficult to avoid plastic, but Emma Beddington’s article makes it seem impossible and it isn’t (My no-plastic life: I tried to cut out single-use items for a month – and it almost broke me, 12 February). We have a routine that eliminates most plastic waste. We shop at the market for fruit and vegetables, all in paper bags, and use vinegar for all cleaning. We use tooth tabs in glass jars, shampoo soap bars and laundry sheets. We’ve had dairy milk and oat milk delivered in glass bottles for years.Supermarkets can cut plastic packaging, but don’t. When I&nbsp;asked a manager at a big store why they can’t do more, I was told they have long-term contracts with big producers, which have long-term contracts with plastic producers. So vote with your wallet and shop where they help you – Lidl has compostable bags for many loose veg and fruit, and Aldi has nuts in paper bags. And there are always refill shops, though they tend to be&nbsp;expensive. Cutting down on plastic is possible, it just takes a&nbsp;little more time and effort. Sue KellawayChristchurch, Dorset Continue reading...","Mon, 17 Feb 2025 17:04:42 GMT",-0.4782,-0.9415
The Guardian,Joseph Parker: ‘This will mean something different. I’m doing it for myself now’,"New Zealand fighter has appreciated spending time with his family as he prepares to challenge Daniel Dubois for the IBF world heavyweight titleThere’s nothing quite like watching Joe Parker lip-syncing to Take That to lift the mood in the back of an Uber on a drizzly morning in Dublin. The dangerous threat Parker faces against another big-hitting monster of the ring in Daniel Dubois, in Riyadh on Saturday night, fades with the laughter.Even the depressing reality that boxing will continue to ignore human rights abuses in Saudi Arabia, as Parker’s intriguing bout with Dubois headlines an outstanding bill bankrolled by the country’s General Entertainment Authority, can’t erode the wit and charm of the New Zealand heavyweight channelling his inner Gary Barlow. Continue reading...","Mon, 17 Feb 2025 19:00:44 GMT",0.0,-0.0069
The Guardian,Leeds return to the top after super-sub Struijk strikes twice to sink Sunderland,"The news that a national poetry centre is to be established in Leeds proved the source of considerable pride in West Yorkshire on Monday. By 10pm on a bitterly cold night at Elland Road, any notions that Leeds would capture the mood courtesy of a suitably cadenced performance had been thoroughly disabused as Daniel Farke’s side fought their way to a dramatic last-gasp win after Wilson Isidor had given Sunderland the lead.Yet if it was hardly poetic, substitute Pascal Struijk’s gamechanging double returned Leeds to the top of the Championship, leaving them two points ahead of Sheffield United, seven clear of third-placed Burnley and 10 in front of Régis Le Bris’s team. Continue reading...","Mon, 17 Feb 2025 22:07:55 GMT",-0.1779,0.9152
The Guardian,"After £800m and four years, Everton’s new stadium makes its grand debut","The 52,888-seat ground in Bramley-Moore dock impresses as 10,000 fans flock to test event – even if Everton loseThe clue is in the name, yet it is hard to imagine now that Bramley‑Moore dock was an abandoned, neglected body of water 1,303 days ago.Twelve unexploded anti-aircraft shells from the second world war still lurked in the depths, waiting to be removed by the Royal Navy, when Everton took possession of the site on 26 July 2021. Less than four years later a magnificent, imposing, futuristic stadium has opened on the banks of the River Mersey. A torturous journey decades in the making has been worth every step. Continue reading...","Mon, 17 Feb 2025 21:42:40 GMT",0.4588,-0.7845
The Guardian,"Ruben Amorim’s Manchester United are a mess, with issues starting at the top | Jonathan Wilson","The optimism that greeted Jim Ratcliffe’s arrival as owner has given way to even more disappointment, with Sunday’s defeat at Tottenham the latest exampleSign up for Soccer with Jonathan Wilson hereCovering Manchester United these days feels a little like being a character in Silent Witness: every week you end up writing a postmortem. Their Sunday defeat at Tottenham was an engaging if bitty affair that finished 1-0 largely because the low quality of defending on show was compensated for by the low level of attacking. It was fun in its way, but it didn’t feel a lot like Premier League football.It also meant United dropped to 15th in the table, having won just four of 14 league games under Ruben Amorim. Under Erik ten Hag this season, United were taking 1.22 points per game; under Amorim that’s down to 1.00. Nobody was under any illusions about the scale of the task he was taking on, but four months after Amorim took the job it would be very difficult to identify any concrete signs of progress. There has been the resilience of the performance in the league at Anfield, in the FA Cup at the Emirates, and not a lot else. Continue reading...","Mon, 17 Feb 2025 16:00:54 GMT",0.2732,0.9362
The Guardian,England exposed to video nasties in bid to end losing streak in Calcutta Cup,"Scotland have won the last four meetings in Six Nations Steve Borthwick using clips of defeats for motivationEngland players have been shown Calcutta Cup video nasties for extra motivation as they bid to end a miserable run against Scotland on Saturday.Steve Borthwick’s side will seek a first win against the auld enemy in five years buoyed by their one-point victory against France last time out. But the head coach is waiting on the second-rower George Martin, who was not part of full training on Monday because of discomfort in his knee. Continue reading...","Mon, 17 Feb 2025 18:26:45 GMT",-0.7184,-0.6486
The Guardian,Novak Djokovic laments ‘favouritism’ towards Jannik Sinner over doping ban,"Serb says anti-doping system ‘inconsistent’ and ‘unfair’Liam Broady feels convenience of the ban is ‘interesting’Novak Djokovic has claimed the majority of players believe Jannik Sinner was shown “favouritism” with his three-month doping ban.Sinner reached a settlement with the World Anti-Doping Agency (Wada) over two positive drug tests in March last year. Sinner’s explanation that he was inadvertently contaminated with the banned substance clostebol by his physio was accepted by Wada, but the agency added that “the athlete bears responsibility for the entourage’s negligence”. Continue reading...","Mon, 17 Feb 2025 23:16:42 GMT",-0.7269,-0.0644
The Guardian,Chloe Kelly called into England squad after Beth Mead pulls out injured,"Lucy Parker also in after Lotte Wubben-Moy withdrawsEngland play Portugal and Spain in Nations LeagueThe winger Chloe Kelly and defender Lucy Parker have been called up to England’s squad for the Women’s Nations League fixtures against Portugal and Spain, after the Arsenal duo Beth Mead and Lotte Wubben-Moy had to withdraw with injuries.Kelly, who scored the winning goal in the final of Euro 2022, was left out of the squad because Sarina Wiegman said she “hasn’t played enough” to merit a spot. Continue reading...","Mon, 17 Feb 2025 12:09:24 GMT",-0.4019,0.886
The Guardian,Henderson seeks Cheltenham redemption with star turns after 2024 blank,"Trainer’s winless festival last year was his first since 2008 but he has three Grade One favourites lined up this timeForty years on from his first Cheltenham festival success, with See You Then in the 1985 Champion Hurdle, Nicky Henderson is still at the peak of his profession – and still taking nothing for granted.“The only time I’ve ever been confident about anything was Altior’s Supreme [Novice Hurdle in 2016],” Henderson said on Monday. “It didn’t matter what Willie [Mullins] brought over that year, he wasn’t going to beat him. Continue reading...","Mon, 17 Feb 2025 17:01:22 GMT",0.0,0.982
The Guardian,Solar has taken off in red states. Trump’s funding freeze is causing panic,"On his first day, the president paused billions of dollars in funding for clean energy projects initiated by BidenMike Mullett strains to see through sheets of misty rain while driving through working-class neighborhoods of Columbus, a quaint town in southern Indiana.He’s trying to find the senior center, multi-family homes and rent-assisted properties – more than 530 in total – that he and many other locals hope will receive $4.42m in federal funding for solar electricity projects. Continue reading...","Mon, 17 Feb 2025 12:00:36 GMT",-0.4767,0.6705
The Guardian,Brazil asks UN to ditch proposed levy on global shipping,"Those supporting the deal hope it will raise billions to help poor countries deal with climate breakdownBrazil has asked the UN to throw out plans for a new levy on global shipping that would raise funds to fight the climate crisis, despite playing host to the next UN climate summit.The proposed levy on carbon dioxide emissions from shipping will be discussed at a crunch meeting of the International Maritime Organisation (IMO) that begins on Monday. Those supporting the deal, including the UK, the EU and Japan, are hoping the levy will raise billions of dollars a year, which could be used to help poor countries cope with the effects of climate breakdown. Continue reading...","Mon, 17 Feb 2025 06:00:28 GMT",0.0,0.3417
The Guardian,Weatherwatch: Cyclone Zelia brings 130mph winds to north-west Australia,"Tropical cyclone first to make landfall this year, while a winter storm causes extreme cold across north-eastern USCyclone Zelia became the first tropical cyclone to make landfall in 2025, hitting north-west Australia on Valentine’s Day as a category 4 system. It brought damaging winds of 130mph and heavy rainfall, with 440mm of rain falling in two days. Prior to landfall, Zelia affected southern Indonesia, including Bali, with winds of more than 45mph. The storm weakened into a tropical low by Saturday, but continued to cause widespread flooding, particularly near the Pilbara rivers and the Great Sandy Desert.Zelia intensified rapidly because of the record-warm Indian Ocean temperatures, which were 1-2C above the seasonal average, providing increased energy and moisture to fuel the storm. While Port Hedland in Western Australia had minimal damage, nearby areas like Pilbara and Marble Bar faced flooding and fallen trees. The Great Northern Highway remains closed, disrupting food supplies and leaving supermarket shelves empty. The tropical low is now tracking southwards, with rainfall becoming patchier and lighter. Continue reading...","Mon, 17 Feb 2025 10:37:42 GMT",0.0,0.6705
The Guardian,Extreme weather expected to cause food price volatility in 2025 after cost of cocoa and coffee doubles,"Trend towards more extreme-weather events will continue to hit crop yields and create price spikes, Inverto saysExtreme weather events are expected to lead to volatile food prices throughout 2025, supply chain analysts have said, after cocoa and coffee prices more than doubled over the past year.In an apparent confirmation of warnings that climate breakdown could lead to food shortages, research by the consultancy Inverto found steep rises in the prices of a number of food commodities in the year to January that correlated with unexpected weather. Continue reading...","Sat, 15 Feb 2025 08:39:20 GMT",0.0,-0.1027
