broadcast,title,description,pub_date,title_sentiment_score,description_sentiment_score
The Guardian,The best Valentine’s Day gifts: 34 thoughtful ideas they’ll actually want,"Forget hot-housed roses and generic chocolates: from a modern mix tape to a padel racket, give them something more considered this year• 12 affordable jewellery brands, worn and rated for style and qualityNot everyone embraces Valentine’s Day. It is, at worst, a commercial free-for-all crammed with out-of-season roses and overpriced, throwaway gifts and, at best, a day that sees you dashing to a supermarket at 6pm trying to find something that doesn’t scream “after-thought”.But if you are going to embrace it, there are some great, thoughtful gifts out there. We’ve put together a list of more unusual, long-lasting ideas: from Lego flowers to a digital mix tape, a refurbished games console to an affordable fragrance. Whether you’re looking for a present to bring you closer as a couple – half-and-half duvet, anyone? – or to attract someone new, our guide will help you ace Valentine’s Day this year. And not an (out-of-season) red rose in sight. Continue reading...","Fri, 07 Feb 2025 12:00:00 GMT",0.7964,0.8555
The Guardian,The best mattresses: sleep better with our six rigorously tested picks,"From luxury Simba and Otty mattresses to brilliant budget buys, here’s what we recommend• How to choose a mattress: the features worth paying for – and the ones that aren’tA good mattress improves your sleep, say mattress makers – and they would, wouldn’t they? But they’re right. The older I get, the more I know it. When I was 20, I could sleep anywhere: a friend’s floor, a filthy sofa – even a phone box one night. These days I won’t get a single one of 40 winks if I’m not lying on a decent mattress. Comfy but firm, cosy but breathable, and with loads of cool spots for my feet.Today’s best mattresses promise all this and more. Gone are the days when your biggest decision was between a sprung double or a sprung king size. Pocket springs are still around, but they face stiff – well, medium firm – competition from hybrid mattresses that combine springs and memory foam to provide that all-important balance of comfort and support.Best overall mattress: 
 Otty Original HybridFrom £499.99 (single) to £874.99 (emperor) at OttyBest mattress for couples: 
 Simba Hybrid ProFrom £799 (single) to £1,349 (super king) at SimbaBest budget mattress: 
 Ikea ValevågFrom £149 (single) to £359 (super king) at Ikea Continue reading...","Thu, 06 Feb 2025 12:00:50 GMT",0.7717,0.9916
The Guardian,Plates London becomes first vegan restaurant in UK to win a Michelin star,"Chef Kirk Haworth impressed judges by ‘taking his classical training and inventively adapting it to a vegan diet’A vegan restaurant in London has become the first in the UK to be awarded a Michelin star.Plates London, located on Old Street, serves a fully plant-based menu and chef Kirk Haworth impressed judges by “taking his classical training and inventively adapting it to a vegan diet”, Michelin said. Continue reading...","Tue, 11 Feb 2025 18:39:06 GMT",0.5859,0.836
The Guardian,‘Being ridiculous is not sexy’: Michael Kors wants to restore some sanity to the red carpet,"Fashion designer says when the world is this crazy, you need to feel ‘confident and comfortable’ in your clothesOne celebrity who was very much not on Michael Kors’ moodboard for his New York fashion week show was Bianca Censori, who recently caused uproar with a near-naked appearance at the Grammys with her husband, Kanye West. “I’m not going to mention names,” said the designer, while making the reference quite clear. “Something we saw on the red carpet recently – that’s not sexy. Being ridiculous isn’t sexy.”Kors, who used to love a revealing gown, says naked dressing “is boring now. I grew up infatuated with Cher. I would be waiting to see what she wore, how naked she could be, how amazing she could look”. Continue reading...","Tue, 11 Feb 2025 19:56:46 GMT",-0.0772,0.7489
The Guardian,Are typos lethal in a work email? Nine digital communication tips from an expert,"You might need to brush your hair to go ‘camera on’, but showing your face can forge trust. Andrew Brodsky tells us what he’s learned about digital communicationAndrew Brodsky has been working from home far longer than most of us. Twenty years ago, at age 16, he was diagnosed with a rare form of leukemia that required a bone marrow transplant, and he spent the following month in an isolation room where visitors had to put on a mask, full-body gown and gloves.“I got early experience interacting with people from a distance,” the McCombs School of Business at The University of Texas at Austin professor says. An early interest in virtual communication took hold, growing into a PhD dissertation and the cornerstone of his business consulting practice. Continue reading...","Tue, 11 Feb 2025 17:00:02 GMT",0.0,0.7876
The Guardian,What’s the best way to make dull green cabbage taste interesting? | Kitchen aide,"Stuff them, char them, shred them and pickle them, and become a cabbage convertGot a culinary dilemma? Email feast@theguardian.comI often find green cabbage boring. How can I make it more interesting?The cabbage family is vast and, just like most families, its members differ hugely in shape and size, from long and pointed to rotund with solid hearts. What the green members all have in common, however, is their receptiveness to multiple situations, from braising to layering into lasagne, which is good news for those who think they’re a bit dull.Merlin Labron-Johnson, chef/owner of Osip and The Old Pharmacy, both in Bruton, Somerset, is no such person, though: “Cabbages are much more versatile than people give them credit for,” he says, “but you do need to apply a bit of imagination.” That might mean blanching the leaves, stuffing them with sausagemeat – “sometimes, I add pistachios, too” – then rolling and braising in the oven. “That’s an interesting way to use up a savoy cabbage.” He suggests serving these cabbage parcels with some pumpkin puree. Alternatively, put hispi in a pot roast: halve the cabbage and lay it cut side down in a hot pan with lots of oil, to get some nice caramelisation. “Finish it in the oven, then carve and dress with chopped herbs, toasted nuts [almonds or hazelnuts, say] or pine nuts, perhaps a few raisins, and a bit of vinegar and olive oil.”Got a culinary dilemma? Email feast@theguardian.com Continue reading...","Tue, 11 Feb 2025 14:00:05 GMT",0.6369,0.8095
The Guardian,"I was trapped for 65 hours under 4,000 tons of rubble – and felt an amazing calm","In 1997, the ski lodge where Stuart Diver lived with his wife, Sally, was destroyed by a landslide. She was one of 18 people who died and he was the sole survivor. He describes the pain, fear and long, winding path of recoveryStuart Diver woke up to a roar that sounded like a low-flying plane. The floor was shaking. The windows rattled. It was 11.35pm and 4,000 tons of mud, building and debris was hurtling down the mountainside in Thredbo, New South Wales, towards Bimbadeen Lodge, where he had been asleep with his wife, Sally. In a few short seconds, the ceiling of their apartment caved in and they were entombed by the concertinaed building. Diver fumbled around in the pitch black room for a way out, cutting his hands and feet on broken glass. But there was nowhere to go.“I heard the noise and put my head up, but as I rolled forward the wrought iron headboard came down and pinned Sally to the bed.” Freezing cold water from a broken mains water pipe on the road above them soon started “flying around”. Diver found a small pocket of air to breathe by arching his back and tilting his head up. He tried to cover Sally’s mouth to stop her from drowning but he couldn’t save her. “Sal dying in my hands will stay in my mind forever,” he wrote in his 2012 book, Survival. Continue reading...","Tue, 11 Feb 2025 10:00:14 GMT",0.4019,-0.8945
The Guardian,"‘I was charged £1,406 after my key snapped in my door’: how to protect against locksmith fraud","One young woman had to find £1,406 when a key broke in the lock and two men refused to leave until she paidA key snapped in the lock as my son and his young babysitter tried to open my front door. The babysitter searched online and called a locksmith quoting a £49 call-out charge.The locksmith claimed the key could not be extracted and insisted the entire locking mechanism had failed and would need to be repaired at his workshop, at a cost of around £400. Continue reading...","Tue, 11 Feb 2025 08:30:12 GMT",-0.4588,-0.8176
The Guardian,Tell us: have you been threatened with ‘eviction’ from a specialist care home?,"We’d like to hear from people or anyone in their family who has been ‘evicted’ from a care home providing specialist care for vulnerable adults due to funding cutsResidential homes providing specialist care to thousands of vulnerable adults with learning disabilities and severe autism have warned they are having to “evict” residents to avoid insolvency because of tax and wage rises and local authority funding cuts.The annual Sector Pulse Check survey of more than 200 social care providers, both private and charitable, says many are on the brink as they struggle to remain viable in the face of cash-strapped councils’ refusal or inability to meet the rising cost of services. Continue reading...","Mon, 27 Jan 2025 14:46:05 GMT",0.0516,0.6808
The Guardian,Share your experience of living in an area in the UK that is prone to flooding,"We would like to hear from people who live in an area that is under threat of flooding due to extreme weatherAs storms and bad weather increase every year, more people are facing the devastating impacts of flooding. Are you living in an area under threat of flooding? We want to know how current weather events have changed your circumstances and plans.What are your options for tackling the flooding? Is moving away becoming a likely outcome? What support has been offered to you long term if the area could flood again? Have you had trouble getting insurance? Continue reading...","Wed, 05 Feb 2025 15:43:39 GMT",0.296,-0.9092
The Guardian,Share a tip on a break in Spain,"Tell us about a lesser known corner of Spain – the best tip wins £200 towards a Coolstays breakSpain is one of the most enduringly popular tourist destinations in Europe, but sometimes that popularity comes at a price – a fact that has been highlighted by recent protests against overtourism in Barcelona and the Balearic islands. But if you’re willing to go a little off the beaten track, there is still much to discover in this fascinating country. We’d love to hear about your favourite finds in Spain, whether it’s a beach cafe serving fresh seafood, a mountain walk or an unsung museum or heritage attraction.If you have a relevant photo, do send it in – but it’s your words that will be judged for the competition. Continue reading...","Mon, 10 Feb 2025 13:03:28 GMT",0.296,0.9679
The Guardian,Tell us: have you been affected by the earthquakes on Santorini?,"We would like to hear from people who have been affected by the earthquakes on the Greek islandEarthquake fears have prompted people to flee Santorini, as Greece’s most popular island destination continues to be hit by what scientists described as a “barrage” of tremors.We would like to hear from residents, tourists and workers who who have been affected by the undersea tremors. Have you evacuated? Do you have any concerns? Continue reading...","Tue, 04 Feb 2025 16:24:30 GMT",-0.1531,0.7394
The Guardian,Why is Trump imposing tariffs and which countries will be hit hardest? - in charts,"These graphics explain how the US trade deficit has changed, why Trump may be targeting certain countries with tariffs – and what the impact could beThe US president, Donald Trump, has put global leaders ill at ease with his threat of tariffs.After announcing and then delaying tariffs on Canada and Mexico, hitting Chinese goods with an additional 10% tariff and also threatening the European Union, countries and markets are concerned about where the US president will go next. Continue reading...","Tue, 11 Feb 2025 07:00:11 GMT",-0.1027,-0.6486
The Guardian,‘I became collateral damage’: the trans pilot falsely targeted over Washington DC crash,"Without evidence, Trump blamed diversity after the crash, leading some to accuse Jo Ellis of being one of the pilotsJo Ellis is alive.It was a non-controversial, irrefutable fact – until she was accused of piloting the military helicopter that collided with a commercial airplane in Washington DC on 29 January, killing all involved. Continue reading...","Tue, 11 Feb 2025 11:00:57 GMT",-0.4019,-0.9217
The Guardian,‘An underground thing’: what happens to a pet when its owners are targeted by immigration raids?,"There’s no formal network for families caught up in mass deportations to re-home their pets, but communities are stepping up to helpOn 1 February, Kyle Aaron Reese saw a Facebook post from an old school friend urgently looking for someone to adopt a dog named Benny. Benny’s owners had just been deported after an immigration raid in New York City; faced with high costs and uncertainty, they hadn’t been able to take Benny with them. Reese did not have to stare long at the photo of the jowly bulldog’s silly smile before jumping in his car to go pick him up.“Everything about what I learned about that dog made me want him more,” said Reese, who is 39 and lives in Brooklyn. Continue reading...","Tue, 11 Feb 2025 15:00:00 GMT",0.0,0.7579
The Guardian,Trump’s mass deportation plans spark panic in the Caribbean amid fake news,"Nations try to reassure citizens as Trump threatens unprecedented crackdown but scale remains unclearNations across the Caribbean have been attempting to reassure their citizens at home and in the US after misinformation spread on social media channels caused widespread panic over Donald Trump’s plans for trade tariffs and mass deportations.Alarming stories claiming that 5,000 Jamaicans had already been given final removal orders or that more than 1 million undocumented people were on federal enforcement lists, have caused concern across the region. Continue reading...","Tue, 11 Feb 2025 12:00:04 GMT",-0.6705,-0.6597
The Guardian,"Canada’s Liberal party was left for dead, but Trump might have just given it a second chance","Experts say the US president’s takeover threat will shift election priorities to who seems best suited to face TrumpUntil just a few weeks ago, it was an exhilarating time to be a Conservative in CanadaAfter nearly 10 years of Liberal rule, a deepening cost of living crisis had soured public support for Justin Trudeau and his shop-worn government. The Tory leader, Pierre Poilievre, had seized on a controversial carbon levy, and pledged to make the next federal vote an “axe the tax” election. Pollsters predicted his party would seize a convincing majority of seats. The country was on the cusp of a new Conservative era. Continue reading...","Tue, 11 Feb 2025 11:00:56 GMT",0.1779,0.6908
The Guardian,Mervyn Street’s parents were paid in rocks instead of wages. He led a fight for his people – and won $180m,"The Gooniyandi artist’s new show Stolen Wages chronicles the lives of Aboriginal mustering workers like himself and his father – who was never paid in his lifetimeGet our weekend culture and lifestyle emailAs a child in the 1950s, growing up on a cattle station in the dusty red Kimberley, Mervyn Street remembers finding a rock in his mother’s kitchen, with numerical markings on one side. This, he would learn, was a “black penny”.“My dad had, on the back of the penny, three ones – 1, 1, 1 – I didn’t know what that meant,” he recalls now, wearing a worn bush hat and sitting at Mangkaja Arts Centre near his home in the Muludja community, east of Fitzroy Crossing. The numbers, his father told him, were ration entitlements for flour, tea and sugar. Continue reading...","Tue, 11 Feb 2025 14:00:09 GMT",0.2732,-0.296
The Guardian,Salman Rushdie tells stabbing trial: ‘It occurred to me quite clearly I was dying’,"Author says ‘I was screaming because of the pain’ in trial of man accused of trying to kill himSalman Rushdie took the stand in the trial of the man accused of attempting to kill him at a literary gathering in western New York in August 2022, and described the shocking attack more than 35 years after he was first placed under a death warrant by Iranian religious leaders.Rushdie, 77, is testifying for the prosecution against Hadi Matar, 27, the man accused of assaulting him with a knife as he was about to address an open-air audience on a theme of shelter and home. Continue reading...","Tue, 11 Feb 2025 19:42:54 GMT",0.4576,-0.987
The Guardian,What really happened in Calvine? The mystery behind the best UFO picture ever seen,"In August 1990, two hikers sent photos of a strange diamond-shaped aircraft to the press – but the story never appeared. Was it a prank, a hoax, an optical illusion or something else entirely?On a misty evening in August 1990, two men hiking on the moors surrounding Calvine, a pretty hamlet in Perth and Kinross, claimed to have seen a giant diamond-shaped aircraft flying above them. It apparently had no clear means of propulsion and left no smoke plume; it was silent and static, as if frozen in time. Terrified, they hit the ground and scrambled for cover behind a tree. Then a Harrier fighter jet roared into view, circling the diamond as if sizing it up for a scuffle. One of the men snapped a series of photographs just before the bizarre craft shot away vertically and disappeared.Craig Lindsay was a press officer at the RAF base in Pitreavie Castle in Dunfermline, 50 miles away, when the Daily Record got in touch a few days later. The hikers, who worked as chefs at Fisher’s Hotel in Pitlochry, had sent six photos of the diamond to the newspaper and told their story. The Record’s picture editor, Andy Allen, sent Lindsay the&nbsp;best of the bunch. Continue reading...","Tue, 11 Feb 2025 05:00:08 GMT",0.6369,-0.6884
The Guardian,The Coventry experiment: why were Indian women in Britain given radioactive food without their consent?,"When details about a scientific study in the 1960s became public, there was shock, outrage and anxiety. But exactly what happened?In 2019, Shahnaz Akhter, a postdoctoral researcher at Warwick University, was chatting to her sister, who mentioned a documentary that had aired on Channel 4 in the mid-1990s. It was about human radiation experiments, including one that had taken place in 1969 in Coventry. As part of an experiment on iron absorption, 21 Indian women had been fed chapatis baked with radioactive isotopes, apparently without their consent.Having grown up in Coventry’s tight-knit South Asian community, Akhter was shocked that she had never heard of the experiment. When she looked into it, she found an inquiry by the Coventry Health Authority in 1995 conducted soon after the documentary aired. The inquiry examined whether the experiment put the subjects’ health at risk and whether informed consent was obtained. But the only mention of the women’s perspectives was a single sentence: “At the public meeting, it was stated that two of the participants who had come forward had no recollection of giving informed consent.” Continue reading...","Tue, 11 Feb 2025 05:00:08 GMT",-0.1695,-0.6542
The Guardian,Justice watchdog’s ‘absent’ leadership in disarray before review of Letby case,"CCRC staff accuse former chair of ‘insensitive’ memos and incumbent chief executive of having ‘finger off the pulse’CCRC chief spent public funds on luxury hotels for business courses in FranceFor the wrongfully convicted, watching the years disappear from a prison cell, the miscarriage of justice watchdog represents their final hope. But some staff at the Criminal Cases Review Commission (CCRC) say its leaders appear divorced from that reality, using public money for executive training retreats in France and networking over fine wine and steak.The CCRC is in the spotlight again as it is due to consider a dossier of new expert evidence in the Lucy Letby case. While it faces a decision in one of the most high-profile potential miscarriages of justice in decades, its leadership is in a state of disarray. Continue reading...","Mon, 10 Feb 2025 07:17:25 GMT",0.5267,0.3291
The Guardian,"Bunny Shaw abuse fallout, League Cup and FA Cup drama – Women’s Football Weekly","Faye Carruthers is joined by Suzy Wrack, Sophie Downey, and Sanny Rudravajhala to discuss Bunny Shaw, Chelsea and City’s League Cup final showdown, and a dramatic FA Cup weekendOn the podcast today: Manchester City’s Bunny Shaw is subjected to vile racist and misogynistic abuse, leading to her absence from the League Cup semi-final. The panel discusses how football can better protect its players and the broader impact of such incidents.Elsewhere, Chelsea and Manchester City set up a League Cup final showdown and Crystal Palace made history by reaching the FA Cup quarter-finals. Plus, we break down the Women’s Champions League draw as Chelsea and City prepare for four meetings in 12 days. Continue reading...","Tue, 11 Feb 2025 20:28:28 GMT",-0.6369,0.1531
The Guardian,Don’t look up: is an asteroid heading for Earth? – podcast,"In a case of life imitating art, a 100-metre-wide asteroid has triggered global planetary defence procedures for the first time, after telescope observations revealed it had a chance of colliding with Earth in 2032. To find out what happens now and how worried we should be, Ian Sample hears from Richard Binzel, a professor of planetary sciences at MIT and inventor of the Torino scale, which is used to categorise the threat posed by objects such as asteroids and cometsClips: BBC News, NBC NewsAsteroid’s chances of hitting Earth in 2032 just got higher – but don’t panic Continue reading...","Tue, 11 Feb 2025 05:00:09 GMT",0.0,-0.2382
The Guardian,Lucy Letby and the medical experts who believe she is innocent – podcast,"She was called the worst child serial killer in Britain in modern times. So why are medical experts saying her conviction is unsafe? Josh Halliday and Felicity Lawrence reportLucy Letby was convicted for the murder and attempted murder of more than a dozen babies. She has been called the worst child serial killer the UK had seen. But even before the trial was over experts had begun raising concerns about her conviction.Then, last week, came a bombshell press conference in which a panel of renowned neonatal experts said they believed not just that Letby’s conviction was unsafe - but that there was no murder or deliberate harm. Instead they said the deaths had been caused by a series of factors including understaffing and a lack of skills on the ward to treat the babies they were caring for. So what is the evidence that the panel was looking at and why do so many questions seem to swirl around the Letby trial? Continue reading...","Tue, 11 Feb 2025 03:00:05 GMT",0.34,-0.8482
The Guardian,Can Kemi and Keir combat the rise of Reform UK? – Politics Weekly Westminster,"As Reform UK creeps up the polls, Pippa Crerar and Kiran Stacey look at how the Conservatives and Labour are responding to the threat from Nigel Farage’s party. Plus, will the government’s efforts to show voters it is serious about tackling illegal migration cut through?Send your questions and feedback to politicsweeklyuk@theguardian.com Continue reading...","Mon, 10 Feb 2025 14:56:58 GMT",-0.34,-0.7717
The Guardian,Plymouth Argyle bring the magic in the FA Cup - Football Weekly,"Max Rushden is joined by Barry Glendenning, Jonathan Wilson and Troy Townsend as Plymouth Argyle put a stop to Liverpool’s quadruple dreamsRate, review, share on Apple Podcasts, Soundcloud, Audioboom, Mixcloud, Acast and Stitcher, and join the conversation on Facebook, Twitter and email.On the podcast today; Liverpool finally meet a tough opponent as the team bottom of the Championship, Plymouth Argyle, deservedly beat them 1-0 at Home Park to halt Liverpool’s hopes of achieving a quadruple. Continue reading...","Mon, 10 Feb 2025 12:22:28 GMT",0.0,0.7506
The Guardian,Artificial news: How to create an AI anchor – video,"Channel 1 is a new rolling news channel with a difference – its stories are scripted, edited and presented by AI. Available in more than 30 languages and able to transmit bespoke news stories faster than ever, its threat to the mainstream media is clear. But can we trust it? And would anybody actually watch a channel that lacks the human touch? The Guardian visited the channel’s creators in Los Angeles to find out more – and to audition for a role Continue reading...","Thu, 06 Feb 2025 10:03:28 GMT",0.2732,0.6608
The Guardian,500lb black bear survives LA wildfires hiding under house – video,"For those lucky enough to have a place to return to in Altadena, going home meant dealing with unfinished chores left behind when the Eaton fire forced them to evacuate. For Samy Arbid, who had moved into a property just a block from the fire line in November, there was a different kind of challenge: a 525lb (240kg) black bear. It had moved into the crawl space under the house before the fire and was still sheltering there when Arbid and his wife returned. The California wildfire department stepped in to help, luring the bear out with treats after deciding it was too big to tranquillise. The bear's new home is much more appropriate: the Angeles national forest Continue reading...","Wed, 05 Feb 2025 22:20:28 GMT",-0.296,-0.7645
