broadcast,title,description,pub_date,title_sentiment_score,description_sentiment_score
The Guardian,TV tonight: Linford Christie runs for the hills,"The athlete swaps the city for quieter climes. Plus: will Eddie Redmayne’s assassin come a cropper as The Day of the Jackal ends? Here’s what to watch this evening8pm, BBC One With the help of his daughter Briannah and property expert Alistair Appleton, it’s time for athlete Linford Christie to make a dash for the countryside. Linford has been a city boy all his life so can rural tranquility compete with the buzz of the town? During the course of this special, the Christies take a tour of the Chilterns and enjoy outdoor dining at the more bucolic end of the Thames. Continue reading...","Thu, 12 Dec 2024 07:13:25 GMT",0.0,0.909
The Guardian,The obsession with the 'hot assassin' reveals a disturbing truth about celebrity culture |  Vanessa Friedman,"The folk hero status sometimes accorded to those charged with serious crimes means the victims and the violence can be forgottenFrom the moment the world saw the smiling, unmasked face of the young man in the New York City hostel, memes began spreading about his looks. In the days since Luigi Mangione was identified and charged in the murder of the UnitedHealthcare chief executive Brian Thompson, it has been impossible to escape his photo. Or photos. They are proliferating.They are on television, in the newspaper and all over social media. Not just pictures of Mr Mangione from his booking at a police station in Altoona, Pennsylvania, or his mug shots in prison orange, but photos of him in earlier times, in a navy blazer, crisp white shirt and tie. Images of him hiking shirtless in the hills. In all of them, he is clean-shaven, curly-haired, often flashing a bright, white grin. Even his Tinder profile has made it into the public, with more pics featuring his six-pack. One commentator compared the stream of pictures to “an endless photo shoot”. Continue reading...","Thu, 12 Dec 2024 13:23:16 GMT",-0.5267,0.5423
The Guardian,A vote without a vote: the Saudi World Cup is an act of violence and disdain | Barney Ronay,"The shamelessness of Fifa’s process was fully on show in Zurich during a display of contempt for governance, democracy, love, hope and good senseWell, that’s that then. In the event there were only two notes of jeopardy around Fifa’s extraordinary virtual congress to announce the winning mono-bids, the vote without a vote, for the right to host the 2030 and 2034 World Cups.First, exactly how disgusting would this spectacle turn out to be in the flesh? The answer to which, perhaps unsurprisingly, was: extremely disgusting. And second, how would the process actually work? Continue reading...","Wed, 11 Dec 2024 22:30:00 GMT",-0.802,-0.5192
The Guardian,We have no business even knowing each other. But the value of my work wife cannot be overstated | Emily Mulligan,"What good is piping hot gossip when you have to explain every character’s years-long backstory and their annoying snacking habits?Forget the shrieks and hugs at the arrivals hall or the way the traffic parts for an ambulance with the lights and sirens on. For me, there is nothing more wholesome than lunchtime in the CBD seeing two people who demographically have no business knowing each other glued to one another. They don’t see the traffic, the eye contact is unbroken. The bond is strong.They’re work wives.Emily Mulligan is a writer based in Sydney Continue reading...","Thu, 12 Dec 2024 14:00:19 GMT",0.3612,0.128
The Guardian,Worried about what to buy the man in your life for Christmas? The perfect gift may be more modest than you think | Joel Snape,"If you really care, get us an upgrade of a bargain-basement product you’ve spotted us using. Our gratitude will be eternalWhen I was a small boy, socks were the inverse of a Platonically ideal present – the last resort of a tragically unimaginative relative, correctly derided in the Beano as the worst possible gift. Now that I’m a 45-year-old dad, though, I’ve done a 180 – few things make me happier on Christmas morning than the tell-tale crinkle of a floppy, foot-shaped gift. Maybe this is what being a grownup really means.I think it’s because, as you age, you tend to invest in fewer luxuries for yourself. Fine, I’m not above a subscription box of IPAs or some nice fineliners, but when it comes to the essentials of life, I buy … the basics. A set of AirPods? You can get a set of Bluetooth headphones for less than £20. Designer glasses? Not when I look so stylish in my nerd-frames. A six-pack of white athletic socks? Yes, please — throw in a pack of plain T-shirts while you’re at it. Continue reading...","Wed, 11 Dec 2024 23:59:02 GMT",0.6597,0.9292
The Guardian,Did gerrymandering keep Republicans from a bigger majority? Absolutely not | David Daley,"Mike Johnson has an explanation for why the Republican majority is so thin – and it’s misleading and cynicalMike Johnson, the House Speaker, will soon have the challenge of leading a three-seat Republican majority. He has an interesting theory about why the Republican edge will be so slender. Last week, on Fox News, he blamed Democratic gerrymandering.While it’s always a delightful surprise to hear a Republican leader express concern about the evils of gerrymandering, Johnson has the facts and the math completely backwards.David Daley is the author of the new book Antidemocratic: Inside the Right’s 50-Year Plot to Control American Elections as well as Ratf**ked: Why Your Vote Doesn’t Count Continue reading...","Thu, 12 Dec 2024 11:00:15 GMT",0.0,0.5574
The Guardian,Why birdsong matters more than you think | Natalia Zielonka and Simon Butler,"Our natural soundscapes are falling silent as bird populations decline. To improve our lives, we must invest in conservationImagine you’re walking across rolling hills that stretch for miles, with warm sunshine and the chirping of birds all around.This peaceful and serene scene is an increasingly rare one in the modern world.It goes to show how important nature is for humanity on so many levels and hopefully a study like this supports more investment and help in retaining as well as improving our natural soundscapes. Continue reading...","Thu, 12 Dec 2024 05:00:09 GMT",0.0258,0.9853
The Guardian,Nicola Jennings on the fall of Bashar al-Assad – cartoon,Continue reading...,"Wed, 11 Dec 2024 16:20:56 GMT",0.0,0.0
The Guardian,It’s not bigotry to worry about migration – the latest figures tell a complex story | Larry Elliott,"Large parts of Britain would not function without migrants, but there are consequences for housing, GDP and productivityRecord NHS waiting lists. Flatlining living standards. Rising levels of long-term sickness. The dire state of the public finances. The list of problems inherited from the Conservatives by Keir Starmer is long, but near the top is how to respond to record levels of net migration.According to official estimates released last month, the past three years have seen almost 2.4 million more people arrive in the UK than have left. Over the centuries, inward migration has been a feature of this country’s history, but the speed and scale of the recent increases are new. In the 1960s and 1970s, emigration tended to be higher than immigration and it has only been in the past quarter of a century that net migration began its upward trend. By way of comparison, net migration in the three years leading up the Brexit vote in 2016 stood at 865,000.Larry Elliott is a Guardian columnistDo you have an opinion on the issues raised in this article? If you would like to submit a response of up to 300 words by email to be considered for publication in our letters section, please click here. Continue reading...","Wed, 11 Dec 2024 17:37:57 GMT",0.3412,-0.1306
The Guardian,The Guardian view on Labour and prisons: sustained courage is needed for rational reform,"Circumstances have forced the government into a more rational penal policy but it will take time to show resultsConvicted criminals do not rank high on most voters’ list of candidates for generous government spending. As a result, the prisons budget has historically been a soft political target for cost savings. The people most affected in the short term have little impact on public debate. Prisoners can’t vote. In the longer term derelict, overcrowded jails accelerate recidivism, exacerbate drug and mental health problems and incubate hardcore criminality. That has an impact far beyond prison walls, upsetting a wider swathe of the electorate and placing a heavier burden on the exchequer. Skimping on justice is the definition of a false economy.This is something Sir Keir Starmer, as a former director of public prosecutions, understands. There are encouraging signs that his government is serious about repairing the neglect and wanton damage done in this area by the Conservatives. Continue reading...","Thu, 12 Dec 2024 18:00:23 GMT",0.4939,-0.9775
The Guardian,The Guardian view on the Murdoch family drama: mogul’s death could imitate art,"Events in a US court reveal a story that rivals HBO’s Succession with a patriarch’s waning control, sibling rivalries and a media empire at stake“All happy families are alike; each unhappy family is unhappy in its own way,” begins Leo Tolstoy’s novel Anna Karenina. This is an appropriate lens to view Rupert Murdoch’s semi-public family feud. This week, it emerged that the media mogul had lost the first round in his legal bid to secure his empire for Lachlan, his eldest son and anointed heir, over his other children – James, Elisabeth and Prudence. More than a power play, it was Murdoch’s final push to secure his rightwing media vision, even at the expense of family unity.The familial strife – driven by blurred lines between business and family, ideological clashes and a patriarch’s weakening grip – exemplifies Tolstoy’s “unique unhappiness”. The Murdochs’ conflicts are shaped by their extraordinary wealth, influence and public scrutiny. The divisions could paralyse corporate decision making, destabilising a media empire with significant repercussions for the culture and politics of the Anglosphere. Continue reading...","Thu, 12 Dec 2024 18:00:24 GMT",-0.5994,0.743
The Guardian,"As an MP, I was right to speak out about Gregg Wallace | Letters","Rupa Huq MP responds to a column by Marina HydeMarina Hyde’s piece (So Labour waded into the Gregg Wallace row. Why don’t they get their own house, parliament, in order?, 3 December) seems to miss the point. It’s not a competition between how bad workplaces can be, and I was pleased that I was also able to use my parliamentary voice to speak out during the “Pestminster”&nbsp;scandal.Part of our job as members of parliament is to expose wrongdoing and speak truth to power. Indeed, as a result of my appearances on radio and TV last week, women who have been victims of Gregg Wallace’s behaviour have come forward via my inbox, and the BBC&nbsp;has at last shared with me a route through which their grievances can be aired. Continue reading...","Wed, 11 Dec 2024 17:56:57 GMT",0.0,-0.4404
The Guardian,Moby-Dick reading marathon pioneers | Brief letters,"Stars reading a whale of a tale | Horrible Histories progenitor | Farage fallouts | For efts’ sakeExcellent to see the proto-modernist-genderqueer-futurist vibes of Moby-Dick being hymned in marathon readings in the US (‘People are rooting for the whale’, 8 December). But just as Melville’s book was first published in London in 1851, so the UK pioneered the first digital marathon, mobydickbigread.com, hosted by the University of Plymouth, entirely free of charge, with Tilda Swinton, David Attenborough, Witi Ihimaera, Benedict Cumberbatch, Musa Okwonga, Cerys Matthews, Stephen Fry, Fiona Shaw and Neil&nbsp;Tennant among the readers, and artworks by Anish Kapoor, George Shaw, Dorothy Cross and Gavin Turk. We read it for you, so you didn’t have to.Philip Hoare and Angela CockayneSouthampton• Your heartwarming editorial on the success of Horrible Histories (6 December) might have made mention of its progenitor (and one of its inspirations?), Sellar and Yeatman’s classic prep school parody of British history, 1066 and&nbsp;All That. Happily, still in print&nbsp;(and still on my shelf).Clyde JeavonsBirchington-on-Sea, Kent Continue reading...","Wed, 11 Dec 2024 17:56:52 GMT",0.0,0.9592
The Guardian,Dejan Kulusevski rescues draw for Tottenham to deny Rangers,"Ange Postecoglou does not seem prone to introspection and rarely succumbs to self doubt but maybe, just maybe, a little part of Tottenham’s manager wishes he had never left Glasgow.Things were so much simpler for the Australian when he was hoovering up trophies during his Celtic tenure. Back then Angeball not merely entertained but pretty much worked and he revelled in putting Rangers in their place. Continue reading...","Thu, 12 Dec 2024 22:22:26 GMT",-0.0258,0.3742
The Guardian,Højlund double seals comeback win for Manchester United over Viktoria Plzen,"Rasmus Højlund’s double secured Manchester United a much-needed 2-1 comeback victory in the Europa League at Viktoria Plzen as Ruben Amorim registered his first away win as head coach.After making a promising start to life as Erik ten Hag’s successor, things were thrown off track as the shock exit of sporting director Dan Ashworth compounded back-to-back defeats to Arsenal and Nottingham Forest. Continue reading...","Thu, 12 Dec 2024 21:14:24 GMT",0.765,0.8402
The Guardian,Ben Stokes puts Ashes on back burner to focus on England’s here and now,"England captain admits he ‘spoke a little too much’ about Australia showdown instead of New Zealand and India TestsEngland are about to complete their busiest year of Test cricket with Ben Stokes encouraged by the overhaul in personnel that has taken place. Although the captain has a small regret from this period: publicly discussing the next Ashes series.
 The third Test against New Zealand that starts in Hamilton on Saturday (10pm Friday UK) will be England’s 17th in 2024, matching only their fixture list in 2016 by way of volume. That year saw a jaded Alastair Cook quit the captaincy but while Stokes called 2024 “a long, tough slog”, the 33-year-old completes it looking personally rejuvenated.The same goes for a side that finished 2023 with an average age of 32 and has since shaved that figure by nearly five years. The retirements of Jimmy Anderson, Stuart Broad and Moeen Ali – plus the decision to move on from Jonny Bairstow – account for much of this shift, while the subsequent arrivals of Gus Atkinson, Brydon Carse, Jamie Smith and Shoaib Bashir have largely vindicated the policy also.
 Ordering an all-time great such as Anderson to step aside at the start of the summer was not straightforward, however, and took some explaining publicly. And it was here where Stokes found himself using the 2025-26 Ashes – and the likelihood a seamer already in his forties would not make it that far – as the overriding justification. Continue reading...","Thu, 12 Dec 2024 18:00:24 GMT",0.0,0.85
The Guardian,Police searching for missing rugby player Tom Voyce find body in river,"Former England player’s car had been found in River AlnBody not formally identified but next-of-kin informedSpecialist officers searching for the missing former England rugby player Tom Voyce have found a body close to where he was swept away while trying to drive across a flood-swollen river, police have said.Concerns were raised for the 43-year-old on Sunday after he failed to return home after being out with friends on Saturday. His Toyota Hilux was later recovered downstream from Abberwick Ford on the River Aln outside Alnwick, Northumberland. Continue reading...","Thu, 12 Dec 2024 16:19:16 GMT",-0.296,-0.4767
The Guardian,Alessia Russo double eases Arsenal to WCL victory against Vålerenga,"Two goals from Alessia Russo helped Arsenal claim a 3-1 win at Vålerenga in the Women’s Champions League to take a big step towards securing top spot in Group C.The Gunners were already guaranteed a quarter-final berth after a narrow victory at home to Juventus last month, but knew three points in Norway would keep alive the prospect of beating current leaders Bayern Munich to first position in the group. Continue reading...","Thu, 12 Dec 2024 20:50:00 GMT",0.3182,0.6858
The Guardian,"Kyle Walker calls for action over ‘vile, racist and threatening’ online abuse","Walker received racist abuse after 2-0 defeat to JuventusMan City player: ‘Instagram need to stop this happening’The Manchester City defender Kyle Walker has called for more to be done to prevent online abuse after he revealed a “vile, racist and threatening” message he received.Walker posted a screenshot of a racially abusive message he received on Instagram following Manchester City’s Champions League loss at Juventus on Wednesday. Continue reading...","Thu, 12 Dec 2024 17:51:18 GMT",-0.8481,-0.9756
The Guardian,Eddie Jordan reveals he was diagnosed with ‘aggressive’ cancer earlier this year,"Former F1 team owner has bladder and prostate cancerJordan, who is 76, discussed diagnosis on his podcastEddie Jordan has revealed he was diagnosed with an “aggressive” form of cancer earlier this year. The former Formula One team owner said he suffered with bladder and prostate cancer which spread to his spine and pelvis.The 76-year-old, who ran his own team between 1991 and 2005, before continuing to work in the sport as a broadcaster, is also the manager of F1 designer Adrian Newey. Jordan compared his condition to the six-times Olympic track cycling champion, Sir Chris Hoy, who revealed in October he was terminally ill with prostate cancer. Continue reading...","Thu, 12 Dec 2024 13:56:33 GMT",-0.6597,-0.8979
The Guardian,Chelsea cruise to victory against Astana as Maresca turns to youth,"Chelsea confirmed passage to the last 16 of the Conference League with a 3-1 win against Astana in Kazakhstan as Enzo Maresca handed full debuts to two academy graduates.Defender Josh Acheampong, 18, and 19-year-old midfielder Samuel Rak-Sakyi each played for the club at under-eight level and enjoyed comfortable first starts in the senior team, as the visitors triumphed in temperatures of around minus 10 in the Kazakh capital Almaty. Continue reading...","Thu, 12 Dec 2024 18:09:45 GMT",0.0,0.9432
The Guardian,‘Forever chemical’ found in mineral water from several European countries,"Contamination thought to stem from the heavy application of pesticides containing TFA, a type of PFASMineral water from several European nations has been found for the first time to be contaminated with TFA, a type of PFAS “forever chemical” that is a reproductive toxicant accumulating at alarming levels across the globe.The finding is startling because mineral water should be pristine and insulated from manmade chemicals. The contamination is thought to stem from the heavy application of pesticides containing TFA, or compounds that turn into it in the environment, which are used throughout the world. Continue reading...","Thu, 12 Dec 2024 12:00:16 GMT",0.0,-0.0516
The Guardian,"Is it clouds, shipping or a volcano? Scientists present potential reasons for record heat","Climate researchers share theories behind apparent surge, though none have a full understanding yet of what has happenedScientists are still puzzling over the reasons behind a streak of unexpected, record heat that scorched 2023 and into this year, sparking fears that the climate crisis could be moving faster than previously thought.Is it the clouds? Or shipping? Or maybe a huge volcanic eruption? Continue reading...","Thu, 12 Dec 2024 11:00:15 GMT",0.0,-0.6046
The Guardian,"TikTok’s annual carbon footprint is likely bigger than Greece’s, study finds","Average user generates greenhouse gases equal to driving an extra 123 miles in gasoline-powered car a year, data showsTikTok’s annual carbon footprint is probably larger than that of Greece, according to a new analysis of the social media platform’s environmental impact, with the average user generating greenhouse gases equivalent to driving an extra 123 miles in a gasoline-powered car each year.Estimates from Greenly, a carbon accounting consultancy based in Paris, place TikTok’s 2023 emissions in the US, UK and France at about 7.6m metric tonnes of carbon dioxide equivalent (CO2e) – higher than those associated with Twitter/X and Snapchat in the same region. Continue reading...","Thu, 12 Dec 2024 12:00:18 GMT",0.0,0.0
The Guardian,"Housebuilders supply only half of promised nature-friendly features, survey finds","Developers in England deliver 53% of features such as trees and bird boxes demanded in planning permissions, study saysNearly half of the nature-friendly enhancements promised by developers building new homes have failed to materialise, according to a study of almost 6,000 new houses.Developers are failing to keep legally binding pledges to boost wildlife when building new homes, according to the survey by University of Sheffield academics for Wild Justice. Continue reading...","Thu, 12 Dec 2024 00:01:03 GMT",0.3612,-0.4404
The Guardian,Some jury trials may be scrapped in England and Wales as court backlog hits record high,"Review led by Sir Brian Leveson will consider creating ‘intermediate courts’ heard by judge in bid to speed up trialsCourts in crisis – what it means for claimants, the accused and justice system as a wholeJury trials could be abandoned for some criminal cases in England and Wales under a radical overhaul proposed by ministers as the crown courts backlog hit a record high.A review, to be led by the former high court judge Sir Brian Leveson, will consider creating “intermediate courts” where cases could be heard by a judge flanked by magistrates, in an attempt to speed up the length of trials. Continue reading...","Thu, 12 Dec 2024 16:44:29 GMT",0.0,-0.7096
The Guardian,NHS warns of 'tidal wave' of flu as hospital cases rise 70% in England,"Number of hospital beds occupied by patients with flu has increased by 70% in a week, with norovirus, RSV and Covid-19 all forecast to riseThe number of hospital beds in England occupied by patients with flu has increased by 70% in a week, NHS England said, as it warned of a “tidal wave of flu hitting hospitals”.Health leaders said that people eligible for their free flu jab should get vaccinated as soon as possible to avoid “festive flu”. Continue reading...","Thu, 12 Dec 2024 10:52:09 GMT",-0.4588,-0.7096
The Guardian,Police hunt for culprits after Christmas lights damaged in five Suffolk villages,"Inflatable Santa Claus punctured and wires on Christmas lights cut in spate of Scrooge-like incidentsAn inflatable Santa Claus was punctured and wires on Christmas lights were cut in a spate of Scrooge-like incidents of criminal damage in five Suffolk villages.Officers are appealing for information about at least a dozen reported incidents that they believe are linked, and which happened between the evening of 5 and 6 December. Suffolk police said no arrests had been made. Continue reading...","Thu, 12 Dec 2024 18:57:28 GMT",-0.4404,-0.8123
The Guardian,"Housing must take priority over nature, says Starmer in green belt reform plan","Councils given mandatory targets to deliver 370,000 homes a year in England, including through review of green belt boundariesExplained: What does Labour’s shake-up of planning rules involve?Homes must have a higher priority than nature and the environment, the prime minister said, as ministers outlined reforms that could allow more building on England’s green belt.A shake-up of planning rules revealed on Thursday means councils have been given mandatory targets to deliver a total of 370,000 homes a year. Continue reading...","Thu, 12 Dec 2024 16:54:41 GMT",0.0,0.3612
The Guardian,Barrister cleared of misconduct after criticising 'boys' club' attitude in legal profession,"Dr Charlotte Proudman had faced disciplinary tribunal over Twitter thread criticising a ruling in a case she worked onA barrister has attacked misogyny in the legal profession after a misconduct case brought against her for calling out a “boys’ club” attitude was thrown out.Dr Charlotte Proudman, who specialises in family law and is also a women’s rights campaigner, had faced a Bar Standards Board (BSB) disciplinary tribunal over a Twitter thread criticising a ruling in a case she worked on. Continue reading...","Thu, 12 Dec 2024 13:44:38 GMT",-0.2023,-0.7845
The Guardian,Rotherham rioter who tried to burn down asylum seeker hotel jailed for nine years,"Sentence for Levi Fishlock was joint highest passed down so far for the nationwide disorder over the summerA rioter who tried to set fire to a hotel housing asylum seekers has been jailed for nine years – the joint highest sentence passed down so far for the nationwide disorder over the summer.A judge told Levi Fishlock that he “played a part in almost every aspect of the racist mob violence on that terrible day in August”, calling him a prominent figure in the disorder outside the Holiday Inn Express at Manvers, Rotherham, on 4 August. Continue reading...","Thu, 12 Dec 2024 12:01:10 GMT",-0.4939,-0.9618
