broadcast,title,description,pub_date,title_sentiment_score,description_sentiment_score
The Guardian,The 50 best albums of 2024: 50-11,"Nick Cave rediscovers his lust for life, Ariana Grande embraces new love, and Kneecap raise a Republican ruckus, as we continue the countdown of the year’s best albums• More on the best culture of 2024*** Continue reading...","Tue, 10 Dec 2024 14:00:16 GMT",0.6369,0.9274
The Guardian,I can afford my life. Why can’t I be less anxious about money?,"Being self-employed, I am familiar with my bank account’s ebbs and flows. My worries about money aren’t entirely rooted in realityBeing self-employed, I am familiar with my bank account’s ebbs and flows: the relief of invoices being paid, the dismay as bills drain it again. My vigilance, frequently verging on anxiety, never goes away.What I find in my bank app has the power to influence my day, and whether I feel a lightness of step or a cloud overhead. Continue reading...","Tue, 10 Dec 2024 13:00:13 GMT",-0.1796,-0.4939
The Guardian,"Memo to the Assads: Putin may welcome you in Moscow, but I wouldn't drink his tea | Marina Hyde","The Russian leader may be a warm and attentive host: he may also be cross that Assad is now his problem. But then life’s full of uncertainty, isn’t it? It’s fair to say the TV show Schitt’s Creek would have been a lot less funny had it concerned the family of a deposed dictator rather than the family of an embezzled video store mogul. Even so, it’s a strange but undeniable fact that when toddlers are stumbling out of dungeons, and the unspeakable horrors of the former Syrian regime are still being revealed, a significant part of the human impulse is to thirst for details of the dreadful Assad family’s new lives in Moscow, then remark tartly: “Well, they’ve gone down in the world.” And of course, the Assads may yet plunge further – for all the overly impressed reports of apartments in glittering Moscow skyscrapers, I must say I’d have picked something on the ground floor myself.For now, Syrian refugee Bashar al-Assad might be telling himself that if Vladimir Putin has offered him asylum, he can’t possibly be angry with him for putting Russia’s unrivalled network of military bases in Syria at serious risk. In which case, it’s possible Bashar is about to go on a journey of discovery as long as the Trans-Siberian railway. Then again, it could be much, much shorter. But perhaps Assad’s comfortable with limbo. He has, after all, spent the past two decades apparently unable to decide whether he is or isn’t growing a moustache. Follically speaking, I guess he now finally has time to pick a lane. Or, as I say, doesn’t have time. For while the man who used chemical weapons against his own people may be physically located in Moscow, in security terms, and for the rest of his entire life, he cannot be at all clear where he stands.Marina Hyde is a Guardian columnistDo you have an opinion on the issues raised in this article? If you would like to submit a response of up to 300 words by email to be considered for publication in our letters section, please click here. Continue reading...","Tue, 10 Dec 2024 13:39:09 GMT",0.25,0.6652
The Guardian,Storm Darragh showed me how unprepared my family – and Britain – are for disaster | Gaby Hinsliff,"After just 12 hours without power, we were cold, isolated and facing the fact that everyday life is far more precarious than it seemsIt was the cold that woke me up. Some time in the early hours of Saturday, as Storm Darragh blasted through our bit of rural Oxfordshire, the power lines had come down; by the time the central heating would otherwise have been firing up, the house was decidedly arctic.The novelty of lighting candles, chopping firewood and making coffee on a sputtering camping stove carried everyone through the first few hours. But by mid afternoon frontier spirit was palpably waning, along with everyone’s phone batteries. By early evening there wasn’t much to do except agree that obviously we have it easy compared with Ukraine – now in its third icy winter of Russia using attacks on domestic power infrastructure as an extra weapon of war, which puts this minor domestic inconvenience into perspective – and that our digitised lives have become quite madly, recklessly vulnerable to a sudden loss of power.Gaby Hinsliff is a Guardian columnist Continue reading...","Tue, 10 Dec 2024 10:00:18 GMT",-0.6249,-0.9358
The Guardian,"Jubilation, gunfire, mourning – on the streets of Damascus, Syrians are facing the reality of life after Assad | Danny Makki","As I spoke to locals, the mood was one of relief – but there are countless tales of loved ones who are not here to help celebrateIn the end, there was no great battle for Damascus, no gruelling siege of the kind we have become accustomed to in Syria’s brutal 13-year civil war. It was just an army that melted away and a fleeing president that brought the more than 50-year-long Baathist dictatorship to an end.As Syrians continue to gather to celebrate around Umayyad Square, a new dawn in the country has begun. Further challenges are to come, but for the time being, Syrians can breathe easier. I am a Damascus-based journalist who has been speaking to people on the ground in Syria’s freed capital city as they grapple with their new reality. Continue reading...","Tue, 10 Dec 2024 08:00:35 GMT",-0.4404,0.7505
The Guardian,Martin Rowson on the aftermath of Bashar al-Assad’s fall in Syria – cartoon,Continue reading...,"Tue, 10 Dec 2024 16:48:23 GMT",0.0,0.0
The Guardian,Who’s the most basic person on the internet? A court will have to decide between these two beige influencers | Arwa Mahdawi,"Sydney Nicole Gifford has accused rival Alyssa Sheil of copying her bland style, in a $150,000 lawsuit over lost income and ‘mental anguish’. What’s behind this race to the bottom?Sydney Nicole Gifford, a 24-year-old lifestyle influencer, was busy being her most authentic self when her carefully curated world suddenly shattered. One of her followers had contacted her with terrible news: someone had stolen her vibe.What does this even mean? Well, that’s the question at play in what may be the saddest, beigest (and possibly most important) lawsuit in influencer history. Gifford, you see, is aggressively fond of neutrals. She likes wearing shades of white, black and cream, and lives in an incredibly organised house where her minimalist decor is also shades of white, black and cream. She reviews Amazon products that fit what is known as the “clean girl” aesthetic and, when her followers buy stuff from her affiliate links, she makes a commission from the sale.Do you have an opinion on the issues raised in this article? If you would like to submit a response of up to 300 words by email to be considered for publication in our letters section, please click here. Continue reading...","Tue, 10 Dec 2024 17:39:53 GMT",0.0,-0.8098
The Guardian,"Video is AI’s new frontier – and it is so persuasive, we should all be worried | Victoria Turk","I tried Sora, OpenAI’s new tool, and it just left me sad. Are we ready for a world in which we can never tell what is real?I recently had the opportunity to see a demo of Sora, OpenAI’s video generation tool which was released in the US on Monday, and it was so impressive it made me worried for the future. The new technology works like an AI text or image generator: write a prompt, and it produces a short video clip. In the pre-launch demo I was shown, an OpenAI representative asked the tool to create footage of a tree frog in the Amazon, in the style of a nature documentary. The result was uncannily realistic, with aerial camera shots swooping down on to the rainforest, before settling on a closeup of the frog. The animal looked as vivid and real as any nature documentary subject.Yet despite the technological feat, as I watched the tree frog I felt less amazed than sad. It certainly looked the part, but we all knew that what we were seeing wasn’t real. The tree frog, the branch it clung to, the rainforest it lived in: none of these things existed, and they never had. The scene, although visually impressive, was hollow.Victoria Turk is a London-based journalist covering technology, culture and society Continue reading...","Tue, 10 Dec 2024 14:55:35 GMT",-0.296,0.8874
The Guardian,The latest cost of Brexit is about to hit – and voters are watching. Will Labour act? | Polly Toynbee,"New EU trade regulations will cause further pain for the UK. Starmer’s talk of breaking down barriers must be more than warm words“It’s done! Get over it! It’s eight years ago! We’re independent and we’re free!” claimed Nigel Farage on Question Time last week. But the louder he asserted it, the less convinced he sounded. Watch the Brexit that made him becoming an albatross, as it is for the Tories.This week’s new set of EU trade regulations hammering Britain’s smaller exporters is proof that it isn’t over, but forever adding to our economic woes. From Thursday, general product safety regulations (GPSR) will apply to a huge new range of products. The Federation of Small Businesses (FSB) warns: “The GPSR will be a real barrier to trade.” Exporters will need an agent within the EU or Northern Ireland, costing at least €150 an item a year. “I only found out when eBay said they’d only take GPSR products from this week,” says Noel Humphrey. His company, Electron Electronics, manufactures, sells and trades in small electrical parts. “It will cost me an extra £25 for each soldering iron I sell. If we were still in the EU, this would be no problem,” he says. “And we’d be at the table that makes these rules.” Electron may give up exporting.Polly Toynbee is a Guardian columnist Continue reading...","Tue, 10 Dec 2024 06:00:35 GMT",0.0,0.4797
The Guardian,‘Loaded for bear’? Online puzzles are puzzling enough without all this American lingo | Zoe Williams,"I’ve been doing Wordle-style games for so long that I’ve assimilated US spellings and phrases. Honestly, it’s enough to make you a Monday morning quarterbackTake our UK v US spelling quiz!When Wordle first landed, more than three years ago, a lot of Britons complained, bitterly, about the American spellings, taking to social media to rage that there was no such word as “favor” and what fresh illiteracy was this? Very gradually, we just adapted. They had to choose one dictionary; who says it had to be ours? Especially given that Wordle is now owned by the New York Times.Nowadays, I deliberately forget how to spell “colour” – not just for Wordle, but also for Quordle (which is basically four Wordles at once) – so often that I have given up even wishing for something different. But then I added the NYT’s Connections (a grid of 16 words that you have to sort into four categories) to my morning puzzling roster. Never mind the spellings – now I have to look up American types of cracker, women’s national basketball teams, slang terms for “loo”. Continue reading...","Tue, 10 Dec 2024 11:00:11 GMT",0.0,-0.6251
The Guardian,The Guardian view on Trump’s threat to the media: time to pass the Press Act,"Bipartisan legislation offers historic protections for journalists, banning secret surveillance and ensuring source confidentialityFears of a press crackdown under Donald Trump’s second term deepened with his nomination of Kash Patel as FBI director – given his calls for retribution against journalists. Yet a rare chance to protect press freedom has emerged. The bipartisan Protect Reporters from Exploitative State Spying (Press) Act, the strongest press freedom legislation in US history, is on the brink of a vote. While President-elect Trump has urged Republicans to block it, the Senate could still deliver it to Joe Biden before the lame-duck session ends in January.The Press Act would ban secret government demands for journalists’ communications from tech giants such as Google or Verizon and protect reporters from jail for refusing to reveal sources. For investigative reporters to do their jobs – holding government officials to account for corruption and wrongdoing – they need to be able to protect the confidentiality of their sources. With courts recently weakening already-imperilled “reporter’s privilege” protections, this bill would finally give journalists in the US federal protections comparable to those afforded to other relationships where confidentiality is paramount, such as lawyers and clients, doctors and patients, and spouses.Do you have an opinion on the issues raised in this article? If you would like to submit a response of up to 300 words by email to be considered for publication in our letters section, please click here. Continue reading...","Tue, 10 Dec 2024 18:40:44 GMT",-0.5267,0.9419
The Guardian,The Guardian view on the EU-Mercosur trade deal: another farmer flashpoint approaches | Letters,"Ursula von der Leyen, the European Commission president, has taken a political risk in signing off an agreement with Latin American countriesAnticipating the strong protectionist winds that will blow from Donald Trump’s White House, the president of the European Commission, Ursula von der Leyen, has been responding by making her own economic weather. Last week, Ms von der Leyen flew&nbsp;to&nbsp;Montevideo, 5,000 miles south of Washington DC, to controversially conclude negotiations in one&nbsp;of&nbsp;the biggest free trade agreements in history. Twenty-five years in the making, the Mercosur trade deal opens&nbsp;up trade between the EU and a Latin&nbsp;American bloc of partners comprising Argentina,&nbsp;Brazil, Paraguay&nbsp;and Uruguay.In theory, the agreement promises a more open market of 700 million people for products ranging from Argentine beef to German cars. For European manufacturers, it would eliminate tariffs on a majority&nbsp;of goods. As Mr Trump threatens to impose heavy tariffs on Chinese and European exports, here was evidence, asserted Ms von der Leyen, “that openness and cooperation are the true engines of progress and prosperity”.Do you have an opinion on the issues raised in this article? If you would like to submit a response of up to 300 words by email to be considered for publication in our letters section, please click here. Continue reading...","Tue, 10 Dec 2024 18:40:02 GMT",0.0,0.9563
The Guardian,Men must be held accountable for their bad behaviour | Letters,"Readers respond to Mary Ann Sieghart’s piece on why some men behave badly following revelations about the TV presenter Gregg WallaceMary Ann Sieghart (Why do some men behave badly? I think I have the answer, 6 December) argues that one of the main reasons why some men behave inappropriately is because of a power imbalance. She cites research evidence that a sense of male superiority and entitlement starts early – in parental attitudes and teacher behaviour. I found her arguments partly, but not totally, convincing. The studies she cites about gender socialisation and classroom interaction have been around since the 1980s (eg&nbsp;Dale&nbsp;Spender and Elizabeth Sarah’s Learning to Lose: Sexism and Education, 1980), including my own research. It’s pretty depressing that little has changed since then.But while these findings may help to explain why many women still face problems in career progression – and why women in junior positions may hesitate to highlight men’s sexist behaviour – I&nbsp;don’t think they explain why some men engage in outrageous sexual&nbsp;harassment. Continue reading...","Tue, 10 Dec 2024 18:12:56 GMT",-0.5423,-0.885
The Guardian,Is France’s Fifth Republic past its sell-by date? | Letter,"Steve Brown on the political crisis in France after the fall of Michel Barnier’s coalition governmentYour article (France in political crisis after no-confidence vote topples government, 4 December) accurately reports the events immediately surrounding the vote of no confidence in Michel Barnier’s coalition government. But apart from the observable mediocrity of many of the key players – at least two former prime ministers seem to have become rather economical with the truth concerning what laws can actually be passed before the end of this calendar year, or next year, by an incoming government – other elements&nbsp;help&nbsp;explain the crisis.The main factor is that the current result is the outcome of the party system, which is itself a direct consequence of the voting system. Holding the legislative elections over two rounds, with parties obtaining more than 12.5% of the local electorate allowed to run in the second round, tends to favour many parties, each led, obviously, by an ambitious politician. Continue reading...","Tue, 10 Dec 2024 17:47:54 GMT",0.0,0.9451
The Guardian,Slot unhappy despite Salah sinking Girona to make it a perfect six for Liverpool,"Liverpool’s perfect Champions League continued and a new record was completed with a sixth win and a fifth clean sheet. Arne Slot’s side have now not conceded since the third minute of the opening night at San Siro, their best ever run in Europe. They also have their goalkeeper back, and on a cold night at Montilivi those things were related. Mohamed Salah’s penalty secured a 1-0 victory against Girona, but this was also about Alisson who made five saves on his return to help virtually secure a place in the last 16 with two matches to spare.If the record is perfect, the performance was not. “If you ask me about all the six games, I’m really pleased with all the results,” he said. “I’m really pleased with the five games, the way we played. I am far from pleased about the performance tonight.” Continue reading...","Tue, 10 Dec 2024 20:03:07 GMT",0.2263,0.9883
The Guardian,Ross Barkley’s lucky break edges Aston Villa past Leipzig in five-goal thriller,"After Jhon Durán scored, with another ludicrously powerful strike, he celebrated by showing the Aston Villa supporters the palms of his hands, as if to say: “Calm down, what else did you possibly expect?” Perhaps it explains why Unai Emery, hands in the pockets of his long black puffer coat, was unmoved. Another substitute, Ross Barkley, ultimately earned victory with stoppage time looming, however, after RB Leipzig twice pegged Villa back, Loïs Openda and Christoph Baumgartner cancelling out goals by John McGinn and that dreamy strike from Durán.Villa supporters crooned Emery’s name throughout and his changes proved inspired. Durán made another timely contribution and Barkley scored within two minutes of replacing Youri Tielemans. Barkley took aim from the edge of the box and his right-foot shot took a wicked deflection off the Germany defender Lukas Klostermann, wrongfooting the goalkeeper Peter Gulacsi, to push Villa up to third. With a trip to Monaco and a home game against Celtic remaining in the league phase, Villa are in a fine spot to make a play for the top eight. Continue reading...","Tue, 10 Dec 2024 22:03:33 GMT",0.4939,0.9186
The Guardian,FA warned to avoid protest at meeting unless boycotting Saudi Arabia World Cup,"Saudi Arabia will host 2034 men’s World CupFA yet to disclose how it will approach voteThe Football Association board has been warned by voices in internal discussions to avoid protesting at Wednesday’s meeting that will confirm Saudi Arabia as host of the 2034 men’s World Cup, unless it is willing to boycott the tournament.Saudi Arabia will formally win the right to stage the World Cup at a virtual meeting of the 211-member Fifa congress. On Tuesday there remained a lack of clarity about the process, despite Saudi Arabia being the only bidder, with uncertainty among member nations as to whether they will be given a chance to vote or simply to approve the bid by acclamation, a collective round of applause. Continue reading...","Tue, 10 Dec 2024 19:09:05 GMT",-0.7906,-0.5574
The Guardian,"Tom Voyce, former England rugby player, presumed dead after car swept away","Tom Voyce, 43, is believed to have died after going into the River Aln in his car, Northumbria police have saidThe former England rugby union international Tom Voyce, 43, is believed to have died after going into the River Aln in his car, Northumbria police have said.The force said officers received a report on Sunday morning that Voyce, who played for clubs including Bath and Wasps, had not returned home after an evening with friends. ­Northumbria police said it is believed he attempted to cross Abberwick Ford in his car, which was then pulled along with the current of the river. The car has since been recovered but officers did not find Voyce and it is believed he was swept away while attempting to escape and has died. Continue reading...","Tue, 10 Dec 2024 17:27:26 GMT",-0.6486,-0.128
The Guardian,Bellingham gives Atalanta too much to do as Real Madrid show they are back,"Rumours of Real Madrid’s imminent Champions League demise had, it turns out, been exaggerated. So had suggestions Kylian Mbappé makes a poor fit for Carlo Ancelotti’s side if an emphatic opening goal is anything to go by, although his later departure with an injury means the question marks will linger. Ultimately the holders could feel relieved at hauling themselves back into contention for an automatic knockout spot and the fact Atalanta, intense and vibrant to the last, were cheered off in defeat said everything about the tenor of a pulsating evening.It ended with Mateo Retegui volleying over from point-blank range, although a likely offside spared his blushes. The home side would have deserved to extend a 14-game unbeaten run that stretched to late September. Everyone leaves this rebuilt venue, the most cutting-edge in Italy but still dreamily atmospheric, knowing they have been in a game and Real were taken the distance. Atalanta should still reach the last 16 one way or another and there was a sense, as the teams walked off, that they may meet again soon with more at stake. Continue reading...","Tue, 10 Dec 2024 22:13:36 GMT",0.0,0.5574
The Guardian,Championship roundup: Dan James marks milestone as Leeds return to top,Gnonto also on target in 3-1 win against MiddlesbroughSunderland grab late equaliser to peg back Bristol CityDan James marked his 100th Leeds appearance with a crucial goal as his side beat Middlesbrough 3-1 at Elland Road to regain top spot in the Championship.James fired home in the second half after Max Wöber’s own goal had cancelled out Wilfried Gnonto’s opener. Brenden Aaronson added Leeds’s third in added time. Continue reading...,"Tue, 10 Dec 2024 23:06:38 GMT",0.5719,-0.0
The Guardian,Aston Villa Women consider the future of manager Robert de Pauw,"Dutchman has won just one of nine league gamesDe Pauw did not take training session on TuesdayAston Villa are considering the future of their women’s first-team manager, Robert de Pauw, the Guardian understands.Following Sunday’s 4-0 defeat away at Arsenal in the Women’s Super League, the Midlands club are currently ninth in the table and one point above the relegation zone. De Pauw has overseen one victory in his first nine league fixtures in English football. Continue reading...","Tue, 10 Dec 2024 23:16:31 GMT",0.0,0.6808
The Guardian,Tim Southee’s awkward final chapter comes full circle with England Test,"New Zealand bowler leaves Test cricket with a long list of accolades but there are doubts about his role in HamiltonTim Southee and Test cricket say farewell to each other this coming week and whether selected or not – a hot topic here – any guard of honour will be a deserved one. Starting and finishing against England is a neat way for his 16 years with New Zealand to come full circle, too, as is his domestic home, leafy Seddon Park in Hamilton, playing host.Cricketers are more than just numbers but for the farm boy from Waiotira on the North Island, one of four sport-mad siblings rarely to be found indoors, they are still worth repeating. Southee sits second only to Sir Richard Hadlee for Test wickets by a New Zealander, 389 to the knight’s 431. In the three-format men’s era, 774 wickets combined make him their No 1, as well as 10th in the world overall. Continue reading...","Tue, 10 Dec 2024 19:00:25 GMT",-0.1531,0.8922
The Guardian,"Ministers must reassure consumers feeding cattle Bovaer is safe, says Lady Sheehan","Government should point to evidence of FSA licensing of additive, says chair of environment and climate change committeeThe government must urgently reassure consumers that feed additives given to cattle to reduce methane emissions are harmless, and a vital tool in tackling the climate crisis, the chair of an influential parliamentary committee has warned.Lady Sheehan, chair of the environment and climate change committee of the House of Lords, called on ministers to step up as a row has blown up over the prospective use of the additive Bovaer in British dairy herds supplying Arla, the dairy company. Continue reading...","Tue, 10 Dec 2024 05:00:34 GMT",0.6486,0.5267
