broadcast,title,description,pub_date,title_sentiment_score,description_sentiment_score
The Guardian,Nick Clegg has sold almost $19m in Meta shares since joining Facebook in 2018,"Former UK deputy prime minister, who still has about $21m worth, is leaving role as president of global affairsNick Clegg made almost $19m from the sale of shares in Meta during his six-year term at the owner of Facebook, Instagram and WhatsApp, filings show.The former British deputy prime minister had sold $18.4m (£14.8m) worth of shares in the group before announcing on Thursday that he was leaving his role as its president of global affairs and communications. Continue reading...","Fri, 03 Jan 2025 18:06:16 GMT",0.296,0.7351
The Guardian,"Nigel Farage ‘very pleased’ Elon Musk backs Reform UK, calling him a ‘hero’","Speaking at party conference, its leader calls reports of tech mogul’s potential $100m donation ‘somewhat overexaggerated’Nigel Farage has hailed Elon Musk as a “hero” and said he was “very pleased he’s backing our party”, but he called reports that the tech mogul was preparing to donate $100m (£80m) to Reform UK “somewhat overexaggerated”.Speaking at Reform’s East Midlands conference on Friday night, the party leader said Musk’s efficiency plan for Donald Trump’s government was the “blueprint we need” as he called for a “complete change of culture in Britain”. Continue reading...","Fri, 03 Jan 2025 22:09:15 GMT",-0.0516,0.8779
The Guardian,Football coaches could soon be calling on AI to scout the next superstar,"Technologists claim managers could wish for specific player attributes and AI would suggest perfect youth prospectFootball coaches desperate to boost their team’s performance could soon find an answer in an artificial intelligence system aimed at conjuring the next superstar.A kind of sporting Aladdin’s lamp is within reach, technologists claim, which could allow managers to simply wish for a new player with the aggression of Erling Haaland or the poise of Jude Bellingham and for an AI to suggest the perfect prospect. Continue reading...","Sat, 04 Jan 2025 09:00:44 GMT",0.0,0.9442
The Guardian,Thousands of rival protesters rally in Seoul after Yoon Suk Yeol avoids arrest,"Crowds gather outside South Korean presidential residence where suspended leader is protected by security officersThousands of rival South Korean protesters have rallied in the capital a day after a failed attempt to arrest the country’s suspended president, Yoon Suk Yeol, for imposing a short-lived martial law decree that led to his impeachment.The country has been plunged into political chaos since last month, with Yoon defiantly holed up in the presidential residence surrounded by hundreds of loyal security officers who have so far resisted efforts by prosecutors to arrest him. Continue reading...","Sat, 04 Jan 2025 15:24:02 GMT",-0.6124,-0.5859
The Guardian,"World’s oldest person, Tomiko Itooka, dies in Japan aged 116","Itooka, who died at a care home in Ashiya, enjoyed bananas and had been a keen mountain climberA Japanese woman who was the world’s oldest living person has died at the age of 116.Tomiko Itooka, who was awarded the Guinness World Record status last year, died on 29 December at a care home in Ashiya, Hyogo prefecture in central Japan. Continue reading...","Sat, 04 Jan 2025 15:08:10 GMT",0.0,0.4767
The Guardian,"Bono, Anna Wintour and Jane Goodall receive Presidential Medals of Freedom","Joe Biden awards highest civilian honour to 19 people for ‘exemplary contributions to prosperity, values or security of the US’The U2 frontman Bono, the editor-in-chief of Vogue, Anna Wintour, and the British conservationist Dame Jane Goodall are to receive the Presidential Medal of Freedom, the highest US civilian honour.Joe Biden will drape medals on Saturday around the necks of 19 people from the world of politics, sports, entertainment and other fields for “exemplary contributions to the prosperity, values or security of the United States, world peace, or other significant societal, public or private endeavours”. Continue reading...","Sat, 04 Jan 2025 16:09:38 GMT",0.6369,0.9862
The Guardian,Asian American woman sues PayPal for racial bias in investment program,"Nisha Desai is part of growing conservative push to curtail diversity, equity and inclusion initiatives in corporate USPayPal has been sued by an Asian American businesswoman who accused the digital payments company of racial bias for restricting part of a $535m investment program to Black and Hispanic applicants, costing her millions of dollars.Thursday’s complaint by Nisha Desai and her New York-based venture capital firm Andav Capital is part of a growing push among some conservatives to curtail diversity, equity and inclusion initiatives in corporate America. Continue reading...","Sat, 04 Jan 2025 19:09:22 GMT",-0.1027,-0.6124
The Guardian,Prince William ‘shocked and saddened’ by death of British man in New Orleans attack,"Edward Pettifer, stepson of princes’ former nanny, was one of 14 killed in New Year’s Day truck attackThe Prince of Wales has said he is shocked and saddened by the death of his former nanny’s stepson in the New Years Day truck attack in New Orleans.Edward Pettifer, 31, was one of 14 people killed when a pickup truck was driven through a crowd in the early hours of New Year’s Day. Continue reading...","Sat, 04 Jan 2025 14:45:08 GMT",-0.7906,-0.9709
The Guardian,Days-long funeral procession for Jimmy Carter begins in south Georgia,"Motorcade with flag-draped casket heads to boyhood home in Plains before moving to Atlanta, then WashingtonJimmy Carter’s long public goodbye began on Saturday in south Georgia, where the 39th US president’s life began more than 100 years ago.A motorcade with Carter’s flag-draped casket is heading to his hometown of Plains and past his boyhood home on the way to Atlanta. The procession began at the Phoebe Sumter medical center in Americus, where former Secret Service agents who had protected the late president served as pallbearers. A mournful train whistle filled the clear air as the pallbearers turned to face the hearse for a final goodbye, their hands on their hearts. Continue reading...","Sat, 04 Jan 2025 17:51:22 GMT",-0.3612,0.4404
The Guardian,Venus rewards stargazers with appearance next to moon,"Second rock from sun visible with naked eye in clear skies in areas with low light pollutionStargazers have been treated to seeing the planet Venus as it made an appearance next to the moon.The second rock from the sun could be seen on Friday night with the naked eye in areas with clear skies and low light pollution. Some were able to take incredible photographs of the morning star, so named because it is often mistaken for a bright star. Continue reading...","Sat, 04 Jan 2025 12:52:36 GMT",0.4767,0.34
The Guardian,Fire at Dallas pet shop kills more than 500 animals,"Animals, mostly birds, die of smoke inhalation in incident at shopping centre in TexasMore than 500 animals have died after a fire broke out in a shopping centre in Dallas.The 579 animals, mostly birds, were in a pet shop at Plaza Latina in the north-west of the Texas city. Continue reading...","Sat, 04 Jan 2025 12:47:07 GMT",-0.7096,-0.9136
The Guardian,Fire at food market in northern China kills eight people and injures 15,"Cause of fire in city of Zhangjiakou in Hebei province is under investigationAt least eight people have died and 15 are injured after a fire broke out at a food market in northern China, according to state media.The fire at the Liguang market in the city of Zhangjiakou broke out at midday on Saturday and had been mostly extinguished two hours later, the Xinhua news agency reported, citing a government official in Qiaoxi district where the market is located. Continue reading...","Sat, 04 Jan 2025 14:52:28 GMT",-0.7096,-0.9524
The Guardian,Syria to resume international flights at Damascus airport,"First commercial flights since overthrow of Assad regime to begin from Tuesday, aviation chief saysSyria’s main airport in Damascus is to resume international flights after commercial trips were halted following the overthrow of President Bashar al-Assad.“We announce we will start receiving international flights to and from Damascus international airport from [Tuesday],” the state news agency Sana reported, quoting Ashhad al-Salibi, the head of the General Authority of Civil Aviation and Air Transport. Continue reading...","Sat, 04 Jan 2025 14:44:39 GMT",0.0,0.0772
The Guardian,How to go vegan: our beginner’s guide to everything from essential supplements to meat alternatives,"What you need to buy to make sure your new year resolution of following a plant-based diet lasts beyond JanuaryWhether you’re doing it for the animals, your health or environmental reasons, there’s never been a better time to go vegan. There’s meatless meat, dairy-free cheese, plant-based liqueurs and, well, anything else you can think of.With more than a decade of veganism under my belt, I’ve tried pretty much every plant-based brand going. I was a full-blown omnivore until the age of 20 though, so I can tell straight away when a new vegan product hasn’t got it right. Below, I cover the must-buy alternatives, from cheese to meat, to the foods that would-be vegans fear they’d miss the most. I’ll also tell you what not to buy. Worried about what supplements you need to take? I spoke to a dietician to find out. Continue reading...","Fri, 03 Jan 2025 16:00:24 GMT",0.0,0.4909
The Guardian,From electric blankets to the cosiest coats: the cold weather essentials you need to beat the big freeze,"As the temperature drops, we’ve rounded up our top winter warmers to help you brave the coldAfter a mostly mild, overcast December, winter has finally arrived. To help you keep warm, especially if you’re reluctant to crank up the thermostat too much, we’ve rounded up some of our best-loved, tried-and-tested products.From slippers to coats, toasty PJs to the best electric heaters and blankets, these should all help you beat the chill, and even stay stylish while doing so. Continue reading...","Fri, 03 Jan 2025 14:03:10 GMT",0.0516,0.9527
The Guardian,"The best running shoes to take you from trail to road to marathon, tried and tested by runners","Whether you’re a beginner runner, a 5k faithful or a track star, our expert-picked running trainers, from Adidas and Asics to Hoka, will help you beat your PBs‘How does anyone do this?” I thought as I hobbled home from my first run, a pair of threadbare Converse biting into my heels. It took me a while to connect the dots. Maybe I was just prone to shin splints? Perhaps your calves were supposed to burn with every stride? Or – lightbulb moment – could it be that these post-jog aches and pains were a symptom of my wildly inappropriate footwear?As with millions of rookie runners before me, my problems melted away when I bought myself a pair of proper running shoes. Fifteen years and countless pairs later, I know just how much difference they can make. However, this isn’t a simple case of one size fits all. Continue reading...","Thu, 02 Jan 2025 12:00:47 GMT",0.6369,-0.4329
The Guardian,January style essentials by Jess Cartner-Morley: from super scarves to all-weather leggings,"How do you reset your wardrobe for the new year? Our fashion guru reveals her hardworking heroes for JanuaryThe bar for shopping recommendations is high at this point of the year. No one has the appetite – or the funds – for shopping for the sake of it in January. Don’t know about you but, frankly, I never want to see another nick-nack. And having overindulged throughout the festive season, I have the sparkle equivalent of a hangover. Just thinking about sequins makes me feel nauseous.So, if I’m going to buy something, or suggest you do, at the dawn of the new year then it is with good reason. Investments in keeping your new year fitness resolutions are worth making because those are promises to yourself. Small treats are sometimes necessary to get you through the darkest days of winter. And, it’s never too early to look for the pieces that will shift your wardrobe into a 2025 vibe: the sooner you start wearing them, the more wear you get out of them. Here are my very best sober, no-sparkle January finds. Continue reading...","Wed, 01 Jan 2025 13:00:14 GMT",0.5994,0.9723
The Guardian,Marlon Brando fury at ‘feeling like a freak’ among revelations in new book of Hollywood secrets,"Brando, Ava Gardner, Anita Ekberg and other A-listers are featured in a memoir about the glamour of the 1950s film industry Marlon Brando was the original angry young man, winning an Oscar for On the Waterfront, Elia Kazan’s movie about union corruption. But anger got the better of him at the 1954 Italian premiere of the film, when he refused to watch it after discovering that his voice had been dubbed, a new book reveals.“Why didn’t somebody tell me I was going to see a dubbed version?” he spluttered in fury in the darkened cinema. His embarrassed agent, who had expected the original English-language version, recalled him “staggering up from his seat as if from a heart attack”, frantically whispering: “Get me out of here!” Continue reading...","Sat, 04 Jan 2025 10:15:37 GMT",-0.296,-0.6177
The Guardian,The week in audio: Today’s guest editors; A Point of View; Monstrosities Mon Amour; Shipping Forecast Day – review,"Radio 4’s Today guest editors ranged from the glum to the glorious, while the station truly excelled in a day-long celebration of the Shipping Forecast at 100Today’s guest editors (BBC Radio 4) | BBC SoundsA Point of View: On Resolutions (BBC Radio 4) | BBC SoundsMonstrosities Mon Amour Substack Shipping Forecast Day (BBC Radio 4) | BBC SoundsThe days around new year offer a lovely, woozy limbo away from normal life – perfect for the comforts of radio. Today’s second post-Christmas guest editor didn’t get the memo. “You previously predicted a 10% chance that AI will lead to human extinction in the next three decades,” said Sajid Javid to 2024 Nobel prize winner Geoffrey Hinton, two days after Christmas. “Ten to 20,” Hinton updated him. The bleak midwinter, indeed. Continue reading...","Sat, 04 Jan 2025 17:00:53 GMT",0.0,0.9796
The Guardian,Marcus Brigstocke: ‘I’ve been in recovery for various addictions all my adult life’,"The comedian on gaining and losing weight, taking two-hour baths, and a sexy dream involving Jimmy CarrBorn in Surrey, Marcus Brigstocke, 51, was the winner of the BBC New Comedy Award&nbsp;in 1996. He is a regular on BBC&nbsp;Radio 4 programmes I’m Sorry I&nbsp;Haven’t a Clue and Just a Minute and&nbsp;he hosts a podcast called How Was&nbsp;It For You? with his wife Rachel Parris. Next month, he starts a UK tour of his new show, Vitruvian Mango. He&nbsp;has three children and lives in&nbsp;London.When were you happiest?Every morning when I go into our three-year-old’s room. He’s so happy to see you, it’s a moment of heaven. Continue reading...","Sat, 04 Jan 2025 09:30:44 GMT",0.0,0.9601
The Guardian,From Edvard Munch to Central Cee: Observer critics choose their cultural highlights for 2025,"From Thom Yorke’s Shakespearean score to 25 years of Tate Modern, Bridget Jones to Leigh Bowery, our writers anticipate the most exciting shows, releases and events of the yearAmerican auteurs return Continue reading...","Sat, 04 Jan 2025 13:00:50 GMT",-0.296,0.5413
The Guardian,"Nikki Amuka-Bird: ‘I just played the prime minister and thought, me? Run the country?’","The actor, 48, talks about missing her charismatic mum, improvising throughout her life, being a pacifist despite everything and learning to use a gunI became an orphan in my 40s, which was a strange and disturbing experience. This year is the eighth anniversary of my mum’s passing, which feels like an interesting time to think: how much have I learned since she died? Growing up, she gave me these great life lessons, which I’ve been applying since she’s not been here. I feel really proud of her, and proud of myself how I’ve handled it.Mum was an incredible woman. She came from a very humble background. It wasn’t until she was dying that I read her secret journals about how tough, neglectful and abusive her childhood had been. But she had this spirit of “I’m going to disregard my limitations and do absolutely everything I can to achieve everything I want to achieve.” She wanted me to be stimulated by culture and beauty and the arts.All my friends wanted to stay at our house because they could have conversations with my mum that they couldn’t have with their own. My mum really invited this idea of free thinking. She was the editor of a Nigerian fashion magazine, so it was quite normal to go into the living room and find an impromptu photoshoot. I remember travelling with her to fashion suit shoots in Brazil, thinking she was the most glamorous thing ever.I feel very lucky to be doing the job I’m doing. Often I’m asked to play characters who feel bigger or stronger than I am; women who might intimidate me in real life. I just played the prime minister in the film Rumours and thought: “Me? Run the country?”I’m a hippy at heart. I can apply myself but the machinations of power terrify me. I’m a pacifist. I’m a glass-half-full person. I believe in humanity at its core, and the importance of putting out positivity in the world. It gets harder, when you read the news and see the state of the world. But I return to these practices about loving your neighbour and doing the best that you can.I used to sell candles in a shop called Angelic on London’s Oxford Street, the year before I went to drama college. Since then, I’ve never done any other type of work than acting. You get to this stage in life and think: “Gosh. Surely I should have some other skills?”One thing I have learned is how to use weapons. What’s terrifying is that you feel this extension from your body. I remember between takes constantly thinking: “Where’s my gun?” It terrifies me how quickly the power of having a gun can corrupt you.I cry when I’m happy as well as when I’m sad. When I feel like I’m really connecting to a particular person in a particularly moment, I think: “God, it’s so great to be alive.”Tragedy and comedy are closely linked. It’s playing the truth, understanding the absurdity that as human beings we should have the answers. Most people would have no idea what to do in a crucial moment and are improvising their whole lives out of their depth. There’s something comforting when you remember that.Rumours is in cinemas now; Here opens on 17 January Continue reading...","Sat, 04 Jan 2025 14:00:51 GMT",0.4137,0.994
The Guardian,On my radar: Rebecca Frecknall’s cultural highlights,"The theatre director on the best novel she’s read in a long time, Tracey Emin’s latest exhibition, exercising in the dark, and a Middle Eastern vegetarian restaurantThe theatre director Rebecca Frecknall grew up in Cambridgeshire and studied drama at Goldsmiths. Currently an associate director at the Almeida, from 2026 she will move to the same role at the Old Vic. Frecknall had a huge hit with the 2021 revival of Cabaret with Eddie Redmayne and Jessie Buckley – it won seven Olivier awards – and another with A Streetcar Named Desire starring Paul Mescal. Her production of Cat on a Hot Tin Roof is at the Almeida until 1 February, while Streetcar returns to London from 3 to 22 February at the Noël Coward theatre. Continue reading...","Sat, 04 Jan 2025 15:00:51 GMT",0.0,0.8591
The Guardian,The edit: the best activewear essentials - in pictures,The right kit will help you kickstart your fitness regime. Here’s our pick to get you going Continue reading...,"Sat, 04 Jan 2025 23:50:02 GMT",0.6369,0.5859
The Guardian,"Quit it! From vaping to doomscrolling, 10 bad habits and how to break them","Procrastinating? Online shopping too much? Always cancelling? These top tips from experts will help you change bad behaviour for the better‘Habit is a great deadener,” wrote Samuel Beckett. And he didn’t even&nbsp;have watermelon vapes and doom scrolling to contend with. Most of us have at least a&nbsp;few behaviours we want to&nbsp;change, but&nbsp;how can you break the habits of a&nbsp;lifetime? We&nbsp;asked the experts … Continue reading...","Sat, 04 Jan 2025 12:00:49 GMT",-0.5848,0.4696
The Guardian,"It’s the pits! Would you pay £35 for one of the new, posh deodorants?","Fashionistas are forking out a fortune as the humble anti-perspirant goes high endOnce humble, bought for a quid and used with little pleasure, deodorant has done an about-face. Where it used to be a simple case of misting armpits with Lynx or spritzing with Sure, in recent times the world of deodorant has evolved to offer products that cost as much as fancy face serums and smell as good as fine scents.Encapsulating deodorant’s shift from lowly to elevated is To My Ships, a brand launched last year in London. Apparently inspired by The Iliad, and yours for £35, it is inspired by “a desire for cleaner armpits, and an intention to quell olfactory overload”. If all that sounds highfalutin, this “cultured personal care offer” speaks for itself with a delicious scent and an ability to rival pong. Continue reading...","Sat, 04 Jan 2025 13:29:15 GMT",-0.1759,0.9797
The Guardian,Questions to ask yourself … to fix your love life,"Dr Orna Guralnik, clinical psychologist and Couples Therapy star, on the prompts that could help your relationshipThis is about asking people to move out of the automatic ways they think about their relationships. In the background, they’ve probably heard many times from their partner what they need, and have found all sorts of ways to ignore that information because it’s hard for them. One person might be asking for more warmth – to hug once in a while, say – and for all sorts of reasons the other person might be withholding that, or they’re not wired that way. But it’s not such a hard give. It can also be something as concrete as, “Remember I don’t eat ham when you’re cooking.” Could you push yourself to be more generous and go beyond your own limits? Continue reading...","Sat, 04 Jan 2025 14:00:50 GMT",0.6369,0.8566
The Guardian,"Blind date: ‘He handled an allergic reaction with stoicism, while I fretted about having to tell the Guardian I’d killed my date’","Felix, 24, a film programmer, meets Erin, 23, an archaeologistWhat were you hoping for?
 Someone to talk to about absolutely awful movies. More importantly, someone kind in wonderful knitwear. Continue reading...","Sat, 04 Jan 2025 06:00:43 GMT",-0.8555,0.8578
The Guardian,The food filter: which supermarket has the best tinned chopped tomatoes?,"Welcome to our new series: a battle of the brands in which our expert cooks taste and rate UK supermarket ingredients. Who wins for quality and flavour, and how much should you spend?Tinned tomatoes are wonderful, essential, enduring things: what would we do without them? Of the various types – whole, crushed, pulped, passata – chopped are particularly accommodating, providing a pleasing tomato presence while being easily reduced to sauce, and good value, too. However, chopped tomatoes (unlike whole tomatoes) can also be an excuse for a lesser product and more preservatives, which is why tasting and comparing is essential.I always taste tomatoes cold, straight from the tin, with my eyes closed – a helper is useful – because, while deep red chunks and sauce are pleasing, they may have no bearing on flavour. I hope for a good balance of sweet, sour (acidity), salty (savoury), bitter and umami; chunks that are firm without being unduly crunchy or unripe; and a sauce that is full-flavoured and has a nice texture, and which might be velvety, but could equally be thinner but juicy. The highest compliment I can pay a tinned tomato is feeling that I could eat the contents cold from the tin. Continue reading...","Sat, 04 Jan 2025 10:00:45 GMT",0.6369,0.9636
The Guardian,Young people in the UK: have your social habits changed in recent years?,"We would like to hear about your favourite venues to meet with friendsNightclubs ​have been closing at a rapid rate since the pandemic while music venu​es have declined, leaving the UK with fewer options for socialising.With this in mind, we would like to hear from younger people in the UK about where you go to socialise. How often do you go out, and how much do you typically spend? Have your habits changed in recent years? Continue reading...","Fri, 03 Jan 2025 13:03:47 GMT",0.0,0.6553
The Guardian,Tell us about your favourite wonder of the world,"Share a tip on a peerless architectural or sculptural creation, ancient or modern – the best tip wins £200 towards a Coolstays breakThe Seven Wonders of the World was a list of peerless architectural and sculptural creations from the ancient Mediterranean and Middle East drawn up in the 2nd century BC by Greek travellers following Alexander the Great’s conquests. Only one is still standing – the Great Pyramid of Giza. In 2001, the Swiss-based New7Wonders Foundation came up with an updated list, which included Machu Picchu, Petra and the Taj Mahal. But beauty is in the eye of the beholder, so we would like you to tell us about your personal wonder of the world. It could be an ancient stone circle, a statue, a stately home, a temple or even a modern-day skyscraper.If you have a relevant photo, do send it in – but it’s your words that will be judged for the competition. Continue reading...","Fri, 20 Dec 2024 15:04:00 GMT",0.0,0.9565
