broadcast,title,description,pub_date,title_sentiment_score,description_sentiment_score
Aljazeera,Football star Sam Kerr found not guilty of racial harassment in England,The Chelsea striker is cleared of racially aggravated harassment after calling a police officer &#039;stupid and white&#039;.,"Tue, 11 Feb 2025 14:47:04 +0000",-0.2887,-0.7184
Aljazeera,Who sells the most steel and aluminium to the US and who is facing tariffs?,"Donald Trump plans to place 25 percent tariffs on steel and aluminium imports, valued at about $50bn in 2024.","Tue, 11 Feb 2025 14:17:46 +0000",0.0,0.4404
Aljazeera,‘Eat the Rich’: A Growing Class Divide,We explore rising class consciousness among Gen Z and millennials and the growing awareness of economic inequality.,"Tue, 11 Feb 2025 14:00:00 +0000",0.1779,0.1779
Aljazeera,Why the Gaza ceasefire is in jeopardy,Hamas says it won’t release any more Israeli captives as part of the Gaza ceasefire.,"Tue, 11 Feb 2025 13:31:14 +0000",-0.4767,0.0
Aljazeera,Teacher admits to stabbing pupil to death in South Korea,"Teacher at Daejeon elementary school has not yet been arrested for killing of 7-year-old girl, police say.","Tue, 11 Feb 2025 13:11:22 +0000",-0.4019,-0.4303
Aljazeera,"Rubiales ‘totally sure’ Hermoso consented to kiss at World Cup, trial hears",Spain ex-football chief Luis Rubiales told his version of events over alleged forced kiss of Jenni Hermoso at World Cup.,"Tue, 11 Feb 2025 12:30:46 +0000",0.4215,-0.0516
Aljazeera,Gaza in need of shelter and supplies as winter storms hit,The humanitarian crisis in Gaza is being exacerbated as displaced Palestinians face a shortage of shelter.,"Tue, 11 Feb 2025 12:27:51 +0000",0.0,-0.7269
Aljazeera,"Vance rails against AI regulation in Paris as US faces off with EU, China",US vice president warns global leaders against striking AI deals with &#039;authoritarian regimes&#039; in a veiled jab at China.,"Tue, 11 Feb 2025 12:20:27 +0000",0.0,-0.1027
The Guardian,Elon Musk appears with Trump and tries to claim ‘Doge’ team is transparent,"Key presidential ally, whose agency has operated in secrecy, also makes claim – without evidence – of fraud at USAidElon Musk claimed in the Oval Office on Tuesday that his so-called “department of government efficiency” (Doge) was providing maximum transparency as it bulldozed its way through the federal government, remarks contradicted by the reality of how he has operated in deep secrecy.The appearance from Musk was the first time he had taken questions from the news media since his arrival in Washington, and he used his time standing next to Donald Trump at the Resolute Desk to defend the aggressive cost-cutting measures the Doge team has pursued. Continue reading...","Wed, 12 Feb 2025 01:52:18 GMT",0.0,-0.6808
The Guardian,Zelenskyy: Europe cannot guarantee Ukraine’s security without America,"Exclusive: In extended interview with the Guardian, Ukraine’s president says he will offer US firms lucrative reconstruction contracts to try to get Trump onsideIf Donald Trump withdraws US support for Ukraine, Europe alone will be unable to fill the gap, Volodymyr Zelenskyy has warned, on the eve of what could be his most consequential diplomatic trip since Russia’s full-scale invasion three years ago.“There are voices which say that Europe could offer security guarantees without the Americans, and I always say no,” said the Ukrainian president during an hour-long interview with the Guardian at the presidential administration in Kyiv. “Security guarantees without America are not real security guarantees,” he added. Continue reading...","Tue, 11 Feb 2025 14:00:04 GMT",-0.4168,-0.0093
The Guardian,"Israel will resume war in Gaza unless more hostages freed this week, says Netanyahu","Ultimatum appears to endorse threat by Donald Trump, who on Tuesday also appeared to back annexation of West BankMiddle East crisis – live updatesBenjamin Netanyahu has said that Israel will resume fighting in Gaza if Hamas does not release more hostages by noon on Saturday, endorsing a threat by Donald Trump that could shatter the three-week-old ceasefire between the two sides.Netanyahu’s ultimatum was delivered during a video address posted to social media account on Tuesday. “If Hamas does not return our hostages by Saturday noon – the ceasefire will end, and the IDF will return to intense fighting until Hamas is finally defeated,” he said. Continue reading...","Tue, 11 Feb 2025 19:22:18 GMT",-0.2315,-0.9231
The Guardian,"Rogue landlords in England to face curbs on housing benefit income, says Labour","Deputy PM Angela Rayner announces plans as she presents £350m funding increase for affordable housingRogue landlords in England will face curbs on how much housing benefit they can receive if their properties are substandard, Angela Rayner has said as she announced an extra £350m for affordable housing.The deputy prime minister presented the funding increase, adding to £500m already announced at the budget, as part of the government’s drive to build 1.5m homes. Continue reading...","Wed, 12 Feb 2025 00:01:12 GMT",0.4588,0.765
The Guardian,"Life satisfaction among over-50s in England higher than before pandemic, study finds","Research shows happiness levels have bounced back post-Covid, although depression also remains more commonPeople 50 and over in England have greater life satisfaction and sense life is more worthwhile than before the Covid pandemic, although depression is more common, researchers have found.Prof Paola Zaninotto, first author of the research from University College London, said the study showed wellbeing and mental health worsened between the early stages of the pandemic and later in 2020, contrary to some reports. However, this situation subsequently improved. Continue reading...","Wed, 12 Feb 2025 00:01:11 GMT",0.4404,0.101
The Guardian,UK health insurer Vitality to offer members discounted anti-obesity drugs,"Third-largest healthcare insurer will be first to give 20% off treatments such as Wegovy and Mounjaro through health coverVitality has become the first health insurer in the UK to offer customers discounted weight loss treatments for up to a year through its health cover.The UK’s third-largest health insurer behind Bupa and Axa, with 1.9 million members, said it would offer discounts of up to 20% for medications such as Wegovy and Mounjaro – which are popular but pricey – to members, based on their body mass index (BMI) and weight-related health conditions. Continue reading...","Wed, 12 Feb 2025 00:01:11 GMT",0.3612,0.09
The Guardian,"FBI says it has discovered 2,400 new records related to JFK assassination","The agency was transferring the records for declassification and did not say what information they containedThe FBI on Tuesday said it had discovered 2,400 new records related to the assassination of former president John F Kennedy as federal agencies work to comply with Donald Trump’s executive order last month to release thousands of files.The FBI said it’s working to transfer the records to the National Archives and Records Administration to be included in the declassification process. Continue reading...","Tue, 11 Feb 2025 22:52:42 GMT",-0.5994,-0.5994
The Guardian,"Google Calendar removes Black History Month, Pride and other cultural events","Company says listed holidays were not ‘sustainable’ for its model in latest move to roll back diversity effortsGoogle’s online and mobile calendars are no longer including references to Black History Month, Women’s History Month and LGBTQ+ holidays, among other events.The world’s biggest search engine previously marked the beginning of Black History Month in February and Pride Month in June, but the events do not appear for 2025. Continue reading...","Tue, 11 Feb 2025 18:40:53 GMT",0.34,0.4019
The Guardian,Danes offer to buy California to spite Trump’s Greenland aims: ‘We’ll bring hygge to Hollywood’,"Satirical petition from Denmark, which owns Greenland, racks up 200,000 signatures as Trump eyes Arctic islandSince returning to the presidency last month, Donald Trump has called for Canada to become the 51st US state, suggested he might take over the Panama Canal, floated US ownership of Gaza – and tried to buy Greenland.Now, Denmark – which owns Greenland – is clapping back. Continue reading...","Tue, 11 Feb 2025 20:46:27 GMT",-0.5267,0.0
The Guardian,"Big shot: Belfast hotel launches ‘life-changing’ £1,000 cocktail","A £750 mai tai previously earned the city centre bar the title of world’s most expensive cocktailSpending a grand on an unforgettable experience might not feel extreme for people keen to shake up their routines. But what if it doesn’t involve falling through the skies, or even going outside at all?“A life-changing experience” is the promise of one Belfast hotel’s £1,000-pound cocktail, launched as part of a new drinks menu. Continue reading...","Wed, 12 Feb 2025 00:00:11 GMT",0.0,0.6522
The Guardian,"Many birds-of-paradise species emit light through their plumage, study finds","Researchers found that most birds-of-paradise are biofluorescent – meaning they absorb light through their bodiesBirds-of-paradise are known for their bright and colourful plumage, but it turns out they are even more dazzling than previously thought.Researchers have found 37 of the 45 species show biofluorescence – in other words, patches of their plumage or other body parts absorb UV or blue light, and emit light at lower frequencies. Continue reading...","Wed, 12 Feb 2025 00:01:12 GMT",0.0,-0.2144
The Guardian,"Amid the ceasefire wrangling, how popular is Hamas in Gaza now?","The group still projects a powerful presence but, after all the damage, it will need to divert blame if the truce collapsesMiddle East crisis – live updatesOf the many factors that will determine the fate of the fragile ceasefire in Gaza, one of the most difficult to quantify and predict is the level of popular support for Hamas.On Monday, Hamas threatened to delay the release of further Israeli hostages, accusing Israel of breaches of the ceasefire deal. The uncertainty, just over halfway into the ceasefire’s six-week first phase, complicates talks on the far more difficult second phase. It also jeopardises the pause in the devastating fighting and the increase in humanitarian aid for Gaza that the truce has made possible. Continue reading...","Tue, 11 Feb 2025 16:35:14 GMT",0.4215,-0.9811
The Guardian,‘An act of betrayal’: Japan to maximise nuclear power 14 years after Fukushima disaster,"Tokyo wants to drop attempts to lessen its reliance on nuclear power, according to a draft energy planMore than a decade after the triple meltdown at the Fukushima Daiichi power plant, Japan is again turning to nuclear power as it struggles to reach its emissions targets and bolster its energy security.In a draft strategic energy plan due to be approved by the cabinet this month, the trade and industry ministry signalled it was ditching attempts to lessen Japan’s reliance on nuclear power in the wake of the Fukushima disaster – the world’s worst nuclear accident since Chornobyl 25 years earlier. Continue reading...","Wed, 12 Feb 2025 00:01:13 GMT",-0.6249,-0.5574
The Guardian,Ukraine war briefing: Zelenskyy prepared to offer swap of seized Kursk land,"Ukrainian president does not say which Russian-held territory he would seek in return during any negotiations; Kyiv seeks recruits below draft age. What we know on day 1,085Volodymyr Zelenskyy will offer Vladimir Putin a swap of Ukrainian-occupied territory in Kursk for Russian-held land in Ukraine, if Donald Trump manages to bring them to the negotiating table, Shaun Walker reports. “We will swap one territory for another,” the Ukrainian president said in an exclusive interview, adding that he did not know which part of Russian-occupied land Ukraine would ask for in return. “I don’t know, we will see. But all our territories are important, there is no priority.”Russia released American schoolteacher Marc Fogel on Tuesday after an unannounced visit to Moscow by US special envoy Steve Witkoff. Fogel, 63, had been detained in Russia since August 2021 and was serving a 14-year sentence. Fogel was sentenced to 14 years in prison for drug smuggling over 17 grams of marijuana – which he said was for medical use – in his luggage. Donald Trump called the release a show of good faith from the Russians, Pjotr Sauer writes. “I hope that’s the beginning of a relationship where we can end that war and millions of people can stop being killed.” When combined, some estimates of Russian and Ukrainian casualties – both dead and injured – approach one million.North Korea has sent about 200 long-range artillery guns to Russia, the South Korean news agency Yonhap has reported, quoting the defence ministry in Seoul. The type was not specified, but there have been other reports in recent weeks of Russia receiving Koksan self-propelled artillery guns from Kim Jong-un’s regime.The ministry also estimated North Korea had sent about 11,000 troops to support Russia, with 300 of them since killed and 2,700 wounded. “There is the possibility of [the North] additionally supplying troops, weapons and ammunition going forward,” the ministry said in a briefing to the parliamentary defence committee. The continuing role of North Korean troops in Ukraine has been unclear for several weeks. South Korea’s National Intelligence Service last week said they had been pulled back from the frontline in Kursk amid heavy losses, Justin McCurry reported. Volodymyr Zelenskyy then quickly countered that the North Koreans were back in battle.Poland’s army said a Russian Su-24MR bomber flying from Kaliningrad violated Polish airspace for one minute 12 seconds and flew up to 6.5km into its territory on Tuesday. Poland said the Russian army blamed a navigation system failure. It came a day after Poland’s prime minister, Donald Tusk, announced record-high spending focused on security and spoke of the need to “protect the Baltic Sea from acts of diversion and sabotage”.Ukraine’s defence ministry launched a recruitment drive for young people on Tuesday, encouraging 18- to 24-year-olds to volunteer to serve in the military for a year for the equivalent of about $24,000 plus large bonuses and subsidised mortgages and rents. Ukrainians can be conscripted only once they turn 25. The under-25 volunteer contracts also offer a 12-month exemption from mobilisation when completed.Ukrainian natural gas production facilities were damaged in a heavy Russian missile and drone attack on Ukraine’s central Poltava region over Tuesday night, officials, said on Tuesday. Ukraine hit a refinery in Russia’s Saratov region about 500km (300 miles) from Ukraine’s border, and there were reports of an attack on Engels, an industrial city in the Saratov region with the main base of Russia’s nuclear-capable strategic bombers located nearby. Continue reading...","Wed, 12 Feb 2025 00:56:40 GMT",-0.4588,-0.9777
The Guardian,The Witcher: Sirens of the Deep review – gore flows in bloody animated mer-western,"Lovejoyish dude with magical powers wanders into a seaside kingdom where merpeople and regular humans are at loggerheadsThis animated feature is part of the larger Witcher fantasy franchise which started with short stories by Polish writer Andrzej Sapkowski and has evolved to survive on all manner of platforms, from video games and comics to live-action TV series and films. Thanks to the wealth of wiki knowledge out there, you can get the gist pretty quickly. There’s a dude with magical powers, fearsome pectorals (and the platinum hair of a Finnish metal band lead singer) named the Witcher, AKA Geralt (voiced here by Doug Cockle); he wanders around a medieval-ish countryside battling monsters, partly for hire and partly out of the goodness of his own gruff heart. He’s like a ronin or a knight or TV-show amateur detective of the Lovejoy vintage, but with a sword. Geralt’s wisecracking sidekick Jaskier (Joey Batey) is cowardly and comical, and plays a lute-like instrument on which he performs ballads celebrating Geralt’s heroics. We also meet (mostly in flashback) Geralt’s on-off romantic partner Yennefer (Anya Chalotra) who can visit his dreams in order to flirt with him, but she’s less of a big deal here than in other Witcher products.Instead, Geralt and Jaskier wash up in a seaside kingdom where merpeople and regular humans are at loggerheads because the humans keep decimating the oyster beds in search of pearls. Shockingly, they don’t make use of the oysters as food, which depletes food sources for the various fantasy animals the merpeople feel are their buddies because they all live in the sea together. It’s the equivalent of a post-colonial western where the merfolk are the Native Americans and the humans are rapacious land-grabbing whites. But the script also threads in a star-crossed lovers’ story involving a mer-princess and a dopey human prince which plays out like a blend of Romeo and Juliet and The Little Mermaid. Plus, because no gen-Z skewed animation would be complete without a trans subtext, there’s a bit of that too at the end. Continue reading...","Tue, 11 Feb 2025 23:47:11 GMT",-0.4404,0.9718
The Guardian,"Sam Kerr trial: how a drunken night out revealed questions of race, power and privilege","The jury’s verdict to clear the Australia and Chelsea star shows the complexity of cases with a racial chargeIt was a drunken night out that ended in an exchange in a south-west London police station. Such incidents are commonplace for officers and rarely garner much furore. But this particular case has captured the attention of football fans around the world.Sam Kerr, the captain of the Australian women’s football team and Chelsea’s star striker, was at the centre of the incident in the early hours of 30 January 2023. When the charge of racially aggravated harassment was filed against her last year, the hearts of many sports fans around the world sank. Continue reading...","Tue, 11 Feb 2025 16:05:55 GMT",0.3612,-0.1406
The Guardian,Tariffs through the looking-glass? MPs in dreamworld over Trump’s latest move | John Crace,"Ignore the issue? Praise the president? Blame the opposition? No one in the Commons has a clue how to deal with looming US tariffs on steelSee no evil. Hear no evil. Speak no evil. Hide under the duvet and hope the world forgets you exist.Up until now, the UK government’s strategy for dealing with President Trump has worked out pretty much OK. Wherever possible, do nothing to create waves. To be ignored is very heaven. Continue reading...","Tue, 11 Feb 2025 19:08:54 GMT",0.0,0.9336
The Guardian,26.2 to Life: Inside the San Quentin Prison Marathon review – the inmates who find redemption in running,"This deeply moving film follows the maximum-security detainees training to run a marathon. It’s a troubling portrait of masculinity, but one which offers hopeChristine Yoo’s intelligent, compassionate and deeply moving film, 26.2 to Life: Inside the San Quentin Prison Marathon, follows some of the inmates of the California maximum-security facility. The men, most of whom are serving life sentences, are preparing to run 100-odd laps of the heavily guarded prison yard, along a barely marked track, weaving in and out of prisoners who do not know or care to stay out of their way. All of them are subject at any time to a minor or major lockdown that will interrupt or even cancel the race for which they have trained all year. They can wear non-prison-issue clothes to run in, but their shoes are the property of the state and have to be booked in and out by each man at every session.The 1000 Mile Club, as the runners are known, are trained by a group of volunteers led by Franklin Ruona, an experienced marathon man himself. A naturally quiet and watchful soul, he doesn’t talk to the men about their crimes unless they want to. His view is that they are people who have not had his luck or advantages: “I just feel like I am my brother’s keeper,” he says. In the febrile prison atmosphere, he is an oasis of calm. Continue reading...","Tue, 11 Feb 2025 23:30:10 GMT",-0.5106,-0.9498
The Guardian,‘It felt like a divine calling’: meet the single marriage celebrants refusing to give up on love,"What’s it like celebrating love for a living when you’re still looking for ‘the one’? Five Australian wedding celebrants reveal what the job has taught them about modern romanceGet our weekend culture and lifestyle emailA wedding-obsessed primary school teacher riding the rollercoaster of online dating. A queer youth worker looking for a slow-burn relationship offline. A divorced TV presenter hoping for a second shot at love.These are some of the young Australians navigating the world of apps, ghosting and modern romance in 2025 – all of whom also happen to be registered celebrants officiating weddings for loved-up couples in their spare time. Continue reading...","Tue, 11 Feb 2025 20:15:51 GMT",0.8225,0.949
The Guardian,How Anora became this year’s surprise Oscar frontrunner,"It had seemed like the year of Emilia Pérez or The Brutalist but Sean Baker’s comedy won three major awards over the weekend, turning the best picture race on its headOscars nominations 2025: the full listIt had already felt like a weirder Oscars race than usual.The question of what will win best picture had been asked and then answered by most with a shrug, the frontrunner changing by the day. At various points in the last few months, experienced prognosticators have offered up Conclave, Wicked, A Complete Unknown, September 5, The Brutalist or Emilia Pérez as their pick, the race shifting with the smallest shred of new intel. Continue reading...","Tue, 11 Feb 2025 16:32:40 GMT",0.2732,0.9889
The Guardian,How Musk and Trump are flooding the zone,"Musk raids a dizzying swath of agencies with the goal of ‘slashing waste and fraud’ as the two deploy brinkmanshipHello, and welcome back to TechScape. This week in tech: Elon Musk and Donald Trump flood the zone and deploy brinkmanship as a negotiating tactic; US Immigration and Customs Enforcement learns search engine optimization amid arrests and deportations; and Spotify tries to soften its algorithmic image with human-centric public relations. Thank you for reading. Continue reading...","Tue, 11 Feb 2025 17:35:03 GMT",0.0,0.34
The Guardian,The White Lotus review – an absolutely exquisite third season,"Mike White’s masterly series takes a new gang of shiny unhappy people to a Thai resort and serves up a sumptuous feast for the senses. This is killer TVEight to a dozen affluent Americans, half of them hiding a dark secret as they head to a glamorous location for a luxury vacation, the other half complicating the issue by creating some dark secrets of their own. A dead body ruining everyone’s fun but increasing the audience’s exponentially. Shiny unhappy people getting their just deserts by the end of an immaculately plotted eight-hour series. Yes, my friends, we can only be back at the White Lotus.Written and directed as ever by Mike White, this time he is taking us, his new gang and one or two familiar faces to Thailand. We have the family group, with Parker Posey (possibly Parker Poseying it slightly too much in a part that doesn’t demand as much kookiness as she brings to it) as Victoria Ratliff, a heavily medicated Southern belle and wife of wealthy businessman Timothy (Jason Isaacs). They are the parents of three children: the enjoyably appalling chip-off-the-old-block Saxon (Patrick Schwarzenegger – and the answer to your first question is yes, he is; the answer to the next one is, no, he’s actually very, very good); idealistic daughter Piper (Sarah Catherine Hook), who is writing her thesis about eastern religion and at whose behest they chose Thailand as their holiday location; and sweet, gentle Lochlan (Sam Nivola), who may be trying to work out how to come out as gay in a family that does not seem to accommodate much difference. Continue reading...","Tue, 11 Feb 2025 16:00:02 GMT",0.0,0.9837
The Guardian,"Keir Starmer is in a tight spot, but a ‘Trump, baby, Trump’ strategy just won’t work | Marina Hyde","The president has his own laws of physics. The real thing is bad enough: a pale copy doesn’t stand a chance here or in the USIt’s fun that Keir Starmer has finally unveiled a personality – it’s just a shame it’s the radio edit of someone else’s. I’m sure you can guess whose.Announcing plans to make it easier to build nuclear power stations last week, the prime minister was willingly drawn into some kind of call and response answer to a BBC question, fixing one eye on the cameras and gibbering: “I say: build, baby, build.” Yowch. Hope he sees this, king! On the other hand, this delivery slightly reminded me of Daniel Craig’s accent in Knives Out, of which one co-star opined: “I remember the first time he did that on set, there was kind of a moment of silence after he finished and just a smile on everyone’s face.” Mm. Likewise.Marina Hyde is a Guardian columnist Continue reading...","Tue, 11 Feb 2025 14:39:09 GMT",0.0,0.8932
