broadcast,title,description,pub_date,title_sentiment_score,description_sentiment_score
The Guardian,It’s time for Americans to withhold their taxes | Judith Levine,"The point is not to deprive the government of funds. It’s to expose the regime’s criminalityPolitical power boils down to two things: votes and money. But when money buys presidents, senators and judges, votes are merely the sales receipts. What’s left is money, and the purpose of power is to get more of it.Trump’s non-billionaire followers appear thrilled that Elon Musk and his so-called “department of government efficiency” are burning down the government. “Imagine if Trump hadn’t met and talked with Elon Musk that all this progress on efficiency may not be taking place or at such a fast pace needed before the midterms,” comments holy666 on a Fox News story about the mass layoffs of federal employees. Continue reading...","Thu, 20 Feb 2025 16:00:12 GMT",0.0,0.9178
The Guardian,Harassment of Emma Raducanu reminds us women still bear brunt of abuse | Emma John,"Women in sport are left exposed by the lack of backing that men receive, and by toxic attitudes that must be called outIf you watched any of Emma Raducanu’s Tuesday match against Karolina Muchova, it was probably only the two clips, stitched together neatly for the news highlights. Raducanu approaching the umpire. Raducanu wiping away tears with a towel.An emotional Raducanu is an instant headline, although this wasn’t a case of injury or frustration. Having seen a man in the crowd whose off-court behaviour had already concerned her, she was doing the sensible thing and reporting it. The Daily Mail reported that she was “reduced to cowering behind the umpire’s chair”. What a brilliantly multi-purpose use of language: paternalistic readers can get heroically angry on her behalf while the others write her off as a snowflake. Continue reading...","Thu, 20 Feb 2025 12:28:15 GMT",-0.8271,-0.296
The Guardian,The chances of this asteroid hitting Earth keep rising. But there are four reasons I’m not worried yet | Carrie Nugent,"Scientists are closely monitoring 2024 YR4 – and while it’s relatively small, it reminds us of the dangers lurking in spaceCarrie Nugent is an associate professor of computational physics and planetary science and author of Asteroid HuntersTwo days after Christmas, the Atlas sky survey team discovered a new rocky object in Earth’s astronomical neighbourhood. Atlas discovers near-Earth objects all the time: in 2024, the team discovered 167 of them. They also codiscovered comet Tsuchinshan–Atlas, which dazzled sky gazers last autumn. But this discovery was special: there’s a chance the 40-90 metre object, known as 2024 YR4, will hit Earth in 2032.In January, the impact probability was estimated to be just over 1%, then it was raised to 2.3% in early February. As of this week, the Nasa JPL Center for Near Earth Object Studies has raised that to 3.1% – or about 1-in-32 chance of impact. Continue reading...","Thu, 20 Feb 2025 10:00:34 GMT",0.4082,0.7351
The Guardian,"Don’t mention the war: in Germany, politicians are hiding the truth about defence spending | Paul Taylor","By centring the discourse on immigration, MPs have handed support to the far right – and hidden a ticking economic timebomb from votersThe candidates to lead Germany’s next government are avoiding telling voters painful truths before Sunday’s crucial general election about Russia’s war in Ukraine, the coming disengagement of the US from Europe and the huge defence funding that is needed. Instead, the debate has largely focused on how to revive the ailing German economy after two years of recession and how to control migration, which has fuelled support for the far-right Alternative für Deutschland.The conservative CDU/CSU leader, Friedrich Merz, has swerved speaking about the need for massive borrowing to pay for a surge in defence spending because many of his supporters oppose extra debt. The Social Democratic (SPD) chancellor, Olaf Scholz, is dodging discussion of sending German troops to Ukraine as part of a possible European security force if a ceasefire agreement is reached because part of his political base is either anti-militarist or Russia-friendly. After an emergency European summit on Ukraine in Paris on Monday, an irritable Scholz said talk of boots on the ground was “highly inappropriate”.Paul Taylor is a senior visiting fellow at the European Policy Centre Continue reading...","Thu, 20 Feb 2025 14:00:09 GMT",-0.5267,0.5574
The Guardian,Hold your breath and look to Germany: its election could decide the fate of Europe – and the UK | Martin Kettle,"If the country holds out against the Trump-assisted AfD, it shows rightwing populism can be resisted in Europe’s heartlandEven in less stressed times, Britain always pays too much attention to the US and too little to Germany. In today’s torrid circumstances, that imbalance is perhaps excusable. After all, Donald Trump, it now turns out, really means it. He is more interested in US plunder and profit from places like Gaza, Ukraine and Greenland than in upholding a just peace or good order.Even so, the inattention towards Germany needs to end. Britain’s politicians, like German politicians, are rewiring their worldviews amid a political gale. But Germany, though no longer a great power, is nevertheless a great nation. Indeed, it may be more than ever the essential European nation now, after the Trump administration’s very public trashing of the entire Atlantic alliance seemed to leave Europe to its own devices. Continue reading...","Thu, 20 Feb 2025 08:00:32 GMT",0.0,0.9538
The Guardian,The Guardian view on Gaza’s future: the ceasefire and hostage deal must not fizzle out | Editorial,"As Donald Trump persists with a monstrous proposal to remove Palestinians, the immediate need is to prevent fresh conflictThe pain and damage wreaked in the last 16 months will reverberate through families, communities and the Middle East for decades to come. On Thursday, the bodies of two young children and their mother, and that of an 83-year-old peace activist, were returned to Israel by Hamas. They were kidnapped in&nbsp;the 7&nbsp;October 2023 raid in which the militants killed&nbsp;around 1,200 Israelis and others. Around 48,000&nbsp;Palestinians, most of them civilians, have been killed in Gaza since Israel launched its war&nbsp;in&nbsp;response.It was always feared that the ceasefire deal, which has brought desperately needed respite for Palestinians in Gaza and the return of Israeli and foreign hostages, would be fleeting. The six-week opening stage is due to expire on 1 March. The talks on the more complicated second stage have yet to begin, more than a fortnight after they were due.Do you have an opinion on the issues raised in this article? If you would like to submit a response of up to 300 words by email to be considered for publication in our letters section, please click here. Continue reading...","Thu, 20 Feb 2025 18:42:29 GMT",0.0,-0.7882
The Guardian,The Guardian view on Scottish Labour: a defining moment for Anas Sarwar | Editorial,"After a spectacular general election win, Keir Starmer’s party is struggling to repeat its success in the approaching Holyrood contest​Only a few months ago, Labour won the most votes and a majority of seats in Scotland for the first time since 2010. A 16-point swing from the Scottish National party yielded a harvest of 37 Westminster Labour MPs. The SNP, which had changed leaders twice in little over a year, plummeted from 48&nbsp;Westminster MPs to a mere nine.Yet if anyone assumes Labour is now in the driving seat of Scottish electoral politics again, they have not been paying attention. A poll last week showed Labour facing its worst Holyrood election result since devolution began, with only 18% of Scots planning to vote for Anas Sarwar’s party when the Scottish parliament comes up for election in 2026. The SNP, meanwhile, is on course to be the largest party at Holyrood again, potentially enabling the current first minister, John Swinney, to form the nationalists’ fifth consecutive devolved administration.Do you have an opinion on the issues raised in this article? If you would like to submit a response of up to 300 words by email to be considered for publication in our letters section, please click here. Continue reading...","Thu, 20 Feb 2025 18:41:39 GMT",0.0,0.9599
The Guardian,"We need a debate on defence spending as Nato unravels, putting Europe at risk | Letters","David Blunkett calls for a national debate on the kind of defence spending Britain wants, Ian Davis, Richard Reeve and Paul Rogers say increased military budgets are not the answer, and Ian Henderson and Ruth Blunt respond to Donald Trump calling Volodymyr Zelenskyy a dictatorWith current and past leaders of the armed services joining the Americans in calling for ever greater percentages of national income to be devoted to defence, some hardheaded thinking is going to be needed (Starmer will go in ‘bin of history’ if he fails to raise defence budget, says ex-army chief, 15 February).Unless defence spending contributes to growth, we could have the absurd situation of increasing the proportion of GDP spent on defence without any material increase in the actual amount available; 2.5% of substantial growth is better than 3% of an economy flatlining. Continue reading...","Thu, 20 Feb 2025 17:44:19 GMT",-0.1779,0.901
The Guardian,Rachel Reeves should rewrite the rulebook on GDP growth | Letters,"Donald Power, Dr Neil Lancastle and Andrew Risby respond to an editorial on Britain’s broken economyRe your editorial (The Guardian view on Britain’s broken economy: ‘That’s your bloody GDP, not ours’, 13 February), we are frequently reminded of the inadequacy of GDP growth as an objective, given that it includes the money spent on dealing with pollution, sickness, crime etc. But nobody gets out of bed thinking, “I have to grow GDP today”. We’re thinking about how to earn a living and pay the rent. Nobody, that is, except the chancellor, for whom “growth is the No 1 mission” that “underpins&nbsp;everything else” –&nbsp;schools, hospitals, net zero.Yet decades of growth since the 1960s have left us with thousands of food banks and facing an environmental abyss. The idea that only more growth will allow us to protect the planet is like saying we can only finance the fire brigade by selling petrol to arsonists. Continue reading...","Thu, 20 Feb 2025 17:44:09 GMT",0.3818,0.5838
The Guardian,4 Nations Face-Off final: Canada v USA – live updates,"Latest score from 8pm ET start at TD Garden in BostonOld rivals meet in first edition of hockey tournamentMatthews and 19 more: Team USA Olympians to watchEmail beau.dure@theguardian.com with your thoughtsYes, “game time” was 8 pm ET. No, I don’t know when it’s actually going to start. We have not gotten to the national anthems yet.ESPN is hyping US goalie Connor Hellebuyck, with good reason – he’s allowed just two goals in two games with a .957 save percentage. Continue reading...","Fri, 21 Feb 2025 02:33:47 GMT",0.0,0.7269
The Guardian,Feyi-Waboso injury fallout hits England preparations for Scotland clash,"Wing has reinjured shoulder and could be out for seasonInjury leads to questioning of RFU’s contract systemEngland’s Calcutta Cup preparations have been tainted by the fallout from Immanuel Feyi-Waboso’s shoulder injury, which raises questions over the Rugby Football Union’s new central contracting system.Feyi-Waboso reinjured his shoulder at England’s training base on Wednesday after suffering a dislocation on Exeter duty on 21 December, with the Chiefs confirming he will be sidelined for up to 14 weeks. He is unlikely to play again this season and, as he will be out of action when Andy Farrell names his British &amp; Irish Lions squad, Feyi-Waboso’s chances of touring Australia are hanging by a thread. Continue reading...","Thu, 20 Feb 2025 19:09:42 GMT",-0.4215,-0.4767
The Guardian,Does Pep Guardiola have drive to rebuild broken Manchester City?,"The current iteration is done and manager must decide if he has the energy for exhausting process of reconstructionThere was some talk after Manchester City’s win against Newcastle United last Saturday that City’s players had been inspired, freed from their shackles and generally reinvigorated by the club’s recent legal victory in a tribunal hearing over certain time-specific aspects of financial regulation.Could this be true? Are we underestimating the effect of these things? Did the pitch mics at the Bernabéu pick up Nico González in the pre-match huddle saying: “Lads, we’ve all absorbed the news about the related third-party transaction rules being declared improper. I am as a consequence bang up for this.” Did the cameras detect Savinho whispering: “Guys, we are now free to seek our own definition of market value. This commercial potential is hugely energising. Hit me early over the top.” Continue reading...","Thu, 20 Feb 2025 20:00:16 GMT",-0.4767,0.9773
The Guardian,‘Interesting discussions’: Donald Trump and Tiger Woods hold talks on golf’s rift,"Woods joins PGA delegation at White House on ThursdayLIV representatives also present in WashingtonDonald Trump’s involvement in professional golf’s peace talks has ramped up further, with Tiger Woods among those afforded an audience with the US president at the White House on Thursday afternoon.Woods joined the PGA Tour commissioner, Jay Monahan, fellow board member Adam Scott and representatives of Saudi Arabia’s Public Investment Fund in a meeting hosted by Trump amid increasing hopes the fractured sport can unite over the coming months. Key sticking points were expected to surround the precise role for Yasir al-Rumayyan, the PIF’s governor, in golf’s new world and where the Saudi-established LIV Tour sits on the sport’s schedule. Continue reading...","Thu, 20 Feb 2025 22:33:25 GMT",0.0,0.743
The Guardian,Upgraded Wakefield back in big time hoping to emulate victors Hull KR,Super League returned to Belle Vue after Trinity’s promotion but it was the visitors who left with a 14-12 winThe Super League landscape is changing for the better in so many areas since IMG’s arrival into the game: and few places encapsulate the boom the sport has experienced lately quite like Wakefield Trinity.Even the most ardent Trinity supporter would tell you one of rugby league’s grand old clubs was in desperate need of a refresh as recently as two years ago. Continue reading...,"Thu, 20 Feb 2025 22:31:31 GMT",0.4215,0.9738
The Guardian,Daniel Dubois pulls out of world title fight with Joseph Parker due to illness,"British heavyweight was due to defend title on SaturdayMartin Bakole steps in to face Parker as replacementDaniel Dubois has withdrawn from his IBF world heavyweight title defence against Joseph Parker on Saturday after falling ill.The British boxer was evaluated by a doctor on Thursday, according to a report in the Ring magazine, but is unable to compete. The 27-year-old will be replaced by heavyweight contender Martin Bakole, a dangerous proposition for Parker at short notice. Continue reading...","Thu, 20 Feb 2025 20:24:36 GMT",-0.6486,-0.5423
The Guardian,Chelsea’s Sonia Bompastor reveals 13-year relationship with assistant Camille Abily,"Pair also have four children togetherNews breaks on release of Bompastor’s bookSonia Bompastor and Camille Abily, the Chelsea women’s team head coach and her assistant, have revealed they are in a long-term romantic relationship and have four children together.Discussing their relationship in public for the first time, on the eve of the release of Bompastor’s autobiography, the couple told the French newspaper L’Équipe that they were previously not comfortable talking about their private lives openly. Continue reading...","Thu, 20 Feb 2025 20:38:14 GMT",0.0,-0.0005
The Guardian,Two-thirds of the Earth’s surface experienced record heat in 2024. See where and by how much – visualised,"In oceans and on land, from the north to the south pole, records were smashed for the monthly average temperatureTwo-thirds of the world’s surface was scorched by a month or more of record-breaking heat, Guardian analysis of satellite data can reveal.In oceans and on land, from Colombia to China, and from the north to south pole, records for the monthly average temperature were smashed time and time again last year – in some cases, by as much as 5C (9F) hotter than the previous record. Continue reading...","Thu, 20 Feb 2025 08:00:32 GMT",0.0,0.0
The Guardian,"Europe greenwashing with north Africa’s renewable energy, report says","Greenpeace argues European-backed projects hamper countries’ ability to decarbonise their own economiesEuropean countries are extracting renewable energy from Morocco and Egypt to “greenwash” their own economies, while leaving north Africans reliant on dirty imported fuels and paying the environmental costs, a Greenpeace report says.Both Morocco and Egypt are aiming to leverage their strategic locations south of the Mediterranean, and their solar and wind power potential, to position themselves as pivotal to Europe’s quest to diversify its energy supply. Continue reading...","Thu, 20 Feb 2025 05:00:33 GMT",0.1779,0.128
The Guardian,Climate advocacy groups file two lawsuits against Trump administration,"Groups from Sierra Club to Greenpeace take aim at Trump’s drilling orders in term’s first environmental legal battlesGreen advocacy groups filed two lawsuits against the Trump administration on Wednesday, marking the first environmental legal challenges against the president’s second administration.Both focus on the Trump administration’s moves to open up more of US waters to oil and gas drilling, which the plaintiffs say are illegal. Continue reading...","Wed, 19 Feb 2025 22:04:43 GMT",-0.1531,0.1779
The Guardian,"Melting glaciers caused almost 2cm of sea level rise this century, study reveals","Decades-long research shows world’s glaciers collectively lost 6.542tn tonnes of ice between 2000 and 2023Melting glaciers have caused almost 2cm of sea level rise this century alone, a decades-long study has revealed.The research shows the world’s glaciers collectively lost 6.542tn tonnes of ice between 2000 and 2023, causing an 18mm (0.7in) rise in global sea levels.This article was updated on 20 February 2025 to correct the byline, which was misattributed due to an editing error. Continue reading...","Wed, 19 Feb 2025 17:24:38 GMT",0.0,-0.6808
The Guardian,"Savings providers vow to fight any attempt to cut cash Isa limit to £4,000","Rachel Reeves understood to be considering proposal to reduce annual allowance from current £20,000Major savings providers have pledged to fight any attempts to cut tax breaks on cash Isas after it emerged the government was considering a proposal to slash the maximum amount that people can put into them from £20,000 a year to £4,000.In recent weeks a row has broken out over whether ministers should scale back tax breaks on the popular savings accounts. The chancellor, Rachel Reeves, is being lobbied by some fund managers to put more focus on the riskier practice of investing in the stock market as a way of boosting economic growth. Continue reading...","Thu, 20 Feb 2025 18:01:47 GMT",-0.5719,-0.7269
The Guardian,"UK government may have breached young soldier’s right to life, coroner concludes","‘Systemic’ flaws criticised in army’s investigation into sexual assault of Jaysley Beck, 19, before her suicideJaysley Beck’s death shows toxic misogyny persists in the armed forcesThe UK government may have breached a young soldier’s right to life by failing to protect her from a sexual assault by a more senior colleague and from sustained unwelcome sexual attention from her line manager, a coroner has concluded.Gunner Jaysley Beck, 19, killed herself after errors were made in the way the army investigated a sexual assault, which made her reluctant to report her boss when he later launched an “onslaught” against her, the coroner said. Continue reading...","Thu, 20 Feb 2025 19:00:11 GMT",0.0,-0.9833
The Guardian,Pilot of domestic abuse experts helping in 999 call rooms begins in England,"Jess Phillips says ‘Raneem’s law’ scheme will support ‘force-wide cultural change’ as initial phase is rolled outDomestic abuse specialists embedded in control rooms receiving 999 emergency calls will help “create force-wide cultural change”, said Jess Phillips as the first phase of “Raneem’s law” was rolled out across England.The new law is named in memory of Raneem Oudeh, who was killed alongside her mother, Khaola Saleem, in Solihull by Oudeh’s ex-husband, whom she had reported to the police at least seven times, as well as making four 999 calls on the night she was murdered. Continue reading...","Fri, 21 Feb 2025 00:01:23 GMT",-0.4588,-0.7003
The Guardian,Priest insulted by Andrew Gwynne in WhatsApp group calls for him to resign,"Vicar calls MP’s position untenable after newly revealed messages show him suggesting she be ‘burned on a bonfire’A serving Anglican priest has called for Andrew Gwynne to resign after new WhatsApp messages emerged in which the member of parliament suggested she should be “burned on a bonfire”.She described the chat involving two Labour MPs, as well as several other Labour party members, as “reminiscent of playground bullying and name-calling”. Continue reading...","Thu, 20 Feb 2025 18:06:06 GMT",-0.6908,-0.3612
The Guardian,‘This is not a problem of the past’: Jaysley Beck’s death shows toxic misogyny persists in the armed forces,"Failings in handling of 19-year-old’s sexual assault complaints have left family hoping her inquest can finally effect real changeGovernment may have breached young soldier’s right to life, coroner concludesNobody has a bad word to say about Gunner Jaysley Beck.She was a bright, happy, gregarious teenager who lit up every room she walked into. She was good at her job, confident, inspirational. Continue reading...","Thu, 20 Feb 2025 13:59:43 GMT",-0.3903,0.6705
The Guardian,Lisa Nandy announces £270m fund for England’s ‘crumbling’ cultural infrastructure,"Arts Everywhere Fund will improve cultural offerings in communities and on the curriculumUK politics live – latest updatesCulture has been “erased” from communities and curriculums, according to the culture secretary, Lisa Nandy who vowed to make the arts more accessible by announcing new funding for England’s “crumbling” cultural infrastructure.The £270m fund will support attractions “in urgent need of financial support to keep them up and running, helping to carry out vital infrastructure work and improve long-term financial resilience”, according to the Department for Culture, Media and Sport (DCMS). Continue reading...","Thu, 20 Feb 2025 17:22:36 GMT",0.0,0.9531
The Guardian,"Jenrick and Philp put UK judges’ ‘lives at risk’ with attacks on integrity, former extremism tsar says","Lord Walney: senior Tories ‘deeply wrong’ for suggesting judges are ideologically  driven when enforcing the lawThe shadow cabinet ministers Robert Jenrick and Chris Philp are putting judges’ “lives at risk” by launching “ill-chosen” attacks on their integrity, the outgoing extremism tsar has said.Lord Walney, who until last week was the Conservative-appointed watchdog on political violence, said the senior Tories were “deeply wrong” for indicating that judges were ideologically driven when enforcing the law. Continue reading...","Thu, 20 Feb 2025 18:05:08 GMT",-0.0772,-0.4939
The Guardian,Number of norovirus patients in English hospitals hits record high,"Return to pre-pandemic hygiene behaviour may be contributing factor, experts sayThe number of norovirus patients in hospital in England has reached an all-time high, figures have revealed, with experts saying a return to pre-pandemic behaviours could be fuelling the situation.Norovirus, also known as the winter vomiting bug, is highly contagious. While most people get better at home in a couple of days, it can be more serious in older adults, younger children and people who are immuno-compromised. Continue reading...","Thu, 20 Feb 2025 15:00:05 GMT",0.0772,0.1475
The Guardian,Former leader of Reform UK in Wales charged with bribery offences,"Nathan Gill to appear at magistrates court after investigation led by Met counter-terrorism commandNathan Gill, the former leader of Reform UK in Wales, has been charged with nine bribery offences after an investigation led by the Metropolitan police’s counter-terrorism command.Gill, 51, was charged with one count of conspiracy to commit bribery, under the Criminal Law Act 1977, and with eight counts of bribery, under the Bribery Act 2010, police said. Continue reading...","Thu, 20 Feb 2025 18:56:35 GMT",-0.4939,-0.8625
The Guardian,British Gas pledges to focus on customers after being overtaken by Octopus,"CEO of owner Centrica says service will be ‘my obsession’ as profits slump by a third to £2.3bnBusiness live – latest updatesThe boss of British Gas has said that losing its spot as Britain’s biggest energy supplier for the first time in four decades should “galvanise” its staff to focus on customer service and lowering bills.Chris O’Shea, the chief executive of Centrica, which owns British Gas, said monitoring its customer service was an “obsession” that would continue after Octopus Energy toppled it from the position as the largest energy supplier in the market last year. Continue reading...","Thu, 20 Feb 2025 13:27:39 GMT",0.0,0.5574
