broadcast,title,description,pub_date,title_sentiment_score,description_sentiment_score
The Guardian,Man arrested on suspicion of rape at the Groucho Club,Met police say 34-year-old was arrested in Hertfordshire after reports of rape at London venue in NovemberA man has been arrested on suspicion of rape as part of an investigation into an alleged sexual attack at the Groucho Club in central London.The Metropolitan police said a 34-year-old man was arrested on Saturday evening at an address in Hertfordshire and remained in custody. Continue reading...,"Sun, 01 Dec 2024 12:57:41 GMT",-0.886,-0.9761
The Guardian,"Many unable to access eVisas to prove right to be in UK, Home Office admits",Campaigners say problems with digital transfer could affect hundreds of thousands of people on ‘10-year route’ visasThe Home Office has admitted that many people who have the right to live and work in the UK cannot access their eVisas and provide proof that they are allowed to be in the country.Human rights campaigners have said problems with accessing eVisas could lead to a scandal involving hundreds of thousands of people. Those affected are allowed to be in the UK but cannot show their right to work or rent a home. Continue reading...,"Sun, 01 Dec 2024 19:19:27 GMT",0.296,-0.5789
The Guardian,British man dies in lift shaft during family holiday in Turkey,"Tyler Kerry, 20, from Basildon in Essex, was discovered on Friday morning at bottom of lift shaft in Antaya hotelA young British man has died from injuries in a lift shaft while on a family holiday in Turkey.Tyler Kerry, a 20-year-old labourer from Basildon, Essex, was discovered on Friday morning at the bottom of a lift shaft in a hotel where he was staying in Antalya. Continue reading...","Sun, 01 Dec 2024 13:48:48 GMT",0.4019,-0.2263
The Guardian,Watch out for the Weirdboyz: Games Workshop on track for FTSE 100,"UK miniature wargames maker’s shares have risen by 43% since the start of 2024The UK’s blue-chip share index could be about to be invaded by Space Marines, Weirdboyz and Chaos Knights.Games Workshop, the UK maker of miniature wargames, is on track to be promoted to the FTSE 100 when the next quarterly reshuffle is calculated later this week, taking its place among the 100 most valuable companies listed in London. Continue reading...","Sun, 01 Dec 2024 14:32:03 GMT",0.0,0.7089
The Guardian,Romanian elections: ruling Social Democrats on course for most votes,"Exit poll suggests leftwing PSD poised to defeat resurgent far-right movement in parliamentary electionRomania’s main centre-left party was on track to finish first in parliamentary elections, according to preliminary results, seemingly beating an advancing far right boosted by the shock victory of an ultranationalist in last week’s presidential first-round ballot.With 90% of votes counted, the ruling Social Democratic party (PSD) won 23.9% of the vote, ahead of the far-right nationalist Alliance for the Union of Romanians (AUR) on 17.9%, while the National Liberal party (PNL) had 14.6% and centre-right Save Romania Union (USR) 11.1%. Continue reading...","Sun, 01 Dec 2024 19:27:41 GMT",0.0,0.872
The Guardian,Georgia protests enter fourth night as opposition grows to freeze on EU talks,"Georgian media reports protests in at least eight cities and towns after Saturday’s demonstrations leave 44 in hospitalProtesters rallied in Georgia’s capital for a fourth consecutive night on Sunday and there were signs that opposition was spreading to the government’s decision to suspend talks on joining the European Union.For months, tensions have been rising between the ruling Georgian Dream party and opponents who accuse it of pursuing increasingly authoritarian, anti-western and pro-Russian policies. Continue reading...","Sun, 01 Dec 2024 18:46:57 GMT",-0.1779,-0.4939
The Guardian,Unrwa suspends aid deliveries through main Gaza route after convoy attacked,"Agency says armed gangs looted several trucks carrying food supplies and urges Israel to ensure safe flows of aidMiddle East crisis – live updatesThe UN’s agency for Palestinian refugees has suspended aid deliveries through the main lifeline for the Gaza Strip after a fresh attack by armed gangs on a humanitarian convoy, amid a severe food crisis caused by more than a year of fighting between Israel and Hamas.In a statement on Sunday, Philippe Lazzarini, the head of Unrwa, said several trucks carrying food supplies were looted the day before on the road from Kerem Shalom on the border with Israel, now the main aid crossing point into the besieged Palestinian territory. The route had not been safe for months, he said on X, referring to the unprecedented hijacking of nearly 100 aid trucks last month. Continue reading...","Sun, 01 Dec 2024 16:56:45 GMT",-0.4588,-0.9338
The Guardian,Justin Trudeau promises Trump that Canada will increase border surveillance,"Canadian PM dines with Trump, who vowed tariffs unless country stops migrants and drugs from entering USJustin Trudeau promised Donald Trump that Canada would increase surveillance over the long undefended joint border, a senior Canadian official said on Sunday. The Canadian prime minister flew to Florida on Friday to have dinner with the US president-elect, who has promised to slap tariffs on Canadian imports unless Ottawa prevents undocumented people and drugs from crossing the frontier.Canada sends 75% of all goods and services exports to the United States and tariffs would badly hurt the economy. Continue reading...","Sun, 01 Dec 2024 22:17:25 GMT",0.5994,0.4404
The Guardian,Meta to force financial advertisers to be verified in bid to prevent celebrity scam ads targeting Australians,"Exclusive: Businesses to require financial services licence number to post Facebook ads while individuals will need government-issued IDFollow our Australia news live blog for latest updatesGet our breaking news email, free app or daily news podcastFake celebrity investment scams may soon be harder to push on Facebook and Instagram, with Meta introducing a requirement that financial advertisers are verified.Beginning in early February, Meta will require advertisers seeking to run ads about financial services to verify information about who are the beneficiary and payer. Businesses will be required to provide their Australian financial services licence number or declare an exemption. Individuals will need to provide a government-issued ID.Sign up for Guardian Australia’s breaking news email Continue reading...","Sun, 01 Dec 2024 18:46:21 GMT",-0.5574,-0.163
The Guardian,Irish Greens virtually wiped out in general election rout,"Junior coalition partner loses all but one of 12 seats, while gangland figure Gerry Hutch loses election bidThe Green party in Ireland has been virtually wiped out in the general election, and its leader admitted it was entering a period of “rebuild” after the electorate removed any prospect of the party re-entering government.The Greens lost all but one of their 12 seats, with its leader, Roderic O’Gorman, scraping through on the 13th count. Continue reading...","Sun, 01 Dec 2024 20:18:50 GMT",0.0,0.6059
The Guardian,Belgium’s sex workers win maternity pay and pension rights in world first,"Move by lawmakers hailed as ‘huge step forward’, ending legal discrimination against sex workersBelgian sex workers have gained the right to sick days, maternity pay and pension rights under the first law of its kind in the world.Lawmakers voted in May to give sex workers the same employment protections as any other employee, in an attempt to clamp down on abuse and exploitation. Continue reading...","Sun, 01 Dec 2024 13:11:18 GMT",0.5267,-0.128
The Guardian,Dawson’s Creek actor James Van Der Beek sells merch to pay for cancer treatment,"Actor says he’s selling memorabilia to help cover ‘expensive’ treatment costs for recent colorectal cancer diagnosisThe Dawson’s Creek star James Van Der Beek announced he is selling memorabilia to help cover the “expensive” treatment costs for his recent colorectal cancer diagnosis.Van Der Beek, also known for the film Varsity Blues, made the announcement on Instagram last week, nearly three weeks after revealing his illness in an interview with People. Continue reading...","Sun, 01 Dec 2024 16:30:01 GMT",-0.7003,-0.6597
The Guardian,Romania votes in parliamentary election amid claims of Russian interference,"Success in presidential poll of far-right populist Călin Georgescu has triggered nightly protests across countryVoting is under way in parliamentary elections in Romania, with voters still unsure whether the shock result of last week’s presidential first-round ballot will stand amid continuing allegations of electoral fraud and foreign interference.Far-right parties are forecast to make significant gains in Sunday’s parliamentary vote, with polls showing the nationalist Alliance for the Union of Romanians (AUR) slightly ahead of the Social Democratic party (PSD), part of the ruling coalition. Continue reading...","Sun, 01 Dec 2024 09:32:06 GMT",0.0,-0.1779
The Guardian,"Gisèle Pelicot is not my adversary, says defence lawyer treading a fine line in mass rape case","Béatrice Zavarro has tried to explain, not excuse, why Dominique Pelicot invited strangers to rape his wife, while hoping the case will lead to social change in FranceBéatrice Zavarro, a diminutive figure in a long black robe and heavy red glasses, who has described herself as the “devil’s advocate”, stood up in a packed courtroom in Avignon to sum up the defence for Dominique Pelicot, on trial for drugging his wife, Gisèle, and arranging more than 50 men to rape her.What could his lawyer say about the man who has admitted to the charges in the notorious mass rape trial, and whose perversions and depravity have been played out in words and pictures around the world since proceedings opened three months ago? Continue reading...","Sun, 01 Dec 2024 05:00:46 GMT",-0.4419,-0.9277
The Guardian,"Beer, biscuits and … tools: 2024 Advent calendars – tried and tested","From spices to seeds, coffee to candles, we opened the doors of some of this year’s more inventive countdown-to-Christmas offerings – with varying resultsAdvent calendars filled with everything from beauty products to chocolate, Lego to tea, are as much a staple in the run-up to Christmas as drinking too much and listening to Last Christmas for the 1,237th time.So, we’ve sniffed, tasted and drunk our way through 12 of them, rating them by their contents, value for money, sustainability and festive factor. And for those who want to swerve products altogether, we’ve rounded up the most beautiful, feelgood paper Advent calendars we could find. Continue reading...","Thu, 31 Oct 2024 17:17:55 GMT",0.0,0.9061
The Guardian,"The best non-alcoholic prosecco, champagne and sparkling wines for 2024","From alcohol-free prosecco to dealcoholised wine, here are our top picks for no-booze bubbles with plenty of sparkleParty season is around the corner, but that doesn’t have to mean overdoing the booze until we try to undo the excesses in Dry January.If you’re avoiding alcohol, there are plenty of good alternatives to sparkling wine that still feel celebratory and make that great sound when you pop the cork. And, for once, we can toast to “our good health” and actually mean it. Continue reading...","Fri, 29 Nov 2024 12:00:08 GMT",0.8225,0.9377
The Guardian,"The best Christmas trees: everything you need to know, from sustainability to style","Oh, Christmas trees, how lovely are your branches and are you going to cost the Earth? Our writer demystifies buying the perfect tree, whether real, potted, rental or artificial• The best Christmas baubles and decorations: 28 trinkets to deck the hallsFew things signal the beginning of Christmas like a beautifully dressed tree. But as more of us try to make sustainable choices, the idea of discarding a real tree come January can feel wasteful. The alternative – artificial trees – presents both a solution and a problem.Each type of tree – real, potted, rented or fake – has its benefits and drawbacks, while the right fit for each household will come down to various factors, including space, cost, care and lifestyle. As the Carbon Trust puts it: “The most sustainable choice will depend on the tree, your plans for reuse, then options for disposal.” Continue reading...","Thu, 28 Nov 2024 17:41:03 GMT",0.6369,0.9638
The Guardian,"The 8 best e-readers, tried and tested – from Kindle to Kobo and beyond","In a world where books have to vie with smartphones for attention, a brilliant ebook reader is more necessary than everE-readers have been one of the greatest single-purpose gadgets for almost three decades. They offer an escape from technology and the endless distraction of mobile phones, despite also being tech devices.But that is starting to change. Colour ebook readers, for graphic novels, magazines and books, are now fairly common, and there are several models designed for note-taking. Plus, a whole family of these devices uses Android, meaning they can run all of those apps that often distract from reading.Best e-reader overall: Kindle Paperwhite£124.99 at AmazonBest colour e-reader: 
 Kobo Libra Colour£179 at CurrysBest affordable e-reader: 
 Kobo Clara BW£119 at AmazonBest phone-style e-reader: Onyx Boox Palma 2€299 at Boox Continue reading...","Wed, 27 Nov 2024 18:00:20 GMT",0.6369,0.7096
The Guardian,"Marshall Brickman, Woody Allen’s Oscar-winning co-writer, dies aged 85","Screenwriter co-wrote Annie Hall and Manhattan, penned the Jersey Boys musical, and wrote for Johnny Carson’s Tonight Show and The Muppet ShowMarshall Brickman, the Oscar-winning screenwriter who wrote some of Woody Allen ’s best films, the Broadway musical Jersey Boys and a number of Johnny Carson’s most beloved sketches, has died aged 85.Brickman died Friday in Manhattan, his daughter Sophie Brickman told the New York Times. No cause of death was given. Continue reading...","Sun, 01 Dec 2024 23:32:18 GMT",0.0,-0.6378
The Guardian,"Bob Bryar, former My Chemical Romance drummer, dies aged 44","Longest-standing drummer of pop-punk band said to have influenced emo movement was found dead in TennesseeBob Bryar, the former drummer of the US pop-punk band My Chemical Romance which was said to have influenced the youth culture movement emo, has died aged 44.Bryar’s body was found in his home in Tennessee last week. The entertainment news outlet TMZ, which was the first to report his death, said that according to police no foul play was suspected as his possessions, including musical equipment and weapons, were untouched. Continue reading...","Sun, 01 Dec 2024 22:26:41 GMT",0.5574,-0.9251
The Guardian,Film advent calendar: 24 festive movies chosen by leading film figures,"​Count down to Christmas with favourites selected by Sean Baker, Gillian Anderson, John Waters, Mike Leigh, Gurinder Chadha, Will Sharpe and moreThe Christmas movie has, in recent years, become its own industrial complex, algorithmically churned out by streaming services to hit various subscriber demographic sweet spots. Perhaps the seemingly disposable likes of Hot Frosty and Meet Me Next Christmas will be treasured for many Decembers to come, but they have a tough canon to crack, as represented by our all-star Advent calendar of festive movie favourites, chosen by some of the film industry’s best and brightest, invited by the Observer New Review to help our readers count down to the big day itself.
 Some of the films here are as firmly entrenched in the season as mince pies and fir trees – who can argue with director Gurinder Chadha’s selection of It’s a Wonderful Life or actor Joe Alwyn’s of The Snowman? Others are less obvious: you wouldn’t expect John Waters, Hollywood’s emperor of bad taste, to go cosy and cute, and sure enough, his choice of the notorious video nasty Christmas Evil would make many a person bring up their turkey dinner. For a lot of us, meanwhile, our personal Christmas classics aren’t technically Christmas films at all, but made so by timing and association: we’re steering clear of the played-out Die Hard debate, but Himesh Patel certainly isn’t alone in finding the holiday incomplete without the Lord of the Rings trilogy, and screenwriter David Nicholls makes a strong case for Phantom Thread as festive viewing. To each their own Christmas, and to all a good night. Continue reading...","Sun, 01 Dec 2024 08:00:05 GMT",0.4588,0.9901
The Guardian,Rediscovered Elizabethan portrait may have been love token for Sir Walter Raleigh,"Exclusive: Miniature is thought to be of Elizabeth, Lady Leighton, one of Queen Elizabeth I’s ladies-in-waitingA previously unknown 1580s portrait by Queen Elizabeth I’s official painter has been discovered after languishing for hundreds of years in a private collection.Art experts hailed the “wonderful” discovery of a miniature by Nicholas Hilliard, which has come to light just as Hilary Mantel’s Wolf Hall and all things Tudor are gripping the nation once again. Continue reading...","Sun, 01 Dec 2024 10:45:57 GMT",0.6369,0.2263
The Guardian,Hawking Building review – the Science Museum’s giant new shed of the weird and wonderful,"Science and Innovation Park, Wroughton, SwindonOn an old RAF airfield, a no-frills metal barn has been built to house the reserve collections of the London museum and its associates, with 300,000 objects ranging from a 1960s nuclear missile to Stephen Hawking’s voice synthesiserMuseum storage facilities are unseen wonders, dark troves of material in little-publicised locations. They might hold 95% or more of an institution’s collections, with some objects as fascinating and beautiful as those on view, others acquired for long-forgotten reasons, destined to languish on obscure shelves. They offer resources for researchers, content for exhibitions, and refreshed permanent displays and refuge to artefacts with nowhere much else to go. They are necessary backup to the workings of a museum. They are the underwater part of the iceberg, the paddling parts of a swan, the dark side of the moon.Now, three of the country’s most significant reserve collections are being rehoused in new multimillion-pound facilities where, as well as being better cared for, they will be more accessible to the public. This shift has been prompted by a government plan, announced in 2015, to sell Blythe House in west London, an Edwardian baroque office block converted in the 1970s into a store for the British Museum, the Victoria and Albert and the Science Museum. The first of these has moved its objects to a new archaeological research collection in Shinfield, near Reading, and the second to the V&amp;A East Storehouse, a “new kind of museum experience”, which will open next year within the former 2012 Olympics media centre in east London. Continue reading...","Sun, 01 Dec 2024 13:00:07 GMT",0.4588,0.9432
The Guardian,Wedgwood Collection still revealing new treasures a decade after it was saved for the nation,"From a royal dolls’ house tea set to a plate from a shipwreck, the V&amp;A’s ceramics trove is full of gems from history that still inspire artists todayIt is one of the most important industrial collections in the world, with more than 175,000 artworks, ceramics and photographs, spanning two centuries of history.The Wedgwood Collection was acquired for the nation by the charity Art Fund and gifted to the Victoria and Albert Museum 10 years ago today, and researchers are still uncovering new treasures within it, from china with royal connections to family keepsakes. The fundraising drive to buy the archive is still the most successful ever held by Art Fund. Continue reading...","Sun, 01 Dec 2024 14:00:12 GMT",0.6808,0.9381
The Guardian,Flex your new visual super skills,We’ve all acquired new design smarts. Now it’s time to make the most of them Continue reading...,"Wed, 20 Nov 2024 10:47:07 GMT",0.5994,0.3818
The Guardian,From manifesting to manifestos: Steven Bartlett is spearheading a new approach to achieving your goals,"The entrepreneur has teamed up with Adobe Express to promote the benefits of creating your own personal manifestoSteven Bartlett might be a visionary entrepreneur but he’s all-too aware that having vision isn’t enough on its own. As part of a partnership with Adobe Express, the quick and easy content app, he’s now on a mission to show people how to turn their vision into actionable steps with the help of a carefully-conceived manifesto that aligns with their goals and values. Calling it the “Manifest-o Method”, the idea is to provide a framework that can help guide entrepreneurs in their early stages. As he put it in an interview with Adobe: “Manifestation without action is like setting your car’s sat-nav without turning the engine on.”When creating the Manifest-o Method, Bartlett, who is probably best known for The Diary of a CEO podcast and his appearances on BBC Dragons’ Den, drew on his own experience of creating and designing a business manifesto for his podcast company, Flight Studio, using Adobe Express. Continue reading...","Mon, 04 Nov 2024 15:36:29 GMT",0.0,0.9854
The Guardian,‘Time-chunking’ and great design … side hustle experts give their tips for success,"Nearly half of us now run a side gig alongside our regular job. Here’s how to make it work …The side hustle has become central to modern living. Nearly 50% of Brits have a side hustle, with nine out of 10 “side hustlers” who are under 34 planning to transition said hustle into a full-time business. But juggling your side hustle with your day job can be tricky even for the most skilled multitasker. So here are some tips for managing multiple gigs without annoying your boss or colleaguesCompartmentalise while cross-fertilising Try to view your day job as a source of inspiration and insights rather than an obstacle to your side-hustle. Your life will feel more coherent and less draining. Continue reading...","Mon, 21 Oct 2024 09:54:16 GMT",0.8316,0.5166
The Guardian,‘The best personal brands aren’t overly curated’: six dos and don’ts for the jobs market,"Personal branding is far more complex than it once was, with evolving tech adding to the possibilitiesPersonal branding has undergone a radical rebranding. The way we showcase ourselves in the workplace and jobs market has been transformed by the tools at our disposal and societal shifts, such as the melding of work and life. Twenty-five years ago, you had a CV and, if you wanted a new job, you updated it and sent it to prospective employers. Your reputation may have enhanced your prospects but, when it came to job hunting, your qualifications and CV were pretty much the only showcase you had.With the internet everything changed – and then changed again with social media and smartphones. Suddenly, you were visible to millions of people on a device they carried around in their pockets. Those same tools gave you the ability to step up from CVs to slickly presented websites and slide decks. And social media gave everyone a platform to build and manage their own personal brand in real time. Continue reading...","Fri, 01 Nov 2024 13:59:22 GMT",0.6369,0.8338
The Guardian,Is it important for kids to learn about winning and losing?,"Some experts say the values of fun and personal development in youth sports are being replaced by performance and victoryMy boyfriend’s parents coached youth sports teams in the 90s, so they have many anecdotes about how children handle winning and losing. Two cousins on separate soccer teams were so competitive that the one who lost would refuse the post-game high-five, instead retreating to some nearby bushes to cry. A little girl used to kick opponents with her ice skates during hockey; another refused to pass because her dad gave her cash for every goal she scored. One boy, when his team lost, lay flat out on the ice and simply wouldn’t get up.There’s a general consensus that, in addition to boosting fitness, youth sports impart valuable life skills, like teamwork and discipline. Winning and losing are especially significant, because they prepare children for the setbacks and challenges they will face in adult life. Continue reading...","Sun, 01 Dec 2024 13:00:08 GMT",0.3818,0.8816
The Guardian,‘I felt like a bystander in my own internal recovery’: one woman’s battle for health after a life-changing diagnosis,"Facing an enormous decision about her health filled Kat Lister with wonder at her body’s ability to fight for herThe 2cm wound to the right of my bellybutton had been oozing for days. A syrupy weep in the well of my abdomen. A surgical pothole so small that it felt almost indulgent to photograph it in my bathroom mirror. As if these tiny keyhole incisions dotted around my swollen stomach – one, two, three, four, five of them – bore no relation to the magnitude of the plunder beneath.Magnitude. Or, should I say: weight. “Do you feel lighter?” a friend asked me a week after I had a total colectomy to save my life. To which I replied (somewhat contradictorily): yes and no. It didn’t take long for my doctors to start referring to my large bowel, laden with more than 400 precancerous polyps, as a “heavy burden” – and I think there is something poetic in that choice of words. A flash of humanity in an otherwise sterile place. Which is where I found myself in May last year, staring numbly at pictures of stoma bags in St Mark’s hospital in north-west London, the only hospital in the world to specialise entirely in intestinal and colorectal medicine. Continue reading...","Sun, 01 Dec 2024 09:00:02 GMT",-0.0258,-0.0056
