broadcast,title,description,pub_date,title_sentiment_score,description_sentiment_score
Aljazeera,"Myanmar’s military regime to free nearly 6,000 prisoners in amnesty","Myanmar&#039;s military rulers announced an amnesty for 5,864 prisoners to mark Independence Day, state media reports.","Sat, 04 Jan 2025 05:51:58 +0000",0.0,-0.5106
Aljazeera,Medical victims: Indian visa curbs amid Bangladesh tensions hurt patients,"India has scaled back visa operations in Bangladesh, hitting thousands of patients who rely on its hospitals for care.","Sat, 04 Jan 2025 04:19:10 +0000",-0.8126,0.4939
Aljazeera,"Russia-Ukraine war: List of key events, day 1,045","Here are the key developments on the 1,045th day of Russia’s invasion of Ukraine.","Sat, 04 Jan 2025 03:34:05 +0000",-0.5994,0.0
Aljazeera,Q&A: Leader of Myanmar’s shadow government talks civil war strategy in 2025,Myanmar’s National Unity Government (NUG) seeks to deal a decisive blow to the country’s military rulers in 2025.,"Sat, 04 Jan 2025 01:45:21 +0000",-0.5994,0.2263
Aljazeera,FBI suspects soldier behind Las Vegas Cybertruck blast suffered from PTSD,"The soldier, Matthew Livelsberger, was found dead in the wreckage of the New Year&#039;s Day explosion outside a Trump hotel.","Fri, 03 Jan 2025 23:31:05 +0000",-0.6808,-0.6486
Aljazeera,"Brighton vs Arsenal preview; kickoff time, team news, how to follow, stream",Arsenal manager Mikel Arteta has urged his players to &#039;flip the coin&#039; in their pursuit of the Premier League title.,"Fri, 03 Jan 2025 22:37:56 +0000",0.0,0.0
Aljazeera,New Orleans mourns as Bourbon Street reopens after truck-ramming attack,"Residents have erected a makeshift memorial to the victims, as local businesses prepare for the tourist high season.","Fri, 03 Jan 2025 22:03:36 +0000",-0.7579,-0.3182
Aljazeera,New York judge sets Trump’s sentencing in hush-money case for January 10,"In his decision, Judge Juan Merchan wrote that President-elect Trump would not face jail ahead of his inauguration.","Fri, 03 Jan 2025 21:12:46 +0000",-0.1531,0.0
Aljazeera,Finnish court upholds oil tanker seizure in undersea cables probe,Finland seized Eagle S tanker carrying Russian oil on suspicion that it damaged the Finnish-Estonian Estlink 2 power.,"Fri, 03 Jan 2025 20:46:32 +0000",0.0,-0.6705
The Guardian,Fears of unrest as PM considers open prisons for more offenders,"Unions concerned about potential rise in violence, drug abuse and the threat of riots at low-security facilities in England and WalesThe government is considering relaxing the restrictions on inmates who can be sent to open prisons, despite warnings that the move could increase violence, drug abuse and the potential for riots.Under an unannounced policy first introduced by the Conservatives and expanded by Labour, officials have already been accelerating moves from closed to open prisons in order to ease overcrowding. Continue reading...","Sat, 04 Jan 2025 19:00:01 GMT",-0.6801,-0.947
The Guardian,Man dies after 70-metre fall from mountain ridge in Lake District,Callout ends in tragedy after an as yet unnamed person fell on Thursday and their body was recovered by a rescue teamA man has died after falling 70 metres from a mountain ridge in the Lake District.Keswick Mountain Rescue said its first callout of the year ended in tragedy after the man fell from Sharp Edge on Blencathra on Thursday. Continue reading...,"Sat, 04 Jan 2025 17:48:37 GMT",0.0,-0.8126
The Guardian,"UK weather: power cuts, traffic chaos and cancelled flights due to heavy snow","Closed roads, multi-vehicle collisions and train interruptions reported as Met Office yellow and amber warnings remain in placeHomes were left without power, roads were closed, cars stranded, and flights and train services disrupted on Saturday as heavy snow and freezing rain hit much of the UK.The National Grid said on Saturday night that power was cut to properties across the Midlands, south-west England and South Wales, including Birmingham, Bristol and Cardiff, and that work was under way to get services restored. Continue reading...","Sat, 04 Jan 2025 23:45:33 GMT",-0.7845,-0.8176
The Guardian,‘Picture Nigel Farage as PM’: jubilant Reform UK dares to dream at East of England conference,"Members urged to feel party’s momentum – but some remain aware of the obstacles ahead“I want you to take a moment to picture the day when, in just a few years’ time, prime minister Nigel Farage triumphantly arrives at No 10 Downing Street, puts his briefcase down on the desk and takes a seat,” Reform UK chair Zia Yusuf tells a rapt audience of party members. “Change is coming. We will turn this country around and restore the United Kingdom to its rightful position as one of the greatest countries in the world.”The speech is met with rapturous applause and a standing ovation at Reform’s East of England conference, held in Kemi Badenoch’s rural North West Essex constituency on Saturday. Continue reading...","Sat, 04 Jan 2025 20:56:12 GMT",0.7184,0.9744
The Guardian,Hamas releases video it says is of Israeli hostage held in Gaza since 2023 attack,"Family of now 19-year-old conscript Liri Albag appeals to PM to ‘take decisions as if it were your own children there’The armed wing of Hamas has released a video it says is of an Israeli hostage held in Gaza since its October 2023 attack.Liri Albag, described by local media as a soldier, was 18 when she was captured by Palestinian militants at the Nahal Oz base on the Gaza border along with six other women conscripts, five of whom remain in captivity. Continue reading...","Sat, 04 Jan 2025 19:01:16 GMT",-0.4767,0.0
The Guardian,Wegovy maker Novo Nordisk sponsored British pharmacies in pursuit of sales,"Danish drug company gave money for Google ads to promote weight loss services and received data on web traffic and prescriptionsThe Danish drug company Novo Nordisk provided hundreds of thousands of pounds’ worth of sponsorship to pharmacies including Boots and Lloyds as it sought to boost sales of its slimming drugs in Britain, the Observer can reveal.The maker of Wegovy and Saxenda weight-loss injections gave money for Google ads to promote weight-loss services, staff training, and the creation of patient information content. In exchange it received detailed reports about website traffic, advertising hit rates and prescription numbers. Continue reading...","Sat, 04 Jan 2025 18:59:40 GMT",0.0,0.8225
The Guardian,All NHS acute hospital trusts in England are missing Labour’s 18-week target,"The PM’s ‘milestones’ include 92% of patients waiting no more than 18 weeks – but not one of the 124 trusts is hitting the markEvery acute hospital trust in England is failing to hit Keir Starmer’s key target to treat 92% of patients within 18 weeks, analysis of NHS figures reveals.The new data exposes the scale of the challenge facing the prime minister this year as he tries to reform the NHS. The most recent waiting list data reveals that in some hospital trusts, more than half of patients are waiting longer than 18 weeks. Out of 124 acute trusts across the country, none are hitting the target, according to analysis of the figures by the Observer. Continue reading...","Sat, 04 Jan 2025 19:24:46 GMT",0.2263,0.9442
The Guardian,Coalition talks between Austria’s two biggest centrist parties collapse,"Chancellor Karl Nehammer to step down after failure to form government without far-right Freedom partyTalks between the two biggest centrist parties in Austria on forming a coalition government without the far-right Freedom Party (FPO) have collapsed, Chancellor Karl Nehammer said on Saturday, adding that he would step down in the coming days.The announcement came a day after a third party, the small, liberal Neos, threw the process into disarray by saying it was quitting the talks, blaming the other parties for failing to take the bold and decisive action it said it had called for. Continue reading...","Sat, 04 Jan 2025 20:23:02 GMT",-0.128,-0.6526
The Guardian,Washington Post cartoonist resigns over paper’s refusal to publish cartoon critical of Jeff Bezos,"Pulitzer prize winner Ann Telnaes had drawn a cartoon of the paper’s owner kneeling before Donald TrumpThe Washington Post’s Pulitzer prize-winning editorial cartoonist Ann Telnaes has resigned from her position at the newspaper after its refusal to publish a satirical cartoon depicting the outlet’s owner, Jeff Bezos – along with other media and technology barons – kneeling before Donald Trump as he gears up for his second US presidency.“I have had editorial feedback and productive conversations – and some differences – about cartoons I have submitted for publication, but in all that time I’ve never had a cartoon killed because of who or what I chose to aim my pen at,” Telnaes wrote on Friday in an online post on the Substack platform detailing her decision to quit. “Until now.” Continue reading...","Sat, 04 Jan 2025 15:23:11 GMT",-0.5574,-0.6369
The Guardian,Protesters march in London for release of teenage boy in Dubai jail,"Marcus Fakana from north London was convicted of having sex with British girl, now 18, when they were on holidayProtesters have marched through central London calling for the release of a teenager in prison in Dubai for having sex with a 17-year-old British girl.Marcus Fakana, from Tottenham in north London, was jailed last month after being convicted of having sex with the girl, who has now turned 18, when they were on holiday in September. Continue reading...","Sat, 04 Jan 2025 16:50:23 GMT",-0.2263,-0.1531
The Guardian,Indie film-maker Jeff Baena dies aged 47,"Husband of actor Aubrey Plaza was known for writing and directing Life After Beth and co-writing I Heart HuckabeesIndependent director and screenwriter Jeff Baena – who was known for quirky hits such as Life After Beth and was the husband of that film’s star, Aubrey Plaza – has died, according to reports. Baena was 47.The Los Angeles medical examiner said that Baena died on Friday at his home in that city at about 10.39am local time. Officials did not immediately provide Baena’s cause or manner of death. Continue reading...","Sat, 04 Jan 2025 17:04:33 GMT",0.0,-0.4588
The Guardian,"New year, new Keir? Labour have big plans for 2025 - including taking inspiration from Thatcher","The party’s manifesto promised big policy reforms. Now, with his popularity in freefall, the prime minister must deliver to change the political narrativeAs the popularity of his government has nosedived in recent weeks, Keir Starmer has turned up the heat on his cabinet ministers. Since early last month, individual secretaries of state have been summoned by the prime minister to attend 90-minute, one-to-one interrogations to check on their work, department by department.Starmer’s officials insist that no one in Downing Street or Whitehall is panicking. Not yet, anyway. But just six months on from his landslide general election victory, the meetings are evidence of a sense of urgency and unease, and proof that the hard realities of government have dawned. Continue reading...","Sat, 04 Jan 2025 19:32:29 GMT",0.5267,-0.431
The Guardian,"Polyphenols: the natural chemicals that could give you a small waist, healthy heart and low blood pressure","Can the compound found in plants slow the ageing process and help tackle Alzheimer’s? Food writer Giulia Crouch finds out . . . There’s a new buzzword in town when it comes to health: polyphenols. While scientists have been investigating the plant compounds for years, the term has now caught the public imagination – and for good reason.A growing body of evidence shows that eating a diet high in these clever natural chemicals offers numerous health benefits, improving everything from heart and metabolic health to lowering the risk of neurodegenerative diseases, such as Alzheimer’s. Continue reading...","Sat, 04 Jan 2025 15:12:34 GMT",0.7269,0.9538
The Guardian,New Orleans attacker fell into extremism after marital and financial woes,"Shamsud-Din Jabbar once worked at a major accountancy, but a chaotic family life undermined his stabilityShamsud-Din Jabbar’s descent into religious extremism unfolded over years – but his deadly disdain for many of his fellow Americans’ way of life had recently intensified as he faced increasing financial and familial pressures, his associates have said in the wake of the truck attack that killed 14 Near Year’s Day revelers on New Orleans’ famed Bourbon Street.Jabbar – a 42-year-old former army signal corps sergeant who was shot dead by police – was described as smart and affable by his former military colleagues, who shared shock at his transformation into someone authorities now consider to be a terrorist. Continue reading...","Sat, 04 Jan 2025 16:48:53 GMT",-0.765,-0.979
The Guardian,Luke Littler’s rise brings darts huge opportunities – and burning questions,"The 17-year-old could reign supreme for years but at some point his unassailability risks dulling the sport’s edgesYou know what? I reckon this is the year Luke Littler could finally be ready for the Premier League. Obviously we all still want to wrap him up in cotton wool. Obviously we’re all still deeply concerned about how the attention and pressure could affect his game. But my bet – if the evidence of the last 12 months is any guide – is that he might just be able to handle it.Premier League champion, Grand Slam champion, a slew of victories across eight different countries in the Pro Tour, the European Tour and the World Series. Nine-dart finishes falling out of his sleeves. Had he not also gone on to win his first world championship at the age of 17, we would still be toasting one of the most remarkable full debut seasons ever seen in the sport’s professional era. Continue reading...","Sat, 04 Jan 2025 19:00:01 GMT",0.5994,0.9792
The Guardian,Ukraine waits for Trump the dealmaker to broker end of Putin’s war | Shaun Walker in Kyiv,"The US president-elect’s policy on the conflict may prove decisive, but appeasing both sides will be a challengeA new year in Ukraine began in much the same way as the old one finished: with deadly Russian drone attacks across the country. In Kyiv, one person was killed and at least six others were injured in the first few hours of 2025.It is Ukraine’s third new year since Russia’s invasion. If 2023 began with hopes high that Ukrainian battlefield gains would push Russia back and lead to an outright victory, by the start of 2024 the Ukrainian army and population were already settled in for the long haul and had few illusions about a quick victory. Continue reading...","Sat, 04 Jan 2025 16:29:31 GMT",-0.5994,-0.8735
The Guardian,Simon never linked the pain in his hands and feet to multivitamins – but a pathology test did,"A growing number of consumers are presenting with symptoms linked to high levels of vitamin B6, pathologists say, while the supplement industry goes unpolicedWhen Simon Bogemann’s hand began cramping around the steering wheel in a claw position on his commute from Geelong to Melbourne, he began to worry.Bogemann, then 43, was also getting pins and needles in his feet and fingers every night in bed, and while sitting down during short lunch breaks at work.Sign up for a weekly email featuring our best reads Continue reading...","Sat, 04 Jan 2025 19:00:02 GMT",0.2146,0.891
The Guardian,Labour’s poll lead is fading and the base is weak – it’s time for Starmer to roll the dice,"The PM can at least take comfort from the fact that the Tories are struggling just as much as he isSix months after Labour’s biggest landslide in a generation, the new government is already in the mire. The poll lead on which Starmer’s majority was built has already all but vanished, leaving Labour in a three-way dogfight with the Conservatives and Nigel Farage’s resurgent Reform UK, while, further down, both the Greens and Liberal Democrats have also made gains.Voters have historically given new governments the benefit of the doubt, with most holding their ground or gaining support in their first six months. Blair’s first two new Labour governments enjoyed polling honeymoons. Starmer has had no such luck. Labour’s seven-point decline since the election has been exceeded only once in the past four decades – by the Conservatives’ eight-point fall in the wake of “Black Wednesday” in 1992. Starmer’s early approval ratings are also worse than any PM at this stage except Major after the ERM (Exchange Rate Mechanism) crisis. Major never recovered the ground lost early, and went on to a landslide defeat. Continue reading...","Sat, 04 Jan 2025 18:57:08 GMT",-0.4404,-0.3226
The Guardian,"‘Everything is destroyed, nothing could be saved:’ anger and despair in communities devastated by North West floods","After flood defences failed yet again, heartbroken residents of Merseyside and Cheshire now face a painful clean-up and possible financial ruinAt about 3.15am on New Year’s Day, Caroline McClymont looked out of her bedroom window at the Sankey brook over the road. It looked a bit fuller than usual – to be expected, given the rain. “But there was nothing out of the ordinary,” McClymont said. “There was no indication it was going to flood.”Within an hour, the whole street was under water. The home McClymont, a science lecturer, has owned with her husband Alan, a technician, for 31 years was filled with dirty water, higher than the kitchen countertops. It covered the sofas, washing machine, Christmas tree, everything on the ground floor. The neighbour’s car was submerged. “Everything is destroyed. Nothing could be saved,” McClymont said. “It’ll take six, seven months to get right again. Continue reading...","Sat, 04 Jan 2025 19:53:39 GMT",-0.9217,-0.9584
The Guardian,Cocksure Kim Jong-un is raising the nuclear stakes. Is it time for South Korea to follow suit? | Simon Tisdall,"Under Donald Trump, the US may become an unreliable ally. The case is getting stronger for Seoul to build its own deterrentSo-called frozen conflicts can suddenly turn hot without warning. Look at Ukraine, Syria or Armenia-Azerbaijan. Might Korea be next? For almost three-quarters of a century, an armistice – not a peace treaty – has prevented old foes North Korea and South Korea tearing each other apart. Their respective backers, China and the US, underwrote a chilly cold war status quo.Now, momentously, the ice is cracking. But it’s not a political thaw. Mutual hostility is undiminished. It’s not because Kim Jong-un’s impoverished hermit kingdom is imploding, as often predicted. Rather, it’s because North Korea, buoyed by new friends in high places, is on a roll while South Korea is suffering a very public meltdown. In short, things are hotting up. Continue reading...","Sat, 04 Jan 2025 17:30:54 GMT",0.0,-0.8251
The Guardian,This is how we do it: ‘We don’t share the intimate details of the sex we have with other people’,"Lachlan and Agnes are in an ethical non-monogamous relationship but get frustrated when couples exploit the concept as a tool for bad behaviourHow do you do it? Share the story of your sex life, anonymouslyWe let people know they can choose to date us as a couple or separately Continue reading...","Sat, 04 Jan 2025 12:00:48 GMT",0.296,-0.7906
The Guardian,Embracing X and a turn by Timothée Chalamet: how Bob Dylan is capturing gen Z,"As Chalamet plays the singer in the acclaimed biopic A Complete Unknown, the man himself has taken, at 83, to posting on XIn 1965, Bob Dylan was the most fashionable musician in the world. Over the past 60 years, his critical and commercial appeal has fluctuated, but in the 21st century his acclaim has steadily increased in an unusual way for an ageing musician, capped with winning the 2016 Nobel prize in literature.More surprisingly, he’s become hip again, not just with long-term followers but with younger listeners, many adding his music to their playlists for the first time. And he has recaptured the zeitgeist via the most unlikely of means for an enigmatic, grouchy eightysomething: taking up posting on X as others abandon it, and endorsing a biopic, A Complete Unknown, that celebrates the first few years of his career, and conceding – as he has rarely done before – that his past might be as important as his present or future. Continue reading...","Sat, 04 Jan 2025 16:00:53 GMT",0.0,0.8519
The Guardian,Ruben Amorim shapes up as Manchester United’s fall guy but rot runs deeper | Jonathan Wilson,"Unbending coach takes his side to Liverpool on Sunday, with attempts to kick club on undermined by a decade of misruleThe thought had always been that it couldn’t happen now. It’s just not possible in modern football that a super-club could be relegated. Manchester United may have gone down in 1974 but it’s not going to happen in 2025. Even when Ruben Amorim said that United were in a relegation battle after Monday’s 2-0 defeat by Newcastle, he was making the point to shock.And it’s not going to happen now. United will not be relegated. They probably only need 15 points from the second half of the season to be safe and the financial structure of modern football means there are at least three sides worse than them.&nbsp;Yet it’s significant that Amorim could mention relegation&nbsp;without it sounding entirely absurd, revealing that it feels worth doing the calculation, working out what sort of tally might be necessary for United to survive. What has happened at United since Sir Alex Ferguson left feels like thought experiment made flesh: what would it take for the most successful side in English history to go down? Continue reading...","Sat, 04 Jan 2025 20:00:01 GMT",0.0,0.9612
The Guardian,"Australia v India: fifth men’s cricket Test, day three – live","Updates from Day 3 of New Year’s Test at the SCGAustralia four wickets down as India fight backAny thoughts? Email our writers35th over: India 148-7 (Washington 7, Siraj 1) Mohammed Siraj at No9 is not a comforting prospect for India. So presumably Bumrah will bat last, if he must, to make sure that warm-up is next to his bowling warm-up? The Indian camp said he had back spasms, which might be manageable. Siraj gets a run first ball though, to fine leg, and Washington has a big square drive to end the over but misses out. Siraj on strike in Boland’s second over. Not good for India.The lead is 152. Continue reading...","Sun, 05 Jan 2025 02:45:46 GMT",0.0,-0.8122
The Guardian,Arteta rages at Brighton penalty award: ‘I’ve never seen a decision like this’,"João Pedro won and scored spot-kick in Arsenal draw‘When you look, you can see contact there [with the ball]’Mikel Arteta hit out at Anthony Taylor for awarding the penalty that pegged back Arsenal at Brighton but admitted his side lacked enough “freshness” to hold on for victory. Ethan Nwaneri’s second Premier League goal had given the visitors the lead in the first half but the Arsenal manager was left raging when William Saliba was penalised by Taylor for catching João Pedro in the face as he attempted to head the ball away.“I have never seen a decision like this in my career. I asked the boys if they have and nobody has seen it before,” said Arteta. “When you look at the incident, the distance, the player, João touching the ball, then Saliba touching the ball, you can see contact there. I checked [with the officials]. After three seconds they said they had already checked. It seems quick.” Continue reading...","Sat, 04 Jan 2025 21:27:41 GMT",-0.0258,0.1406
The Guardian,Tuchel’s notebook: what England’s head coach may have learned at Tottenham,"Newcastle duo catch the eye in first Premier League game Thomas Tuchel has attended since contract officially startedIt didn’t take long for the Thomas Tuchel effect to be felt. By the time six minutes had been played at the Tottenham Hotspur Stadium under the – seemingly quite grumpy – eye of the new England head coach, two English players had scored with excellent finishes, Dominic Solanke with a plunging header and Anthony Gordon with a calm angled shot. If there were concerns about Gordon’s positioning for Solanke’s goal, they could be excused in the context of a generally excellent defensive performance from Newcastle.Nine of the starters were England-qualified, even with James Maddison on the bench. Of most interest to Tuchel, perhaps, would have been a Newcastle pairing with which he is already familiar. It was Tuchel who gave Lewis Hall his full Chelsea debut, starting him on the left of a back three in a 5-1 FA Cup win over Chesterfield in 2022. Later that year, around a month before Tuchel was sacked, Chelsea had a £40m bid for Gordon rejected by Everton. Newcastle’s left flank is the left side Chelsea could have had and the left side England might favour in the future. Continue reading...","Sat, 04 Jan 2025 16:11:14 GMT",0.0,0.9577
