broadcast,title,description,pub_date,title_sentiment_score,description_sentiment_score
The Guardian,Polo review – Prince Harry’s unintentionally hilarious profile of the world’s stupidest sport,"Fixtures are chosen by popping confetti-filled balloons, obnoxiously privileged players weep in darkened rooms when they lose … this documentary about the royal’s hobby is like a spoofTo briefly paraphrase Hans Gruber: when Prince Harry saw the breadth of his Netflix deal, he wept for there were no more family members to slag off.In 2020, Prince Harry and Meghan signed a $100m deal with Netflix to produce – as they put it – “content that informs but also gives hope” utilising “powerful storytelling” through a “truthful and relatable lens”. What this meant in practice was that they made one reality show about how hard they had it, and then they stuttered. The Harry &amp; Meghan show was followed by two forgettable documentaries, one about the Invictus Games and one about some nebulous concept of leadership. At some point in the future there will be a Meghan cookery show that Netflix seems reluctant to show. But before that comes Polo, a show about polo made by Prince Harry, who likes polo. Continue reading...","Tue, 10 Dec 2024 12:47:39 GMT",-0.1779,-0.6124
The Guardian,Society of Authors calls for celebrity memoir ghostwriters to be credited,"Many celebrities’ books are actually written by others, the UK writers’ union says, and it’s time they were acknowledgedThe Society of Authors (SoA) is calling on celebrities and the publishing industry to properly acknowledge the writers behind celebrity books, particularly those aimed at children.In a statement published on Monday, the SoA – the largest trade union of writers, illustrators and translators in the UK – said that many celebrity titles, especially those for children, involve ghostwriters and other “co-creators”. Continue reading...","Tue, 10 Dec 2024 16:42:22 GMT",0.3612,0.0
The Guardian,‘Those women are the embodiment of resilience’: how refugees in Uganda are building a future filled with hope,"For displaced women in Uganda, finding safety is just the start of a journey that ultimately leads to developing the skills needed to thriveFor most of the world’s displaced women and girls, crossing into a safe country is not the end of their struggle, but the beginning of another. Having fled unimaginable horrors – war, violence, and persecution – they face new challenges on arrival, often lacking access to basic rights such as healthcare, education, and economic opportunities.In Uganda, one of Africa’s leading countries for receiving refugees, organisations such as ActionAid play a vital role in supporting displaced women and girls as they navigate these difficulties. Led by Mercy Grace Munduru, head of Programmes and Fundraising, ActionAid Uganda, the chairty’s efforts go far beyond basic relief. It works with women and girls to rebuild their lives, fostering resilience in the face of extraordinary adversity.The Imvepi refugee settlement Continue reading...","Fri, 22 Nov 2024 10:07:20 GMT",0.4404,0.3919
The Guardian,‘I want my daughters to be educated’: how Rohingya women refugees are taking charge of their own futures,"Almost 1 million refugees live in Cox’s Bazar – and many of them are women and girls at risk of gender-based violence. But, with the support of ActionAid, training in vocational skills, community participation and leadership is helping them advocate for the needs of their communityWhen Anwara fled her home in Myanmar six years ago, the youngest of her three daughters was still only a babe in arms. They were part of a group of hundreds of thousands of Rohingya refugees who crossed the border looking for safety. After walking for several days, they arrived in Cox’s Bazar in south-east Bangladesh, a makeshift settlement that is now home to nearly 1 million Rohingya refugees. Life in the camps is hard, Anwara says. But at least it is providing some security for her family. “When we came from Myanmar, we suffered a lot. We didn’t have any money, shelter or food. Now we have a house to live in and receive food rations every month.”Rohingya refugees are in a precarious situation as they have not been formally granted refugee status, so they’re unable to work and integrate with the community outside the camps. Prospects for their return to Myanmar have continued to decrease as levels of violence have risen across the country. Continue reading...","Fri, 01 Nov 2024 14:05:53 GMT",0.0772,-0.2047
The Guardian,‘Non-Ukrainians face discrimination’: how a social enterprise in Warsaw helps marginalised refugees,"When war escalated dramatically in Ukraine, some minorities faced additional difficulties when it came to seeking safety in Poland. Thankfully, Conflict Kitchen was determined to bring them together with the local population through the universal language of foodWhen Russia began its full-scale invasion of Ukraine in February 2022, hundreds of refugees began pouring into Warsaw central station in Poland every day in search of safety. Most were native Ukrainians, while others were third-country nationals who had built a life in Ukraine. For all those fleeing the devastation, it was a time of terror and uncertainty, but for the latter group, it was particularly perilous.“From the very beginning of the war, we were getting information about all kinds of abuses that non-Ukrainian [refugees] were facing in Ukraine while trying to get to Poland,” says activist Jarmiła Rybicka. “At the border on both sides, non-Ukrainians were expelled or sent to the back of the queues. They were pushed out from trains and told that there was no space for them. Meanwhile, white Ukrainians escaped.” Continue reading...","Fri, 01 Nov 2024 14:01:53 GMT",0.3612,-0.9552
The Guardian,From period poverty to gender-based violence: how women refugees in Uganda are standing up for their rights,"International charity ActionAid has been working with women and young activists in refugee settlements who are advocating for their communities, fostering leadership skills and creating economic opportunitiesNo one chooses to be a refugee. Some are fleeing conflict, others extreme poverty or persecution, but one thing they all share is the desire to find safety or freedom. Around 1.7 million refugees and 50,000 asylum seekers live in Uganda, with 80% of communities living in the country’s refugee settlements made up of women and children.Since 2018, international charity ActionAid has been supporting the work of women and young activists in these refugee settlements who are advocating for their rights, leading their communities and creating economic opportunities for themselves to fight economic injustice. Continue reading...","Fri, 01 Nov 2024 14:03:02 GMT",-0.8126,0.9793
The Guardian,"Advocaat, cream liqueur, spiced rum … why retro Christmas drinks are back","From snowballs to sweet sherry, the Observer’s wine expert picks the delicious seasonal tipples you wouldn’t dream of having at any other time of yearWhen it comes to the festive period, I’m definitely closer to the “most wonderful time of the year” than the “bah humbug” end of the spectrum. But even this fully paid-up Christmas-enjoyer would admit there is something peculiar about many of the things we get up to in this season – not least the fact that so much of what we eat and drink between now and the new year wouldn’t get anywhere near the menu at any other time.That starts, for me, with turkey – a strictly Christmas Day-only meat in my household. It also includes such festive staples as Quality Street, dates, mincemeat, cloves, cranberry sauce, pigs in blankets and, for that sizeable majority of people who don’t share my love of the greatest of bitter brassicas, brussels sprouts. Continue reading...","Tue, 10 Dec 2024 14:00:14 GMT",0.0,0.9815
The Guardian,I’m having the best sex of my life – but I can’t climax until my lover leaves the room,"We are in a close and loving relationship, so neither of us can understand this last inhibitionMy lover and I are in our 70s, have been friends for years and are enjoying the best, most intimate sex of our lives. But I struggle to orgasm in front of him. I wish I could see what other women look like when they do but I’m too scared to search for it on the internet. He is very considerate and when he sees that I am close to an orgasm, he leaves me alone for a few minutes with my vibrator. When he hears me climax, he comes back because he wants to hold me and share it. I’d like to understand what is stopping me from doing it while he is lying next to me or watching. I think it could be because I feel at a disadvantage. Unlike me, he probably has seen other women masturbating and climaxing. We are in a close and loving relationship, so he can’t understand this last inhibition of mine. I hesitate to talk to him about it as I don’t want him to look back at previous partners and compare me with them.You do not have to feel bad about a very normal response. Most of us were taught that masturbation was wrong or “dirty”, and for that reason it is hardly surprising you are now programmed to keep it private. Most of us have developed ideas of what is sexually “normal” from unreliable sources – media, pornography, friends. As a couple you have developed a style that works for you, and that is wonderful. Your partner is acting in a very loving and considerate manner, so relax, be grateful for that and appreciate that you are well understood.Pamela Stephenson Connolly is a US-based psychotherapist who specialises in treating sexual disorders.If you would like advice from Pamela on sexual matters, send us a brief description of your concerns to private.lives@theguardian.com (please don’t send attachments). Each week, Pamela chooses one problem to answer, which will be published online. She regrets that she cannot enter into personal correspondence. Submissions are subject to our terms and conditions. Continue reading...","Tue, 10 Dec 2024 11:00:12 GMT",0.8316,0.9896
The Guardian,Crumbs! Why are mince pies so expensive this Christmas?,Some supermarket varieties cost 40% more than last year. But they’re not the only festive favourites breaking the bankName: Mince pies.Appearance: Sugar-dusted flying saucers of pastry. Continue reading...,"Tue, 10 Dec 2024 15:24:58 GMT",0.0,-0.4973
The Guardian,Think you know the differences between UK and US spelling? Take our quiz,"From beer and facial hair to stomach bugs and car parts, test your knowledge of English’s transatlantic idiosyncrasiesZoe Williams: Online puzzles are puzzling enough without all this American lingo Continue reading...","Tue, 10 Dec 2024 11:00:13 GMT",0.0,0.0
The Guardian,Nigel Slater’s recipe for chicken with grapes,"A succulent, herby, meaty dish with a dash of white wineYou will need 2 large chicken breasts off the bone, with the small wing bone attached, if possible. Using a cutlet bat or a rolling pin, bash out the chicken breasts to about 1cm thick (this will help them to cook right through more quickly). Season with salt and black pepper.Finely chop 2 tsp of thyme leaves. Cut 90g of smoked streaky bacon into short, thick strips. Continue reading...","Tue, 10 Dec 2024 12:00:12 GMT",0.0,0.1531
The Guardian,"In the realm of being boring, nothing is more thrilling than top-tier chess | James Colley","There is something even more wonderfully ponderous than Test cricket – the world chess championship – and this year’s showdown is exceptionalLike many Australians, when a Test match finishes early, I spend the next day pottering around the house completely devoid of purpose. My soul understands that I should be spending this time watching cricket. That there is no cricket to watch opens a void in my life. What am I to fill it with? Chores, charity or family? No, that is not acceptable. I need another way to waste my time.Fortunately for me, there is an even more wonderfully ponderous and very occasionally thrilling event going on at this very moment, and it’s the perfect antidote for anyone who finds Test cricket to be a little too high octane. I’m speaking of the world chess championship, which is currently being held in Singapore.James Colley is a comedy writer from Sydney. His debut novel The Next Big Thing is out now Continue reading...","Tue, 10 Dec 2024 14:00:16 GMT",-0.6213,0.9718
The Guardian,Women in the UK: share your experience of gynaecological pain,We would like to hear from women on their gynaecological conditions and their experience of being diagnosedWe would like to find out more about women and their experience of painful gynaecological conditions such as endometriosis.How long have you had your condition and how does the pain affect your life? What was your experience like getting diagnosed and treated? Do you have any concerns? Continue reading...,"Tue, 10 Dec 2024 10:46:33 GMT",-0.2732,0.212
The Guardian,Share your reaction to the fall of Assad in Syria,"We would like to hear from Syrian refugees, the diaspora and anyone affected by the regime changeCrowds in Syria have been celebrating the end of five decades of dynastic rule following the fall of the dictator Bashar al-Assad who has fled to Moscow.People waved the Syrian revolutionary flag and pulled down statues and portraits of the president and his father, Hafez. Families have been reunited with loved ones long lost to the dark of the regime’s notorious prison system. Continue reading...","Mon, 09 Dec 2024 12:33:03 GMT",0.296,0.5994
The Guardian,People in the UK: tell us what your hopes and concerns are for your finances in 2025,We would like to hear from people in the UK and what they predict will happen to their finances next yearWe want to find out more about how people in the UK feel about the state of their finances and what the new year might bring for them.What are your hopes and concerns for your finances in 2025? Are you hoping to get promoted or change jobs? Are you starting a family and worried about how you will manage? Perhaps you have been unemployed and will be returning to work next year. What will this mean for you? Continue reading...,"Mon, 09 Dec 2024 09:19:47 GMT",0.4215,0.8738
The Guardian,Nature boys and girls – here’s your chance to get published in the Guardian,"Our wildlife series Young Country Diary is looking for articles written by children, about their winter encounters with natureOnce again, the Young Country Diary series is open for submissions! Every three months, as the UK enters a new season, we ask you to send us an article written by a child aged 8-14.The article needs to be about a recent encounter they’ve had with nature – whether it’s a majestic deer, a busy rock pool or a yomp in the woods. Continue reading...","Fri, 29 Nov 2024 09:06:07 GMT",0.25,0.0
The Guardian,"As a wildfire erupted, Malibu was told to evacuate. Why were students at Pepperdine told to stay put?","The 830-acre Christian college invested in fire-proofing its buildings and landscaping, a strategy that has long served itAs thousands of residents fled a roaring wildfire ripping through Malibu’s mountainsides on Monday, Pepperdine University students stayed put.Howling winds spit embers into the trees of the Christian college’s picturesque campus and the skies cast an ominous orange-and-red haze as students gathered in two buildings in the center of campus. Continue reading...","Tue, 10 Dec 2024 23:50:52 GMT",0.0,0.0516
The Guardian,The five-minute city: inside Denmark’s revolutionary neighbourhood,"While ambitious urban planners try to make 15-minute cities a reality, the Nordhavn district of Copenhagen has gone one better. What’s life like when everything you need is just a stroll away?It’s not often that the worlds of town planning and traffic management become mired in controversy, but in recent years the innocuous concept of the “15-minute city” has sparked outrage in online forums, among cynical politicians and on the streets of British cities such as Oxford. The originator of the concept, urban planner Carlos Moreno, has even received death threats. All of this has hinged on the spurious conspiracy theory that 15-minute cities were part of some shady global population-control agenda, rather than a desire to simply create more pleasant neighbourhoods.If the concept of having all your basic amenities within 15 minutes’ distance was enough to provoke such hostility, what would the conspiracy theorists make of a five-minute city? Fortunately, they have failed to notice that Denmark has already built such a place: Nordhavn, an emerging new neighbourhood of Copenhagen. If they visited today they might be disappointed, or perhaps converted. Continue reading...","Tue, 10 Dec 2024 10:00:19 GMT",0.0,-0.9588
The Guardian,"Who is Friedrich Merz, the pilot politician tipped to be German chancellor?","CDU leader once sidelined by Merkel loves private planes, hates tax bureaucracy, and backs UkraineIn July 2022, the prevailing political mood in Germany was grim. The economic powerhouse was on the brink of a recession, with Russia threatening to cut off its gas supplies. There were widespread fears of a decline in prosperity. The gloss was beginning to wear off Olaf Scholz’s coalition government.Amid the gloom, the finance minister, Christian Lindner, got married on the North Sea island of Sylt. And one of the guests, Friedrich Merz, decided to make his entrance at the opulent, three-day celebration in his private plane: a twin-engine Diamond DA62, complete with personalised number plate. Continue reading...","Tue, 10 Dec 2024 05:00:33 GMT",0.0,-0.9337
The Guardian,"After Biden pardoned his son, advocates call on him to grant clemency for others","People on death row, those with marijuana convictions and the Indigenous activist Leonard Peltier are among those the president could benefitIn late November, a group of lawmakers sent a letter to Joe Biden, calling on him to use his “executive clemency power to address longstanding injustices in our legal system”.The letter, which is just one example of how lawmakers and advocates across the country have pushed for the president to grant clemency and issue pardons during his lame duck period, came days before the US president pardoned his son Hunter for any federal crimes “he committed or may have committed” between 1 January 2014 and 1 December 2024. Continue reading...","Tue, 10 Dec 2024 13:00:14 GMT",0.5267,-0.1779
The Guardian,‘Incredibly harmful’: why Trump’s FBI and DoJ picks scare civil liberties experts,"Ex-DoJ prosecutors fear loyalists Kash Patel and Pam Bondi will pursue Trump’s calls for revenge on ‘deep state’ foesBy tapping two combative ultra-loyalists to run the FBI and the justice department, Donald Trump has sparked fears they will pursue the president-elect’s calls for “revenge” against his political foes and sack officials who Trump demonizes as “deep state” opponents, say ex-justice department prosecutors.Kash Patel and Pam Bondi, who Trump has nominated to run the FBI and Department of Justice, respectively, have been unswerving loyalists to Trump for years, promoting Trump’s false claims that his 2020 election loss to Joe Biden was due to fraud. Continue reading...","Tue, 10 Dec 2024 11:00:13 GMT",0.0258,0.0516
The Guardian,Why did ‘Brazil’s George Floyd’ receive less public outcry – even in Brazil?,"Genivaldo de Jesus Santos was asphyxiated in a police car – but his killers’ lengthy sentences received little attentionStopped at a checkpoint for riding a motorcycle without a helmet, Genivaldo de Jesus Santos, 38, was forced into the boot of a police car by three police officers, who sprayed pepper spray and teargas into the confined space.With dozens of bystanders watching – some of them shouting “You’re going to kill him” and warning that De Jesus was mentally ill – the officers kept him in the makeshift gas chamber for 11 minutes and 27 seconds in 2022 in the north-eastern Brazilian state of Sergipe. Continue reading...","Tue, 10 Dec 2024 11:30:10 GMT",-0.4627,-0.9331
The Guardian,"My father, the serial killer: how April Balascio put her dad behind bars – and broke free of her childhood","When Balascio was growing up, her charismatic father was violent, controlling, yet often very loving. Then her foster brother was killed and she started piecing together the dates and places that would prove crucial to solving a string of murdersIn 2009, while her husband and teenage children slept, April Balascio was often wide awake in their home in Jefferson, Ohio, jotting down the small towns she’d lived in as a child and trying to match them to their month and year.This wasn’t as easy as it might sound. Her father had driven them all over the US – Ohio, Georgia, Florida, Arizona, Colorado, Wisconsin, Pennsylvania – in whatever vehicle they had at the time – an RV, a U-Haul truck, a camper, a school bus. They had set up home in farmhouses, mobile homes, tents, a barn. Sometimes Balascio completed a school year in one place; other times she didn’t, because her father would wake them at night, tell them to pack up, then off they’d go, no goodbyes, headed who knows where. Continue reading...","Tue, 10 Dec 2024 05:00:32 GMT",-0.5859,-0.1045
The Guardian,"Endless work, little money, occasional UFOs: my father’s five decades driving Brazil’s roads | Long read","As a sociologist, my career couldn’t be further from that of my father, who spent his life on the road as a truck driver. It’s only in recent years, as illness has struck, that I’ve started to truly understand himRemember, your dad helped build this airport so you could fly.I hear my father’s words every time I catch a flight from São Paulo’s main airport. And while I always remembered those words, it has taken me some time to truly understand them. Continue reading...","Tue, 10 Dec 2024 05:00:32 GMT",0.0,0.2732
The Guardian,"Inside the hunt for hidden cells in Sednaya prison, Syria’s ‘human slaughterhouse’","Exclusive: The Guardian gains access to Sednaya jail, where prisoners are rumoured to be trapped underground – as desperate relatives wait for newsThe celebrations in Damascus were interrupted by a whisper.On the outskirts of the city, a door had been found. Beyond it lay a vast underground complex, five storeys deep, containing the last prisoners of the Assad regime, who were gasping for air. Continue reading...","Mon, 09 Dec 2024 10:53:23 GMT",-0.5106,-0.9022
The Guardian,A new start after 60: I gave up work – and began travelling the world alone,"After 40 years of work, Bally Bhamra went hiking in Nepal. Now 74, she still travels solo across Africa and Asia, staying with local familiesWhen Bally Bhamra retired at 60, she decided this was her time. She started travelling alone, hiking in Nepal, “to prove that senior citizens shouldn’t be afraid to go out and have adventures”.Now, 14 years on, Bhamra is 74 and each winter she has ventured to a different part of the world. Last month, she left her home in Berkshire, UK, for south-east Asia, having recently returned from nine months exploring southern Africa and Madagascar. “If I can do it at this age, anybody can,” she says. Continue reading...","Mon, 09 Dec 2024 06:55:15 GMT",-0.25,-0.25
The Guardian,"West Ham win thriller, FA Cup latest and Wales make history – Women’s Football Weekly","Faye Carruthers is joined by Suzy Wrack, Chris Paouros, and Sophie Downey to round up the weekend’s Women’s Super League actionOn the podcast today: there was a seven-goal thriller at the foot of the WSL table as West Ham came from behind to beat Crystal Palace 5-2, with five different scorers and Rehanne Skinner’s side climbing up to eighth. Is this a turning point for West Ham?Chelsea notched their ninth consecutive win in a 4-2 victory over Brighton, while Manchester United and Arsenal cruised to 4-0 victories. Bunny Shaw leads Manchester City to a dominant win against Leicester. The panel also responds to Marc Skinner’s comments about criticism of his team. Continue reading...","Tue, 10 Dec 2024 15:30:16 GMT",0.6369,0.9153
The Guardian,The science of laughing – podcast,"Madeleine Finlay speaks to Sophie Scott, a professor of cognitive neuroscience at University College London, to dig into the science of laughter. Sophie explains what exactly laughter is, the many different purposes it serves for humans and animals, and how prioritising it could make us all feel a little betterSupport the Guardian: theguardian.com/sciencepod Continue reading...","Tue, 10 Dec 2024 07:41:01 GMT",0.4939,0.7506
The Guardian,"S8, E12: Paterson Joseph, actor and author","One of the UK’s best loved character actors, Paterson Joseph, joins Grace for another serving of Comfort Eating. The Beach, Peep Show and Wonka actor looks back at his career and muses on the roles he didn’t get, namely the role of Doctor Who to replace David Tennant in 2010. Paterson remembers his parents smuggling yams in from Saint Lucia, the politics of biscuit and toast tax when you’re one of six siblings and the sweet treats on the Wonka set.If you liked this episode then have a listen to James Norton, David Harewood and Tamsin GreigNew episodes of Comfort Eating with Grace Dent will be released every Tuesday Continue reading...","Tue, 10 Dec 2024 05:00:32 GMT",0.0,0.9657
