broadcast,title,description,pub_date,title_sentiment_score,description_sentiment_score
Aljazeera,Trump memo calls on US federal agencies to prepare for mass layoffs,The US president and his allies continue their efforts to dismantle agencies long viewed with ire by conservatives.,"Wed, 26 Feb 2025 19:17:11 +0000",0.0,0.0
Aljazeera,Bosnian Serb President Dodik sentenced to prison for defying peace envoy,The Bosnian Serb separatist leader Milorad Dodik was sentenced to one year in prison by a Bosnian court.,"Wed, 26 Feb 2025 18:26:42 +0000",0.0258,-0.5267
Aljazeera,Trump administration appeals deadline to release US foreign aid funding,Nonprofits and businesses have argued that a 90-day foreign aid freeze under Trump has left US government bills unpaid.,"Wed, 26 Feb 2025 18:19:38 +0000",0.0,-0.3182
Aljazeera,BP drops climate targets in pivot back to oil and gas,BP slashes planned investment in renewable energy and is increasing annual oil and gas spending.,"Wed, 26 Feb 2025 17:53:58 +0000",0.0,0.0772
Aljazeera,"US will not give security guarantees to Ukraine, Trump says","US president says Volodymyr Zelenskyy will visit Washington, DC, on Friday to sign US-Ukraine critical minerals deal.","Wed, 26 Feb 2025 17:51:17 +0000",-0.2584,-0.3182
Aljazeera,Father describes baby daughter’s death from the cold in Gaza,A Palestinian father has described how his 6-week-old baby daughter died from the cold in their tent in northern Gaza. ,"Wed, 26 Feb 2025 15:20:50 +0000",-0.5994,-0.5574
Aljazeera,‘Everyone wants to go back home’: Inside Catatumbo’s displacement crisis,"In Catatumbo, fighting has forced over 55,000 people from their homes. What does it mean for Colombia’s peace process?","Wed, 26 Feb 2025 15:11:54 +0000",-0.6249,-0.25
Aljazeera,‘No one talks about this’: Remembering Germany’s role in colonising Africa,How do Germans remember - or forget - their colonial history and role in the Berlin Conference that carved up Africa?,"Wed, 26 Feb 2025 14:53:03 +0000",0.0,-0.2263
Aljazeera,The US Constitution was not made to protect against Trump,The belief that the US Constitution can protect against despotism has always been an illusion.,"Wed, 26 Feb 2025 14:39:47 +0000",-0.2924,0.3818
Aljazeera,Why are Israeli troops occupying more and more of Syria?,"Israel has bombed Syria, just days after Netanyahu said Syrian troops are banned from entering the south.","Wed, 26 Feb 2025 14:31:53 +0000",0.0,-0.4588
Aljazeera,Netanyahu’s political calculus that sent tanks into Jenin,"Palestinians took selfies with three Israeli tanks sent into Jenin, analysts said their deployment was performative.","Wed, 26 Feb 2025 14:07:31 +0000",0.0,0.0
Aljazeera,"Trump posts bizarre AI video of a rebuilt Gaza with Netanyahu, Musk",US President Donald Trump has posted a bizarre AI-generated video believed to represent his &#039;Gaza Riviera&#039;,"Wed, 26 Feb 2025 14:01:29 +0000",-0.3182,-0.3182
Aljazeera,US-Ukraine critical minerals deal: What we know so far,Zelenskyy might visit Trump this week for a rare earth minerals deal in efforts to win Washington&#039;s backing for Kyiv.,"Wed, 26 Feb 2025 14:00:04 +0000",-0.3182,0.5994
Aljazeera,Israel arrests dozens of Palestinians in overnight West Bank raids,"Mass arrests come as army issues evacuation orders to families in Nur Shams camp, giving them three hours to leave.","Wed, 26 Feb 2025 13:23:00 +0000",-0.4404,-0.1779
Aljazeera,Echoes of Water: Morocco | Africa’s New Directions,Morocco tackles pressing water scarcity through a blend of ancient and modern solutions. ,"Wed, 26 Feb 2025 12:58:50 +0000",0.0,0.1779
The Guardian,"Russia could reinvade Ukraine without US security guarantees, Starmer warns","UK prime minister faces major diplomatic effort to get president on board after he said no plans for US ‘backstop’Keir Starmer has warned that Vladimir Putin could invade Ukraine again unless the US provides security guarantees as he arrived for critical talks with Donald Trump at the most precarious moment for European stability in decades.With the future of Ukrainian security hanging in the balance, he urged the president to commit a US backstop to a British and French-led peacekeeping force, saying it was the only way to avoid Russia plunging Europe back into war. Continue reading...","Wed, 26 Feb 2025 22:30:18 GMT",-0.3476,-0.0516
The Guardian,Israel releases some Palestinian prisoners after Hamas returns bodies of four hostages,"Gaza ceasefire appears to hold, though it remains unclear whether exchange would include all 602 Palestinian prisoners who were due for release on SaturdaySee all our Middle East coverageHamas has handed over the bodies of four hostages, and Israel has released some Palestinian prisoners, as the five-week-old ceasefire appeared to get back on track after a breach that had brought fears of a return to war in Gaza.The bodies of the hostages were transferred to the Red Cross in southern Gaza and driven to the border point at Kerem Shalom at about midnight. Meanwhile, a convoy of buses carrying Palestinian prisoners arrived in the West Bank city of Ramallah. The Israeli newspaper Haaretz reported that 43 Palestinians being held in Ofer had been transferred to the Red Cross. Continue reading...","Thu, 27 Feb 2025 01:47:37 GMT",-0.5106,-0.9559
The Guardian,Trump vows to slap 25% tariffs on EU and claims bloc was ‘formed to screw US’,"EU said it will reply ‘firmly and immediately’ to ‘unjustified’ trade barriers, signaling it’s ready to retaliate against leviesDonald Trump has threatened to slap 25% tariffs on the European Union, claiming the 27-country bloc was “formed to screw the United States”.Speaking at his first cabinet meeting on Wednesday, the US president said he would soon release details of the latest tariff threat. “We have made a decision and we’ll be announcing it very soon. It’ll be 25%,” he said. Continue reading...","Wed, 26 Feb 2025 18:25:04 GMT",0.0516,-0.2263
The Guardian,"Michelle Trachtenberg, Buffy the Vampire Slayer and Gossip Girl actor, dies aged 39","The actor was found at a New York apartment on Wednesday, with the cause of death unknown but not being treated as suspiciousMichelle Trachtenberg: a life in picturesThe actor Michelle Trachtenberg, known for her performances in Buffy the Vampire Slayer and Harriet the Spy, has died at the age of 39.Police sources confirmed her death to both ABC News and the New York Post. There is no cause of death yet known, with police saying on Wednesday that the New York Medical Examiner was investigating the cause, but that no foul play was suspected. Trachtenberg had recently undergone a liver transplant, according to sources. Continue reading...","Wed, 26 Feb 2025 19:51:46 GMT",-0.1779,-0.9827
The Guardian,Parents of under-fives may be exempted from UK’s two-child benefit limit,"Exclusive: Ministers considering options to bring down child poverty without removing rule entirelyParents of under-fives could be exempted from the government’s two-child benefit limit under a range of options UK ministers are considering as they try to bring down child poverty numbers without removing the rule altogether.Ministers are trying to find ways to alleviate the impact of the two-child limit for universal credit or child tax credit, which was imposed by the Conservatives in 2017, without spending £3.6bn to remove it entirely, according to those briefed on the discussions. Continue reading...","Wed, 26 Feb 2025 14:00:36 GMT",0.4588,0.0772
The Guardian,"Reforms needed to way potential miscarriages of justice handled, says Law Commission","Report also criticises compensation system for people wrongly convicted of crimes in England and WalesMore potential wrongful convictions could be sent back to the appeal court under proposals to change the way the miscarriages of justice watchdog decides cases.Suggestions by the Law Commission, which reviews legislation in England and Wales, for reform of the criminal appeals system include making it easier for those cleared of crimes to receive compensation and enabling investigation into allegations of jury misconduct. Continue reading...","Thu, 27 Feb 2025 00:01:20 GMT",0.5267,0.2263
The Guardian,Sussex to launch UK’s first climate justice undergraduate degree,"University announces new BA, after survey found most 14- to 18-year-olds want more rigorous climate change educationThe University of Sussex will introduce what it says is the UK’s first undergraduate degree focused on climate justice.The BA course, called “climate justice, sustainability and development”, will begin in 2026. The university says it will equip students with a blend of expertise in climate politics, activism and environmental human rights. Continue reading...","Thu, 27 Feb 2025 00:01:20 GMT",0.5267,0.6003
The Guardian,"Only 5% of UK medical school entrants are working class, data shows","Sutton Trust says underrepresentation of poorer students is ‘outrageous’ but number has doubled in 10 years to 2022Students from working class backgrounds still only make up 5% of entrants to medical schools across the UK, a proportion that has doubled over the past decade, analysis has found.The research, conducted by the Sutton Trust and University College London (UCL), looked at almost 94,000 applicants to UK medical schools between 2012 and 2022, which represent almost half of all UK medical applicants. Continue reading...","Thu, 27 Feb 2025 00:01:21 GMT",0.0,0.743
The Guardian,"Senior figure in English football raped then paid underage girl, court documents claim","The man, who works in the Premier League, is protected by an anonymity order. He denies rape but has admitted a ‘cash for sex’ deal with the girl aged ‘16 or just 17’A senior figure in English football allegedly gave an underage girl £150 after raping her, high court documents claim. The man, who works in the Premier League but is protected by a court anonymity order, is being sued for damages by a woman for rape and sexual assault, which allegedly took place at his home in the 1990s when she was 15.His lawyers said he denied raping her but admitted initiating a “cash for sex” arrangement with her when she was “16 or just 17”. Continue reading...","Wed, 26 Feb 2025 18:44:34 GMT",-0.6808,-0.9878
The Guardian,Stonehenge-like circle unearthed in Denmark may have links to UK,"Archaeologists suggest ‘woodhenge’ was built between 2600 and 1600BC on similar axis to English stone circleAn “extraordinary” timber circle believed to be thousands of years old and connected to Stonehenge in England has been discovered in the ground in Denmark.The circle of at least 45 wooden posts in Aars, North Jutland, has a diameter of about 30 metres and is believed to have been constructed between 2600 and 1600BC. Continue reading...","Wed, 26 Feb 2025 17:19:37 GMT",0.0,0.0
The Guardian,"Trump cabinet flunkies hail wannabe Caesar and Elon, his oligarch pal","Special adviser showed instinctive feel for authoritarianism as he addressed the president’s first full cabinet meetingOn Tuesday, just over a mile from the White House, the classicist Mary Beard spoke to an audience about Roman emperors. “An autocrat is somebody who kills you when he’s being his most generous,” she remarked. “You go to dinner, you think, wow, this is wonderful! But the generosity of the autocrat is always potentially lethal.”On Wednesday, Donald Trump held his first full cabinet meeting. The mood was warm and convivial and, some might say, generous. Housing secretary Scott Turner offered a prayer that included: “Thank you, God, for President Trump.” Continue reading...","Wed, 26 Feb 2025 21:51:06 GMT",-0.2732,0.9612
The Guardian,Ukraine war briefing: Kyiv’s troops regain village near Pokrovsk where ISW says Russians falter,"Moscow claims recapture of some Russian territory held by Ukrainian troops in Kursk; ‘security guarantees’ hole in US-Ukraine mineral deal. What we know on day 1,100Ukrainian troops on Wednesday announced a successful counterattack to retake the settlement of Kotlyne near the key city of Pokrovsk, which many Russian forces have died trying to take over the past year. The Institute for the Study of War (ISW) said: “The year-long Russian effort to seize Pokrovsk has so far failed, and Russian forces appear to have abandoned the effort to take the city directly, preferring instead to conduct a wide envelopment. The Kremlin may have abandoned even that effort for now, however, in the fact of increasing Ukrainian resistance in the area and extremely high Russian losses.”The Russian defence ministry said its forces had recaptured the settlements of Pogrebki and Orlovka, north of the town of Sudzha, in Kursk oblast where Ukraine has held territory inside Russia since August 2024. The ministry added that Russian forces had struck Ukrainian units and positions near more than a dozen settlements, including several around Sudzha. Zelenskyy, in his nightly video address, noted it was nearly seven months that Ukrainian forces “have been holding the buffer zone on the aggressor’s territory in Russia. They have almost become used to it.”The Ukrainian military said it had attacked Russia’s Tuapse oil refinery on the Black Sea coast and that at least 40 explosions had been recorded at the site. Tuapse is home to one of Russia’s biggest oil refineries and has been targeted by Ukrainian drones several times before. The Ukrainian military also said it had attacked two military airfields in Russia-controlled Crimea but gave no further details. Russia confirmed drones attacked its southern Krasnodar region, including the port of Tuapse, on Wednesday. Drones also attacked the Russian regions of Bryansk and Kursk, which border Ukraine, according to Russia’s defence ministry.Ukraine said Russian strikes on Kostyantynivka city in the east killed at least five people and wounded eight more. Russian drones also killed two people near Kyiv, including the Ukrainian journalist Tetiana Kulyk who worked for the Ukrinform news agency. Ukraine’s interior ministry said separately that two people were wounded in Kharkiv city during a drone attack. Ukraine’s largest private energy company, DTEK, said one of its facilities had been damaged in the Dnipropetrovsk region.Any peace deal for Ukraine must include “security guarantees” involving the “Atlantic alliance”, according to Giorgia Meloni, who was referencing Nato. The Italian prime minister spoke as it emerged a draft deal between the US and Ukraine does not include security guarantees, but only references Ukraine somehow obtaining them. Peace in Ukraine “can only be achieved if Kyiv is given adequate security guarantees to make sure that what we have seen over the past three years does not happen again”, Meloni said on Tuesday.While Donald Trump said Ukraine’s president, Volodymyr Zelenskyy, would sign their “very big agreement” in Washington on Friday, Zelenskyy insisted that “guarantees of peace and security” remained vital as he prepared for “talks” with Trump. “For me and for all of us in the world, it’s important that US support is not stopped. Strength is needed on the path to peace,” Zelenskyy said during his evening address to Ukrainians on Wednesday. Zelenskyy elsewhere suggested the deal provides a “framework” under which security guarantees would be agreed jointly with the US and Europe. On security guarantees, Trump said “we’re going to have Europe do that” and Ukraine should forget about joining Nato.Zelenskyy is expected to visit Britain this weekend for talks with its prime minister, Keir Starmer, and other European leaders. Zelenskyy said on Wednesday that after his proposed trip to Washington on Friday, “I plan to go to London: and immediately after this I and the Europeans will meet there with Keir Starmer”. Keir Starmer will convene the meeting after he returns from also meeting with Trump in Washington.The Romanian parliament has authorised its army and allies to shoot down drones illegally breaching Romanian airspace. The EU and Nato member has had Russian drone fragments repeatedly fall on to its territory as Moscow has attacked Kyiv’s ports. Continue reading...","Thu, 27 Feb 2025 01:43:03 GMT",-0.5994,-0.9468
The Guardian,Jeff Bezos is muzzling the Washington Post’s opinion section. That’s a death knell | Margaret Sullivan,"‘I couldn’t be more sad and disgusted,’ says former top editor Martin BaronOwners and publishers of news organizations often exert their will on opinion sections. It would be naive to think otherwise.But a draconian announcement this week by Jeff Bezos, the Washington Post owner, goes far beyond the norm.Margaret Sullivan is a Guardian US columnist writing on media, politics and culture Continue reading...","Wed, 26 Feb 2025 20:10:38 GMT",-0.5994,-0.5709
The Guardian,Milan fashion week: it’s a family affair as Fendi celebrates centenary,"Italian fashion label marks 100-year milestone with great-great-grandsons of founders Edoardo and AdeleThe hot ticket of Milan fashion week was a family birthday party first, a catwalk collection second. The Fendis celebrated 100 years in fashion with a show that began with a cameo by Dardo and Tazio, seven-year-old great-great-grandsons of house founders Edoardo and Adele. The twins’ jewellery designer mother, Delfina, designed the snake chain bracelets and shimmering fountain earrings in the show; their grandmother, Silvia, artistic director of accessories and menswear, presided over the evening as master of ceremonies.Fendi is now owned by LVMH. “So I’m not here because I own it – I don’t,” said Silvia backstage before the show. “But nothing changed for me when we sold. This is still my home.” Continue reading...","Wed, 26 Feb 2025 21:07:25 GMT",0.5719,0.7506
The Guardian,"What I have learned in my filthy, bloody, sisyphean quest to tame my garden | Adrian Chiles","It’s chaos as small jobs become big jobs, tools disappear and distractions lead to furious frustration. Then you spot spring’s first flower ...There’s no such thing as gardener’s block, I once read. This from, I believe, a famous writer who was making the point that if you’ve got writer’s block, you should just go and do something else for a bit. Point taken. There is no such thing as gardener’s block because if you get stuck doing one job, even in the smallest garden, there are roughly 10m other jobs you can be cracking on with. Which is quite right. And this is what makes gardening either the worst thing for you if – like me&nbsp;– you have attention deficit hyperactivity disorder (ADHD), or possibly the best.I stride into the garden full of purpose and ambition, with a smile on my face. Invariably, several hours later, I stagger out of there, aching all over, scratched, bloodied, filthy and demoralised, having dug, scraped, cursed and carried myself to physical and mental exhaustion. The clarity of purpose I have at the outset vanishes very quickly, along with my secateurs. In its place, as things that need doing proliferate around me like Japanese knotweed, there comes a confusion of purpose. Lots gets done a&nbsp;little bit, but nothing gets done properly. Nothing is&nbsp;finished. And it all looks a right bloody mess. Continue reading...","Wed, 26 Feb 2025 15:29:36 GMT",-0.4404,-0.967
The Guardian,Trump brings peace to PMQs. No one knows what to argue about | Zoe Williams,"With this US president, diplomacy is over, but it would be great to have a clue how Britain is going to respond“Does the prime minister agree with me,” asked Labour’s Alex McIntyre, “that we are delivering opportunity for the next generation?” The soft-soap question from your own team is such a well-worn convention of PMQs that it was previously impossible to imagine anyone bringing anything new to it, but McIntyre was so trite and banal, with so much incongruous passion, nay, fury, that it was genuinely diverting. Good job, that man. Someone put a sticker on his suck-ass chart.The real business was the prime minister’s trip to Washington; and what a vast amount of business this encompasses. It’s three years this week “since Putin’s barbaric invasion of Ukraine”, Starmer reminded the house, and that grinding war still holds a unique place in the chamber: the issue on which every serious person is agreed. Continue reading...","Wed, 26 Feb 2025 17:14:08 GMT",-0.0258,0.7873
The Guardian,"The Last Laugh review – Eric Morecambe, Tommy Cooper and Bob Monkhouse’s antic triple act","Theatre Royal BrightonBob Golding, Simon Cartwright and Damian Williams, who have played the comedy giants before, summon them like spirits to the stage in this tribute‘You tell ’em a joke they’ve heard before, and: silence.” So says Eric Morecambe in The Last Laugh on audience resistance to secondhand comedy. But it’s a sentiment contradicted by the show itself, which recycles lots of jokes we’ve heard before in its tribute to three 20th-century comedy giants, and makes us laugh plenty. Writer-director Paul Hendy’s play imagines Morecambe, Tommy Cooper and Bob Monkhouse sharing a dressing room preshow. There is no plot, there are no narrative surprises, just chat and banter among the threesome about their lives and the nature of comedy. Oh, and jokes. Lots of – usually terrific – jokes.It’s as much tribute act as drama, the chief pleasure of which is to see these stars of (some of) our childhoods brought uncannily back to life. It helps that Bob Golding, Simon Cartwright and Damian Williams have played their alter egos before, extensively, and summon them like spirits to the stage. Jus’ like Cooper, Williams need only gather his awkward bulk and peer haughtily down from under his fez, and we’re laughing. Cartwright’s Monkhouse, bordering on animatronic and caked in makeup that would make Donald Trump blush (not that we’d see it), is fascinated by Tommy and Eric’s “funny bones”. It comes less naturally to him, a scholar of comedy but no clown. Continue reading...","Thu, 27 Feb 2025 00:01:20 GMT",0.5574,0.9938
The Guardian,Why has BP pulled the plug on its green ambitions?,"Oil firm abandons plan to become net zero energy company as its CEO claims strategy went ‘too far, too fast’BP has angered climate groups by abandoning its green ambitions to instead invest about $10bn a year in a string of new oil and gas projects to help reverse its flagging fortunes.The strategy, put forward by its chief executive, Murray Auchincloss, pulls the plug on BP’s 2020 plan to become a net zero energy company, which he claims was “misplaced” and went “too far, too fast”. Continue reading...","Wed, 26 Feb 2025 18:03:00 GMT",0.0,0.0772
The Guardian,Saldaña squished and Chalamet chafing as Ariana and Cynthia bag the best seats: the 2025 Oscars class photo,"The Academy Award nominees assembled for their annual group portrait, but who scooped the prize for looking the most bored?Every year during Oscars week, it has become tradition for all the nominees to meet up and eat a meal together. This is usually followed by a group photo; something that the people in attendance can look back upon and cherish, knowing that for this one moment all competition fell away and they found joy in surrounding themselves with their gifted colleagues.At least that’s the idea. As anyone who has ever been in a group photo will attest, these things are an absolute mess. There are simply too many people to control, and the resulting image is generally a free-for-all of weird costumes, odd expressions and seemingly hostile body language. As such, let’s use this year’s Oscars class photo to hand out some awards of our own. Continue reading...","Wed, 26 Feb 2025 13:04:20 GMT",0.6369,0.9319
The Guardian,The ultimate signs of wealth: do you most covet a kitchen island – or early retirement?,"Forget a Porsche and a Rolex. A new survey has thrown up some interesting signifiers of what it means to be wealthy todayName: Wealth signifiers.Age: We know from cave paintings and burial sites that Homo sapiens started to live a more settled life about 35,000 years ago – not just hunting and gathering, but trading, too. The ones who had the most tools, weapons, food and baskets were seen as the wealthy ones. Continue reading...","Wed, 26 Feb 2025 16:13:37 GMT",0.4939,0.3984
