broadcast,title,description,pub_date,title_sentiment_score,description_sentiment_score
The Guardian,I tested the best thermal swimsuits for wild swimming. Here are my favourites for beating the cold,"Keep out the chill for longer with a new breed of thermal swimsuits designed for cold-water swimming, tested and rated by our expert• ‘The best way to beat face freeze’: 15 wild swimming essentialsFor those brave enough to swim outdoors in winter, there have, until recently, been two options: wear an ordinary swimsuit and feel the thrill/horror of cold water on your skin for a few minutes; or pull on a wetsuit and stay in for longer, but without the endorphin high.But there is now a third way: a cold-water swimsuit, made from thermal fabric to keep your core warmer for longer and lengthen your time in the water. A wetsuit may seem the obvious choice for winter swimming, but many open-water wetsuits won’t offer much warmth in water below 10C, and the effort of putting one on at this time of year when swims are short often isn’t worth it (see more detail below). But is a cold-water swimsuit any different from a standard suit, and are they worth buying? I tested seven of the best to find out.Best overall cold-water swimsuit:
 Zoggs Brave crossback£65 at ZoggsBest sustainable cold-water swimsuit:
 Finisterre Nieuwland 2mm Yulex long-sleeve£150 at FinisterreBest for simplicity:Zone3 OWS Ti+ thermal high neck costumeFrom £65 at Amazon Continue reading...","Fri, 14 Feb 2025 12:00:07 GMT",0.296,0.9764
The Guardian,"The best iPhones in 2025: which Apple smartphone is right for you, according to our expert","Looking for the latest iPhone, or a good deal on a refurbished handset? Our expert has assessed and rated the current crop of Apple smartphonesThe best iPhone may be the one you already own. There is generally no need to buy a fresh phone just because new models have been released, as hardware updates are broadly iterative, adding small bits to an already accomplished package. But if you do want a replacement handset, whether new or refurbished, here are the best devices of the current crop of Apple smartphones.Many other smartphones are available besides the iPhone, but if you’re an Apple user and don’t fancy switching to Android, you still have a couple of choices. Whether your priority is the longest battery life, the best camera, the biggest screen or simply the optimal balance of features and price, there’s more to choose from in the Apple ecosystem than you may expect, especially after the iPhone 16 models were released in September 2024.Best iPhone for most people:
 iPhone 16From £799 at AppleBest iPhone for camera:
 iPhone 16 ProFrom £999 at AppleBest iPhone for screen:
 iPhone 16 Pro MaxFrom £1,199 at Apple Continue reading...","Thu, 13 Feb 2025 13:24:41 GMT",0.6369,0.9714
The Guardian,"A new start after 60: I got divorced, became a lawyer – and began fighting for other women","After a spell as Isabella Rossellini’s hand model, Elizabeth Barbour went to law school at 54. Now, she is working on 50 domestic violence cases and says her career is a privilege, not a jobElizabeth Barbour didn’t start studying law until she was 54 and had a school-age daughter. “But once I decide to do something, I’m hard to stop,” she&nbsp;says.Law is an atypical later-life career choice. It certainly bore no connection to Barbour’s first and second vocations, as a hand model and then a real-estate developer. “Law school was hard. It was disheartening,” she says. “I was literally everybody’s mother’s age. I didn’t have a cohort of friends. I was like a foreigner. I&nbsp;felt&nbsp;really isolated. But three years of being pummelled with all&nbsp;this information really did expand my&nbsp;bandwidth.” Continue reading...","Mon, 17 Feb 2025 06:55:27 GMT",-0.3612,0.7284
The Guardian,"Rukmini Iyer’s quick easy recipe for baked trout with beetroot, lentil and pomegranate salad | Quick and easy","Two meals in one: a bright, enticing salad and a substantial fish dinnerAn easy dinner packed with colourful plants and leaves. You could make a batch of the salad by itself for lunchboxes, but the trout elevates it to a filling dinner for two. You can, of course, use your preferred fish: any thick fillets, such as cod, pollack or haddock, would work well here. And if you don’t have pumpkin seeds, substitute breadcrumbs or any type of nut. Continue reading...","Mon, 17 Feb 2025 13:00:37 GMT",0.7003,0.714
The Guardian,Rachel Roddy’s recipe for hazelnut and mushroom ragu with pasta | A kitchen in Rome,"Its origins may be a mystery, but what is certain is that this luxuriant alternative to meat ragu is totally delicious“Antica e desueta [archaic and forgotten] is a beguiling introduction to a recipe,” I said to my friend, the cook and writer Stefano Arturi, when we talked on the phone the other week. He laughed, noting that those words in relation to recipes made him both curious and, because of their foggy closeness to mythologising, suspicious.It was his recipe for hazelnut ragu that started it all, sending us down more or less the same paths in books and online, where we met more of the same thing: fabulously contradictory stories in which ragu made from hazelnuts was an ancient Piedmontese dish of great beauty born out of economy and hardship, and also “forgotten”, which justifies the lack of any evidence as to where it actually came from. Yet also, a breezy, contemporary dish that, like so many modern dishes, was scorned by those faithful to more traditional (ancient, authentic) versions. There were other claims, too, such as “This is the authentic recipe” and “This is an improvisational dish: do as you wish”. In short, a big tangle, which makes for entertaining reading. Although maybe not for those of the opinion that recipe writers should stop the self-indulgent introductions and get straight to the recipe – which is what we did. Continue reading...","Mon, 17 Feb 2025 11:00:35 GMT",0.0,0.9787
The Guardian,Samsung Galaxy S25 Ultra review: still the superphone to beat,"Huge glass and metal slab packs super-fast chip, long battery life and unrivalled camera zoom, but its AI features are overhypedThe Ultra is Samsung’s largest and greatest phone and is packed to the gills with the very latest technology, which means more artificial intelligence than ever before.The Galaxy S25 Ultra is at the front of the line of a new wave of Android phones that promise to basically do everything for you. It combines Google’s advanced AI assistance with numerous Samsung tools for writing, drawing, photography and chatting.Main screen: 6.9in QHD+ Dynamic Amoled 2X (500ppi) 120HzProcessor: Qualcomm Snapdragon 8 Elite for GalaxyRAM: 12GBStorage: 256, 512GB or 1TBOperating system: One UI 7 (Android 15)Camera: 200MP + 50MP 0.6x + 10MP 3x + 50MP 5x; 12MP front-facingConnectivity: 5G, USB-C, wifi 7, NFC, Bluetooth 5.4, UWB and GNSSWater resistance: IP68 (1.5m for 30 mins)Dimensions: 162.8 x 77.6 x 8.2mmWeight: 218g Continue reading...","Mon, 17 Feb 2025 07:00:27 GMT",0.0,0.9196
The Guardian,Falling for Alassio – the rebirth of an Italian resort,"The former fishing village on the Ligurian coast was once a favourite with the wealthy British set. Now instead of tennis and tea parties, it offers scenic treks and seafood feasts in glorious spring sunshine‘Why don’t the inglesi come here any more?” The question was asked by a customer at Caffè Roma in the seaside town of Alassio, whose pre-second world war British population could reach 5,000.There are several reasons, I think. From the late 19th century, wealthy Britons would arrive in October to escape the winter cold, stay until May, and then head home before the torrid Italian summer. These days, British people with that kind of wealth probably winter between Zermatt and the Caribbean. But neither has Alassio great appeal to more ordinary Britons wanting a summer holiday: August temperatures can hit the high 30s, crowds and prices surge and, as in so many Italian resorts, the sands are taken over by beach concessions from&nbsp;Easter to September. Continue reading...","Mon, 17 Feb 2025 07:00:28 GMT",-0.1531,0.6511
The Guardian,Did you solve it? The simple geometry problem that fools almost everyone,The answer to today’s triangular teaserEarlier today I set you the following two problems. Here they are again with solutions.1. Tricky triangle Continue reading...,"Mon, 17 Feb 2025 17:00:42 GMT",-0.6249,-0.5106
The Guardian,Tell us your favourite romantic moments in cinema,"We would like to hear about the scenes in films that make you swoonThe Guardian’s writers have been sharing their most passionate scenes for Valentine’s Day, from thwarted love in Casablanca to awkward listening in Before Sunrise and bicycle jinks in Butch Cassidy.Now, we would like to hear from you. What’s the film scene that makes you swoon? Continue reading...","Fri, 14 Feb 2025 10:41:54 GMT",0.4019,0.9324
The Guardian,Nominate your invertebrate species of the year,"We’re asking readers from around the world to nominate their favourite spineless species for our second Invertebrate of the Year competition They are the unsung heroes of the planet – the silent majority, the innovators, the grafters, our overlooked friends and protectors.Invertebrates make up the vast majority of animals on Earth – at last 1.3 million species. They are a wondrously diverse bunch, including insects, arachnids, snails, crustaceans, corals, jellyfish, sponges and echinoderms. Continue reading...","Wed, 12 Feb 2025 12:40:19 GMT",0.0,0.743
The Guardian,Share your experience of living in an area in the UK that is prone to flooding,"We would like to hear from people who live in an area that is under threat of flooding due to extreme weatherAs storms and bad weather increase every year, more people are facing the devastating impacts of flooding. Are you living in an area under threat of flooding? We want to know how current weather events have changed your circumstances and plans.What are your options for tackling the flooding? Is moving away becoming a likely outcome? What support has been offered to you long term if the area could flood again? Have you had trouble getting insurance? Continue reading...","Wed, 05 Feb 2025 15:43:39 GMT",0.296,-0.9092
The Guardian,Tell us: how has artificial intelligence affected your work?,"We’d like to hear from people about how much their job has been impacted by AIJust how much artificial intelligence will “enhance” our jobs or displace them and create different roles remains to be seen, but what impact has the technology already had on our work?We’d like your help to find out about the different ways that AI has affected your job. Has the technology been positive or negative in your experience? Or perhaps a bit of both? How much do you think might it impact your work in the future? Continue reading...","Fri, 14 Feb 2025 11:28:21 GMT",0.3612,0.8767
The Guardian,Alleged leader of cultlike ‘Zizian’ group arrested in Maryland,"Jack LaSota, who publishes blog under the name of ‘Ziz’, appears to be leader of group of anarchist computer scientistsThe apparent leader of a cultlike group known as the Zizians has been arrested in Maryland along with another member of the group, Maryland state police have said.Jack LaSota, 34, was arrested on Sunday along with Michelle Zajko, 33, of Media, Pennsylvania. They face multiple charges including trespassing, obstructing and hindering and possession of a handgun in the vehicle, police said on Monday. Continue reading...","Tue, 18 Feb 2025 00:57:45 GMT",-0.4767,-0.8074
The Guardian,"Young, old, refugees and returnees: thousands fleeing violence cross border into South Sudan","Makeshift hospitals and informal settlements deal with daily influx of those escaping the war in neighbouring SudanPhotographs by Diego Menjíbar ReynésAt the Joda border crossing between Sudan and South Sudan, movement is constant. Just 100 metres separate the two border checkpoints – on the Sudanese side, three raised flags welcome newcomers; on the South Sudanese side, a sign in Arabic and English marks the entrance to the country.Women arrive carrying their children, with their belongings balanced on their heads. Some families bring bed frames, nightstands, food, chairs and suitcases, loading them on to carts pulled by donkeys and crossing into South Sudan to escape war in Sudan.The entry point for refugees from Sudan to South Sudan; in the background is the border. In December, more than 5,000 people crossed this point each day Continue reading...","Mon, 17 Feb 2025 06:00:30 GMT",-0.6249,0.0
The Guardian,What are Ukraine’s critical minerals – and why does Trump want them?,"Zelenskyy has rebuffed US’s initial attempt to take control of minerals as downpayment for its aid in war with RussiaEurope live – latest updatesUkraine’s president, Volodymyr Zelenskyy, has rebuffed an initial attempt by the US to corner his country’s critical minerals as a downpayment for continued military and economic aid for its war with Russia.Three sources told the Reuters news agency that the US had proposed taking ownership of 50% of Ukraine’s critical minerals. Zelenskyy did not dismiss the offer out of hand, but said it did not yet contain the security provisions Kyiv needed. Continue reading...","Mon, 17 Feb 2025 14:44:31 GMT",-0.25,-0.25
The Guardian,"‘This is a coup’: Trump and Musk’s purge is cutting more than costs, say experts","In slashing staff and disabling entire agencies the administration is lacerating the structures of US democracyDonald Trump and Elon Musk’s radical drive to slash billions of dollars in annual federal spending with huge job and regulatory cuts is spurring charges that they have made illegal moves while undercutting congressional and judicial powers, say legal experts, Democrats and state attorneys general.Trump’s fusillade of executive orders expanding his powers in some extreme ways in his cost-cutting fervor, coupled with unprecedented drives by the Musk-led so-called “department of government efficiency” (Doge) to slash many agency workforces and regulations, have created chaos across the US government and raised fears of a threat to US democracy. Continue reading...","Mon, 17 Feb 2025 11:00:37 GMT",-0.128,-0.9657
The Guardian,‘It comes from racism’: immigrant workers on Trump’s deportation push,"The president’s actions have sent a wave of terror through the community that underpins much of the US economyDonald Trump has ramped up anti-immigration fervor into his second presidency, promising mass deportations, pushing to increase arrests and bolstering public relations efforts to amplify arrests. The moves have sent a wave of terror through the undocumented worker community that underpins large parts of the US economy.“Every day I wake up and walk out the door, I go with the hope of going to work, but with the fear of not being able to come back,” said a construction worker and single parent in Texas who obtained immigration protection under the Biden administration. She requested to remain anonymous due to fears about her immigration status. Continue reading...","Mon, 17 Feb 2025 12:00:36 GMT",0.0,-0.8945
The Guardian,Explainer: what will the withdrawal of USAid mean for the Pacific?,"Analyst says while USAid supports hundreds of jobs, the most significant damage from Donald Trump’s cuts will be to US relations with the PacificThe dismantling of USAid by president Donald Trump is having a ripple effect across the Pacific as people working on more than 100 projects and activities in the region grapple with an uncertain future.While Pacific analysts say overall the region is resilient and will not be heavily affected by the withdrawal, hundreds of people working on USAid projects across the region say their lives and communities have already been upended. Continue reading...","Mon, 17 Feb 2025 00:38:55 GMT",0.0258,-0.4101
The Guardian,"‘Biologists were not part of the crime food chain’: why Ecuador’s scientists are facing violence, threats and kidnapping","Despite government efforts, armed groups control many remote areas. Now researchers are caught in the crosshairsRaul*, a biologist from Quito, has been leading conservation projects in the Chocó rainforest in north-east Ecuador for more than 20 years. It has not been easy, he says, recalling the threats he has received over the years for reporting illegal hunters and loggers in reserves, but he never considered giving up.Last year, however, tensions in the area escalated after violence soared on the country’s coast. Accounts of almost daily killings in the cities of Esmeraldas and Guayaquil emerged as gangs appeared to fight over territory, while forced recruitment in rural areas increased, as did extortions, known locally as vacunas, or vaccines. Continue reading...","Mon, 17 Feb 2025 09:00:30 GMT",-0.886,-0.9822
The Guardian,‘We live in constant fear’: Alawites in Syria’s Homs terrified of reprisals,"Diverse city has grown tense since fall of Assad regime, as security forces target groups loyal to the former dictatorOutside the deserted Homs political security directorate building, a group of freshly recruited armed guards were engaged in a heated debate about justice. Sado Junaid, whose sister and brother-in-law were detained and tortured in the squat facility’s underground prison, sided with Mahmoud al-Bashar, who as they spoke sometimes held the black coil of wire and a black-and-white rod once used to beat him and other detainees.They clashed with another young recruit about whether they should be allowed to torture officers from the deposed regime of Bashar al-Assad before any accused of crimes face trial, or whether suspects should be immediately delivered to Syria’s nascent justice system. Continue reading...","Sun, 16 Feb 2025 14:03:20 GMT",-0.6124,-0.4767
The Guardian,The unspoken agony of vaginal dryness: ‘I had to give up four jobs in four years’,"Recently, there has been much more discussion of menopause. But one debilitating condition, experienced by 80% of women, remains shrouded in secrecy and misunderstandingWhen Lorraine Kelly shared her experience of menopause on her daytime TV show in 2017, she was her own last resort. Initially, she set out to interview a famous woman about her story, but everyone she approached refused.“I thought, nobody else will talk about it so I’ll do it. It was a breakthrough moment,” said Kelly. Continue reading...","Sun, 16 Feb 2025 14:00:10 GMT",-0.4215,0.4767
The Guardian,John Major: Trump’s US isolationism threatens global democracy,"Former UK prime minister says US may regret ceding world stage to China and condemns ‘hypocritical’ JD Vance speechDemocracy around the globe is under threat from the retreat of Donald Trump’s US into isolationism and its likely replacement by China on the world stage, John Major has said.The former UK prime minister, who rarely offers direct opinion on contemporary politics, used an interview with BBC Radio 4 to say Trump’s administration was unlike anything he had seen before – and to warn that Washington may live to regret ceding global leadership to a more autocratic power. Continue reading...","Sun, 16 Feb 2025 14:50:18 GMT",-0.235,-0.8885
The Guardian,Spurs stumble past United and Liverpool keep on keeping on: Football Weekly - podcast,"Max Rushden is joined by Barry Glendenning, Will Unwin and Seb Hutchinson to discuss all the weekend’s Premier League gamesRate, review, and share on Apple Podcasts, Soundcloud, Audioboom, Mixcloud, Acast and Stitcher, and join the conversation on Facebook, Twitter and email.On the podcast today: the panel looks over the weekend’s Premier League action as Spurs edge past Manchester United in a game where the loser felt more interesting. They break down United’s threadbare squad and how missed chances cost them, while James Maddison makes his point to Roy Keane with the winner. Continue reading...","Mon, 17 Feb 2025 14:37:12 GMT",0.4215,0.3804
The Guardian,The loudest megaphone: how Trump mastered our new attention age – podcast,"The old model of political debate is over, and spectacle beats argument every time. How did we get here? By Chris Hayes. Read by Adam Sims Continue reading...","Mon, 17 Feb 2025 05:00:27 GMT",0.0,-0.3612
The Guardian,The man with Elon Musk’s chip in his brain – podcast,"When Noland Arbaugh was left paralysed he signed up for an implant created by Musk’s Neuralink company that would allow his mind to directly interact with computers. Jenny Kleeman reportsNoland Arbaugh was a 22-year-old student when an accident changed his life for ever. Swimming with a group of friends, he was hit in the head and blacked out. He was pulled from the water, and when he came round, it was clear the injury to his spinal cord meant he had lost all movement below his shoulders.A committed Christian, Arbaugh has dealt with his changed circumstances with patience and good humour, the journalist Jenny Kleeman tells Helen Pidd. However, the opportunity came along to have an implant fitted into his brain that would allow him to directly interact with a computer. He jumped at the chance. The operation carried real risk, but he says the thought of being able to move things on a screen with his mind pushed him on. Continue reading...","Mon, 17 Feb 2025 03:00:23 GMT",0.0,0.7227
The Guardian,"Can Drake come back from Kendrick Lamar’s diss?; Marina Hyde on Starmer aping Trump; ‘I was trapped for 65 hours under 4,000 tons of rubble’; and Philippa Perry on setting boundaries with your parents – podcast","Marina Hyde on Keir Starmer’s palid imitation of Trumpism. The sole survivor of a landslide describes the pain, the fear and the long, winding path of recovery. After Kendrick Lamar lands another savage blow at the Super Bowl, a crisis expert advises on how Drake can return to relevance. And, ‘I feel happier and healthier when not around my mother’ – Philippa Perry advises one reader Continue reading...","Sat, 15 Feb 2025 05:00:27 GMT",-0.5267,-0.5859
The Guardian,"Oh, Canada! Can Trump just take it? – podcast","On the first day of his second term in office, Donald Trump suggested he wanted the US to ‘expand’ its territory. Few thought he could actually mean taking Canada and making it the 51st state. But could he actually do that?Jonathan Freedland speaks to the reporter Leyland Cecco in Toronto about the possibility of the two North American allies merging, what Canadians think about it, and why this existential threat has had an impact on Canadian national politics Send your questions and feedback to politicsweeklyamerica@theguardian.com Help support the Guardian by going to theguardian.com/politcspodusArchive: 10 News First, BBC News, CBC News, CTV News, Fox News, NBC News, CNN, CBS News Continue reading...","Fri, 14 Feb 2025 05:00:08 GMT",0.0,-0.3421
The Guardian,'Why should we invite them?': Lavrov ridicules European presence at Ukraine peace talks – video,"Russia's foreign minister has dismissed the prospect of a place for Europe at talks between the US and Russia to end the fighting in Ukraine. Speaking at a press conference alongside his Serbian counterpart, Sergei Lavrov said: 'If they are going to weasel out some cunning ideas about freezing the conflict, while actually intending – as is their custom, nature and habit – to continue the war, then why should we invite them at all?'European leaders have been unnerved by the willingness of Donald Trump, the US president, to engage the Kremlin directly over Ukraine and have been attempting to find a place for themselves in the talksEurope live – latest updates Continue reading...","Mon, 17 Feb 2025 14:03:29 GMT",0.3182,-0.4215
The Guardian,Parents of Alexei Navalny join hundreds of mourners on the anniversary of his death  – video report,"The parents of late Russian opposition leader Alexei Navalny joined hundreds of mourners at their son's grave on Sunday to mark the anniversary of his death. Navalny died aged 47 on 16 February last year while being held in a jail about 40 miles north of the Arctic Circle, where he had been sentenced to 19 years under a ‘special regime’Alexei Navalny supporters visit grave on first anniversary of his death Continue reading...","Sun, 16 Feb 2025 15:34:14 GMT",-0.6705,-0.9136
The Guardian,Netanyahu says Israel working closely with US on Trump’s 'bold vision' for Gaza – video,"Benjamin Netanyahu has said his government is working closely with the US to implement Donald Trump’s plan for Gaza, which involves US ownership of the coastal strip, the removal of more than 2 million Palestinians and the redevelopment of the occupied territory as a resort. The Israeli prime minister was speaking after a meeting in Jerusalem with the US secretary of state, Marco Rubio, who defended the Trump plan as bold and visionaryNetanyahu says Israel working closely with US on Trump’s plan for Gaza Continue reading...","Sun, 16 Feb 2025 15:22:46 GMT",0.5574,0.3818
The Guardian,Sign up for the Fashion Statement newsletter: our free fashion email,"Style, with substance: what’s really trending this week, a roundup of the best fashion journalism and your wardrobe dilemmas solved, direct to your inbox every ThursdayStyle, with substance: what’s really trending this week, a roundup of the best fashion journalism and your wardrobe dilemmas solved, delivered straight to your inbox every ThursdayExplore all our newsletters: whether you love film, football, fashion or food, we’ve got something for you Continue reading...","Tue, 20 Sep 2022 11:06:20 GMT",0.5106,0.9565
