broadcast,title,description,pub_date,title_sentiment_score,description_sentiment_score
Aljazeera,ICC Champions Trophy 2025: India’s Gill steers nervy win against Bangladesh,Opener Shubman Gill carries his bat with a century to lead India to victory against spirited Bangladesh in Dubai.,"Thu, 20 Feb 2025 17:31:26 +0000",0.802,0.3182
Aljazeera,Bulldozers and trucks carrying mobile homes seen entering Gaza,"Bulldozers, building materials and housing units have been seen at the Rafah crossing. ","Thu, 20 Feb 2025 16:56:58 +0000",0.0,0.0
Aljazeera,Pope’s supporters gather outside hospital over health concerns,Supporters of Pope Francis gathered outside Rome’s Gemelli Hospital to pay tribute to the 88-year-old.,"Thu, 20 Feb 2025 15:59:14 +0000",0.4404,0.3612
Aljazeera,South Africa urges cooperation at G20 meeting amid tensions over Ukraine,President Cyril Ramaphosa tells grouping international law is key to solving world crises. ,"Thu, 20 Feb 2025 15:52:14 +0000",-0.4019,0.34
Aljazeera,Malcolm X assassinated 60 years ago redux,"The Nation of Islam minister was a polarising figure who advocated for Black separatism, self-defence and cultural pride","Thu, 20 Feb 2025 15:20:00 +0000",0.0,0.34
Aljazeera,Marco Rubio: A traditionalist hawk in the age of Trump,The &#039;might makes right&#039; worldview and ambitions that drive the top US diplomat spearheading Trump&#039;s foreign policy.,"Thu, 20 Feb 2025 14:41:43 +0000",0.0,0.2023
Aljazeera,"Reality of war clashes with Trump’s demand for Ukraine vote, analysts say","As Trump joins Russia in tying national elections to any peace deal, analysts question Moscow&#039;s true motives.","Thu, 20 Feb 2025 14:41:40 +0000",-0.6597,0.743
Aljazeera,Spain’s ex-football chief Luis Rubiales found guilty of sexual assault,Rubialies found guilty of sexually assaulting footballer Jenni Hermoso by forcibly kissing her and ordered to pay fine.,"Thu, 20 Feb 2025 14:40:24 +0000",-0.765,-0.25
Aljazeera,Why the billionaire class is kissing Trump’s proverbial ring,The billionaire set and the massive corporations they represent are not showing deference to the president.,"Thu, 20 Feb 2025 14:36:33 +0000",0.5719,0.0
Aljazeera,Hamas releases bodies of four Israeli captives including Bibas family,"Hamas has released the bodies of four Israeli captives who’d been held in Gaza, including the Bibas family.","Thu, 20 Feb 2025 14:34:02 +0000",0.0,0.0
Aljazeera,Arab leaders set to meet to counter Trump’s Gaza plan,"The closed-door summit in Riyadh will take place tomorrow, Saudi Arabia has said.","Thu, 20 Feb 2025 14:04:25 +0000",0.0,0.0
Aljazeera,Palestinians say the occupied West Bank & Gaza hard to tell apart,Palestinians in the occupied West Bank say the Israel is using the same tactics it used in Gaza to forcibly expel them.,"Thu, 20 Feb 2025 13:16:41 +0000",-0.1027,-0.4404
Aljazeera,"After splinter, can Sudan’s anti-war coalition reinvent itself?","Sudan&#039;s antiwar coalition, Taqaddum, splintered into two entities. One joined RSF and the other professes neutrality.","Thu, 20 Feb 2025 12:10:54 +0000",0.0,0.0
Aljazeera,ICC Champions Trophy 2025: Blow to Pakistan as Zaman out of tournament,Pakistan&#039;s Champions Trophy hopes hit by news that injured batter Fakhar Zaman will miss remainder of the tournament.,"Thu, 20 Feb 2025 12:05:07 +0000",0.5267,0.4404
Aljazeera,Israel increases “unlawful detention” of Palestinians,Milena Ansari talks about the unlawful detention of Palestinians ,"Thu, 20 Feb 2025 12:03:38 +0000",0.0,-0.3612
Aljazeera,"Fact-check: Did Ukraine start its war with Russia, as Trump claims?","Trump has blamed Ukrainian President Zelenskyy for starting the war with Russia, fuelling a war of words amid talks.","Thu, 20 Feb 2025 11:58:28 +0000",-0.5994,-0.8979
Aljazeera,What’s going on with the Gaza ceasefire deal?,The clock is ticking towards phase two of the Gaza ceasefire deal but there are still major questions over the accord.,"Thu, 20 Feb 2025 10:44:44 +0000",0.0,0.0
The Guardian,Middle East crisis live: Israeli military says body of Shiri Bibas is not among returned hostages,"Israel has demanded the return of Shiri Bibas after it said testing showed that one of the four bodies released by Hamas did not belong to any other hostageWe’re pausing our live coverage of the Middle East crisis now – it’s approaching 4.30am in Tel Aviv and Gaza City. You can read all the key developments in our latest full report. Here’s where things stand:One of the four bodies Hamas returned to Israel on Thursday is not that of Shiri Bibas, the Israeli military has said, calling it a “violation of utmost severity” of a ceasefire deal that was already fragile.The Israel Defense Forces confirmed on Friday that two of the bodies belonged to Bibas’ children, Ariel and Kfir, but said that during the identification process it was determined the additional body received was not Shiri Bibas and no match was found for any other hostage. “This is an anonymous, unidentified body,” it said. “We demand that Hamas return Shiri home along with all our hostages.” There was no immediate response from Hamas.Bibas and her children became a symbol of the Hamas attack of 7 October 2023. The militant group has said they were killed in an Israeli airstrike in the early days of the war. However, the IDF said on Friday that they had been murdered in captivity, posting on X: “According to the assessment of professional officials, based on the intelligence available to us and forensic findings from the identification process, Ariel and Kfir Bibas were brutally murdered by terrorists in captivity in November 2023.”The IDF’s statement Friday’s statement came hours after Israeli prime Benjamin Netanyahu ordered the military to conduct an “intense operation” against “terror hubs” in the occupied West Bank after a series of explosions on three parked buses in Bat Yam, a city outside Tel Aviv, that authorities said was a suspected terrorist attack. No injuries were reported.Explosives were found on two other buses but did not detonate, Israeli police said. The five bombs were identical and equipped with timers, and bomb squads were defusing the unexploded bombs, they said. There was no immediate claim of responsibility for the explosionsThe IDF said it “was decided to reinforce with three battalions in the Central Command sector” of the West Bank.It is my hope that the peace he worked to see in the region through his charity work and activism will be achieved. Continue reading...","Fri, 21 Feb 2025 02:34:33 GMT",-0.6249,-0.9955
The Guardian,Nigel Farage dissents from Trump’s Zelenskyy ‘dictator’ claim,"Reform leader contradicts Trump rant, saying ‘you shouldn’t always take things Donald Trump says absolutely literally’Nigel Farage has contradicted his ally Donald Trump, saying Volodymyr Zelenskyy “is not a dictator” after the US president’s attack on the Ukrainian leader this week.Farage, who became one of the last UK party leaders to distance himself from Trump’s remarks, said he had been delayed in calling it out earlier because he was heading to the US to speak at the Conservative Political Action Conference. Continue reading...","Thu, 20 Feb 2025 18:59:50 GMT",0.0,-0.8126
The Guardian,"Don’t be fooled by Putin’s ‘imperialism dressed up as realpolitik’, Lammy warns","Foreign secretary’s speech comes as UK continues to tread fine diplomatic line between supporting Ukraine and not offending TrumpThe west should not be “fooled” by Vladimir Putin’s attempts to dress up imperialism as pragmatism in advance of any talks over the future of Ukraine, David Lammy has warned.Speaking before Keir Starmer’s visit to Washington next week to discuss Ukraine, the foreign secretary said Britain was “ready to listen” to Russia but it had not yet heard that Moscow was prepared to meet the conditions for a durable peace. Continue reading...","Thu, 20 Feb 2025 20:27:57 GMT",-0.4588,0.6758
The Guardian,Historic England acquires collection featuring some of UK’s oldest photos,"Janette Rosing built up pioneering trove of 8,000 images dating back to the early days of the Industrial RevolutionSome of the oldest photographs in England which show the country’s transformation after the industrial revolution have been acquired by Historic England.Images from the Janette Rosing collection include some of the earliest landscape photography ever taken in the country, spanning the breadth of southern England from the harbours of Clovelly and Plymouth in Devon to the streets of Bethnal Green and the banks of the River Thames in London. Continue reading...","Fri, 21 Feb 2025 00:01:21 GMT",0.0,0.0
The Guardian,"UK hiring on the rise as confidence lifts, research suggests","Companies increase hiring for first time since June, and households more optimistic about their financesCompanies have ramped up hiring in recent weeks while consumer confidence has started to rise, research suggests, in a boost for Rachel Reeves as the government looks for signs of economic growth.The chancellor has received a fillip after the market research company GfK’s consumer index improved from -22 in January to -20 in February as households said they were more optimistic about their personal finances and the economic outlook. Continue reading...","Fri, 21 Feb 2025 00:01:23 GMT",0.5106,0.9391
The Guardian,"Cancer death rates 60% higher in deprived areas, UK research finds","Analysis by Cancer Research UK says there are 28,400 extra cancer deaths across the UK every year due to deprivationCancer death rates are 60% higher for people living in the most deprived areas of the UK compared with those in more affluent areas, according to new analysis.There are 28,400 extra cancer deaths across the UK each year due to deprivation, the equivalent of 78 additional deaths every day, Cancer Research UK found. Continue reading...","Fri, 21 Feb 2025 00:00:22 GMT",-0.9081,-0.9829
The Guardian,Trump’s re-election to boost UK universities as fewer students choose US,"During Trump’s first term, the number of international enrolments in the US declined every yearDonald Trump’s return to office may bring an unexpected boost to UK universities as fewer international students choose to study in the US, according to a British Council report.The trend is expected to dovetail with greater restrictions in Australia and Canada on international students, making the UK appear the most welcoming English-speaking country, the report said. This would reverse years of the UK’s popularity declining relative to competitors as a result of previous governments’ hostile immigration policies. Continue reading...","Fri, 21 Feb 2025 00:01:22 GMT",0.4019,0.8479
The Guardian,Doctors in London cure blindness in children with rare condition,"Four children can now see shapes, find toys, recognise their parents’ faces and some can read and writeDoctors in London have become the first in the world to cure blindness in children born with a rare genetic condition using a pioneering gene therapy.The children had leber congenital amaurosis (LCA), a severe form of retinal dystrophy that causes vision loss due to a defect in the AIPL1 gene. Those affected are legally certified as blind from birth. Continue reading...","Thu, 20 Feb 2025 23:30:21 GMT",0.0,-0.802
The Guardian,Man dies at Manchester airport after arrest by Border Force officers,"Police watchdog is investigating death of 27-year-old who showed ‘unusual behaviour’ at security checkA 27-year-old man has died at Manchester airport after being arrested by Border Force officers.The man had been stopped while going through security in Terminal 2 on Wednesday after “displaying unusual behaviour”, the police watchdog said. Continue reading...","Thu, 20 Feb 2025 20:29:27 GMT",-0.34,-0.8271
The Guardian,Thirty English councils granted exceptional financial support packages,"Local authorities can collectively borrow £1.5bn to plug budget gaps caused by underfundingA record 30 English local authorities have been granted effective “bailouts” enabling them to borrow money to avoid bankruptcy, as ministers advised them against selling off prized local assets such as historic buildings, parks and allotments.The councils, all of whom were experiencing “unmanageable” financial pressures, were given the green light by ministers to collectively borrow £1.5bn to plug significant budget gaps caused by underfunding and soaring demand for social care and other services. Continue reading...","Thu, 20 Feb 2025 19:24:53 GMT",0.6096,0.8481
The Guardian,Nearly 500 cat figurines stolen from Gordon Ramsay’s London restaurant,"By Ramsay’s own estimate, he has lost more than £2,000 during one week in stolen maneki-neko cat modelsNearly 500 cat figurines were stolen in one week from Gordon Ramsay’s new London restaurant, the TV chef has said.The restaurateur, 58, recently launched Lucky Cat 22 Bishopsgate by Gordon Ramsay in one of London’s tallest buildings, which features the beckoning Japanese cat models called maneki-neko. Continue reading...","Thu, 20 Feb 2025 21:59:29 GMT",-0.4939,-0.6597
The Guardian,Taiwan holds its breath as Trump turns on Ukraine and upends US foreign policy,"The mood in Taipei is one of wariness as the new US president takes a blowtorch to diplomatic norms and assurancesIt’s a bustling morning at the Dongmen wet market, in inner-city Taipei. Mr Yu is shouting at passersby, trying to offload his boxes of freshly steamed dumplings. In between customers, the self-professed “dumpling king” and his wife, Ms Liao, discuss Donald Trump.“He’s very positive, energetic,” says Yu, handing flour-covered coins to a customer. Liao chimes in: “The dancing! Isn’t he in his 80s?” Yu nods in agreement. But asked what Trump means for Taiwan, the elderly couple is less effusive. Continue reading...","Fri, 21 Feb 2025 01:55:39 GMT",0.0,0.5702
The Guardian,US politics briefing: Trump administration warns Kyiv and picks up court win in mass firings case,"From the Trump administration’s latest moves abroad and in the US – here are the key US politics stories from Thursday at a glanceThursday saw a judge rule that the Trump administration can continue the mass firing of US federal workers, rejecting a bid by labor unions to stop the US president dramatically cutting the jobs of many of the 2.3 million people employed by the government. The IRS began laying off roughly 7,000 workers on Thursday.In his 16-page order, US district judge Christopher Cooper started by saying that Trump’s executive actions had “caused, some say by design, disruption and even chaos in widespread quarters of American society”. Continue reading...","Fri, 21 Feb 2025 02:29:15 GMT",0.5267,-0.9231
The Guardian,Chief whip’s diaries reveal rescue of Tory MP from KGB agent in London brothel,"From MPs’ demands for peerages to Rishi Sunak calling a minister ‘fucking useless’, stories from former chief whip Simon Hart’s diaries have drawn attentionThey say that to govern is to choose, but for one former chief whip it meant rescuing a Conservative MP from a suspected KGB agent in a London brothel.The story of said MP is one of many colourful anecdotes in Simon Hart’s political diaries, which have become the talk of Westminster this week. Continue reading...","Thu, 20 Feb 2025 17:01:19 GMT",0.5106,-0.3291
The Guardian,Say yes to the dress? Here comes the supermarket bridesmaid gown,"The cost of living crisis isn’t going away but neither are weddings. With budgets being slashed, even supermarkets are coming for the bridal marketFirst came the supermarket wedding dress. The next unexpected item in the bagging area? A bridesmaid dress. From next month, alongside eggs and loo roll, bridesmaids-to-be doing the weekly shop at Asda can pick up a dress with the launch of its first bridesmaid range. Available in sizes UK8 to 24, the collection starts at £24 for a satin halterneck dress. The retail giant says the launch was prompted by demand from consumers with searches for bridesmaid dresses up 69% year on year.While most people are thrilled to be a bridesmaid, the excitement can be somewhat diminished by the cost involved. Social media is rife with bridesmaid horror stories of what brides have expected their friends to pick up the costs for. My own quick straw poll found dozens of tales of brides dictating what bridesmaids could wear. Even though it wasn’t something the bridesmaid wanted to wear or would wear again, they were expected to cover the costly bill. The expense is often in addition to hen parties followed by travel, accommodation, hair and makeup for the wedding itself. Continue reading...","Thu, 20 Feb 2025 17:00:13 GMT",0.4019,0.7136
The Guardian,Neighbours cancelled for second time as Amazon backs out,"Long-running Australian soap will be ‘resting’ from December, after streaming giant withdraws from productionNeighbours: the 10 best memories, from Scott and Charlene to Madge’s ghostThe long-running Australian soap Neighbours has been cancelled – again, just two years after it was revived by streaming giant Amazon.“We are sad to announce that Neighbours will be resting from December 2025,” read an official statement from the show on Friday morning. Continue reading...","Fri, 21 Feb 2025 00:35:25 GMT",-0.128,0.0258
The Guardian,‘Not what I expected’: Russian soldiers sent to North Korea for medical care,"Wonsan resorts offer troops time off to recover, but some wonder if move is a pretence for military trainingAfter two years fighting for Russia on the frontlines in Ukraine, Aleksei returned to his home town of Vladivostok last summer to recover from a shrapnel wound to his leg.Looking to speed up his recovery and take a break from the city, he asked his military unit in Russia’s far east to see if he could secure a state-sponsored stay at a sanatorium – a health resort offering a mix of medical treatment and rest. Continue reading...","Thu, 20 Feb 2025 14:42:58 GMT",0.4939,-0.0387
The Guardian,From Phil Mitchell’s time-travelling murder to audience-dictated love: EastEnders Live capped a wild 40th,"The Albert Square soap’s 40th anniversary has been absolutely wild, and now it’s released its best live episode ever – even if the viewer vote on the outcome of a romantic plot wasn’t that thrillingThe 40th anniversary of EastEnders couldn’t have come at a better time. Ratings are in freefall; once the most watched thing on TV, these days the soap is lucky if it cracks the top 20. But an anniversary like this gives EastEnders an opportunity to not only celebrate itself, but to reaffirm its own mission statement. And it has gone about this by going on an absolute tear.With little else to lose, EastEnders has spent the last few weeks wildly swinging for the fences. Don’t mistake this for hyperbole, either. Just look at last Thursday’s episode where – and I promise I’m not making any of this up – Phil Mitchell embarked on a long monologue about all the different things he’s survived (alcoholism, drug addiction, illness, heart attacks, an actual shooting), then travelled back in time and murdered a younger version of himself, before the ghost of his dead mother arrived and urged him to kill himself. It was utterly bizarre, but it was also incredible. Had a big budget streaming show attempted something this daring, it would be lauded to the heavens. But this is old workday EastEnders, and so the whole thing passed without comment.EastEnders Live aired on BBC One and is available on iPlayer. Continue reading...","Thu, 20 Feb 2025 20:42:27 GMT",-0.128,-0.8854
The Guardian,"The cameras weren’t rolling, so no one saw Lammy neglect to tackle Dictators United | John Crace","Britain’s foreign secretary was supposed to be shooting from the hip, but even one mild criticism of Trump was beyond himIf a tree falls in the forest and no one is around to hear it, does it make a sound? If the foreign secretary makes a speech to the G20 in South Africa and someone forgot to switch on the televised stream, did it really happen?This was meant to be David Lammy’s big day out. His Foreign Office team had briefed in advance that this was to be his most forceful intervention on Ukraine yet. No more Mr Nice Guy. No more couching his words in the language of twisted diplomacy. Just shooting from the hip. Telling it as it is. Leaving every other foreign minister at the summit in Johannesburg gasping for breath. Continue reading...","Thu, 20 Feb 2025 18:51:56 GMT",-0.4707,-0.8173
The Guardian,‘I’ll have to move out’: coping with Surrey’s new sinkhole,"People in Godstone have lost their water supply, their back gardens and even been evacuated since Monday night‘We’re just terrified’: People evacuate homes after sinkhole appears on Surrey high street“If we lose the car, we lose the car,” said Fran Pavely. The 81-year-old’s bright orange family motor sits perilously close to a hole in the ground that, since Monday, has continued to get bigger.Her husband summed up how the couple felt about the prospect of losing their trusty four-wheeler. “It’s not the end of the world,” said Iain Pavely, 83. “We don’t drive around in it much.” Continue reading...","Thu, 20 Feb 2025 19:36:40 GMT",0.0,-0.25
The Guardian,"This is my final OFM column. Here’s what I’ve learned about buffets, ‘clean eating’ and what not to serve food on | Jay Rayner","Much has changed in the food world but there are a few truths that still holdI have been writing this column for 15 years. That means there have been 180 of them, filled with wisdom, insight, whimsy, prejudice, contradiction and sometimes just outrageous stupidity, all of it interrogating the way we cook and eat now. As this is my last of these columns I thought, as a service, I&nbsp;should summarise the key points. Are&nbsp;you ready? Good. Let’s go.Individual foods are not pharmaceuticals; just eat a balanced diet. There is nothing you can eat or drink that will detoxify you; that’s what your liver and kidneys are for. No healthy person needs to wear a glucose spike monitor; it’s a fad indulged by the worried well. As is the cobblers of being interested in “wellness”, because nobody is interested&nbsp;in “illness”. People have morals but food doesn’t, so don’t describe dishes as “dirty”. And stop it with the whole “clean eating” thing. It’s&nbsp;annoying and vacuous. Continue reading...","Thu, 20 Feb 2025 12:00:49 GMT",0.0,0.1687
The Guardian,I love my kids but I regret having them. How can I accept my life as a parent? | Leading questions,"It may help to view parenthood as a rapidly changing condition, advice columnist Eleanor Gordon-Smith says. It’s also important not to struggle with these feelings aloneRead more Leading questionsI have two children, aged eight and four. I love them both and we live in a mostly happy family with their dad, my partner.We had our children in our early 30s, without really thinking about it or talking it through. I have struggled to find peace with my role as a parent and, though I love my kids, I am increasingly envious of my single friends. Continue reading...","Thu, 20 Feb 2025 14:00:11 GMT",-0.0772,0.9556
The Guardian,"In the global clash between democracy and oligarchy, the US is switching sides | Robert Reich","As Trump empowers Russia and the far right, he is laying the foundation for undermining democracies around the worldSince the end of the second world war, liberal democracies have stuck together – led by the US. On the opposite side have been authoritarian states, led mainly by the Soviet Union, followed, after the demise of the Soviet Union, by Russia and China.But all this is rapidly changing. Russia and China have morphed into oligarchies, run by small groups of extraordinarily wealthy people. Continue reading...","Thu, 20 Feb 2025 11:00:36 GMT",0.0,-0.7096
The Guardian,The key global issue is not the clash of north and south: it’s who supports international law and who doesn’t | Jean-Noël Barrot,"We say the defining question is this: do nations work for peace and order or embrace the notion of power by force?Jean-Noël Barrot is the foreign minister of FranceWe are being told that the world is divided between a “global north” and a “global south”. But what exactly is meant by that? An economic difference? Of the 20 leading global economies, several are in the south. In the south, some countries are many, many times richer than their neighbours. A climate difference? The climate crisis affects every country in the world, and especially small island states and the poorest countries. The 10 greatest emitters, if we go by CO2 emissions per inhabitant, are split between countries in the north and south.Are we talking about a migration difference? A huge number of migrations are between countries in the south. A political divide? In both the north and the south, there are those who support collective solutions, and conversely, those who support efforts to withdraw from global affairs. In both the north and the south, there is competition between regional powers. In both the north and the south, there are countries that comply with international law and others that flout it.Jean-Noël Barrot is the foreign minister of FranceDo you have an opinion on the issues raised in this article? If you would like to submit a response of up to 300 words by email to be considered for publication in our letters section, please click here. Continue reading...","Thu, 20 Feb 2025 11:03:44 GMT",0.3612,0.9706
The Guardian,Ben Jennings on the myth of America’s past – cartoon,Continue reading...,"Thu, 20 Feb 2025 18:21:21 GMT",0.0,0.0
